;meta[language=de]
    555990|00000000||Zum Badehaus. Gehen wir.
    555981|00000000||War das die Vergangenheit oder die Zukunft?
    555995|00000000||War das die Vergangenheit oder die Zukunft?
    556000|00000000||Die jüngste Vergangenheit. Wir müssen uns beeilen.
    550334|00000000||Greame et dwyr! Deagnis cair-lle ess pyr'shena a et cleytte!
    550335|00000000||Kommt mir bekannt vor ... Ein Badehaus ... Ich kenne es ...
    550336|00000000||Dijkstra!
    550337|00000000||Er hat sie. Das ist sein Badehaus.
    555626|00000000||Hätte ich mir fast denken können.
    555400|00000000||Fangen wir an.
    555402|00000000||Beobachte die Wasseroberfläche genau. Uns darf nichts entgehen.
    550242|00000000||Greame et dwyr! Rhobeir'me gelle a failte!
   1061285|00000000||Da sind wir.
   1061288|00000000||Schön ruhig. Wir müssten ungestört sein.
    579853|00000000||Es war falsch.
    579905|00000000||Schön, dich glücklich zu sehen ... aber ich glaube nicht, dass es richtig war, was wir getan haben.
    579910|00000000||Wie hältst du es bloß mit so einem Langweiler aus?
    579912|00000000||Lass ihn zufrieden, Aegar. So ist Geralt nun mal - redlich.
    579944|00000000||Danke für eure Hilfe. Und für euren Besuch.
    579949|00000000||Es war herrlich, euch alle wiederzusehen. Haltet die Ohren steif und passt auf euch auf.
    579951|00000000||Vergiss uns nicht. Bis dann.
    579964|00000000||Ich muss mich von Valdo verabschieden.
    579952|00000000||Na schön, dann sehen wir uns bei Rittersporn. Ich muss in der Stadt noch was erledigen.
    579970|00000000||Bis dann, Geralt.
    579903|00000000||Ja ... schöne Abwechslung vom Monstertöten.
    579852|00000000||Und ob.
    577331|00000000||Juhuu! Wir haben es geschafft!
    577332|00000000||Toll gemacht! Habt ihr die beiden Deppen gesehen, die uns jagen wollten?
    579899|00000000||Sind fast über ihre eigenen Stiefel gestolpert!
    579849|00000000||Danke, Geralt, das war super!
   1055188|e87aca57||Gefängnisaufseher
    558989|00000000||Worüber machst du dir denn Sorgen?
    559015|00000000||Was bedrückt dich denn?
    559018|00000000||Was uns erwartet ...
    558990|00000000||Erst müssen wir die Jagd besiegen.
    559020|00000000||Hmm ... märchenhaft ... aber zuerst müssen wir die Wilde Jagd besiegen.
    559051|00000000||Eins nach dem anderen.
    559065|00000000||Mach dir deswegen keine Sorgen. Eins nach dem anderen.
    559058|00000000||Du weißt doch, dass du dich immer auf mich verlassen kannst, was auch geschieht.
    559062|00000000||Ja. Danke dir, Geralt.
    559052|00000000||Es kommt, wie es kommt.
    559064|00000000||Du machst dir zu viel Gedanken. Es kommt, wie es kommt.
    559144|00000000||Was meinst du damit?
    559185|00000000||Was meinst du damit?
    559194|00000000||Gewöhnlich.
    559145|00000000||Ich verstehe dich.
    559187|00000000||Ich auch. Manchmal ist es eine Last, ein Hexer zu sein ...
    559282|00000000||Genau wie mein "Erbe". Ich wäre so gerne gewöhnlich.
    559281|00000000||Es ist deine Wahl, wer du bist.
    559287|00000000||Dein Leben gehört dir, sonst keinem. Du legst fest, wer du bist.
    559289|00000000||Geralt, du weißt, das hat noch nie gestimmt.
    559459|00000000||Geschenke können auch zurückgewiesen werden ...
    559461|00000000||Man kann Geschenke auch ausschlagen, darauf verzichten ...
    559462|00000000||Das ist nicht so einfach. Hab ich mal versucht, weißt du noch?
    559475|00000000||Und selbst wenn mich das von Eredin befreien würde, gäbe es doch immer Leute mit Plänen, in denen ich vorkomme.
    559309|00000000||Sei nicht naiv.
    559328|00000000||Je schneller du diese Illusion loswirst, desto besser.
    559329|00000000||Wie meinst du das?
    579397|00000000||Nein.
    579404|00000000||Haben wir, bis uns jemand gestört hat.
    579423|00000000||Ganz schön kratzbürstig, dein Freund hier.
    579428|00000000||Ihr habt viel gemeinsam.
    579430|00000000||Wie war es denn beim Händler?
    579398|00000000||Hast du die Pferde gekriegt?
    579406|00000000||Ich wüsste lieber, wie es beim Händler war. Konntest du ein paar Pferde auftreiben?
    585949|00000000||Ich kauf sie euch.
    586015|00000000||Es muss eine andere Lösung geben ...
    586070|00000000||Zufällig habe ich etwas Geld, das ich euch leihen könnte.
    586017|00000000||Wir können uns nicht erkenntlich zeigen.
    586019|00000000||Das müsst ihr auch nicht.
    586063|00000000||Schade, dass der Kaiser nicht noch eine Tochter hat. Wir könnten alle Pferde in Novigrad kaufen.
    586026|00000000||Ein großzügiges Angebot, aber es löst das Problem nicht.
    586028|00000000||Der Händler hat nicht unser Geld abgelehnt, sondern uns. "Mit Abschaum mach ich keine Geschäfte" - ich glaube, das sagte er.
    586094|00000000||Und wenn er nicht handelt, haben wir keine Wahl, als zu stehlen.
    586100|00000000||Ich weiß nicht. Kommt mir nicht wie die beste Idee vor ...
    586098|00000000||Das gefällt mir nicht.
    586097|00000000||Du hast mich überzeugt.
    577198|00000000||Ach, was soll ich machen? Man muss den Bedürftigen helfen ...
    577199|00000000||Ja, ja, ja!
    577200|00000000||Ich muss sagen, so hätte ich dich nicht eingeschätzt.
    579627|00000000||Wie nicht?
    579629|00000000||Zuverlässig. Es wird Zeit! Wir treffen uns bei den Ställen.
    577195|00000000||Gehen wir Pferde stehlen.
   1058973|00000000||Das ist nicht unser Bier.
   1058976|00000000||Meines aber schon. Das sind meine Freunde.
   1058979|00000000||Die kommen alleine klar.
   1058981|00000000||Wenn Ciri mit uns reiten will, tut sie's. Sie ist nicht dein Eigentum.
   1058983|00000000||Sie wird ihren Hals nicht für Diebe riskieren.
    577196|00000000||Ich werde nicht stehlen.
    579579|00000000||Könnt ihr sie nicht einfach kaufen?
    579581|00000000||Kauft die Pferde doch einfach. Warum nicht?
    579583|00000000||Mit welchem Geld?
    579598|00000000||Ciri hat euch ein volles Säckel gegeben ...
    579600|00000000||Das reicht höchstens für eins. Wir brauchen mindestens vier.
    579602|00000000||Geralt, lass das Getue. Wir rauben den Händler nicht komplett aus, und wir können endlich mal was anderes machen, als vor der Wilden Jagd zu fliehen!
    579618|00000000||Lass uns nicht betteln!
    579478|00000000||Pah, vergiss es. Einen Tausch wollte er nicht. Ich sagte also, ich kaufe, und da hat er Mondpreise für ein gesundes Tier verlangt.
    579495|00000000||Wir brauchen Pferde. Aber wir müssen eine andere Möglichkeit finden, welche zu kriegen ...
    579530|00000000||Hoho, mir schwant Übles ...
    579532|00000000||Ich wusste, dass es dir gefällt.
    579541|00000000||Wir wollen uns in seinen Stall schleichen. Er hat rund dreißig Gäule, da machen ein paar mehr oder weniger nicht viel aus.
    579547|00000000||Kommt ihr mit?
    579554|00000000||Na klar!
    579402|00000000||Lagerfeuer, Wein, Jongleure ... Was will man mehr?
    579426|00000000||Ich wüsste ein paar Sachen, gegen die ich es eintauschen würde, aber es könnte schlechter sein.
    579455|00000000||Du wirkst bedrückt. Ist es beim Händler schlecht gelaufen?
    579396|00000000||Ja.
    577174|00000000||Das ist Pablo. Irgendwann will ich auch jonglieren lernen.
    579351|00000000||Unglaublich nützliche Fertigkeit.
    579395|00000000||Endlich hab ich euch gefunden! Amüsiert ihr euch?
    559344|00000000||Eines Tages wird Avallac'h dich um einen Gefallen bitten.
    559348|00000000||Vielleicht ... Aber wenn, wird es noch lange, lange hin sein ...
    559350|00000000||Und ich bin sicher, was immer es ist, er wird mir eine Wahl lassen. Ich werde ablehnen können.
    559351|00000000||Hoffentlich hast du recht ...
    559321|00000000||Wenn du meinst ...
    559326|00000000||Du bezweifelst es?
    559308|00000000||Hoffentlich hast du recht.
    559300|00000000||Erst waren es die Zauberinnen der Loge, jetzt ist es mein Vater, sogar Yennefer ...
    559306|00000000||Du vergisst Avallac'h ...
    559307|00000000||Avallac'h ist anders ...
    559324|00000000||Er will verhindern, dass meine Gabe in die falschen Hände fällt oder außer Kontrolle gerät. Darum lehrt er mich und beschützt mich.
    559290|00000000||Damit ist bald Schluss. Wenn wir Eredin besiegt haben, bist du frei.
    559207|00000000||Wirklich? Eredin ist kaum allein. Es gibt andere, die Pläne mit mir haben.
    559380|00000000||Wir werden Eredin besiegen. Du wirst frei sein.
    559261|00000000||Alles wegen dieses verwünschten Älteren Bluts! Mein Geschenk - mein Fluch.
    559270|00000000||Es hat mir all diese Kräfte gewährt, lässt mich aber mein Leben auf der Flucht und versteckt verbringen.
    559285|00000000||Das bist du aber nicht. Sondern zu Großartigem geboren.
    559293|00000000||Was ich seitdem zu hören kriege.
    559280|00000000||Du bist zu Großartigem geboren.
    559183|00000000||Betrunken oder albern? In beiden Fällen hast du heute gute Chancen.
    559189|00000000||Das meine ich nicht.
    559197|00000000||Ich wäre gern gewöhnlich.
    559143|00000000||Betrunken?
    559084|00000000||Hahaha!
    559132|00000000||Du hast es versprochen!
    559134|00000000||Ich hab Spaß gemacht!
    559074|00000000||Manchmal wünschte ich, ich könnte sein wie sie.
    559056|00000000||Wie meinst du das?
    559050|00000000||Was meinst du damit?
    559025|00000000||Ich fürchte, der Kampf gegen die Jagd ist nur der Anfang. Für mich jedenfalls.
    559034|00000000||Es wird nicht einfach werden, die Jagd zu besiegen, aber mit der Hilfe der Loge und von Avallac'h ... Wir können es schaffen.
    559006|00000000||Guter Plan. Ich glaube, ich komme mit.
    559021|00000000||Dann ist unsere Zukunft ja geregelt.
    559044|00000000||Sofern nicht nur noch Asche von uns übrig ist, wenn dies vorbei ist, heißt das.
    558988|00000000||Klingt nach einem guten Plan.
    537215|00000000||Noch Wein?
    537216|00000000||Danke.
    537217|00000000||Ich bin froh, dass wir hiergeblieben sind.
    537218|00000000||Ich auch.
    537219|00000000||Sie mögen dich hier.
    537224|00000000||Ich mag sie auch. Ahh, würde ich gerne bei ihnen bleiben ...
    558985|00000000||Trinken und Wettreiten, von Dorf zu Dorf ziehen. Mir keinerlei Sorgen machen ...
    172316|3a2616f8||Hexenjäger
    528874|00000000||Zurück mit euch! Ihr könnt noch früh genug glotzen!
    528875|00000000||Die Schlampe bleibt dort, bis sie verrottet ist!
    546562|00000000||Da bist du ja endlich.
   1059364|00000000||Was machen wir?
   1059366|00000000||Du musst zu den Wachen gehen. Ich ... mich könnten sie erkennen, ich zeige mein Gesicht besser nicht.
   1059368|00000000||Gut. Du bleibst hier.
    546561|00000000||Es sind nur zwei Wachen geblieben. Jetzt oder nie.
   1075039|00000000||Jetzt nicht. Wir sollten bis zum Einbruch der Dunkelheit warten.
    576140|00000000||Du hast sie getötet! Du hast unsere Schwester getötet!
    576142|00000000||Das wirst du bereuen!
    538331|00000000||Aaaaaah ...
    538335|00000000||Ich fühl mich zweihundert Jahre jünger.
    538337|00000000||Her mit dem Fleisch.
    536366|00000000||Aaah ...
    536367|00000000||Mehr Fleisch.
    538325|00000000||Ich fühl mich zweihundert Jahre jünger.
    576141|00000000||Sie hat unsere Schwester getötet!
    537173|00000000||Heh. Grabräuber. Der hier mochte wohl Elfenkram ...
    545696|00000000||Das kann doch nicht wahr sein ...
   1060569|00000000||Mist. Ich hab den Wein vergessen.
   1061348|00000000||Hmm ... bei einem Händler in der Nähe?
   1054110|00000000||Da ist es.
   1058650|00000000||Hmm ... Vielleicht sollte ich sie sich erholen lassen?
    537179|00000000||Nasse Kleider ... Welch eine Freude ...
    545655|00000000||Verdammt viele Sporen in der Luft.
    565211|00000000||Ich brauch eine Dosis vom Gegengift.
    560366|00000000||Niemand Besonderes.
    560390|00000000||Niemand Wichtiges.
    560415|00000000||Ihr könnt gern heute Nacht bei mir bleiben. Könnte einen "Niemand" wie dich gebrauchen ...
    560365|00000000||Ein Verteidiger der Unterdrückten.
    560369|00000000||Ein Verteidiger der Unterdrückten.
    560375|00000000||Mmm ... Zufällig wurde ich eben von oben bis unten unterdrückt. Wärst du so nett und würdest mir bei der Genesung behilflich sein?
    560377|00000000||Bea, du Hure, beherrsch dich! Das ist Geralt!
    560378|00000000||Ach, warum hast du das denn nicht gleich gesagt?
    560418|00000000||Ciri, komm zur Sache.
    560451|00000000||Ciri, hast du nicht etwas zu sagen?
    560457|00000000||Richtig.
    560467|00000000||Und? Was führt euch her, meine Lieben?
    560469|00000000||Ich wollte dir danken. Für alles.
    560470|00000000||Ach, hör auf! So wie ich hätte jeder gehandelt.
    560475|00000000||Aber nur wenige hätten es mit so viel Mut getan. Ich danke dir.
    571144|00000000||Das ist für dich. Damit du dich an mich erinnerst.
    560477|00000000||Oh, das ist wunderschön! Danke. Und? Bleibt ihr auf einen Eintopf? Der Wirt hat heute Morgen ein Ferkel geschlachtet.
    560484|00000000||Danke, aber wir müssen noch nach Ferneck.
    560498|00000000||Ah, zu Valdo, hm? Nun, dann werd ich euch nicht aufhalten. Dort bekommt ihr bestimmt auch was Leckeres zu essen.
    560486|00000000||Lebt wohl, ihr beiden. Und pass auf sie auf, Hexer.
    560499|00000000||Das werde ich. Leb wohl.
    560420|00000000||Wirklich? Was denn so?
    560421|00000000||Zum Beispiel, dass du ihr so oft aus der Patsche geholfen hast, dass sie aufgehört hat, zu zählen. Und dass du sie zum Lachen bringst.
    560438|00000000||Das gilt für Ciri. Andere Damen allerdings ...
    560448|00000000||Bea, ich stehe direkt hier.
    560452|00000000||Schon gut, schon gut.
    560417|00000000||Was hast du denn so gehört?
    560383|00000000||Freut mich sehr. Hab schon viel von dir gehört.
    560386|00000000||Geralt von Riva.
    560388|00000000||Der Geralt?
    560364|00000000||Geralt von Riva.
    545034|00000000||Ich danke dir. Sie wirkten diesmal entschlossener ...
    545035|00000000||Du solltest dich doch nicht mit denen anlegen ...
    560355|00000000||Soll ich etwa Anderlinge verstoßen, nur weil diese Halunken mich bedrohen? Kommt nicht in Frage!
    560357|00000000||Es ist so schön, dich wiederzusehen, Bea.
    545036|00000000||Dich auch, Ciri. Wer ist dein charmanter Begleiter?
    536564|00000000||Wir haben's geschafft.
    540336|00000000||Gerade so. Wie lief's da unten?
    540338|00000000||Ich habe nur zwei der Muhmen getötet.
    588426|00000000||Die dritte ist geflohen ... mit Vesemirs Medaillon. Meinem einzigen Erinnerungsstück.
    588652|00000000||Hierherzukommen war eine gute Idee.
    588654|00000000||Ich wusste, dass wir es schaffen. Von Anfang an.
    588645|00000000||Gute Idee, hierherzukommen.
    588648|00000000||Du hast Vesemir gerächt.
    588650|00000000||Avallac'h sagt, Rache ist nur dann süß, wenn sie kalt serviert wird. Er hat unrecht.
    588644|00000000||Du hast Vesemir gerächt.
    588646|00000000||Wir hatten Glück, großes Glück.
    588656|00000000||Wir hatten Glück. Ich hoffe, es verlässt uns nicht.
    588658|00000000||Das ist kein Glück. Du bist eine Tötungsmaschine und ich dein echter Spross.
   1013517|00000000||Also, auf nach Novigrad?
    540360|00000000||Noch nicht.
    540364|00000000||Nicht so schnell. Ich bin alt, ich muss mich erst ausruhen.
    581166|00000000||Hm. Das bist du und das sollst du.
    581168|00000000||Lass uns noch etwas bleiben.
   1050802|00000000||Nicht so schnell. Ich bin alt, ich muss mich erst ausruhen.
   1050806|00000000||Lass uns noch etwas bleiben.
   1050800|00000000||Noch nicht.
   1050799|00000000||Ja. Gehen wir.
   1050818|00000000||Ja, lass uns gehen.
   1050824|00000000||Gehen wir.
    540362|00000000||Ja, lass uns gehen.
    581161|00000000||Danke, dass du mich begleitet hast.
    581163|00000000||Komm her.
    588674|00000000||Gehen wir.
    540359|00000000||Ja, gehen wir.
    588660|00000000||Jetzt müssen wir noch Eredin finden und töten.
    588663|00000000||Ein Oren für deine Gedanken.
    588665|00000000||Was soll ich nur Yennefer sagen, wenn wir wieder in Novigrad sind?
    588667|00000000||Sag ihr die Wahrheit. Immer.
    588670|00000000||Ob Triss und Yennefer die Zauberinnen der Loge gefunden haben?
    588672|00000000||Wir sollten wieder zu ihnen stoßen.
    545562|00000000||Vogel schön ... Gut stinken.
    570971|00000000||Ich bin jetzt dein Meister. Du beschützt mich, verstanden?
    570972|00000000||Bart verstanden.
    560567|00000000||Bleib hier stehen ... und lass niemanden vorbei!
    560569|00000000||Bart hier stehen. Niemand vorbei.
    557230|00000000||Wir müssen zur Tempelinsel.
    557231|00000000||Seit wann bist du denn religiös?
    557612|00000000||Bin ich nicht. Lass uns gehen.
    557232|00000000||Wir fangen mit den Scherben an.
    557233|00000000||Zu wem gehen wir?
    557493|00000000||Wirst schon sehen ...
    557227|00000000||Geh voraus.
    557225|00000000||Na klar, gehen wir.
    557508|00000000||Kein Problem. Ich warte hier.
    557516|00000000||Dann warte ich dort auf dich ... auf dem Markt in Gildorf.
    557234|00000000||Würde ich liebend gern, aber ich muss vorher noch etwas erledigen.
    557226|00000000||Ich muss vorher noch etwas erledigen.
    557446|00000000||Als ich zuletzt in Novigrad war, hatte ich einige Probleme ...
    557833|00000000||Hab ich gehört.
    557376|00000000||Ein paar Leute haben mir geholfen, andere wiederum ... nicht so richtig. Ich will's beiden zurückzahlen.
    557377|00000000||Kommst du mit?
    557304|00000000||Ich war neugierig auf diese "kleine Sache", die du klären musst.
    557501|00000000||Können wir aufbrechen?
    557499|00000000||Für einen meiner Helfer, von denen ich dir erzählt habe ... als Zeichen des Danks.
    557237|00000000||Suchst du was Bestimmtes?
    557238|00000000||Ein hübsches kleines Schmuckstück ...
    557444|00000000||Ein Geschenk für jemanden?
    557525|00000000||Bereit?
    553345|00000000||Weiß Yen, wo Rita sich aufhält?
    553358|00000000||Weißt du, was Yen herausgefunden hat?
    553361|00000000||Da musst du sie selber fragen, ich war mit der Suche nach Philippa beschäftigt.
    527056|00000000||Grüß dich, Triss.
    527057|00000000||Bist du verrückt geworden?! Ihr habt ganz alleine Imlerith verfolgt?! Zum Sabbat?!
    552810|00000000||Wie konntest du Ciri in solche Gefahr bringen?!
    552813|00000000||Wir mussten es tun.
    552855|00000000||Ciri musste es tun. Ich konnte sie nicht alleine losziehen lassen.
    552865|00000000||Du hättest an meiner Stelle dasselbe getan.
    552861|00000000||Außerdem würde ich nicht zulassen, dass Ciri etwas passiert. Das weißt du.
    552829|00000000||Ist es aber nicht. Ich war dort. Hatte alles unter Kontrolle.
    552840|00000000||Können wir bitte das Thema wechseln?
    552858|00000000||Außerdem war ich die ganze Zeit über da. Ich hatte alles unter Kontrolle.
    552842|00000000||Das hätte ich nicht tun sollen ... Tut mir leid.
    552850|00000000||Es ist gut ausgegangen. Aber es hätte auch anders enden können.
    552852|00000000||Ich weiß. Aber Imlerith ist besiegt. Das zählt.
    552812|00000000||Tut mir leid, das hätte ich nicht tun sollen.
    552811|00000000||Beruhige dich. Alles ist gut gegangen.
    552823|00000000||Komm schon, wir haben es gut überstanden. Im Gegensatz zu Imlerith.
    552825|00000000||Das ist das einzig Beruhigende. Aber das ist keine Rechtfertigung.
    552826|00000000||Weißt du, was alles hätte passieren können?
    552831|00000000||Ja. Aber ich hätte nie zugelassen, dass Ciri etwas passiert. Das weißt du.
    553503|00000000||Auf dem Weg in die Stadt haben wir Hexenjäger gesehen.
    553517|00000000||Die Stadt ist in Radovids Farben geschmückt. Und wir sind auf dem Weg hierhin an Hexenjägern vorbeigekommen.
    553541|00000000||Novigrad ist verloren. Es sei denn, der Kaiser nimmt die Stadt wie durch ein Wunder ein.
    554344|00000000||Hm, hätte nie gedacht, dass die Magier Emhyr mögen würden ...
    554345|00000000||Lieber den berechenbaren Emhyr und seinen Anschein von Freiheit, als den verrückten Radovid, der alles hasst, was auch nur entfernt mit Magie zu tun hat.
    570839|00000000||Wir sahen brennende Scheiterhaufen. Anderlinge.
    570840|00000000||Auf dem Weg in die Stadt kamen wir an brennenden Scheiterhaufen vorbei. Mit Anderlingen.
    570849|00000000||Es wird jeden Tag schlimmer. Hier sind keine Magier mehr übrig, sodass sich die Jäger andere Opfer suchen mussten.
    570853|00000000||Wir müssen alles so schnell wie möglich erledigen und aus Novigrad verschwinden.
    552869|00000000||Wie geht es voran mit der Loge?
    552892|00000000||Hattest du Erfolg mit der Loge? Will uns jemand helfen?
    552897|00000000||Sieht nicht gut aus ... Ida hat abgelehnt und Francesca möchte im Krieg ihr kleines Reich nicht verlassen.
    552943|00000000||Von Fringilla wissen wir's nicht. Wir konnten sie nicht kontaktieren.
    553150|00000000||Keira wurde einmal in Velen gesehen. Seitdem keine Spur von ihr. Sie könnte tot sein ...
    553136|00000000||Keira kannst du auch streichen ...
    553174|00000000||Ich hoffe, dass wir Philippa und Rita noch rechtzeitig finden.
   1059257|00000000||Was ist mit Philippa?
    553304|00000000||Und ich hoffe, dass es bei uns klappt und wir Philippa und Rita finden.
    553179|00000000||Keira ... hat ihren Charme überschätzt. Wollte sich Radovids Wohlwollen erkaufen und bot an, eine mächtige Waffe für ihn anzufertigen ...
    553185|00000000||Ich hab versucht, es ihr auszureden, aber sie wollte nicht hören ...
    554482|00000000||Radovid hat sie ausgelacht und dann befohlen, sie festzunehmen und ... aufzuspießen. Ich konnte nichts tun ...
    553208|00000000||Keira hat mit dem Feuer gespielt. Sie hätte wissen müssen, dass sie sich verbrennt.
    553210|00000000||Vielleicht die Hände ... aber gepfählt?
    553193|00000000||Sie hatte es darauf angelegt.
    554488|00000000||Dich trifft keine Schuld. Keira hat noch nie auf Vernunft gehört ...
    554486|00000000||Dich trifft keine Schuld.
    553192|00000000||Sie hat es nicht verdient.
    553198|00000000||Ganz seine Art ... Er hätte sie erhängen können, köpfen ... Selbst auf dem Scheiterhaufen wäre ihr Tod schneller gewesen ...
    553206|00000000||Er wollte sie leiden sehen ...
    553215|00000000||Bevor wir gehen, müssen wir sie begraben. Ich lass nicht zu, dass die Krähen ihr Fleisch vom Pfahl picken.
    553217|00000000||Zumindest das kann ich für sie tun ...
    553224|00000000||Die Wächter werden die Leiche rausrücken ... mit den richtigen Argumenten.
    553254|00000000||Ich hoffe, dass wir Philippa und Rita finden ... bevor sie ein ähnliches Schicksal erleiden.
   1059268|00000000||Hoffentlich können wir Philippa erreichen, bevor sie ein ähnliches Schicksal ereilt.
   1059259|00000000||Ich hab ein bisschen nachgeforscht und interessante Sachen rausgefunden.
   1059253|00000000||Nämlich?
   1059255|00000000||Willst du die lange oder die kurze Version?
   1059247|00000000||Verdammt schade, dass Keira uns nicht helfen kann ...
   1059251|00000000||Stimmt, aber vielleicht können wir Philippa finden.
   1059245|00000000||Was ist mit Keira und Philippa?
   1059241|00000000||Yen und ich haben Margarita gerettet.
   1059243|00000000||Ich weiß. Rittersporn hat sie oben in ein Zimmer gebracht. Sie erholt sich allmählich.
    553137|00000000||Und die anderen? Keira? Margarita? Philippa?
    553142|00000000||Keira?
    553148|00000000||Ich dachte, gerade du würdest das verstehen ...
    553297|00000000||Hab schon unpassendere Paare gesehen ... Hoffentlich klappt es.
   1059261|00000000||Hoffentlich klappt es bei uns, und wir finden Philippa und Rita.
    553325|00000000||Das werden wir. Wir müssen es.
    553329|00000000||Ich werde besser schlafen, wenn sie beide hier bei uns sind.
    553188|00000000||Keine Sorge, das werden wir.
    553187|00000000||Wo sind Philippa und Margarita?
    553319|00000000||Weißt du, wo sie sind?
    553323|00000000||Yennefer sucht nach Rita. Und ich versuche herauszufinden, wo Philippa steckt.
    553344|00000000||Hast du etwas über Philippa herausgefunden?
    553363|00000000||Und? Hast du was herausgefunden?
    554349|00000000||Einiges, was interessant sein könnte. Willst du die lange Version oder die kurze hören?
    554354|00000000||Rate mal.
    554357|00000000||Kurz gesagt, sie war die ganze Zeit hier, in dieser Taverne, direkt vor unserer Nase. Sie saß verwandelt im Käfig und hatte ein Dimeritiumband am Bein.
    554359|00000000||Zoltans Eule?
    554361|00000000||Mhm.
    554362|00000000||Und warum ist sie nicht mehr hier?
    554365|00000000||Weil Zoltan sie vor einigen Tagen bei einem Kartenspiel verloren hat.
    554350|00000000||Die Kurze, nur das Wichtigste.
    554351|00000000||Die Lange. Ich will alles hören.
    554352|00000000||Erzähl mir alles. Ich möchte alle Details wissen.
    553364|00000000||Nachdem Philippa aus Loc Muinne geflohen ist, kam sie nach Novigrad. Sie suchte Hilfe bei einem früheren Liebhaber, dem Zauberer Arthur de Vleester.
    570878|00000000||De Vleester? Kommt mir bekannt vor ...
    553407|00000000||Philippa und ein früherer Liebhaber ... Irgendwie hab ich das Gefühl, dass die Geschichte nicht gut ausgeht.
    553411|00000000||Philippa hat mal einen Trottel aus ihm gemacht. Arthur wollte sich rächen. Er hat sie überzeugt, dass sie als Eule am sichersten wäre. Sie hat sich verwandelt, und er hat ihr ein Dimeritiumband am Bein angebracht.
    553416|00000000||Kurz danach fing die Hexenjagd an. Leider fiel Arthur ihr zum Opfer. Sein Besitz wurde versteigert.
    553417|00000000||Und wie es der Zufall wollte, kam ein uns wohlbekannter Zwerg zufällig bei dieser Auktion vorbei ...
    553418|00000000||Zoltan. Oha. Philippa ist die ganze Zeit unter unserer Nase gewesen?
