;meta[language=de]
   1011364|00000000||Warum kriegen wir den Schlüssel nicht?
   1011366|00000000||Der Schlüssel ... warum glaubst du nicht, dass wir ihn kriegen?
   1011367|00000000||Herrje, ihr seid ja schlimmer als Kinder!
   1011368|00000000||Drei Seelen werden auf den Berg gelassen ... und zwar nur stramme Burschen oder holde Mädel. Sie bekommen den Schlüssel, öffnen das Tor und treffen die Herrinnen.
   1011369|00000000||Dann wäre ich also dabei.
   1011370|00000000||Aber er ist alt und hässlich. Was kann er denn?
   1011371|00000000||Verlorene Stimmen wiederfinden, zum Beispiel.
   1011372|00000000||Dann finde die Stimme der Vernunft. Sie wird euch raten, umzukehren. Ihr könnt die Herrinnen nicht täuschen.
   1011365|00000000||Haben die Muhmen Gäste?
   1011373|00000000||Wir suchen einen Elfen namens Imlerith. Ciri meint, er könnte ein Gast der Muhmen sein.
   1011407|00000000||Ein großer Kerl in Plattenrüstung? Da seid ihr auf dem richtigen Weg ... Er ist auf den Berg rauf.
   1011408|00000000||Du hast ihn gesehen?
   1011409|00000000||Zuerst im Sumpf. Unter den Hufen seines Pferdes ist das Wasser gefroren. Und dann gestern noch mal, als er den Weg hochritt.
   1011410|00000000||Warum sucht ihr ihn?
   1011411|00000000||Er hat meinen Freund getötet.
   1011412|00000000||Bei dem würde ich auf Rache verzichten. Selbst die Herrinnen kriechen vor ihm im Staub.
   1011363|00000000||Wir müssen es versuchen.
   1011464|00000000||Wir müssen zum Gipfel. Ganz einfach.
   1011465|00000000||Dann müsste ihr Thekla überreden. Sie ist zwar blind wie ein Maulwurf, aber sie ist nicht dumm.
   1011466|00000000||Wir wollen sie nicht hereinlegen.
   1011467|00000000||Ihr findet sie in dem Zelt da drüben. Ich wünsche euch Glück und hoffe, wir sehen uns wieder ... irgendwann.
    569275|00000000||Philippa! Warte!
    569278|00000000||Ich werde dir nichts tun!
    569279|00000000||Schwachsinn!
    569281|00000000||Ich will dir helfen!
    569282|00000000||Beim Sterben vielleicht? Das kannst du vergessen!
    465459|c422f954||Gruftweib
   1059595|00000000||Zahlreiche Fußspuren. Hier ist ein Haufen Bauern durchgezogen.
    536517|00000000||Ghaarrr!
    536518|00000000||Raaaghr!
    536516|00000000||Arrrgh!
   1051202|00000000||Was nun?
   1051204|00000000||Wir gehen nach Hause ...
   1051206|00000000||*Seufz* Versuchen wir es nächstes Jahr wieder.
    569288|00000000||Geralt, wir dürfen keine Zeit verlieren. Folge ihr.
    587715|00000000||Es waren gar keine Magier, heißt es.
    588026|00000000||Wer dann?
    588028|00000000||Ein Mann! Hat sich durch die Wachen gekämpft und ist geflohen!
    587716|00000000||Noch ganz dicht?
    588031|00000000||Deireadh ist zu gut bewacht. Das ist das bestbewachte Gefängnis des Kontinents.
    556897|00000000||Triss bleibt bei mir.
    556912|00000000||Wir gehen zusammen.
    556913|00000000||Auf keinen Fall.
    556914|00000000||Schon gut, Geralt, ich bleibe. Falls sie auf diesem Weg fliehen möchte.
    556931|00000000||Bin gleich wieder zurück.
    556898|00000000||Bleib hier, Triss. Falls sie auf diese Weg fliehen möchte.
    556900|00000000||Sei vorsichtig. Sie mag zwar blind sein, aber sie ist immer noch gefährlich.
    564529|00000000||Und tu ihr nicht weh.
    556896|00000000||Gut.
    556053|00000000||Verdammte Schwachköpfe! Ihr nach!
    556062|00000000||Wir kümmern uns um sie.
    556064|00000000||Oh nein! Nein, nein! Die Zauberin bleibt hier.
    556021|00000000||Ergib dich!
    556030|00000000||Das hier ist ein Labyrinth, Hexe! Du wirst niemals rausfinden!
    564854|00000000||Wusstest du davon?
    564926|00000000||Wusstest du davon?
    564928|00000000||Nein, sie haben es mir erst heute Morgen gesagt.
    564952|00000000||Ein Jammer, denn offenbar hast du dich hervorragend amüsiert.
    564932|00000000||Ich zeig's dir gleich ...
    564936|00000000||Ich zeig's dir gleich, wenn du nicht ...
    564938|00000000||An deiner Stelle, mein Freund, würde ich haufenweise Gold versprechen, nicht drohen.
    564946|00000000||Bind mich jetzt los, sonst brauchst du das Gold als Zahnersatz.
    564951|00000000||Dazu müsstest du mich erst kriegen. Und es sieht nicht so aus, als würdest du bald hier rauskommen.
    564987|00000000||Ich hab gekriegt, was ich verdient habe.
    565001|00000000||Ich hab gekriegt, was ich verdient habe ... Hätte wissen müssen, dass das zu gut war, um wahr zu sein ...
    565044|00000000||Das hättest du auf jeden Fall.
    564988|00000000||Ich will nicht drüber reden.
    565003|00000000||Wenn du irgendwem davon erzählst ...
    565046|00000000||Beruhig dich, ich sage nichts. Es ist eins, über einen Freund zu lachen, aber was ganz anderes, ihn öffentlich zum Gespött zu machen.
    565069|00000000||Ich geh zu Avallac'h. Der wollte wohl mit mir reden ...
    565086|00000000||Ich geh zum Hafen. Wir sollten schon nach Skellige unterwegs sein.
    565088|00000000||Pass auf dich auf, mein Freund. Und du bist doch nicht böse, dass ich dich geneckt habe, oder?
    565090|00000000||Nein, bin ich nicht. Bis dann, Rittersporn.
    565048|00000000||Oh Geralt, wie wenig du über Frauen weißt ... Hast du wirklich geglaubt, du könntest sie beide haben?
    565050|00000000||Du musst noch viel lernen ... Ich unterweise dich gerne, wenn du willst.
    565059|00000000||Ich verzichte.
    564998|00000000||Triss und Yen - wo sind sie? Denen hab ich was zu sagen ...
    564986|00000000||Triss und Yen werden büßen ...
    564923|00000000||Ritterspooorn ...
    564954|00000000||Schon gut, schon gut. Tut mir leid, so seh ich dich nicht oft, konnte nicht widerstehen ...
    564985|00000000||Und, wie fühlst du dich? Etwas taub, wette ich.
    564856|00000000||Spar dir das. Ich bin nicht in der Stimmung ...
    564858|00000000||Oh, aber ich. Was habt ihr gespielt?
    564859|00000000||Zähm den Bies"? Oder "Befrei den Prinzen"
    564853|00000000||Spar dir das.
    564292|00000000||Holla, die Damen haben's dir aber gezeigt.
   1012529|00000000||Ist das der Kerl, der dich aus deinem Haus geschmissen hat?
   1012616|00000000||Ja.
   1012617|00000000||Dann muss ich mal ein Wörtchen mit ihm reden.
   1012618|00000000||Tu ihm nicht weh!
   1012619|00000000||Für wen hältst du dich? Sarah aus ihrem Haus zu schmeißen ... Wie konntest du?
   1012620|00000000||Es war nicht ihr Haus und außerdem ...
   1012621|00000000||Bitte, es ist doch alles gut ausgegangen. Hätt ich Novigrad nicht verlassen, wäre ich Hansi nie begegnet.
   1012634|00000000||Gut, dann kommst du diesmal noch davon.
   1012635|00000000||Du hast also dein Mädchen gefunden. Was führt dich her?
   1012623|00000000||Was macht ihr hier?
   1012629|00000000||Was machst du denn hier? Und wie seid ihr zwei zusammengekommen?
   1012630|00000000||Wir haben eine Einladung bekommen, die wir nicht ablehnen konnten. Zum Sabbat werden die Herrinnen immer netter. Oder wollen sie mir nur zeigen, wer das Sagen hat?
   1012631|00000000||Hab ich richtig gehört? Du bist den ganzen Weg aus Novigrad hergelaufen?
   1012632|00000000||Kein Problem für jemanden, der mit Vögeln spricht. Eine Amsel hat mir von Hansi erzählt, also bin ich hergekommen.
   1012622|00000000||Wir suchen einen Weg auf den Berg hinauf.
   1012624|00000000||Wir wollen auf den Berg steigen. Irgendwelche Ratschläge?
   1012625|00000000||Ja ... macht das nicht. Hansi sagt, mit den Muhmen sei nicht zu spaßen.
   1012626|00000000||Du hast dein Mädchen doch gerade erst gefunden. Willst du sie etwa schon wieder verlieren?
   1012627|00000000||Uns wird nichts passieren.
   1012628|00000000||Tut, was ihr wollt. Der Weg auf den Berg rauf beginnt hinter dem Tor. Dafür braucht ihr den Schlüssel. Die alte Thekla gibt ihn nur denjenigen, die der Herrinnen würdig sind.
   1012667|00000000||Der Schlüssel ... was hat es damit auf sich?
   1012697|00000000||Das Tor ist verschlossen? Warum?
   1012698|00000000||Meine Güte, schlimmer als Kinder, die beiden.
   1012699|00000000||Zu jedem Sabbat fordern die Muhmen drei schöne Jünglinge. Die alte Thekla wählt sie aus und gibt ihnen den Schlüssel zum Tor.
   1012700|00000000||Sie ist jung und schön.
   1012701|00000000||Aber er sicher nicht.
   1012702|00000000||Überlasst die Sache mit Thekla uns.
   1012703|00000000||Lügt sie nicht an, das kriegt sie sofort raus. Wenn sie euch nicht helfen möchte, müsst ihr sagen, dass ihr die Prüfung ablegen wollt.
   1012704|00000000||Die Prüfung?
   1012705|00000000||Thekla wird es euch erklären.
   1012668|00000000||Haben die Muhmen Gäste?
   1012669|00000000||Wir suchen einen Elfen namens Imlerith. Ciri glaubt, die Muhmen könnten ihn eingeladen haben.
   1012670|00000000||Der große Ritter? Er hat mich fast niedergetrampelt!
   1012671|00000000||Auf seinem Weg den Berg hoch?
   1012672|00000000||Ja. Was willst du von ihm?
   1012673|00000000||Er hat meinen Freund getötet.
   1012674|00000000||Auf Rache aus, hm? Vergesst es. Hilft niemandem, den Narrentod zu sterben. Sogar die Muhmen kriechen vor dem Kerl im Staub.
   1012633|00000000||Danke für den Rat. Gehen wir.
   1012706|00000000||Danke für den Rat. Wir sollten jetzt gehen.
   1012707|00000000||Viel Glück.
   1012708|00000000||Besucht uns mal. Wir wohnen nicht weit von hier weg.
   1012709|00000000||Das werden wir bestimmt. Macht's gut.
   1074645|00000000||Ich muss da runter.
    558062|00000000||Er lügt, töte ihn.
    558099|00000000||Er lügt, bereite ihm ein Ende.
    558101|00000000||Nein, warte, es stimmt!
    558111|00000000||Beweise es.
    558102|00000000||Weißt du noch ... als wir Dijkstras Schatz stehlen wollten?
    558109|00000000||Wir haben Sporen verteilt, den Troll schläfrig gemacht. Hat im Schlaf über Dijkstras Fußwickel gesungen und wollte Elfensuppe!
    564589|00000000||Du hättest doch die Gestalt eines anderen annehmen können.
    547150|00000000||Wär nicht nötig gewesen, wenn du nicht Hurensohns Gestalt angenommen hättest.
    564593|00000000||Was zum Henker sollte das?
    558257|00000000||Sei vorsichtig. Man könnte dir auf die Schliche kommen.
    558267|00000000||Wilys Männer sind zu dumm dazu und seine Kollegen sind nicht viel besser.
    558269|00000000||Denk dran, auch ihr seid reingefallen.
    558270|00000000||Und das hätte für dich böse enden können.
    558272|00000000||Stimmt, ich bin manchmal etwas zu leichtsinnig. Aber meistens pass ich auf.
    558208|00000000||Hast du keine Angst, entlarvt zu werden?
    558317|00000000||Wir müssen gehen.
    558318|00000000||Ja, wir müssen noch zum Goldenen Stör.
    558321|00000000||Es war schön, euch beide zu sehen. Passt auf euch auf.
    558323|00000000||Du auch.
    558324|00000000||Mach's gut, Dudu.
    558199|00000000||Wir müssen gehen.
    558198|00000000||Wie läuft das Geschäft?
    558211|00000000||Interessante Branche hast du dir da ausgesucht.
    558216|00000000||Dudu hatte schon immer einen Sinn für Zahlen. Was sind schon ein paar Bordelle und Kasinos? Er schafft das.
    558221|00000000||Das ist es ja ... ich brauch's gar nicht.
    558223|00000000||Zwei Wochen nach Wilys Tod hab ich gesagt, ich hätte das Licht des Ewigen Feuers erblickt.
    558226|00000000||Hab alle illegalen Geschäfte abgetreten. Ich bin jetzt ein anständiger Händler.
    558244|00000000||Und Hurensohns Leute haben nichts gesagt?
    558246|00000000||Ich habe Verbindungen zu den Gilden, das Geschäft blüht, die Gewinne haben sich verdoppelt.
    558250|00000000||Für Wilys Männer bedeutet eine doppelt gefüllte Börse doppelten Respekt für den Überbringer.
    558194|00000000||Ganz schön mutig, Dudu. Hätte ich nicht erwartet.
    558197|00000000||Ich auch nicht.
    572091|00000000||Ach, übrigens ... Du ahnst ja nicht, wie froh ich bin, dass du wohlauf bist.
    572105|00000000||Und ich erst, dass ich dir nicht den Hals aufgeschlitzt hab.
    558129|00000000||Nach unserer Flucht wusste ich nicht weiter. Ich konnte mich nur verstecken. Sie hätten mich irgendwann gefunden.
    558130|00000000||Die Entscheidung war einfach. Außer uns wusste kaum jemand, dass er tot ist. Das war meine Chance.
    564590|00000000||Es ist nicht klug, mit einem Hexer zu spielen ...
    564595|00000000||Hurensohn Junior? Warum muss es ausgerechnet der sein?
    564588|00000000||Das war ein idiotischer Witz.
    547149|00000000||Götter! Habt ihr mir einen Schreck eingejagt!
    558088|00000000||Warte, Ciri.
    558091|00000000||Nach dem Raub in Dijkstras Schatzkammer warst du verschwunden. Wo habe ich dich gefunden? Schnell.
    558092|00000000||Auf dem Fleischerhof. Du hast in Priscillas Stück mitgespielt. Und mich auf die Bühne gezerrt.
    558095|00000000||Steck das Schwert ein, Ciri. Es ist Dudu.
    558057|00000000||Beweise es.
    547143|00000000||Sieh einer an, wen haben wir denn da?
    558004|00000000||Hast dein Mündel endlich gefunden. Hat ja 'ne Weile gedauert.
    558045|00000000||Sieht mir putzmunter aus.
    547144|00000000||Aaah, hast du gedacht, du hättest mich kaltgemacht? Überraschung!
    558061|00000000||Halt den Rand, Hexe, bevor ich dir das Maul stopfe!
    558068|00000000||Schluss jetzt.
    558069|00000000||Ich bring zu Ende, was du angefangen hast.
    558074|00000000||Hey, stopp! Ich bin's, Dudu! Dudu Biberveldt! Hast du mich echt nicht erkannt?
    558087|00000000||Dudu?
    581110|00000000||Ja, sie ist hier.
    581119|00000000||Ja. Wir sind beide hier.
    581121|00000000||Wo ist das Mädchen?
    581123|00000000||Das spielt keine Rolle. Du kriegst sie nicht.
    581125|00000000||Du hast in der Festung tapfer gekämpft, bis zum bitteren Ende.
   1086392|00000000||Ich hoffe, diesmal wird es nicht anders sein.
    581116|00000000||Erst du, dann sie.
    581112|00000000||Ich bin alleine hier.
    581114|00000000||Ein Lüge, die nichts ändern wird.
    581109|00000000||Ich bin allein hier.
    540267|00000000||Die Schwestern sagten, du würdest kommen. Sie haben es auf dem Wasser gesehen.
    540269|00000000||Das Mädchen haben sie nicht gesehen, aber sie ist mit dir gekommen, oder nicht?
    528671|00000000||Ich bring sie an einen ... sicheren Ort.
    554627|00000000||Dann warte ich vor dem Passiflora auf dich.
    554640|00000000||Wir sehen uns dort.
    554645|00000000||Mach dir keine Mühe.
    554632|00000000||Bis später.
    554631|00000000||Nein danke. Das schaff ich schon.
    554628|00000000||Bist du sicher, dass du keine Hilfe brauchst?
    554639|00000000||Soll ich dir helfen?
    534048|00000000||Gehen wir.
    559818|00000000||Gehen wir.
    534047|00000000||Warte kurz. Bin gleich wieder da.
    559824|00000000||Beeil dich.
    559819|00000000||Ich komme wieder.
    527830|00000000||Da bist du ja. Bea ist drinnen.
    558815|00000000||Du sagst "Geralt"? Und weiter?
    558862|00000000||Von Scheißriva.
    558817|00000000||Ach so, warum sagst du das nicht gleich?
    558818|00000000||Tut mir leid, der Stress ... war 'n Missverständnis.
    558896|00000000||Herr Wily erwartet euch.
   1043409|00000000||Äh ... klar, klar, ein Geschäft ...
   1043411|00000000||Geht nach oben. Der Boss wartet.
    558842|00000000||Wie wär's mit einem Geschäft?
    558833|00000000||Wir lassen uns was einfallen.
    558845|00000000||Aus dem Weg, ihr Knilche, sonst richten wir eure Fratzen so zu, dass ihr nicht mal bei der Krüppelkati ein Mädchen findet.
    558848|00000000||Was hast du gesagt?
    558850|00000000||Nicht kapiert? Zu viele Silben? Verschwindet.
    558852|00000000||Oh, du kleine Schlampe!
    558853|00000000||Und ich dachte, es ginge auf die freundliche Art ...
    558840|00000000||Aus dem Weg, sonst werdet ihr es bereuen.
    558779|00000000||Was?
    558780|00000000||Wir suchen Herrn Wily.
    558781|00000000||Herr Wily erwartet wichtige Gäste, also verpisst euch, ihr ... äh ... äh ...
    558836|00000000||Kackfrösche!
    560214|00000000||Und ob es das tut.
    560217|00000000||Du bist ja auch ein verfluchter Sonderling ...
    560224|00000000||Ist er. Und ziemlich gefährlich dazu. Der Schlächter von Weißgarten.
    564615|00000000||Und was macht er hier? Die Bäume beschneiden?
    560228|00000000||Yugen, der hat das halbe Dorf ausgerottet und die Leichen des Dorfältesten und seiner Frau mit dem Pferd bis Novigrad gezogen. Lass uns abhauen.
    560234|00000000||Du solltest auf deinen Freund hören.
    560251|00000000||T-t-tut mir leid ...
    560209|00000000||Lasst sie in Ruhe ...
    560211|00000000||Zieht eure Waffen. Bringen wir's hinter uns.
    560280|00000000||Wa... was?
    560281|00000000||Du willst ihr wehtun, ich lass es nicht zu, wir streiten uns und machen 'nen riesigen Schwanzvergleich.
    560283|00000000||Ich hab keine Zeit für so was. Zieht eure Waffen.
    560253|00000000||Oder ich schmeiß euch raus.
    558938|00000000||Ich hab dir eine Chance gegeben. Hättest sie nutzen sollen.
    558940|00000000||Ich scheiß drauf, was du mir gibst.
    560031|00000000||Das wird dir noch leidtun, dumme Kuh.
    534445|00000000||Achte auf deine Manieren, du redest mit einer Dame.
    560206|00000000||Halt dich da raus ... das geht dich nichts an.
    171505|05d41baa||Fugas
   1061399|00000000||Gute Herrinnen, gnädige Herrinnen.
   1062116|00000000||Schenkt meinem Enkel Gesundheit.
   1062118|00000000||Er macht viel Unsinn, aber er ist ein guter Junge.
   1062120|00000000||Schenkt ihm Gesundheit, ich bitte euch.
   1060980|00000000||Hah. Eines Tages können wir uns richtig satt essen.
   1060982|00000000||Also wirklich. Wenn die Herrinnen genug zu essen haben, warum geben sie uns dann nicht öfters was ab?
   1060984|00000000||Wag es ja nicht, schlecht von unseren Gönnerinnen zu sprechen!
    572537|00000000||So schlimm war es noch nie.
    572685|00000000||Sie sind nicht aus Novigrad rausgekommen, da haben sie einen letzten aussichtslosen Kampf geführt ...
    562529|00000000||Zoltan wartet auf dein Signal.
    562599|00000000||Wir kommen schon alleine klar.
    536832|00000000||Ich brauche noch etwas Zeit ...
    562641|00000000||Beeil dich.
    536835|00000000||Vielleicht hast du recht. Ein bisschen Hilfe kann nicht schaden.
    562635|00000000||Natürlich habe ich recht.
    536836|00000000||Geh. Ich warte hier.
    536826|00000000||Warte. Ich hole Hilfe.
    536825|00000000||Ja.
    536833|00000000||Kann losgehen.
    562530|00000000||Fangen wir an?
    562526|00000000||Graden wird kommen, und Zoltan erwartet dein Signal.
    536821|00000000||Hast du einen Zugang gefunden?
    536822|00000000||Mehrere. Der nächste ist in einem Brunnen beim Gefängnis.
    562532|00000000||Hast du Hilfe organisiert?
    562609|00000000||Da sind wir.
   1059926|00000000||Das ist es? Hmm ... bis vor Kurzem war der Brunnen mit einem Felsbrocken verschlossen.
   1059928|00000000||Aufgrund eines Erlasses von Hemmelfart vor einigen Jahren. Aber ich habe zwei starke und willige Passanten gefunden, die das Hindernis entfernt haben. Gegen eine bescheidene Gebühr natürlich.
   1059930|00000000||Hier.
    562611|00000000||Was ist das?
    562613|00000000||Benutz es, wenn du Rita hast. Dann kann ich dich orten.
    562628|00000000||Dann sehen wir uns drinnen.
    562629|00000000||Viel Glück.
    562620|00000000||Bis später.
    562619|00000000||Ich dachte, du kommst mit mir.
    562622|00000000||Kommst du nicht mit?
    562624|00000000||Durch Ruinen und Kloaken kriechen, hmmm, das überlass ich lieber dem Fachmann.
    562626|00000000||Du willst also lieber antanzen, wenn die harte Arbeit getan ist.
   1059893|00000000||Komm. Es ist nicht mehr weit.
   1022078|00000000||Und die Vierte - wer war sie?
   1022080|00000000||Manche sagen, sie war ihre Mutter, andere nennen sie die vierte Schwester.
   1022082|00000000||Sie nahmen kalte Eisennägel, durchbohrten ihr Herz, ihren Kopf und versenkten ihren Leichnam in einem stinkenden Sumpf.
   1022109|00000000||Der Ritter, der auf den Gipfel ritt, wer war er?
   1022111|00000000||Wer weiß das schon? Vielleicht haben die Herrinnen ihn bezirzt, ihnen beim Fest zur Hand zu gehen?
   1022113|00000000||Vielleicht lag er unter den Wurzeln der Eiche begraben und ist auferstanden, als der Baum reichlich Eicheln trug?
    546219|00000000||Schau mal da drüben - Kinder.
    546221|00000000||Beides Göttlinge. Ich kenne sie.
   1058903|00000000||Nein - ein Göttling. Ich kenn ihn, er heißt Hansi.
    543663|00000000||Guck mal, ein Kind.
    587690|00000000||Zu den Waffen!
    587994|00000000||Magierrevolte!
    587692|00000000||Hoch mit den Barrikaden!
    587992|00000000||Schützen aufs Dach! Alle anderen auf ihre Posten!
    587694|00000000||Verrammelt.
    588005|00000000||Ich muss einen anderen Ausgang finden.
    587696|00000000||Wo sind die Magier?
    587698|00000000||Nicht drauf reinfallen!
    588010|00000000||Den haben sie vorgeschickt. Jeden Moment beginnt der komplette Angriff!
   1061901|00000000||Danke, hab Dank, guter Mann ...
   1061903|00000000||Mögen die Götter dich belohnen!
   1061905|00000000||Danke ... und pass auf dich auf. Lass dich nicht kriegen.
    535986|00000000||Zieh die Samthandschuhe aus, Geralt.
    535988|00000000||Ich dachte, ihr hättet ein Treffen vereinbart.
    561391|00000000||Ich sagte, dass ich ihn gefunden habe, nicht, dass ich ihn gesprochen habe.
    535989|00000000||Was wollt ihr von mir?! Lasst mich!
    546214|00000000||Beruhige dich. Wir wollen nur reden.
   1061299|00000000||Mhm, und mir eine Klinge in die Rippen stecken und mich in die Gosse werfen.
   1061309|00000000||Schau uns doch an. Sehen wir wie Banditen aus?
   1061312|00000000||Hm ... nein ... eigentlich nicht.
   1061304|00000000||Schön, dass du das einsiehst. Außerdem würdest du uns tot nichts nützen.
   1061314|00000000||Dann ... tut ihr mir nichts?
    561395|00000000||Nein. Du erzählst uns deine Geschichte und gehst dann, wohin du willst.
   1061316|00000000||Hm ... na gut. Aber wir sollten wieder zur Kati gehen. Es ist ... äh ... unklug, sich auf den Straßen aufzuhalten.
   1061319|00000000||Hm ... nein ... eigentlich nicht.
   1021996|00000000||Was für Kreaturen die Welt unter einem menschlichen Schleier betreten ... das weiß niemand.
   1021997|00000000||Wir, wir alle, benutzen diesen Schleier wann und wie wir wollen.
   1021998|00000000||Sicher ist nur, dass sein wahrer Nutzen noch keinem offenbar wurde.
   1021999|00000000||Daher die vielen Fehler, daher legen wir den Schleier im Dunkeln ab, der Schleier, den wir Tod nennen.
   1022027|00000000||Fügt weder euch noch eurem Nächsten Leid zu vor dem Tod.
   1022028|00000000||Bereitet euch vor auf ihn, denn er bereitet sich auf euch vor.
   1022029|00000000||Verscheucht ihn nicht mit starken Worten ... offenbart euch ihm.
    554976|00000000||Die Bauern in Velen nennen diesen Abend das Fest der Geschenke. Ich weiß nicht, warum.
   1011422|00000000||Mist. Los, wir müssen den Schlüssel finden.
   1010763|00000000||Ich warte hier auf dich.
   1015414|00000000||Da unten fließt Wasser ... Was soll's, ich springe.
   1051173|00000000||Ich hab mir schon Sorgen gemacht. Komm, holen wir den Schlüssel.
   1058806|00000000||Avallac'h behauptet, dass Imleriths größte Schwäche seine Eitelkeit ist.
   1059238|00000000||Nicht überraschend, immerhin war er Avallac'hs Schüler.
   1059236|00000000||Der andere, Caranthir, soll verschwiegen und pragmatisch sein.
   1059234|00000000||Er will jeden Feind beeindrucken.
    533396|00000000||Zurück, bevor ein Unglück geschieht.
    533409|00000000||Ich mag dich, Dijkstra. Zwing mich nicht, dir wehzutun.
    533410|00000000||Spar dir deine Drohungen für die Ratten am Hafen auf. Mich kannst du damit nicht beeindrucken.
    533397|00000000||Wir haben jetzt keine Zeit für einen Ehekrach.
    533411|00000000||Ich weiß, ihr wart ... zusammen, aber jetzt ist der falsche Zeitpunkt für einen Ehekrach.
    533412|00000000||Aber er ist perfekt, um eine offene Rechnung zu begleichen.
   1067433|00000000||Das wird sich zeigen.
   1067441|00000000||Es wird sich zeigen, ob ich mich irre oder nicht.
   1067443|00000000||Na ja, wenn du Unfug redest und ich dir glaube ... dann ist es zu spät.
   1067445|00000000||Das Risiko musst du wohl eingehen.
    557146|00000000||Aber was hat das mit Philippa zu tun?
    557148|00000000||Philippa wird uns helfen, Ciri vor der Wilden Jagd zu beschützen.
   1067330|00000000||...
    557156|00000000||Geht schon. Bevor ich meine Meinung ändere.
   1067500|00000000||Vielleicht solltest du sie mal anhören? Ich schätze, Philippa verachtet Radovid mindestens so sehr wie du.
   1067502|00000000||Ich bin froh, dass endlich jemand außer mir auf die Idee gekommen ist, die Welt von diesem Degenerierten zu befreien.
   1067504|00000000||Spar dir dein Lob für andere. Mich schert es nicht.
   1067506|00000000||Derzeit gibt es nur zwei Personen, die Radovid von seinem Boot holen können. Emhyr ... und mich.
   1067508|00000000||Du würdest als Köder herhalten?
   1067510|00000000||Es dürfte dir wohl schwerfallen, Emhyr dafür zu gewinnen ...
   1067512|00000000||Wohl kaum! Geralt, ich würde dieser Schlampe nicht mal mein Frühstücksei anvertrauen!
   1067514|00000000||Zu recht ... mit Eiern kann ich gar nicht. Aber bedenke: Radovid hört, dass du mich geschnappt hast ... wird er dann nicht jede Vorsicht in den Wind schlagen? Wird er die Gelegenheit nicht nutzen, mich zu töten ... selbst ... eigenhändig?
   1067516|00000000||Kommt nicht in Frage! Geralt, bring sie hier weg, bevor mir der Sack platzt!
   1067582|00000000||Und dann ... müssen wir uns treffen. Mit unseren Freunden. Ich hab ein Lagerhaus am Hafen gemietet. Du musst unbedingt kommen.
   1067459|00000000||Lass sie reden.
   1067460|00000000||Sie wird nicht sterben.
   1067462|00000000||Dijkstra, Philippa wird nicht sterben, das haben wir schon besprochen. Vergiss es.
   1067464|00000000||Die Situation hat sich geändert, Hexer. Jetzt ist Philippa in der Lage, meine Pläne zu durchkreuzen.
