;meta[language=hu]
; id      |key(hex)|key(str)| text
    320960|00000000||Nem hagyom, hogy elvigyenek.
    320972|00000000||Nem hagyom, hogy elvigyenek, ugye tudod?
    320974|00000000||Tudom.
    561082|00000000||Csak maradj távol a bajtól.
    320982|00000000||Ne kezelj gyerekként.
    320984|00000000||Akkor sem tettem, amikor még az voltál.
    320986|00000000||Szeretem, amikor mosolyogsz.
    320988|00000000||Gyere ide.
    320990|00000000||Minden rendben lesz.
    320964|00000000||Érted jönnek. Akármi is történjék, nem sodorhatod magad veszélybe.
    320966|00000000||Azt akarod, hogy üljek és várjak, amíg mások az életüket teszik kockára értem?
    320968|00000000||Ez egyszer hallgass rám… ne vedd a kezedbe az irányítást.
    320958|00000000||Ne feledd, nem keverheted magad veszélybe.
    311661|00000000||Van egy perced?
    320956|00000000||Hűha, ez komolyan hangzik.
    520472|00000000||Hamarosan kezdődik.
    548190|00000000||Ha-ha-ha!
    586567|00000000||Igazad volt, ez tényleg beválik.
    586570|00000000||Köszönöm.
    586572|00000000||Szívesen.
    586574|00000000||És most mi következik?
    586576|00000000||Megnézem, hol van a mi drága bölcsünk…
    548186|00000000||Ha-ha! Legyőzték Ríviai Geraltot! Dolgozni kell még azokon a kitéréseken.
    549111|00000000||Biztos vagy benne, hogy nem engedtelek győzni?
    549151|00000000||Biztos vagy benne, hogy nem sértődtél meg azon, hogy legyőzött egy igazi mester?
    547898|07606bf7||Kincstárnok
   1076927|00000000||Szembe szállni a Vad Falkával… Kicsit erősebb, mint a gerillaháború.
    546798|00000000||Menni fog. Ne aggódj.
   1076925|00000000||Ves… ne legyél bolond.
    572659|00000000||Gyenge ítélőképességre vall idehívni a királygyilkost.
    307008|103d66e3||Nyúl
    550116|00000000||Nem érdekel.
    550129|00000000||Nem tudom és az igazat megvallva nem is érdekel.
    550131|00000000||Emlékszel? Az Avallac'hhal folytatott képzés után Novigradba lovaglunk.
    550133|00000000||Változott a terv. Imlerith ott lesz a szombaton. Ott elkapjuk.
    550139|00000000||Mit szól ehhez Avallac'h?
    550147|00000000||Miért nem hiszem, hogy Avallac'hnak tetszik ez az ötlet?
    550154|00000000||Talán látod itt? Írtam neki levelet, Novigradban csatlakozunk hozzá majd.
    554385|00000000||Honnan tudsz a boszorkányszombatról?
    554387|00000000||Honnan tudsz erről az egészről, Imlerith-ről, a boszorkányokról…
    554388|00000000||Avallac'htól. Beszélt azokról, akik hajszolnak minket. Szerinte maga a tudás is változást hozhat.
    550164|00000000||Hát jó, akkor irány Velen.
    550352|00000000||Te vezetsz.
    550212|00000000||A helyedben nem mennék.
    550258|00000000||*Sóhaj* Nem áll jól neked a fekete.
    550260|00000000||Ez meg mit jelent?
    550262|00000000||Szerinted azért akar veled találkozni, mert hiányzol neki? Véleményem szerint tervei vannak veled.
    550263|00000000||Húh. Számíthattam volna erre…
    550354|00000000||Geralt, elegem van. Nem fogom hagyni, hogy mások döntsenek rólam a hátam mögött. Megyünk Velenbe.
    550235|00000000||Valószínűleg csak beszélni szeretne veled.
    550237|00000000||Honnan tudod? Mi van akkor, ha mást is akar?
    550239|00000000||Nekem azt ígérte, semmire nem kényszerítene téged.
    550246|00000000||Szóval akkor oda kellene mennem.
    550247|00000000||Az apádról van szó…
    550252|00000000||Vizima útba esik. Végül is beugorhatunk.
    550211|00000000||Igen, oda.
    550218|00000000||Erről neked kell döntened.
    550220|00000000||Neked kellene eldöntened.
    550222|00000000||De érdekel a véleményed: menjek vagy se?
    550177|00000000||Várj még… van még valami, amit el kell mondanom.
    550179|00000000||Tudtad, hogy a császár nagyon szeretett volna előkeríttetni?
    550181|00000000||Yennefer… említett valamit.
    550183|00000000||Azt akarta, hogy keresd fel.
    550185|00000000||Miért mondod ezt most?
    550194|00000000||Mert talán nem lesz több lehetőséged találkozni az… az apáddal.
    550197|00000000||Szerinted oda kellene mennem?
    550163|00000000||Előbb el kell menni a császárhoz.
    550162|00000000||Gyere, útközben megbeszéljük.
    550135|00000000||Ciri… Biztosan tudod, mibe mászol bele?
    550137|00000000||Igen. És meg kell tennem.
    550138|00000000||Tudod, hogy mit csinálsz?
    550141|00000000||Honnan vetted ezt? Mi ütött beléd?
    550143|00000000||Meg kell bosszulnom Vesemirt.
    550145|00000000||A szombatnál nem lesz jobb alkalom. Imrelith lerészegedik, ott lesz a cimborái között és mulatozik majd. Nem számít arra, hogy lecsapunk rá.
    550123|00000000||Nem t'om. Mondd el!
    550125|00000000||Imlerith.
    550127|00000000||Ez a legjobb lehetőségünk elkapni.
    550115|00000000||Mondd meg.
    549156|00000000||Geralt! Geeeraaalt!
    549157|00000000||Ébresztő!
    549160|00000000||Mi? Mi van? Mi történik?
    549162|00000000||Kelj föl, mennünk kell. Már felnyergeltem a lovakat.
    549197|00000000||Ciri… még csak pirkad. Hová akarsz menni?
    547528|00000000||Velenbe. A Kopasz hegyre. Még néhány nap és kezdődik a boszorkányszombat.
    550114|00000000||Találd ki, hogy ki lesz a díszvendég!
    529751|00000000||Ciri! Vissza az erődbe!
    529752|00000000||Nem!
    531828|00000000||Geralt megadta a jelet!
    531830|00000000||Kész vagyok!
    543483|00000000||Elli Abadabra Sani!
    543485|00000000||Tetrah… Tetragh… Tetraglarie!
    543480|00000000||Láttam! Fedezz!
    548151|00000000||Na megállj, ezt megkeserülöd!
    548152|00000000||Öregszel! Célozni se tudsz már!
   1064962|00000000||Hahaha! Oh, el foglak páholni!
    548150|00000000||Hé, ez csalás!
    565655|00000000||Túl kevesen vagyunk.
    565707|00000000||Nem vagyunk elegen. Való igaz, visszavertük a Vad Falka támadását, de valljuk be, ez kisebb csoda volt. Legközelebb nem leszünk ilyen szerencsések.
    565709|00000000||Bocsáss meg, Geralt, de ez egy olyan ember üres fecsegése, aki láthatóan még nem tért magához egy tragikus veszteség után.
    565711|00000000||Igyál rá egyet, vagy aludj, ahogy tetszik… csak szedd össze magad, és gondold át a dolgot.
    565713|00000000||Úgy teszek, Zoltan.
    565656|00000000||Sajnos ez nem ilyen egyszerű. Nem tudjuk megtalálni őket, ők viszont nagyon könnyen minket. Akkor lepnek meg, amikor akarnak.
    565654|00000000||Nem ilyen egyszerű.
    465924|00000000||Jöttél megnézni, hogy érzem magam? Köszönöm, nem olyan rosszul.
    524918|00000000||Az jó.
    524919|00000000||Eh, szörnyű, ami Vesemirrel történt. Tudom, hogy közel álltatok egymáshoz.
    524920|00000000||Köszönöm, valóban.
    524925|00000000||Figyelj, igazán nem akarom beleütni az orrom olyasmibe, amihez semmi közöm, ezért kérlek, ne érts félre. Bárhogy is döntesz, segíteni szeretnék. Úgy vélem, ellentámadást kellene indítanunk.
    524926|00000000||Meg kell találnunk a Vad falkát és Eredint, és rájuk rontani, akár a bika az üszőre.
    572961|00000000||A fenébe is, nagyon fog hiányozni.
    466174|00000000||Gyertek!
    466172|00000000||Gyertek csak!
    466170|00000000||Tartsátok a pozíciót!
    319846|00000000||Majd szemmel tartom.
    310326|00000000||Lethót majd én szemmel tartom.
    319901|00000000||Én pedig jól viselkedek, ígérem.
    319903|00000000||Ha ezt a gyilkos lesed, nem figyelheted az ellenséget. Miért ilyen fontos ez a királygyilkos?
    319905|00000000||Eredin is király, nem?
    559318|00000000||Basszátok meg! Mindketten!
    319848|00000000||Itt én vagyok a parancsnok.
    319959|00000000||Itt én vagyok a parancsnok, én hozom a döntéseket. Tudhatnátok, hogy háborúban nincs helye vitának.
    319961|00000000||Tudod mit, Geralt? Életemben sok mindent tettem, amit szívesen visszacsinálnék, de mindig tiszteltem azokat, akiknek a szolgálatában álltam, és mindig megbíztam bennük.
    319963|00000000||Itt, Kaer Morhenben ez lesz az első alkalom, hogy egyiket sem tudom elmondani.
   1062868|00000000||Maradunk és segítünk. De nem akarunk neki hátat fordítani.
    319887|00000000||Meg kell menteni Cirit, bármi áron. És Letho már harcolt a Vad falkával.
    319889|00000000||Nem a képességeit kérdőjelezem meg, egyszerűen csak nem bízom benne.
    319891|00000000||Letho nem árul el minket.
    319893|00000000||Naiv vagy, mindig is az voltál. Ez általában nem érdekel, de ez alkalommal megölheted vele Vest, és engem is.
    559312|00000000||Gondold ezt át, mielőtt túl késő lenne.
    319844|00000000||Meg kell értenetek.
    535946|00000000||Ó, régi barátok.
    536191|00000000||Mit keres itt ez a kurafi?
    536194|00000000||Szükségünk van rá.
    559315|00000000||Talán elfelejtetted, mit tett? Mert én nem!
    535941|00000000||Örülök, hogy itt vagytok.
    535942|00000000||Egyedül indultam el, de Ves megtalált. Ragaszkodott hozzá, hogy ő is jöjjön.
    536186|00000000||Le akartalak hordani, amiért nem kérted a segítségem. De útközben kitöltöttem a dühöm Roche-on.
   1061994|00000000||Jó téged újra látni.
   1061992|00000000||A fenébe is, jó téged újra látni.
    462992|00000000||Örülök, hogy látlak, Triss.
    522511|00000000||Köszönd Yennefernek. Ő hívott meg.
    549984|00000000||Lesz még időnk később beszélni. Most kellene tárgyalnunk.
    522515|00000000||Kezd hűvös lenni. Elkezdhetnénk a tanácskozást.
    522544|00000000||Ne álljunk itt kinn.
    520117|00000000||Igen. Gyertek, tanácskozzunk.
   1061996|00000000||Kevés az időnk. A Vad Falka hamarosan itt lesz.
   1061993|00000000||A Vadak hamarosan itt lesznek.
    462983|00000000||Nincs értelme idekinn lenni… Gyere be.
    462858|00000000||Mindannyian itt vannak, mindenki, akinek a segítségét kérted. Avallac'h a toronyban pihen, még mindig elég rossz állapotban van.
    522469|00000000||Hőőő. Jól van, jól van. Rendben van.
    522472|00000000||Mi a…?
    522475|00000000||Üdv ismét, gyermekem!
    522478|00000000||*Sikkant* Ciri!
    522481|00000000||Istenem, de gyönyörű lettél!
    522484|00000000||Nincs értelme ott ácsorogni. Gyere, ideje üdvözölni a többieket.
    522486|00000000||Semmit sem változtatok. Egyiktek sem… így emlékeztem rátok.
    522488|00000000||Mi?
    549628|00000000||Kishúgom.
   1061976|00000000||Yen, te jobban ismered a Vad Falkát, mint bárki. Mesélnél az általuk használt mágiáról…
   1061978|00000000||A navigátoraik portálokat nyitnak, olyan hasadékokat, amik ellen küzdhetünk dimeritiummal vagy a mi mágiánkkal.
   1061980|00000000||Ezen felül megidézhetik a fagyot, ami kitölti a semmit, amin keresztül utaznak.
   1062794|00000000||Egyszerűen nem vagyunk elegen. Kemény harc lesz.
    466075|00000000||Még többen jönnek! Figyelj!
    466077|00000000||A pokolba!
    466073|00000000||Túl sokan vannak!
    572909|00000000||Készüljetek, hamarosan újabb hullám érkezik!
    572908|00000000||Ügyeljetek jól!
    572917|00000000||Csukjátok be azt az átkozott kaput!
    572918|00000000||A kaput, a pokolba is! Csukjátok be a kaput!
   1074923|00000000||Egy nagyobb egység közeledik az erdőből!
    577451|00000000||Be kell zárnunk a kaput, mielőtt bejutnak.
   1074921|00000000||Legyetek éberek! Figyeljetek egymásra! Utat találtak bentre!
    532804|00000000||Elhagyni az udvart! Kaput becsukni!
    532922|00000000||Lambert, ne hősködj!
    532923|00000000||Geralt, menj Lambertért, most!
    532951|00000000||Vissza kell húzódnunk! Yennefer ereje fogy!
    532933|00000000||Megölték! A szukafattyak!
    562205|00000000||Megölték Lambertet!
    532946|00000000||Lambert, az ördögbe is! Maradj velünk!
   1074915|00000000||Hogy haladtatok az erdőben?!
   1074919|00000000||Bezártunk két hasadékot, aztán összefutottunk a Falka egyik hadnagyával.
   1076913|00000000||Készen állsz a harcra?
    465103|00000000||Késznek születtem.
   1076911|00000000||Ha egyszer elkezdődik… Nem játszod a hőst, rendben?
    465101|00000000||Vettem. Ezek nem holmi közönséges lidércek.
   1062948|00000000||Micsoda átkozott régi kacat. Alig fiatalabb Vesemirnél.
    542145|00000000||Szerencsével jártál?
   1076915|00000000||Jutottál valamire?
   1062950|00000000||Nem bírok belőle kilőni semmit. Előbb neveznek ki Novigrad főpapjának.
    321078|00000000||A pokolba is, éppen időben!
    321080|00000000||Vissza a helyedre!
    533060|00000000||Vissza! Át a kapun, be az udvarra!
    533061|00000000||Ellenőrizni az átjárót a fő udvarba!
    565503|00000000||Jó utat.
    565515|00000000||Vigyázzatok magatokra.
    565517|00000000||És még egyszer köszönök mindent.
    565505|00000000||Együtt mentek?
    565507|00000000||Van egy elképzelésem, de a megvalósításához szükségem lesz egy witcherre. Lambert beleegyezett, hogy segítsen.
    565509|00000000||Hm. Sok szerencsét. És még egyszer köszönöm.
    565511|00000000||Most már nem tartozunk egymásnak.
    565502|00000000||Együtt mentek?
    565523|00000000||Örülök, hogy segíthetek, de indulok, amint Lambert jobban érzi magát.
    558916|00000000||Köszönök mindent, amit értem és Ciriért tettél.
    558917|00000000||Lehetek őszinte? Ha tudtam volna, mi fog itt történni, Kaer Morhen közelébe se jövök.
    572963|00000000||Részvétem a veszteséged miatt, Geralt.
    572964|00000000||Nincs kedvem beszélgetni.
    566035|00000000||Akárki javította ki ezeket a falakat, pocsék munkát végzett.
   1062930|00000000||Miért engedted ki a gázt?
   1062932|00000000||Mire való a gáz?
   1062934|00000000||Rendkívül gyúlékony. Fel akarom robbantani, és vele meggyújtani a Vad Falka néhány lovasát.
   1062936|00000000||A vár falai nem sínylik meg?
   1062938|00000000||Az erőd falai romosak. Ennél már nem lehet több kárt tenni bennük.
    319685|00000000||Mi nem vagyunk kőművesek.
    319687|00000000||Nagy kár. Nem tudjuk az erődön kívül tartani a Vad falkát.
    319689|00000000||Nem baj, egyébként sem sokat tudunk az ostromgyűrű feltöréséről.
    319691|00000000||Az udvaron szállunk velük szembe.
    566036|00000000||A falak nem igazán a mi szakterületünk.
    566037|00000000||Befoltozhatnánk a lyukakat.
    566055|00000000||Talán befoltozhatnánk ezeket a lyukakat.
    566057|00000000||Van hozzá anyagunk.
    566059|00000000||Segítek, ha gondolod.
    566061|00000000||Mi van Lamberttel?
    566063|00000000||Hm, nagyon jól tudom, hogy áll a falazáshoz.
   1062927|00000000||Sosem gondoltam, hogy a gáz ennyire büdös lehet. Figyelmeztetnünk kell a többieket, hogy senki se jöjjön erre nyílt lánggal.
   1062929|00000000||És ez után?
    465239|00000000||Jól jönne egy ital.
    551709|00000000||Akárcsak nekem. A tanácskozás után keresünk valamit.
    541760|00000000||Hehehe, szép kis csapatot gyűjtöttél össze.
   1062924|00000000||Anair, anadar, vallanda!
   1062914|00000000||Nagyon remélem, hogy ez a gáz bejön.
   1062916|00000000||Úgy lesz. Csak a megfelelő pillanatban kell meggyújtanunk.
   1062918|00000000||És az a lyuk… Az szándékosan van ott?
   1062920|00000000||Majd akkor aggódunk a lyuk miatt, ha ennek vége. És most lépj hátra, witcher uram.
    550680|00000000||Nem vagyok biztos benne, hogy Ciri is így akarja.
    550695|00000000||Ciri még nem bólintott rá erre.
    550750|00000000||Nem?
    550816|00000000||Nem?
    550818|00000000||Ismersz bárkit is, aki nem szeretne Nilfgaard császára lenni?
    550784|00000000||Képzeld csak el! Azt hittem, efféle történetek csak a bárdok és a költők borgőzös elméjében születhetnek.
    552371|00000000||Mégiscsak a földrész történetének leghatalmasabb uralkodójáról van szó, kinek tékozló leánya a császár végső győzelmének napján tér vissza, hogy átvegye örökségét.
    550815|00000000||Az együgyű emberek rajonganak az efféle történetekért: akárcsak a mindig szép, mindig törékeny hercegnőkért, akik az ő…
    550776|00000000||Úgy van.
    550749|00000000||Nem, természetesen nem.
    550747|00000000||Na persze, körültekintő, nem olyan, aki megünnepli az el sem hangzott ajánlatot… Csakhogy efféle ajánlatot nem szokás visszautasítani.
    550681|00000000||Hát persze.
    550694|00000000||Ha már itt tartunk, hogy van a mi jövőbeli uralkodónk? El kell ismernem, kíváncsi vagyok, mit szól majd, amikor megtudja, hogy övé lesz a trón. Meg merem kockáztatni, el lesz ragadtatva…
    550752|00000000||Ki tudja…
    550664|00000000||Igen. Eléggé nyilvánvaló, hogy így lesz.
    547869|00000000||Fehér Farkas! Örülök, hogy találkozunk!
    550649|00000000||Üdvözlöm, tábornok úr!
    550644|00000000||Remélem, nem jelentett gondot átkelni a Pontaron?
    547871|00000000||Nem.
    550652|00000000||Gondolom a Ban Gleàn melletti gázlónál keltetek át?
    550657|00000000||Még jó, hogy nem Rindén akartatok átlovagolni. Arrafelé még mindig nincs nyugalom. Radovid nyugaton szeretne áttörni.
    550662|00000000||De nem fog sikerülni neki. És ha mégis, addigra császárnő lesz már a hercegnőből és rendet teszünk arrafelé.
    524739|00000000||Ladd nahw!
    524776|00000000||Ni'l ceim siaar!
    524777|00000000||Trooid'i!
    524775|00000000||Hoinne heets!
    524358|00000000||Hív a kötelesség.
    524369|00000000||De Geralt… van egy cimborád, aki király. Ezt kevesen mondhatják el magukról.
    524471|00000000||Ha neked vagy Cirinek… esetleg neked és Cirinek valaha segítségre lesz szükségetek, Kaer Trolde kapuja nyitva áll előttetek.
    565588|00000000||Köszönöm, nem felejtem el.
    565580|00000000||Minden jót.
    566135|00000000||Jó utat, Hjalmar.
    524355|00000000||Nem lenne helyes tovább időzni… a háború a Feketék ellen nem vár.
    524360|00000000||Számíthatsz rám, ugye tudod? Mindig.
    524362|00000000||Tudom és köszönöm.
    565582|00000000||Egyenesen visszamész Skelligére?
    565579|00000000||Mész vissza Skelligére?
    321589|00000000||Hát itt vagy.
    321591|00000000||Nagyon sajnálom Vesemirt. Részvétem.
    321593|00000000||Köszönöm a segítséget.
    524342|00000000||Az adósod voltam.
    572962|00000000||Igazán bátor férfi.
    564544|00000000||Nem felejtem el.
    564546|00000000||Köszönöm, nem felejtem el.
    564548|00000000||Még megnézem a sebesülteket, de hamarosan indulnom kell. Hagyok itt némi gyógyszert.
    564550|00000000||Menj egészséggel, Ermion.
    564552|00000000||Még találkozunk.
    564554|00000000||Nem igazán tudom, mit teszek most.
    564556|00000000||Amikor kételyek gyötrik az elméd, kövesd az ösztöneidet.
    564558|00000000||Ha rossz felé vezetnek és megfeneklesz a sárban, békélj meg önmagaddal. Ez a legfontosabb.
    564560|00000000||Hasznos tanács.
    564562|00000000||Bah! Persze hogy az! Elvégre a szent misztériumok ismerője vagyok, nem igaz?
    564564|00000000||Hamarosan haza kell indulnom. Vigyázz magadra, és Cirire is.
    564566|00000000||Még egyszer köszönök mindent.
    564543|00000000||Nem tudom, mit teszek most.
    321491|00000000||Köszönöm.
    321493|00000000||Kérlek. Ő az én védencem is volt. És az öregek azért vannak, hogy segítsék a fiatalokat.
    321495|00000000||Tudod, hogy ezzel nem ért véget a küzdelmed?
    321497|00000000||Tudom.
    321501|00000000||Bármit is tervezel most, ne feledd. Skelligén mindig találsz segítőkész lelkeket. Ott vagyok én, Crach, a gyermekei…
    572957|00000000||Sajnálom, hogy nem ismerhettem jobban.
    542689|00000000||Nem néz ki jól.
    564393|00000000||Hogyan köszönhetem meg?
    564399|00000000||Kockáztattátok értem az életeteket. Hogyan hálálhatnám meg?
    564401|00000000||Majd kitalálunk valamit, igaz?
    564403|00000000||Úgy bizony.
    564404|00000000||Mihez kezdtek most?
    564405|00000000||Novigradba megyünk, hogy megvívjuk a következő csatát.
    564406|00000000||Ha hiányzunk, keress minket a táborban.
    564395|00000000||Köszönöm, hogy eljöttetek. Hogy kockáztattátok értem az életeteket.
    564397|00000000||Vigyázz a lányra, ne hagyd, hogy bárki is bántsa.
    564392|00000000||Köszönöm a segítséget.
   1071971|00000000||Szóval? Mondd el.
    321386|00000000||Azt hiszem, túl sok volt ez nekem.
    321388|00000000||Még mindig nem hiszem el a történteket.
    572958|00000000||Átkozott balszerencse.
    572959|00000000||Ugh.
   1076904|00000000||Készülj, Folan. A Vad Falka már közel van.
    520063|00000000||Mörhogg lidércei? Hjalmar és én ezeknél ocsmányabb rohadékokat is legyőztünk már.
    520062|00000000||Tehát eljött a Ragh nar Roog.
    548042|00000000||Geralt! Indulunk!
    548044|00000000||Igazán örülök a találkozásnak, úrnőm.
    548052|00000000||Szintén.
    550579|00000000||Már úton kellene lennünk.
    550600|00000000||Milyen kár, hogy nem maradhat. Remélem, egy másik alkalommal folytathatjuk.
    550602|00000000||Legalább az egyikünk így van vele.
    575458|00000000||A fenébe!
    575460|00000000||Geralt!
   1061955|00000000||Vissza!
   1061957|00000000||*Fütyül*
    533413|00000000||Az erődben kellett volna maradnod a seggeden, ahogy utasítottak rá!
    533414|00000000||Ühüm. És akkor ki mentette volna meg a tiédet?
    533425|00000000||Köszönöm!
    533426|00000000||Ki kell nyitnunk nekik a kaput!
    524548|00000000||Látod?
    524550|00000000||Kezdődik. Az erdőbe! Gyorsan!
    533349|00000000||Éppen időben!
    575408|00000000||*Két ujjal fütyül*
    575412|00000000||Látod? Én is képes vagyok rá.
    533353|00000000||Mi van Eskellel? Vissza kell vonulnunk!
    533354|00000000||Bajba került! Segítek neki!
    562633|00000000||Ne feledd a követ, amit adtam!
    533350|00000000||Minden rendben?
    533351|00000000||Igen, köszönöm… kissé rázós lett itt a helyzet.
    533352|00000000||Vissza kell húzódnunk. Megpróbáltak átjönni a főkapun. Attól tartok, legközelebb sikerrel járnak.
   1055661|6bf543da||Veréb
    533661|00000000||Jönnek át a résen!
    534386|00000000||Dimeritium bombák.
    546099|00000000||A fal melletti ládákban találsz még.
    321106|00000000||Nem szabadna idekint lenned!
    321108|00000000||Már késő.
    533655|00000000||Eskel kinyitotta a kaput! Vissza tudunk vonulni!
    533656|00000000||Vissza!
    465851|00000000||Kaer Morhen. Nem tudom elképzelni ezt a helyet Vesemir nélkül.
    565472|00000000||Megértem.
    565478|00000000||Megértelek.
    565480|00000000||Szerencsét próbálok Lormarkban. Ahol háború van, ott mindig akad munka is. Utána meglátjuk.
    565482|00000000||Akkor a legközelebbi viszontlátásig.
    565484|00000000||Minden jót, Farkas.
    565474|00000000||Ugyan már, soha nem ismertünk más otthont. Maradj!
    565476|00000000||Nem, Geralt. Ez a hely egy ideje már haldoklik. Ma verték be az utolsó szeget a koporsójába. Ideje, hogy ezt elfogadjuk.
    565153|00000000||Maradj.
    524892|00000000||Hamarosan leereszkedem a völgybe. Aztán keresek egy másik helyet, ahol áttelelek.
    465853|00000000||Ez a hely… már nincs értelme visszajönni.
    465849|00000000||Mi foglalkoztat?
    572942|00000000||Már nincs értelme visszajönni ide. Mintha Kaer Morhen halt volna meg a mai napon.
    466232|00000000||Gyerünk!
    466230|00000000||Gyere, kapj el!
    466228|00000000||Hah!
    466372|00000000||Behatolnak az udvarra!
    466095|00000000||Hány van még a mama pici kölkeiből?
    466091|00000000||A fenébe!
    466093|00000000||Ugh!
   1074926|00000000||A rohadék át akar törni, be akar jutni!
   1063029|00000000||Legközelebb, ha úgy látod, felbaszom az agyam Merigold miatt, inkább csapjál fejbe.
    520509|00000000||Nem mintha nem bíznék ebben a láthatatlanság dologban, de távol kellene maradnunk azoktól a lényektől.
   1074961|00000000||Ő közűlünk való, Geralt. Semmiképpen sem hagyhatjuk, hogy elvigyék.
    464404|00000000||Gyere a mamához.
    464406|00000000||Gyere csak!
    464402|00000000||Hah!
    558820|00000000||Ez elképesztő volt. Kösz.
   1074929|00000000||Átjutott!
    564505|00000000||Mihez kezdesz most?
    564513|00000000||Mihez kezdesz most?
    564515|00000000||Valószínűleg keletre indulok, át a hegyeken.
    564517|00000000||Utána? Meglátjuk.
    564519|00000000||Minden jót.
    564507|00000000||Nem gondoltál rá, hogy Kaer Morhenben maradj?
    564509|00000000||Nem rossz ötlet. Legalább egy időre, amíg kitalálom, mihez kezdjek.
    564511|00000000||Rendben, tégy úgy.
    564476|00000000||Nem akarsz Kaer Morhenben maradni?
    321440|00000000||Nem sokon múlt.
    321442|00000000||Megoldottuk.
    564502|00000000||Köszönöm a segítséget.
    564504|00000000||Szívesen.
    572960|00000000||A witcherek soha nem ágyban halnak meg.
    550900|2b0e5344||Nilfgaardi udvaronc
   1063565|00000000||Hé! Ez csalás!
   1063567|00000000||Nyafka!
   1063569|00000000||Na ezt még meglátjuk!
   1063571|00000000||Hahaha, gyere, kapj el!
    520100|00000000||Nagy kár, hogy Vigi és Folan nincsenek itt.
    523431|00000000||Köszönöm, hogy eljöttetek.
    520113|00000000||Egész életünkben arra készültünk, hogy szembeszálljunk Mörhogg árnyékával.
    569882|00000000||Megöltük az óriást, végzünk a lidércekkel is.
    569884|00000000||Egen!
    523422|00000000||Köszönöm, hogy eljöttetek.
    520101|00000000||Azt hitted, kihagyunk egy ilyen lehetőséget? Soha!
    549786|00000000||Nagy kár, hogy Folan nincs velünk.
    523426|00000000||Köszönöm, hogy eljöttetek.
