;meta[language=cz]
    528527|00000000||Uvědomuješ si, že ta potvora, jak říkáš, by taky mohla být zakletá Ciri?
    528529|00000000||Jo. Slyšel jsem o tom.
    528531|00000000||No, a trochu soucitu by se nenašlo?
    528533|00000000||Hele, vidím potvoru, tak říkám – je to potvora. Já už jiný nebudu.
    528583|00000000||Víš co? Nech to být... nechci se s tebou hádat.
    528585|00000000||Dobře... Neztrácejme čes. Potvora čeká.
    528587|00000000||Lamberte...
    528600|00000000||Ehm. Promiň. Potenciální Cirilla.
    528567|00000000||Dobře... nechci se hádat.
    528534|00000000||Leze ti na nervy?
    528575|00000000||Leze ti na nervy?
    528577|00000000||Myslel jsem, že máš rád lidi, co jsou trochu jedovatý.
    528579|00000000||Jen pokud jsou to ženské.
    528581|00000000||V tom případě se ti podařilo najít potvoru všech potvor... Ale dost už toho. Vzhůru ke kruhu živlů.
    528515|00000000||Co to tam máš? Vaříš nějaké elixíry?
    528517|00000000||Ne. Chlast. Pálím slupky z brambor.
    528519|00000000||Hmm. Na oslavu mého příjezdu?
    528521|00000000||Spíš na mou rozlučku…
    528523|00000000||Ještě jsi o tom neslyšel? Madam čarodějka požaduje, abych naplnil filakterium Mocí z kruhu živlů. Tvrdí, že je to nezbytné pro sejmutí kletby z té tvé potvory.
    534982|00000000||Todle ne kruh, todle trollová díra. Nelezeš do díra. Ty ne trollolo.
    535004|00000000||Ostrá klacek tady… nebo troll biješ!
    534972|00000000||Co to? Vědmáky dva v rybník?
    534973|00000000||Uh… troll nevíš.
    535386|00000000||Poblívka!
    535388|00000000||Harharhahar!
    534997|00000000||A pak že trolly blbá.
    535005|00000000||Vědmáky lžeš! Vědmáky lžeš!
    519499|00000000||Příště se vsadíme.
    519501|00000000||Tak se příště vsadíme. Protože já vyhraju.
    519503|00000000||Tak určitě.
    519535|00000000||No konečně! To ti to trvalo.
    519537|00000000||Sjíždělo mi sedlo...
    519539|00000000||Jasně. A každou špatnou baletku zrovna tlačí nové střevíčky.
    519540|00000000||Sám jsi kurva baletka... ale na koni umíš jezdit dobře. Sice jsme se o nic nevsadili, ale mám takový dojem, že si zasloužíš nějakou výhru...
    519563|00000000||Dej pokoj, přece si od tebe nebudu něco brát. Můžeš mi někdy koupit pití a jsme si kvit.
    519565|00000000||Dobře, domluveno.
    519555|00000000||Dej pokoj. Já nic nepotřebuju.
    519561|00000000||Pokud na tom trváš...
    519567|00000000||Pokud na tom trváš...
    519569|00000000||Tumáš. Ať ti dobře slouží.
    519542|00000000||Až příště přijedu, dovezu ti láhev.
    519552|00000000||Až příště přijedu, dovezu ti celou láhev. Slibuju.
    519554|00000000||Beru tě za slovo!
    519544|00000000||To máš štěstí, čistě náhodou mám jednu flašku s sebou... Tumáš.
    519546|00000000||Sakra... Ty mi snad čteš myšlenky na dálku!
    519548|00000000||Ani ne. Ale taky si občas rád přihnu, stejně jako ty.
    519550|00000000||Pravda... Vesemir o nás říkával, že jsme nerozluční přátelé. Jako bratři, jako dvě kapky vody... I když už je to dávno. Děkuju.
    519541|00000000||Náhodou jí mám ještě trochu s sebou. Máš ji mít.
    519505|00000000||Dobře, jakou výhru chceš? Zasloužíš si ji.
    519507|00000000||No... už nějakou dobu prahnu po mahakamské kořalce. Nic tak nevypálí červa.
    519498|00000000||A co bys chtěl?
    518496|00000000||Prý "Tebe bych předjel i na kulhavé svini"... Haha.
    519495|00000000||Podcenil jsem tě. Nebo spíš tady Škorpiona. Moc šikovná mrcha kůň.
    519497|00000000||A já jsem tě přecenil. Kdybych věděl, že tě porazím tak snadno, byl bych se s tebou o něco vsadil.
    530893|00000000||Přežiješ?
    530894|00000000||Mhm. Asi jo.
    531066|00000000||Vypadneme.
    531068|00000000||Počkej.
    531071|00000000||To máš za Voltehra, ty zkurvenče!
    531079|00000000||Voltehre… to byl kdo?
    531081|00000000||Nepamatuješ si ho? Takový prcek, s jizvou tady na bradě.
    531083|00000000||Aha, už si vzpomínám.
    531085|00000000||Jo. Víc už toho nenaděláme. Ten se odtud nedostal.
    531087|00000000||Tak jdeme.
    531073|00000000||Voltehre… kdo to byl?
    531072|00000000||Hotovo?
    531075|00000000||Skončil jsi?
    531077|00000000||Hm. Jdeme.
    526233|00000000||A jéje...
    526232|00000000||Boha jeho! Ty kráme podělanej!
   1027881|00000000||Po proudu tak daleko, jak to jde? To bude snadné.
   1027942|00000000||Řeka tady mizí... už musím být blízko.
   1027943|00000000||Dál už se plout nedá. Je čas vysednout.
   1027954|00000000||Nooo... starý a silný, zdá se. Není divu, že s ním Berengar měl potíže.
   1027955|00000000||Tak to bychom měli čerta... a teď najít Berengarovy věci.
   1027957|00000000||Á, tady je nákres. Vykovat Tor'haerne nebude legrace... ale rozhodně to stojí za pokus.
   1056280|fb94e1c3||Ida Emean aep Sivney
   1056935|00000000||Já nevím... Vyprávěj mi něco.
    537931|00000000||Říkal jsem ti někdy, jak mi Marigold koupil meč?
    537941|00000000||Vyprávěl jsem ti někdy, jak mi Marigold koupil meč?
    537943|00000000||To bylo v Keracku? Po tom, co jsme…
    537945|00000000||Měli… přestávku. Jo. Moje meče někde zmizely a Marigold trval na tom, že mi koupí nějakou zbraň.
    537947|00000000||Přišel za mnou celý rozzářený. "Ta nejlepší viroledanská ocel! A dobrá cena, měl jsem pocit, že kradu!"
    537949|00000000||Samozřejmě, že se čepel roztříštila při prvním krytu.
    537951|00000000||Uuuuma…?
    537953|00000000||Je vzhůru… Je čas… čas sejmout kletbu. Připrav filakterium.
    537933|00000000||Slyšela jsi tu historku, jak jsem byl s Ciri bruslit?
    537935|00000000||Ne… nepamatuju si.
    537937|00000000||Během té zimy, kdy tady cvičila. Po pár měsících si začala stěžovat, že jsem moc tvrdý učitel. Nejdřív jsem ji odbyl.
    539018|00000000||Ale pak mě požádala, ať s ní jdu bruslit. Nechtěl jsem, nikdy jsem to nezkoušel… ale ona na tom trvala.
    537939|00000000||Jakmile jsme vlezli na led, začala kolem mě kroužit a řvát "Tak ne! Práce nohou! Nejdřív jedna, pak druhá!" "Překřížit! Ne! Špatně!" "Brzdi patou brusle, ne špičkou!" No a pak už jsem nikdy...
    537888|00000000||Slyšelas, jak jsem bruslil s Ciri?
    537822|00000000||Lechtání je prý účinné.
    537824|00000000||Možná později. Mluv na mě. Řekni mi nějaký příběh.
    535070|00000000||Hej, Yen… usínáš.
    537885|00000000||Ne… jen odpočívám na oči.
    537887|00000000||Jo, tomu se říká spánek.
    537820|00000000||Tak dělej něco, ať neusnu.
    538466|00000000||Já vařit neumím.
    538468|00000000||S jídlem to moc neumím.
    538470|00000000||To vím až moc dobře. Když jsme žili v Aedd Gynvael, zkusil jsi jednou uvařit vajíčka na měkko. Zapomněl jsi je dát do vody.
    538472|00000000||Zamyslel jsem se.
    538474|00000000||Spíš jsi na něco čučel. Na mě.
    538476|00000000||Mhm… pořád tu noční košili máš?
    538478|00000000||Geralte… Zpátky k tématu. Mám hlad. Mám takový hlad, že je mi jedno, jak mizerně vaříš.
   1056920|00000000||Starý dobrý časy, dalo by se říct... No nic. Mám hlad. Takový, že je mi úplně jedno, jak mizerně vaříš.
    535320|00000000||Ach jo… nechce se mi věřit, že to opravdu děláme.
    535075|00000000||Utíráme zvratky z podlahy?
    535079|00000000||Ne. Zkoušku.
    538361|00000000||Pokud je to Ciri… jestli to zničí její organismus nebo ji to zbaví citů… napadlo tě to?
    538408|00000000||Jistě. Jenže nemáme na výběr.
    538410|00000000||To už ne. Ale… uspěchali jsme to. Měli jsme začít…
    538363|00000000||Nemáme na výběr.
    538362|00000000||Yen ví, co dělá.
    538404|00000000||Já Yen věřím. Ví, co dělá.
    538406|00000000||O tom nepochybuju. Ale víme my, co dělá? Řekla ti, jaká je šance, že se to povede?
    538412|00000000||Pánové… podlaha čistější nebude a mě je potřeba taky utřít.
   1060170|00000000||Geralte... Možná bys mohl...?
   1056918|00000000||No tak, Eskele. Já tě neukousnu. Prostě to udělej.
    538415|00000000||Neuraž se, ale budu radši, když to udělá Geralt.
    538417|00000000||Jasně. Já budu taky radši.
    538486|00000000||Ummmma…
    538420|00000000||To je normální?
    538422|00000000||Ano. Umovo tělo se rozpadá zevnitř. Když to skončí, budeme ho muset znovu zformovat… nebo zemře.
    538459|00000000||Vy zaklínači používáte mutageny… ale my použijeme kouzla.
    538462|00000000||Přinesl jsem jídlo.
   1059218|00000000||Výborně, umírám hlady. Mohl...?
   1059221|00000000||Vesemire, mohl bys mi něco připravit?
   1059223|00000000||Něco, jasně... Jen nečekej paštičku a lívance. Tady nejspíš dostaneš fazole a rajskej guláš... Nebo--
   1059225|00000000||Liboli. Hlavně, ať je to teplé. A ať je toho hodně.
    538464|00000000||Dobře, umírám hlady. Geralte… nemůžu odejít od stolu. Udělal bys mi něco?
    538465|00000000||Co bys chtěla?
    538483|00000000||Dobrá. Na co máš chuť?
    538484|00000000||Něco lehkého. Možná míchaná vajíčka. Pokud mě chceš rozmazlovat, tak omeletu. S cibulí, houbami a paprikou.
    538489|00000000||Díky.
    532277|00000000||Mhm. Předpokládám, že jste večer strávili usilovnou prací.
    532279|00000000||Ano. Mluvili jsme o Umovi… dlouho do noci.
    532281|00000000||Takže jste asi neměli šanci opravit ty trámy ve věži?
    532283|00000000||Ech, ne… ale, ehm, postaráme se o to, slibuju. Že ano, Lamberte?
    519681|00000000||Tvá metoda nevyšla, Vesemire?
    519694|00000000||Takže tvoje metoda s náhrobkem a bolehlavem nezabrala…
    519703|00000000||Ne úplně, ale něco jsem zjistil.
    537428|00000000||Fajn... Tak co teď?
    537430|00000000||Můžeme začít… jen potřebujeme uvařit elixíry.
    537432|00000000||Počkat. Proč jsme nemohli…
    537434|00000000||Udělat to dřív? Protože přípravné elixíry pro Zkoušku jsou krajně reaktivní. Musí se podat okamžitě po uvaření. Spokojen?
    537436|00000000||Geralte, namíchej ty elixíry. Tady jsou recepty. Eskele, vezmi si lahev alkoholu…
    537438|00000000||To ne. Po tom včerejšku…
    537440|00000000||…a vydezinfikuj nástroje. No tak, šup šup!
    537335|00000000||Co teď?
    537336|00000000||Já myslel, že ten stůl už tu není.
    537442|00000000||Já myslel, že jsme se toho stolu dávno zbavili.
    537444|00000000||Huh. Smutného Alberta jsem viděl tak před padesáti lety.
    537446|00000000||Bylo mi ho líto vyhodit. Říkal jsem si, že třeba bude jednou potřeba…. Víš, jací jsme my staří…
    537448|00000000||Jasně. Každej dědula má půdu plnou mučidel.
    532305|00000000||Když jste lovili vidlohony a bavili se s megaskopem, vyšetřil jsem Umu. Všiml jsem si jedné věci. Občas, když… jak to říct… když ho řídilo uvolněné vědomí, choval se jinak.
    532309|00000000||Když Uma usínal, tak se na chvíli zarazil… a v jeho pohybech a pohledu bylo něco jiného. Ale jen na okamžik.
    532310|00000000||A tak jsem u něj vyvolal trans, zhypnotizoval jsem ho. Nejdřív žádný účinek, ale když ho přepadla otupělost, něco jsem slyšel… povzdych nebo naříkání. A nebyl to Umův hlas.
    532431|00000000||Dobrá. Ale já nechápu, jak nám to pomůže…
    532433|00000000||Tak mlč. Díky, Vesemire. A… omlouvám se za to, co jsem předtím říkala. Řekli ti chlapi, co plánujeme?
    532435|00000000||Ano. Vůbec se mi to nelíbí. Ale asi ti budu muset věřit.
    519690|00000000||Vesemire, zjistil jsi něco?
    519680|00000000||Vesemire, zjistil jsi něco?
    532285|00000000||Chlapům můžeš napráskat později. Teď se dáme do práce.
    532271|00000000||Mhm. A smrdí to tu jak v kořalně.
    532273|00000000||Ten klobouk byla památka, Lamberte.
    532275|00000000||Klid, staříku. To se vypere.
    519512|00000000||Vidím, že jsou už všichni na nohou.
   1075881|00000000||Sakra… To byl ale sen.
    535230|00000000||[Podat Matčiny slzy.]
    535232|00000000||[Podat Ostrávovou mízu.]
    537559|00000000||…
    537618|00000000||Ummmmmmamama… UUUuuu… Umamama….
    537620|00000000||Doufal jsem... Doufal jsem, že tohle už nikdy neuvidím.
    537622|00000000||Tak proč sis nechal ten stůl, co?
    537665|00000000||Geralte… další elixír.
   1059214|00000000||Eskele, promiň... Dovolíš...?
   1059216|00000000||Mám dojít pro hadr? Jasně.
    535265|00000000||…
    535277|00000000||Oesi, caefyn!
    537758|00000000||Co teď?
    537760|00000000||Teď počkáme, až elixíry odvedou své… možná to bude trvat den. Možná víc.
    537763|00000000||Vám stačí počkat, ano… ale já musím udržovat stabilizační kouzlo. Umovo tělo není tak odolné jako tělo mladého nastávajícího zaklínače. Bez toho by...
   1056916|00000000||Bueeeeergh…
    537561|00000000||…
    537625|00000000||Hele… měli bychom toho nechat.
    537627|00000000||Pak Uma zemře. Ve velkých bolestech.
    537629|00000000||Yennefer má pravdu.
    537631|00000000||Otevřete další záklopku.
    537592|00000000||Dost. Tohle je špatný nápad.
    535231|00000000||[Podat Divožitnou šťávu.]
    535233|00000000||…
    537594|00000000||Aaaa…. Aaaa…. Ummmmmmamamamaaaaa…
    537596|00000000||Zabírá ten hákorost?
    537598|00000000||Kdyby ne, bolest by u něj vyvolala šok a zabila ho.
    537661|00000000||Takže jde všechno hladce.
    537663|00000000||Ne... Ale je to v rámci mezí.
    537601|00000000||Dejte mu další elixír.
    535169|00000000||Elixíry jsou připravené.
    535170|00000000||Nástroje taky.
    535171|00000000||Dobrá… Vesemire…
    535172|00000000||Výtažek z hákorostu na ztišení bolestí. Já vím... Už jsem to dělal.
    535175|00000000||Eskele… otevři mu žíly a strč do nich kanyly. Geralte, dej flakóny s elixíry do plniček.
   1056911|00000000||Umauma!
    537508|00000000||Připraven.
    535180|00000000||Otevři záklopky. Na pořadí nesejde.
    537766|00000000||Geralte… Promiň, mohl bys…
    537768|00000000||Uklidit to? Jistě.
    526021|00000000||Nebudu žádat o nic. Prostě ti to říkám. Můžeš mi v tom zkusit zabránit...
    571955|00000000||Musíš požádat barona vo svolení. Jenže von tady nejni...
    571957|00000000||Ale pak tvou osvícenou vládu ukončím. Předčasně a násilně.
   1059030|00000000||Myslíš, že si z tebe nadělám do kalhot?
   1059033|00000000||To pro mě za mě můžeš.
    571961|00000000||Fajn. Ten mrzák za žádnou krev nestojí. Běž za podkoním. Ten bude ještě rád, že se ho zbaví, ten hajzl se krmí z toren. A šťastnou cestu vám oběma.
    571963|00000000||Děkuju pěkně.
    571959|00000000||Ale to by byla chyba. Smrtelná.
    571952|00000000||Si myslim, žes chtěl říct, žes mě přišel požádat vo svolení si ho vzít. Teď tady velím já, takže...
    571954|00000000||Uma - odvedu si ho s sebou.
    526012|00000000||Potřeboval bych si odvést Umu.
    526015|00000000||Zapomeň na to, probereme to později.
    526013|00000000||Vrátím se později.
    525898|00000000||Potřebuju s tebou mluvit.
    525899|00000000||Ano? A o čem?
   1059206|00000000||Jasně. Jdeme zpátky.
   1059208|00000000||Po tobě, pane.
   1059186|00000000||Jasně. Zpátky do pevnosti.
   1059210|00000000||Běž napřed. Já tu chvíli zůstanu.
   1059212|00000000||Mhm. Ale ne moc dlouho. Pamatuj, musíme vyléčit mrzáka.
   1059187|00000000||Jdi. Chvíli tady zůstanu.
   1059228|00000000||Vědmáci ostrý palice bereš. A deš doma.
   1059831|00000000||Mhm. Neboj, nemusíš mě přesvědčovat. No tak, Geralte, jdeme.
    527137|00000000||Zéélení háájovéé, bejvali jste výý mojéé, bejvali jste výý moje póótěšeníí. Aále teď smutný čas, nééslyším ptááčka hlas...
    527138|00000000||Co je to za písničku?
    528032|00000000||Nějaká lidová, horalská, dobře se zpívá do kroku... Tu mi zpívávala máma.
    528034|00000000||Ty se na ni pamatuješ?
    528035|00000000||Jenom tu hloupou písničku... Jinak nic.
    527140|00000000||Nebojíš se nechat koně tady dole? Ten vidlohon by se na něj mohl vrhnout…
    528042|00000000||To tak… můj Škorpion je válečný kůň, čistokrevný kaedwenský. Ten by si poradil. Říkal jsem ti, kde jsem k němu přišel?
    528100|00000000||Ne... Myslím že ne.
    528102|00000000||Jednou jsem zachránil ztraceného rytíře... Znáš to, temný hvozd, vlci, klasika.
    528104|00000000||Povídám mu: "Dáš mi to, o čem doma nevíš" a tak dál, a v tomhle případě jeho žena nečekala děcko, zato jeho klisna se ohřebila.
    528106|00000000||Eskel a Škorpion… spojeni osudem. Kouzelný příběh.
    528108|00000000||Jen se směj. Stejně mi závidíš.
    512156|00000000||Žádný velký závod to nebude, protože tebe bych předjel i na kulhavé svini... Ale proč ne.
    512157|00000000||Sám jsi kulhavá svině.
    533870|00000000||Kdo bude první na Kaer Morhen, vyhrává!
    512154|00000000||Ano, rád.
    512158|00000000||Radši ne. Měli bychom pak zbytečně unavené koně.
    512159|00000000||Teda... já vážně nechápu, co na tobě všechny ty ženské vidí. Vždyť jsi hrozné dřevo...
    533872|00000000||Ale jsem hezký klacek, to musíš uznat.
    533874|00000000||To je sporné... No tak jdeme.
    512155|00000000||Radši ne.
    512153|00000000||Hej… co bys řekl na malý závod? Třeba zjistíme, kdo je rychlejší - Klepna, nebo Škorpion… A kdo je lepší jezdec.
    565422|00000000||Umu si odvedu.
    568992|00000000||Tak to ani...
    565467|00000000||Seržant Ardal mi to dovolil.
    565466|00000000||Mám baronovo svolení.
    565468|00000000||Ale vrátíš ho, že jo? Bez něj to tady bude hrozná nuda.
    378703|00000000||Najdi si jinou zábavu.
    378731|00000000||Najdi si něco jiného, čemu se budeš smát. Pro mě za mě nachytej pár žab a nastrkej jim do řiti trávu.
    378733|00000000||He? To je nějaká vaše zaklínačská hra?
    379567|00000000||Zaklínači to dělají jinak. Nechtěj, abych ti to ukazoval.
   1075413|00000000||Otevři ty dveře. Hned.
    378715|00000000||Ne. Nehodlám ho přivést zpátky.
    378701|00000000||Jdi mi z cesty.
    332382|00365006||Zbojník
   1064467|00000000||To už jsi zapomněl? Omeleta s paprikou, houbami a cibulí. Děkuju.
   1056926|00000000||Něco takového jsem nežádala... ale vypadá to docela chutně.
    538508|00000000||Oh, snažil ses... Díky.
    538510|00000000||Dočkám se nějaké vděčnosti?
    538512|00000000||Možná později.
   1056922|00000000||Co... co to je?
   1056924|00000000||Můj původní recept... Nijak vábně to nevypadá, ale jíst se to dá. Asi.
    538547|00000000||Takže tě mám… krmit?
    538549|00000000||Chceš se radši dívat, jak jím bez rukou? Asi by to bylo hodně zábavné.
    538551|00000000||Fajn… tak jednu za tatínka Vesemira…
    538545|00000000||To tě mám krmit?
    538553|00000000||Všichni tě obskakují…
    538555|00000000||Všichni tě obskakují. Já ti vařím, Vesemir ti dělá poslíčka…
    538557|00000000||Ráda se s kterýmkoli z vás vyměním. Pokud si myslíš…
    538559|00000000||Klid. Dělám si legraci.
    538561|00000000||Geralte... Jsem vyčerpaná, hladová a naštvaná. Jinými slovy, prosím, vtipy si necháme na později.
    538518|00000000||Umm…. Umma… Umma…
    538520|00000000||Co s ním je?
    538537|00000000||Horečka. Snížím mu teplotu kouzlem.
    538539|00000000||Stačí studené obklady. Postarám se o to. Ty se najez.
    538544|00000000||Díky. Geralte? Čekám.
    538514|00000000||Takže přece jen míchaná vejce?
    538516|00000000||Promiň… na pořádné vaření jsem neměl chuť.
    530850|00000000||Něco mi říká, že se mu to nebude líbit…
    530852|00000000||Kosti... Rozdrcené na kusy.
    530853|00000000||Mhm. Starý Ostroň nemá rád hosty.
    530854|00000000||Připrav se… už jde.
    530855|00000000||Chyběl jsem ti, zkurvysynu?
   1058917|00000000||Ah, bylo tady tak měkoučko, že bych tu usnul... Jeden by snad i chtěl, aby tenhle okamžik trval věčně...
   1058921|00000000||Právě jsme přišli o okamžik překvapení.
   1058923|00000000||To je mi ukradený. Já se tý výzvy nebojím.
   1058919|00000000||Musíme být zticha... Bez vřelého uvítání Starýho Ostroně bych se obešel.
    530848|00000000||Slyšíš?
    531012|00000000||Mhm. Starý Ostroň už nás hledá.
    526007|00000000||[EN] Was q103 (finding Baron's family) the last quest I completed, and thus I have already seen Uma?
    526008|00000000||[EN] Yes. I've completed q103.
   1056476|00000000||[EN] No.
   1056475|00000000||[EN] Yes.
   1061709|00000000||[EN] Enough!
    526029|00000000||[EN] Enough!
    526009|00000000||[EN] No.
   1061706|00000000||[EN] Have I completed q107 (rescuing Anna from the swamps) and is the baron dead?
   1061708|00000000||[EN] No. The baron is still alive.
   1061707|00000000||[EN] Yes. The baron is dead.
   1056474|00000000||[EN] Did I do sq202 (hunting genie with Yen) and tell Yennefer I wanted to be with her?
    515891|00000000||To měla být návnada na vidlohona... Koukám, že to zabírá i na zaklínače!
    515592|00000000||Sama se k tomu klacku nepřivázala...
   1061767|00000000||…
    514684|00000000||Vypadá to, že máme společnost. Nilfgaardskou vojenskou jízdu...
   1032319|00000000||Co chceš?
    514690|00000000||Císař z tebe nemá radost.
    514687|00000000||V tom případě bude muset požádat o pomoc někoho jiného.
    514686|00000000||Císař zásadně nežádá, nikoho a o nic. Pojedeš s námi do Wyzimy.
    514688|00000000||Víš to jistě?
    514689|00000000||To ani nezkoušej.
    514692|00000000||Dobře, tak jedeme.
    530069|00000000||Lamberte… ty jseš ženiální.
    532690|00000000||No jasně, že jsem! Tak co, pozveme Lóži čarodějek na pařbu?
    532694|00000000||Jo, kurva! Sem s babama!
    530067|00000000||Ty jseš génius!
    530070|00000000||Lamberte… Ty už radši nic nepij.
    532697|00000000||Žárlíš, že tě to nenapadlo jako prvního… ale kvůli tomu nám to nemusíš kazit.
    532699|00000000||Nemám sílu se hádat.
    532701|00000000||Jasně že nemáš, slabochu. Malíčkem bych tě položil.
    532703|00000000||Hele… klid, Lamberte.
    532705|00000000||Chceš se bít? Co? Chceš se bít?
    532707|00000000||Brou noc.
    530068|00000000||Ty už to nepij.
    530066|00000000||Hej, Eskele! Budíček!
    532663|00000000||Hm? Co? Co se stalo?
    532665|00000000||Ožral ses, ztřískal, zlil a opil na dalších padesát sedum způsobů, to se stalo. Vstávej, jde se chlastat.
    532667|00000000||Nechte mě bejt… budu blít… Takhle to skončí dycky, když se my tři sejdeme.
    532669|00000000||Tak si najdem čtvrtýho! Nejlíp ňákou babu!
    532671|00000000||Tady žádná není, jenom Yen… a tu vzbudit nechceme, to mi věř.
    532673|00000000||Co ta čarodějka, se kterou jste mluvili? Přemejšlej... zapneme megaskop, srdečně ji pozvem... ona se sem přiteleportuje... možná vezme i pár kámošek! Co vy na to?
    535511|00000000||I se svým věrným Zvonečkem!
    535509|00000000||Hej… hele, tady je!
   1043810|00000000||Útulné trollí doupě. Když už jsem tady, stálo by za to se tu porozhlédnout.
   1043851|00000000||Hádám, že náš milý troll nesnáší topivce.
   1043849|00000000||Na tohohle topivce ten troll jasně vztáhl láskyplnou ruku.
   1047959|00000000||Dopis...? Sice to vypadalo, že s rukama ten troll umí leccos, ale nečekal bych, že zvládne i psát.
   1047862|00000000||Poznámky, pečeť Salamandry... Musí to pocházet z doby útoku na Kaer Morhen.
   1047871|00000000||Plán útoku na pevnost... Ale pokud vím, nikdo jej nevyužil. Troll jeho majitele vyřídil dřív, než se stačil k pevnosti dostat.
   1047961|00000000||Zdá se, že tomu trollovi vděčíme za hodně.
   1028723|00000000||Co si myslíš, že máš v ruce? Meč, nebo cep? Úder musí jít ze zápěstí, ne z lokte! Znovu!
   1029043|00000000||Odešel jsi z tréninku bez dovolení. A víš přece... nepřestávej! To, že krvácíš, není žádná omluva!
   1029044|00000000||Sundej si ten obvaz a padej dál cvičit. Zranění si ošetříš, až ti dovolím odložit meč!
   1029049|00000000||A to má být co? Kymácíš se jako třtina ve větru! Hlavu vzhůru! Střeh! A rychleji!
   1029073|00000000||Zaklínač obvykle bojuje mečem, stříbrným nebo ocelovým. Musí ale ovládat všechny zbraně. Sekery! Praky! Nebo třeba motyku!
   1029074|00000000||Dneska budeme cvičit střelbu. Kdo mine cíl, dělá padesát kliků. Když zasáhnete, stačí dvacet. Tak jedem!
   1029262|00000000||Roh? Něco se děje. Schovejte se a čekejte, až se vrátím!
   1029263|00000000||Ano, vím, že cvičíte s mečem. Jenže zatím umíte hovno. Takže zalezte do skal a držte huby.
    526974|00000000||Puls má slabý... ale pravidelný.
    526976|00000000||Podívej se do ohně... a teď se podívej sem...
    526978|00000000||Zorničky mu pracují normálně...
    526980|00000000||Ummmmamama.
    526982|00000000||A teď mi podrž tohle.
    526984|00000000||Umamamma.
    526986|00000000||Na dwimerit žádná reakce.
    526136|00000000||Podívej, to je krása, co?
    526138|00000000||Ummmmamamama…
    526139|00000000||Zajímavé... Stříbra se nebojí...
