;meta[language=cz]
    527263|00000000||Chlapi z tebe nejsou zrovna štěstím bez sebe...
    527265|00000000||Hmm. A proč?
    527267|00000000||Protože... jim nechceš říct, co máš v plánu... Chováš se k nim jako ke služebnictvu. Nebereš žádný ohled na ně - vlastně na nás, protože já si tak taky připadám.
    527269|00000000||Všechno vysvětlím... až přijde správný čas. Nejdřív musíme dokončit přípravy.
    526857|00000000||Ty nám nevěříš?
    527405|00000000||Ehm. Ty nám nedůvěřuješ?
    527407|00000000||Ale ne... Vlastně mám strach, že vy nedůvěřujete mně. Takže si nechávám určitá tajemství – i když jen prozatím.
    527409|00000000||To je pěkně pokřivená logika...
    527422|00000000||Tak ti to možná může připadat teď... ale časem to pochopíš.
    535084|00000000||Vida, Geralt... Nechceš mi náhodou něco říct?
    533975|00000000||Hmm. Ten výhled – no prostě nádhera.
    535152|00000000||Možná bych tě měla odteleportovat o dvě míle výš... To by byl teprve výhled, že by až dech vyrazil. Navždy!
    533972|00000000||To byl nádherný výhled.
    533971|00000000||Omlouvám se.
    533973|00000000||Promiň. To byla hloupá výmluva.
    533974|00000000||Extrémně hloupá. Těší mě, že ti to na čerstvém vzduchu začalo myslet a došlo ti to.
    527469|00000000||Dobře, zeptám se jich. Ještě něco?
    527470|00000000||Lambertovi už jsem pomohl... Půjdu se podívat, jak je na tom Eskel. Chceš ještě něco?
    527471|00000000||Eskelovi už jsem pomohl... Půjdu se podívat za Lambertem. Chceš ještě něco?
    527571|00000000||Ano... Je tady ještě jedna taková drobná záležitost.
   1061279|00000000||Ah, ještě jedna věc...
   1061281|00000000||Mhm?
   1061283|00000000||Díky, Geralte.
    513763|00000000||Potes-co-metru? To zní nějak moc složitě.
    514075|00000000||Ale je to hrozně jednoduché. Vezmeš ho do ruky, budeš s ním chodit kolem, a čím silněji bude pískat, tím blíž jsi.
    514077|00000000||Hmm…
    532015|00000000||Nech si ty dětinské vtípky, ano? No tak, na co čekáš?
    513724|00000000||Pomocí tohoto potestizometru.
    513723|00000000||Dobře... Jak najdu ten zdroj?
    527574|00000000||Jak to mám udělat?
    527575|00000000||Na koho se chceš obrátit?
    527577|00000000||Na koho se chceš obrátit? Nebo je to taky tajné?
   1061273|00000000||Vůbec to není tajné. S Idou Emean. Pamatuješ si na ni?
    527579|00000000||Zaprvé, přestaň rýpat. Zadruhé – ne, není to tajné. Idu Emean. Pamatuješ se na ni?
    527581|00000000||Jak bych mohl zapomenout. Členka Lóže... elfská Vědoucí.
    527583|00000000||Přesně tak. Vědoucí. A jak už toto jméno napovídá, měla by toho hodně vědět. Chci se jí zeptat na radu ohledně Umy. Spokojený?
    531641|00000000||Hmm, je to tvá přítelkyně čarodějka – a věštkyně, nebo ne – čarodějky už mě nejednou nechaly ve štychu... Ale když musíš, tak musíš...
    531643|00000000||Škoda, že nejsi tak opatrný a podezřívavý ke všem čarodějkám... Ale to je jedno. Děkuju za laskavé dovolení.
    527572|00000000||Možná už sis všiml, že se megaskop chová... takovým dost spektakulárním způsobem.
    527573|00000000||Tady v okolí je určitě zřídlo energie, které ty poruchy způsobuje a krystaly díky tomu nepracují tak, jak mají. Musíme ho najít a zneškodnit... Rychle - musím se s někým spojit, je to naléhavé.
    527472|00000000||Už jsem to vyřešil.
    527473|00000000||Opravdu...? No výborně, vidíš, jak to jde rychle. Teď už zbývá jen jedna taková maličkost.
    527462|00000000||No dobře. Co mám tedy dělat?
    527463|00000000||Nejdřív pomoz Eskelovi a Lambertovi. Jeden z nich mi měl přinést mozkomíšní tekutinu z vidlohona a druhý měl nabít filakterium energií živlů... Ale zatím jsem ani od jednoho nic nedostala.
    526856|00000000||Tak co mám udělat?
    527281|00000000||Slyšel jsem, co jsi provedla s tou postelí...
    527363|00000000||Slyšel jsem, cos provedla s tou postelí... Opravdu chceš spát radši na podlaze? To bych ti neradil. Je kamenná, a mohla bys na ní pořádně prochladnout.
    527365|00000000||Upřímně dám přednost mrazu před postelí se zrzavými vlasy.
    526718|00000000||Takže jsi naštvaná kvůli Triss a musíš si to vybíjet tak, že ničíš nábytek?
    526748|00000000||Byl bys radši, kdybych si to vybíjela nějak jinak?
    526681|00000000||Potřebuješ se vypustit páru? Posluž si, pokud to nebude přímo na mně. Najdi si nějaký jiný cíl, ano? Mohla bys třeba shodit z balkonu další postel.
    527271|00000000||Ha, ha, ha. Takže další špatné vtipy, jo?
    527273|00000000||A co vážný rozhovor? Já jsem pro, jestli tomu dáváš přednost.
    526675|00000000||Uklidni se.
    526674|00000000||Žere tě něco?
   1061216|00000000||Geralte... omlouvám se, ale na žerty nemám náladu.
    511885|00000000||Zatracený krystal!
    526673|00000000||Chystáš se nás vyhodit do povětří?
    527294|00000000||To by rozhodně neškodilo. Ale ani špetka pochopení by nebyla od věci.
    530158|00000000||Nechte nás projít, nebo toho budete litovat.
    530166|00000000||Nechte si poradit. S náma si nechcete začínat.
    530168|00000000||Trollová rada bereš!
    530170|00000000||Ne… trollí rada! A vědmáky musíš bereš rada!
    530172|00000000||Argh, dost… jděte mi z cesty, pitomci, nebo vás namelu na štěrk! Tomu rozumíte?
    530175|00000000||Hm. Rozuměli ti. Blahopřeju.
    530177|00000000||Zdrhej k jeskyni, než nás ukamenujou.
    530160|00000000||Uklidněte se. My jen chceme projít ke kruhu.
    530162|00000000||Vědmáky povídáš jedna věc, děláš druhá.
    530164|00000000||Třetí děláš. Někdyjc.
    530139|00000000||Chceme se jen dostat ke kruhu.
    528760|00000000||Vědmáky oba dva stojíš! Bo todle, todle trollová hora.
    530135|00000000||Trollí hora.
    530137|00000000||Co? A jo. Todle trollí hora!
    528761|00000000||Uh… promluv s těma hlupákama ty.
   1027409|00000000||To písmo je mi povědomé... Patří Berengarovi. Ty papíry tady už leží pěkných pár let.
   1027416|00000000||A hele. Pracoval na meči... a podle jeho poznámek ne na ledajakém. "Tor'haerne".
   1043331|00000000||Musím se na něj zeptat Vesemira. Berengar se s ním radil, Vesemir by si mohl pamatovat, jak daleko se dostal.
   1055702|5ec210eb||Utopenec
    527356|00000000||Zatraceně... Zakotvil jsem ji přece přímo tady...
    527357|00000000||Nejspíš se uvolnilo lano.
    529052|00000000||Opravdu? A já už jsem se bál, že se ta loďka odvázala sama a vyplula jen tak na špacír. Zatraceně, v té mlze ji nikdy...
    529122|00000000||Nebyla náhodou před naším příjezdem bouřka?
    529123|00000000||Zkusím si vzpomenout... Ano, byla. Je to tak pět dní.
    529124|00000000||Hmm… loďky se nejspíš zmocnil vítr, cloumal s ní, až se lano uvolnilo, a pak ji zahnal do křoví...
    529054|00000000||Psst... Něco slyším...
    521230|00000000||No teda!
    521178|00000000||Chlapi, dáte někdy Yen pokoj?
    521185|00000000||Dáte někdy Yen pokoj?
    521187|00000000||Jo. Až jí začnu věřit.
    521189|00000000||Ty bys pro ni vlez i do ohně. A ona na tebe hraje jako na housle. Vždycky to tak bylo.
    521191|00000000||To se teda sešli dva odborníci na lásku. Ani jeden z vás nebyl s čarodějkou…
    521193|00000000||A víme proč…
    521195|00000000||Fajn, nech kunďáka, nebo se namíchne. Hele, už se na mě vztekle kouká. To nesnáším.
    521197|00000000||Chlastej, Geralte. Na tebe a Yen - šťastně spolu až na věky!
    521179|00000000||Fajn, změníme téma.
    521181|00000000||Fajn, změníme téma.
    521183|00000000||Protože odmítáš přiznat, že mám pravdu? Liboli.
   1056888|00000000||Přestaň dělat chytrýho a nalejvej.
   1056890|00000000||Jen klid. Yen a já - my nejsme spolu. A nikdy nebudeme...
   1056892|00000000||Ah, to vysvětluje, proč byla Vrchní čarodějka tak zatraceně nabroušená.
   1056894|00000000||Lamberte, nech toho... Promiň, Geralte, to bylo, eh, necitelný. To jsme nevěděli. Chceš... si o tom promluvit?
   1056896|00000000||Ne. Chci pít.
   1056898|00000000||Tak to se dá rozhodně zařídit.
   1056886|00000000||Yennefer a já - my nejsme spolu.
    467507|00000000||Co ta samovíla?
    521169|00000000||Chytila na svůj taneček jednoho vidláka… místo aby byl rád, že vyváznul živej, se ten pitomec úplně zamiloval.
    521171|00000000||Chtěl, abych mu ji chytil. Odmítnul jsem ho... Tak to zkusil sám, s rybářskou sítí. Vsadím se, že ještě teďka tancujou mazurku na nějakým poli.
    521173|00000000||Skvělej příběh! Má i morální ponaučení!
    521175|00000000||Vážně? Jaký?
    521177|00000000||Vyhejbej se nebezpečnejm ženskejm.
   1062159|00000000||Takže - ta samovíla?
    521056|00000000||Radši ne.
    535662|00000000||Radši hraju pro potěšení.
    535666|00000000||Ty nemáš dost, co? Celej hrad slyšel to vaše potěšení.
    535664|00000000||Potěšení? Hele, tak s tím jdi radši za Yen.
    521073|00000000||Tobě jde vážně jen o to jedno, Lamberte. Kolik je ti, dvanáct?
    521075|00000000||Začal mu mutovat hlas. Sis nevšim?
    521077|00000000||Hrozně vtipný!
    521079|00000000||Hrozně vtipný!
   1056901|00000000||Hahaha!
    521081|00000000||Dobrá, tak dost. Budeme hrát.
    521058|00000000||Jo… leda bys radši hrál svlíkací gwint?
    521060|00000000||Možná bych konečně pochopil, co na tobě ty baby viděj…
    521062|00000000||Hady v gatích si porovnáte pak. Teď pytle na stůl!
   1051966|00000000||Hahaha!
    521065|00000000||Co se mu jeví?
    521067|00000000||Na to kašli. Jde se hrát.
    521055|00000000||Jasně.
    467489|00000000||Nezahrajeme si partičku karet?
    467491|00000000||Proč by ne... Ale budeme hrát o prachy, že jo?
   1062161|00000000||Co takhle zahrát si karty?
    520920|00000000||Fajn, chlapi… čas jít chrnět.
    520922|00000000||Mluv za sebe. Noc je ještě mladá.
    520924|00000000||Heh, ale my už ne… a zejtra je velkej den.
    520926|00000000||Fajn. Chlastat jen se svým odrazem v zrcadle se mi nechce.
    520928|00000000||Vidíš? Ani ty sám se sebou nevydržíš. Brou noc.
   1062162|00000000||Je čas jít na kutě.
    531366|00000000||Máš proti mně něco?
    531394|00000000||Lamberte… hele… tobě na mě něco vadí?
    531396|00000000||Mně? Proč… proč to říkáš?
    531398|00000000||No… to tak vypadá… a víš… seš jako můj mladší brácha… blbej a otravnej… ale brácha.
    531400|00000000||Geralte, kurva… dyť já se snad rozbrečím! Pocem!
    531403|00000000||Kurva… se rozbila…
    531405|00000000||Eště že byla prázdná…. Eh. Kde je Eskel? Už tady měl bejt. Musíme… se po něm podívat!
    531407|00000000||To je práce… pro Vesemira!
    531409|00000000||Už zase… Sundej si tu hučku…
    531410|00000000||Kampak se nám ten plantážník jen poděl? Že by mu snad hrozilo nebezpečenství? Za mnou, chlapci, zachráníme ho!
    531386|00000000||Lamberte… kámo... musím ti něco říct.
    531388|00000000||No?
    531390|00000000||Někdy jseš… vážně strašný hovado… ale mám tě rád, brácho.
    531392|00000000||A ty seš… občas blbej jak necky… ale kurva… šel bych pro tebe do pekla a zpátky. Pocem, ty vole!
    531365|00000000||Lamberte, já tě mám rád, víš to, viď?
    531359|00000000||Uf. Vodka… vodka došla. Kdo půjde pro další?
    531361|00000000||Já už jsem šel… pro žrádlo.
    531363|00000000||Fajn… já půjdu… kuchyně… To je támhle, že jo?
   1062163|00000000||[DEBUG] DEBUG - Přeskočit k opilému Eskelovi - DEBUG
   1062160|00000000||Trochu se pobavíme.
    467499|00000000||Hele… chce to ňákou zábavu.
    467505|00000000||Nudíme tě?
    535660|00000000||Ne, jen je to takový…
    521216|00000000||Pomalý. Kunďák má pravdu. Hele… znám takovou hru, naučil mě ji jeden student z Oxenfurtu.
    521218|00000000||Hm?
    521220|00000000||Někdo začne "Nikdy v životě jsem ne…" a dokončí větu, jak chce. A když to někdo udělal... tak pije do dna. Pak je na řadě ten další.
    521222|00000000||To zní dobře. Začínej.
    521224|00000000||Nikdy v životě... jsem nespal se sukubou.
    521226|00000000||[Vynechat.]
    521225|00000000||[Pít.]
    521326|00000000||Čekal jsem, že Geralt… ale ty?
    521328|00000000||Eskele, Eskele… Tichá voda břehy mele.
    521330|00000000||Rohatejm ženskejm neodolám.
    524846|00000000||Fajn… jsem na řadě. Nikdy jsem se po tahu… neprobudil jen v podvlíkačkách.
    521331|00000000||[Pít.]
    521332|00000000||[Vynechat.]
    521341|00000000||Oh, Lamberte, Lamberte... Černá ovce Kaer Morhen...
    521343|00000000||A víš, co je na tom to nejlepší? Že ani nebyly moje!
    521334|00000000||Geralte? Lambert je ztracenej případ, ale ty… co by říkal tatík Vesemir?
    521336|00000000||Myslím, že taťka Vesemir... by se v tom kole napil taky.
    521345|00000000||Fajn, Geralte, teď ty. Nikdy v životě jsem…
    521351|00000000||… nevyskočil z okna milenky.
    521354|00000000||No teda… to musel bejt drsoň, cos mu jebal babu…
    521356|00000000||To ne… byl to kamarád. Nechtěl jsem ho urazit.
    521358|00000000||Jo… seš vážně kámoš.
    521347|00000000||Nevyskočil z okna milenky.
    521346|00000000||Nebral fisstech.
    521360|00000000||…nebral fisstech.
    521363|00000000||Eskele… Vážně?
    521365|00000000||Jednou… s tou sukubou.
    521349|00000000||Fajn, chlapi… to už by stačilo. Nebo se vám nebudu moct už nikdy podívat do očí.
    531289|00000000||Brrr… je tu zima jako v řiti ledovýho obra. Pánové… vrátím se… musím s pískem.
    531301|00000000||Hele, mně je celkem teplo…
    531303|00000000||Von byl dycky zmrzlík. Pamatuješ tu zimu před patnácti rokama, jak sníh zůstal až na Belleteyn?
    531304|00000000||Mhm. Lambert seděl u ohně zabalenej v dece. Házel kolem sebe kurvy a prdele vždycky, když začalo sněžit…
    531291|00000000||Mně tady zima není…
    531290|00000000||Vycházíš s Lambertem?
    531293|00000000||Vycházíte s Lambertem?
    531295|00000000||Tak nějak… Naučil jsem se s ním o některejch věcech nemluvit.
    531297|00000000||To musí bejt dlouhej seznam.
    531299|00000000||To je.
    531328|00000000||Zdravíčko, mládeži! Jak vám jde zábava? Alkohol, drazí pánové, je zaklínačův největší nepřítel!
    531330|00000000||Kdes vyhrabal ten klóbrc?
    531332|00000000||Ve Vesemirově skříni. Výkřik módy roku 1112! Starej si ho nejspíš bral, když šel lovit ženský! Nebo v tehdejší řeči "než se šel kořit dámám".
    531334|00000000||Hoši, život zaklínače, to nejsou jen karty a pití. Je to práce a dřina. My se broukajících batolat nedočkáme. Kdepak, my ne…
    531336|00000000||Hele, jeden Vesemir stačí. Sundej si to, než to umažeš… a poleješ.
    531338|00000000||Jo, já budu lít, Eskele, já budu lít. Protože bez vodky jseš nudnej jak účetní v gypsu.
   1075694|00000000||Dobrá hra, Geralte. Hlavně ten tah s tím--
   1075696|00000000||Eskele, ten žádnou chválu nepotřebuje. Nalejvej.
   1075700|00000000||Heh. Tak, Geralte, zdá se mi, žes dostal na prdel.
   1075708|00000000||Neštěstí ve hře, štěstí v lásce. A naopak.
    520893|00000000||O čem je řeč?
    520895|00000000||O zakázce na samovílu, kterou Eskel před časem měl. Dobrá historka.
    535532|00000000||Hned ji dokončím… ale nejdřív potřebuju smočit jazyk.
    535534|00000000||Ech… pořádnej kopanec do jater… co to je?
    535536|00000000||"Stopa" - špiritus napůl s Bílým rackem. Co ty na to? Yen šla do postele, je na čase začít chlastat doopravdy.
    535538|00000000||Takže ještě jednu rundu! A do dna!
    450392|00000000||A neposlouchal, co?
    520876|00000000||Jasně že ne.
    532252|00000000||Máme vše, co potřebuješ.
    532254|00000000||Výborně.
    523860|00000000||Nemáme čas…
    523867|00000000||Neber si to zle, Vesemire, ale… nemáme moc času.
    523869|00000000||Chci jen jednu noc navíc. Když z toho nic nebude… uděláme, co bude chtít Yennefer.
    528171|00000000||Je něco špatně?
    528245|00000000||Něco není v pořádku?
    528297|00000000||Nebo tři…
    528298|00000000||Beru tě za slovo.
    528294|00000000||To zní skvěle.
    528300|00000000||Yen… nezlob se, ale…
    528302|00000000||Dost.
    528304|00000000||Najednou jsem dostala neskutečnou chuť opít se.
    528295|00000000||Nezlob se, ale…
    528306|00000000||No teda, říkáš to pěkně na rovinu…
    528308|00000000||Na nesmělou pannu jsem moc stará... Pokud mě hezky nepoprosíš.
    528310|00000000||Půjdeme? Pak se k nim přidáš. Za hodinku. Nebo dvě.
    528312|00000000||Pořád jsem na tebe naštvaná. Musím se nějak odreagovat.
    528247|00000000||Ne, nic. Jen jsem si tě chtěla vzít na chvilku stranou. Tak, aby chlapi nevycítili, co se děje.
    528249|00000000||Mhm. A co se děje?
    528251|00000000||Odplížíme se nahoru a pomilujeme se.
    528243|00000000||Dobrá. Co jsem udělal tentokrát?
    528170|00000000||Co jsem zase udělal?
    528166|00000000||Dělejte si, co chcete, ale až za chvíli. Geralt a já si musíme promluvit.
    528169|00000000||Ho, to zní vážně. Pojď, Lamberte. Tak za chvíli, Geralte.
    524159|00000000||To mi přijde jako lepší nápad než trámy.
    524161|00000000||Skleničkou nepohrdnu. Ani dvěma.
    524163|00000000||Co mám dělat, přehlasovali jste mě. Jdeme na to.
    524155|00000000||Geralt mi dal flašku mahakamské kořalky. Akorát se bude hodit.
    524148|00000000||Takže… máme volný večer. Co s ním uděláme?
    524150|00000000||Vesemir říkal, že je třeba vyměnit trámy ve stropě věže. Možná bychom se o to mohli postarat.
    524153|00000000||Nebo bychom se mohli napít.
    524145|00000000||Co teď?
    524146|00000000||Z Vesemira je na stará kolena pěkný mrzout.
    524165|00000000||Z Vesemira je na stará kolena pěkný mrzout.
    524167|00000000||To nic nebylo… měls tady být minulou zimu, když se ho Lambert pokusil přesvědčit, že bychom měli Kaer Morhen opustit nadobro.
    524169|00000000||K čemu tahle stará ruina vůbec je? Plesnivé zdi, střechou teče a v zimě je to jedna velká zkurvená kostka ledu.
    524171|00000000||Vesemir neřekl ani slovo. Vstal, popadl meč a práskl za sebou dveřmi. Vrátil se až za měsíc.
    523871|00000000||Vezmu Umu do hor.
    523873|00000000||A co pak? Budete spolu výt na měsíc?
    523875|00000000||Trochu úcty. Nemluvíš s Geraltem.
    523877|00000000||Ne, nebudeme výt na měsíc. Položím ho na náhrobek. O půlnoci mu dám čaj z bolehlavu sesbíraný… ale nevidím důvod, proč bych ti to měl vysvětlovat.
    524812|00000000||Podle mého názoru…
    523879|00000000||Tvůj názor znám. Ale já se tu neprosím o svolení. Říkám, co se stane. Vrátím se za úsvitu. S Umou… nebo s kýmkoliv, kdo se v něm skrývá.
    523862|00000000||Co je to za metodu?
    523864|00000000||Pochází z lidové tradice. Použil jsem ji mnohokrát, třeba v roce 1211 na sejmutí kletby Labutě z Povissu.
    523859|00000000||Jaký postup?
    523850|00000000||Lamberte, připrav aparaturu. Eskele, jdi…
    523852|00000000||Co jsem naposledy slyšel, drahoušku, velím tady tomu já. Ne ty.
    523854|00000000||Myslela jsem si, že jsme se dohodli. Že Umu vyléčíme po mém.
    523856|00000000||A já řekl, že ti pomůžeme. To je vše.
    523858|00000000||Nevím, co s ním chceš udělat, neměla jsi chuť nám to říct. Ale není to bezpečné, že ano?
    532247|00000000||Já si to myslel. Proto si myslím, že nejdříve zkusíme jiný, méně otřesný postup.
    532250|00000000||Poslouchejte. Všechno je na místě… můžeme začít.
    529561|00000000||Vykoupeme se později.
    530511|00000000||Pokochat se můžeme později.
    530513|00000000||Jasně… nejdřív povinnosti, pak zábava.
    530515|00000000||Pamatuješ, jak se to s tím kruhem dělá? Už je to nějaká doba, co jsem si aktivoval svůj medailon.
    530517|00000000||V pohodě, staříku, nemusíš se vymlouvat. Zapálíš louče a položíš filakterium na oltář… já se postarám o zbytek.
    530503|00000000||To musí být, když sis toho všiml i ty.
    530505|00000000||Geralte, za koho mě máš?
    530507|00000000||Počkat… za škarohlída?
    530509|00000000||Hah! Pravda. Ale… zbytek komplimentů si nechej na potom. Pustíme se do práce.
    529560|00000000||To je od tebe velká pochvala.
    528853|00000000||No… zvládli jsme to.
    528854|00000000||To se nedá popřít.
    528856|00000000||Sakra… to je krásný výhled.
    538320|00000000||Geeeraltééé… Kam to lezeš?
    538321|00000000||Hej! Vrať se!
    539001|00000000||Jo! Výborně! To ti padne jak ulitý!
    539023|00000000||Jasně... Jen co to v pase trochu povolím...
    539025|00000000||Přestaň kecat a oblíkni se. To ne… to ti nejde k pleti.
    538315|00000000||Ta si přitáhla krámů… jako by se chtěla nastěhovat.
    539020|00000000||Pssst! Vyděsíš Geralta!
    527525|00000000||Myslím, že... no ano... slyším pleskat plachtu.
    530578|00000000||Zaplaval sis dobře? Nebyla voda moc studená?
    530580|00000000||Ne, tak akorát.
    530582|00000000||Ty jseš vážně podivín… ale to pro mě není nic novýho.
    527765|00000000||Připraven na jeskyně?
    530574|00000000||Skoro. Než půjdeme dovnitř…
    530576|00000000||Ech, vypij dávku Kočky, vím. Ještě něco moudrého mi povíš? Například "našlapuj tiše, ať nevzbudíš Starýho Ostroně?"
    530590|00000000||Starý Ostroň tam ještě pořád je?
    530592|00000000||Jo, je, pokud se nám nerozhodl udělat laskavost a nezdechnul sám. Může na nás kdykoli vyběhnout.
    530594|00000000||Jak byla ta básnička? Starý Ostroň tvrdě spí…
    530596|00000000||Když ho vzbudíš, bude zlý. Pojď.
    530584|00000000||Starý Ostroň tam ještě pořád je?
    530583|00000000||Jsi podrážděnější než Yen.
    530586|00000000||Pche. Ty jsi horší než Yen…
    530588|00000000||Ech. Hlavně se do mě nezamiluj. Jdeme.
    528814|00000000||Aaaaáu! Pomoc!
    528815|00000000||Slyšíš to? Zní to jako nějaké děcko...
    528816|00000000||Víš, že tohle údolí je až na nás neobydlené. To je určitě přelud.
    528817|00000000||A co když není?
    528819|00000000||Aaa… Aaaaaau!
   1058953|00000000||Tak ať je po tvém…
   1058880|00000000||Prošetříme to. Pro jistotu.
   1058955|00000000||Víš, Vesemir má pravdu... Ty vážně pícháš do hnízda, skoro pořád. Budiž. Jdeme.
   1058877|00000000||Měli bychom to prověřit. Pro jistotu.
   1058878|00000000||Asi máš pravdu... Pojďme do jeskyně.
   1058882|00000000||Asi máš pravdu... Pojďme přímo do té jeskyně.
   1058957|00000000||Konečně rozumná řeč.
    370082|00000000||To jsou určitě Eskelovy stopy... Nikdo jiný z hradiště neodcházel...
    526687|00000000||Stopy nohou... a kopyt. Koza. Hmm, zajímavé...
    526463|00000000||To je jeho kůň... jak on se to jmenoval? Škorpion? Krásné zvíře...
    445080|00000000||Eskel se tady utábořil... Vypadá to, že hodlal v divočině nějaký čas zůstat...
    526464|00000000||Dobře... tak se podíváme, kam nás ten smrádek zavede.
    526473|00000000||Kamení... stopa tu končí. No výborně.
    526474|00000000||Mohl bych zkusit jít po čichu. Eskela neucítím, ale je tady ta koza... Jen bych potřeboval najít vzorek jejího pachu.
    526475|00000000||Chuchvalec kozích chlupů. Fuj, to je smrad...
    526476|00000000||Zatraceně... nic necítím. Určitě jsem sešel ze stopy.
    526557|00000000||Kousky kůry... Eskelova koza se zřejmě snažila podrbat o strom.
    526753|00000000||Vida, Eskelova stopa... Vyčmuchal jsem ho.
   1030909|002ff636||Oheň
   1055144|00000000||Hele, chci se tady jen porozhlédnout.
   1055146|00000000||Vetřelec! To nemohu dopustit!
   1074537|00000000||To nedopustím!
   1074539|00000000||NE! NEDOPUSTÍM!
   1055140|00000000||Chci se tu porozhlédnout.
   1055153|00000000||Kdo jsi?
   1055155|00000000||Jsem oheň, duše této kovárny. Jsem plamen, který kalí ocel.
   1055142|00000000||Kdo jsi?
   1055141|00000000||Radmir z Tor Carnedd je mrtev.
   1055149|00000000||Radmirovi z Tor Carneddu? Toho stáhli zaživa z kůže během Falčina povstání. To už je hodně dávno.
   1055151|00000000||Lžeš!
   1055137|00000000||Zůstaň stát!
   1055139|00000000||Jdi pryč! Toto místo patří Radmirovi.
    515371|00000000||Co se mě týče, všechno připraveno.
    515358|00000000||Není důvod čekat. Pojďme.
    515348|00000000||Pojďme hned.
    515362|00000000||Musím ještě něco zařídit. Počkej tady na mě.
    515364|00000000||Jak chceš.
    515349|00000000||Ještě si něco zařídím a můžeme jít.
    528569|00000000||Velkou radost z toho nemáš, co?
    528571|00000000||Nemám. Dobře víš, že cesta ke Kruhu není procházka růžovým sadem... ve více než jednom smyslu.
    528573|00000000||Tak já půjdu s tebou.
    528598|00000000||No... Se slavným Bílým vlkem po boku se mi hned půjde snáz. Dobře... jsi připravený vyrazit?
    528524|00000000||Vidím, jakou z toho máš radost...
    528525|00000000||Ta potvora by taky mohla být zakletá Ciri...
