;meta[language=cz]
; id      |key(hex)|key(str)| text
   1047830|069826f1||Skalní troll
    515699|00000000||Pssst.
    515698|00000000||Takže Yennefer nakonec našla dobrovolníka, aby chodil kolem s tím pískajícím klackem, co?
   1040320|00000000||Mám tu odměnu, co jsem ti slíbil. Kořalku z Mahakamu.
   1040322|00000000||Ha! Lambert tvrdil, že zapomeneš. Díky, bratře.
   1040324|00000000||Však sis ji zasloužil. No, vlastně si ji zasloužil spíš Škorpión, ale přece nebudu dávat kořalku koňovi.
   1040308|00000000||Mám tvoji odměnu, mahakamskou kořalku.
    459889|00000000||Měj se.
    335356|00000000||Měj se.
    335354|00000000||Měl jsi poslední dobou nějakou zajímavou zakázku?
    459875|00000000||Narazil jsi v poslední době na nějaké zajímavé zakázky?
    459877|00000000||Už nějaký čas ne. Ale asi před půl rokem jsem v lese v Kreydenu zabil mantikoru. Zatraceně rychlá mrcha to byla.
   1020887|00000000||Skočila na mě z křoví tak rychle, že medailon nestačil ani cuknout. Jizvu ti ale ukazovat nebudu, na to už jsme staří.
   1020894|00000000||Zaplatili ti alespoň pořádně?
   1020904|00000000||Vůbec nic. Když jsem do vsi přinesl její hlavu, ten zatracený staršina přísahal, že je to poprvé, co o té potvoře slyší.
   1020911|00000000||Co ty?
   1020912|00000000||Kromě toho gryfa nic zvláštního: nekkeři, ghúlové a topivci. Mantikoru už jsem neviděl nejmíň rok.
    459879|00000000||Eskele.
    459881|00000000||Hm?
    528719|00000000||No teda, hrdličky se rozhodly k nám přidat. Užili jste si to?
    528721|00000000||Vždyť jsi ji sám slyšel, Lamberte. Navíc, houby je nám po tom.
    528717|00000000||Tak co? Zas ti paní čarodějka pořádně vynadala?
    528777|00000000||Dalo by se to tak říct.
    519808|00000000||Uh, Yen… nemáme skleničky. Nevadí ti pít z korbelu?
    519810|00000000||Dneska bych se napila i ze staré boty.
    524833|00000000||Co kdybychom si místo zachmuřeného mlčení povyprávěli, co je nového?
    524830|00000000||Kde jsi byl, Lamberte?
   1075416|00000000||Tak co jsi prováděl? Nějaké zajímavé zakázky, než ses vydal hledat Karadina?
    446990|00000000||Co jsi vůbec dělal, Lamberte? Viděl jsem tě naposled, když jsi mířil na západ.
    447029|00000000||No jo... Zakázka v Lan Exeter. Musím říct, že dost výnosná.
    447045|00000000||Jo, Kovir, tam je zlata dost. Kolik tam platí za topivce?
    519912|00000000||Ticho, teď mluvím já. Dělal jim problém obr. Útočil na konvoje, tahal lidi do bažin…
    519915|00000000||…a ulevoval si na silnici, takže byla hrozně kluzká. Jako úvod to stačí, zajímá nás pointa.
    519951|00000000||Dobrá. Ukázalo se, že to nebyl žádný obr, ale jen tlustý lesní troll. A konvoje přepadávala tlupa banditů.
    519953|00000000||Co jsi udělal?
    519955|00000000||Zabil jsem bandity, aby byla cesta bezpečná... Pak jsem zabil toho trolla - bez hlavy bych odměnu nedostal.
    519959|00000000||Trolla jsi mohl ušetřit…
    519961|00000000||A žrát kořínky a spát v příkopech u cesty? Potřeboval jsem peníze… a po trollovi nikdo plakat nebude.
    519963|00000000||Tak si na něj aspoň připijeme.
    519957|00000000||Trolla jsi mohl ušetřit.
    519956|00000000||Pragmatik, jako vždy.
    519965|00000000||Pragmatik, jako vždy.
    519967|00000000||Někdy by sis Lamberta mohl vzít za vzor. Zapomenout na spravedlnost pro trolly a myslet taky na peníze.
    519969|00000000||Věděl jsem, že mi čarodějka bude rozumět.
   1067898|00000000||Eskele, přiznej se. Jaks dostal toho katakana?
   1067900|00000000||Eskele, toho katakana, co jsme dostali společně - řekni mi, jaks ho sejmul.
   1067902|00000000||Katakana?
    446988|00000000||Eskele, jak u tebe?
    447071|00000000||Kde jsi byl, Eskele, když jsi byl pryč?
    447073|00000000||Aldersberg. Lovil jsem vyššího upíra.
    447075|00000000||Oh-ho-ho… To jsou nebezpečný zkurvysyni.
    447077|00000000||A mazaní. Řečený exemplář šel jen po mladých ženách z vyšších vrstev.
    447079|00000000||Tak jako já.
    519972|00000000||Tvé fantazie nás nezajímají, Lamberte… ale ten upír… i já jsem zvědavá, jak to dopadlo.
    519974|00000000||Můj zadavatel uspořádal maškarní bál pro městské notábly, aby vylákal upíra z úkrytu. Byl jsem tam v kostýmu. Povídám vám, nikdy jsem neměl takový úspěch u žen jako ten večer…
    519978|00000000||Míchat práci a milostný život? Špatný nápad. Ten upír tě mohl nachytat s kalhotama kolem kotníků.
    519980|00000000||Asi ano… ale když vypadáš jako já, bereš každou příležitost.
    519982|00000000||Možná bys mohl nosit masku pořád.
    519984|00000000||Ehm. A ty bys možná mohl nosit roubík.
    519976|00000000||Míchal jsi práci a zábavu? Špatný nápad.
    519975|00000000||Dostal jsi upíra?
    520014|00000000||Co ten upír?
    520016|00000000||Domluvil jsem se s jednou mladou alchymistkou. Sjela se jak motyka fisstechem, vodkou a houbičkami, pak šla do zahrady. Upír ji našel a napil se… boj byl jenom taková formalita.
    520018|00000000||Hmm… moderní pohádka pro moderní dobu.
    520020|00000000||A co ta alchymistka? V pořádku?
    520022|00000000||V pořádku. Přišla o pár kapek krve, ale kocovinu měla pořádnou. Měsíc pila jenom lák z nakládaných okurek.
    446972|00000000||No, já…
    447126|00000000||U mě se toho v poslední době děje spousta. Králové, draci, spiknutí a pak… jsem našel Yen.
    447184|00000000||To nás hrozně těší. Ale proč nám místo toho neřekneš o Umovi?
    447186|00000000||To je dlouhý příběh. Jdu po stopách Ciri - Velen, Skellige, Novigrad, kde jsem zase musel zachraňovat Marigolda…
    447194|00000000||Zase zkoušel ošukat někoho, koho neměl?
    447196|00000000||Správně. Co se starých přátel, Novigradu a šukání týká… jak se má Triss?
    520579|00000000||Mluvili jsme o Umovi, že ano?
    520581|00000000||Noc je ještě mladá. Můžeme mluvit o všem.
    520032|00000000||Mluvil jsem o Umovi.
    520583|00000000||Triss to… zvládá.
    520585|00000000||Co ty jizvy, co měla od Soddenu? Pořád je má?
    520033|00000000||Triss to zvládá.
    520031|00000000||Jdi do prdele.
    520575|00000000||Jdi do prdele, Lamberte.
    520577|00000000||Ha, asi jsem se trefil do citlivého.
    520587|00000000||Lamberte, to není vtipné.
    520589|00000000||Fajn. Takže teď mluvíme vážně? Tak budeme mluvit. Yen. Co chceš dělat s Umou?
    520591|00000000||Říkala jsem, že vám to povím zítra.
    520593|00000000||Tak už nám to řekni. Už je po půlnoci.
    520595|00000000||Podrobím ho Zkoušce trav. Ale jen…
    520597|00000000||Cože kurva uděláš?!
    520622|00000000||Chovej se slušně, Lamberte.
    520624|00000000||Slyšels, co…
    520626|00000000||Nebudu ti to opakovat.
    520614|00000000||Chovej se slušně.
    520615|00000000||[Nedělat nic.]
    520628|00000000||Ehm, promiň, ale... to z něj chceš udělat zaklínače?
    520630|00000000||Jistě že ne. Jak jsem chtěla říct, vystavím ho jen první polovině Zkoušky, protože...
    520632|00000000||Protože chceš vidět, jak se trápí?
    520634|00000000||Přestaň mi skákat do řeči, nebo budeš trpět ty.
    520650|00000000||Abychom mohli Umovi vrátit jeho původní vzhled, musíme nejprve... Hmm… Jak bych vám to vysvětlila...
    520636|00000000||Představte si kus jílu. Abyste z něj mohli něco vytvarovat, musíte ho nejdřív navlhčit, jinak se bude drolit. Počáteční fáze Zkoušky dělá přesně tohle... Dalo by se říct, že otevírá tělo možnostem změny. Teprve pak z něj mohou mutageny udělat zaklínače.
    529779|00000000||Nepřehánějte to. Zítra nás čeká důležitý den.
    520689|00000000||To bude první Zkouška po mnoha letech… desetiletích.
    520691|00000000||Věděla jsem, že budete proti.
    520693|00000000||Proti? O to nejde. Ta tajemství byla dávno zapomenutá… a měla by tak zůstat.
    520695|00000000||Jsem ta poslední, kdo by navrhoval zahájit masovou výrobu zaklínačů.
    520697|00000000||Ani nemusíš… víš, prozatím jsme měli výbornou výmluvu, proč nebrat učně. Ale teď… musíme si o tom promluvit.
    520699|00000000||Možná později. Kdo si dá ještě rundu?
    520700|00000000||Já… ale došlo nám žrádlo. Geralte, skočíš do kuchyně?
    520711|00000000||Klidně.
    528774|00000000||Pánové, bylo mi potěšením s vámi popít, zvlášť s Lambertem… ale hodina pokročila.
    520686|00000000||To bude první Zkouška po mnoha letech.
    520687|00000000||Jakou má Uma šanci na přežití?
    520702|00000000||Jakou má Uma šanci na přežití?
    520704|00000000||Velkou ne. Ale nemáme na výběr.
    520706|00000000||Pokud Vesemir nezvládne ten svůj trik s bolehlavem.
    520708|00000000||Možná nás překvapí. Stařík se vyzná.
    530299|00000000||Máš to nějaké popletené, Vlku... Ten rybník je na druhé straně.
    530300|00000000||Dobře, Geralte, pokud nutně chceš jít na procházku, jdi si sám... A až se v klidu vydýcháš, přijď za mnou do stájí...
    530293|00000000||No... já to radši zkusím s tou loďkou.
    394356|00000000||Neříkala Yen, k čemu jí to bude?
    387079|00000000||Neříkala ti Yen, k čemu to chce?
    446438|00000000||Chceš říct, že ty to nevíš?
    527920|00000000||A… to tě nežere?
    527924|00000000||Výborně... Pojďme.
    527921|00000000||Výborně. Můžeme jít.
    527926|00000000||Něco ti na Yen vadí? Tak kolem toho přestaň chodit jako kolem horké kaše a řekni mi to na rovinu.
    527928|00000000||A ty si na rovinu přiznej, že tě oblbla a podfoukla. A ne jednou, ale už několikrát.
    527930|00000000||To už je pryč. Yen se změnila.
    527932|00000000||No jo. Dobře, tak to nechme být... a pojďme už.
    527922|00000000||Máš proti Yen něco?
    527934|00000000||Ne, nedělá. Já jí věřím.
    527936|00000000||A pak že prý se lidé dokážou poučit ze svých chyb...
    527938|00000000||Cože?
    527940|00000000||Ale nic, nic.
    527942|00000000||Ne. Já jí věřím.
    527941|00000000||Jasně, že mě to žere.
    527944|00000000||Samozřejmě že mě to žere... Ale bez její pomoci se nám tu kletbu zlomit nepodaří.
    527946|00000000||Možná by bývalo bylo lepší požádat o pomoc Triss...
    527948|00000000||Řeknu ti to takhle... Pokud se Yen nepodaří Umovi pomoct, vždycky se můžeme zkusit obrátit na Triss – a ona nám to nebude mít za zlé. Ale kdybychom to udělali obráceně...
    527950|00000000||Uf... to by bylo nadělení.
    527952|00000000||Přesně tak. Dost už o tom, měli bychom jít.
    387075|00000000||Nechceš mi náhodou poradit, jak se správně drží nůž?
    416853|00000000||Tím ostrým od sebe. Pojď už, pospěš si.
    394354|00000000||Nepoučuj…
    512160|00000000||Výborně... Nabereme ten mozkomíšní mok a vypadneme odtud.
    512162|00000000||Sekni ho do zad, hned za lebkou.
    529475|00000000||Jistota především.
    529481|00000000||Když někomu může jít o život, radši se ujistím. A dost řečí.
    529483|00000000||Jistě. Ušlechtilý Bílý vlk nikdy neopustí člověka v nouzi! Je to spíš světec než zaklínač!
    529485|00000000||Změníme téma… viděl jsem správně? Byl ten kluk…
    529487|00000000||Jo, jeden z našich. Musel se utopit během Zkoušek… Mlhavci si zapamatovali jeho hlas a vzhled.
    529489|00000000||Nádhera… vypadneme.
    529490|00000000||Nemusíš mi říkat dvakrát. Já jsem sem přece vůbec nechtěl jít.
    529491|00000000||Lamberte… Dost.
    529477|00000000||Marigold by měl spíš zpívat o tobě. Lambert, zaklínač vtipálek.
    529479|00000000||Pořád lepší než být naivní pitomec. Dožiju se vyššího věku.
    529474|00000000||Možná by měl zpívat o tobě.
    527855|00000000||Přelud… koho by to napadlo?
    527856|00000000||Ech… mám pocit, že ty toho jen tak nenecháš, co?
    529473|00000000||Přesně tak. Celý svět by měl vědět, jak se slavný Geralt z Rivie nechal podfouknout jako malé děcko. Možná by o tom mohl Marigold složit baladu, co myslíš?
   1029901|00000000||To chtělo hodně úsilí, schovat tenhle průchod za iluzí.
   1029950|00000000||"Monstrum aneb Vědmáka připodobnění."
   1029951|00000000||Na první stránce jsou něčí poznámky.
   1030005|00000000||Ty poznámky popisují, jak v dole otevřít průchod.
   1055124|00000000||Asi by stálo za to se tam dolů podívat.
   1030028|00000000||Železný důl. Vyčerpaný už pár století.
   1030039|00000000||Za těmi kořeny něco je...
   1030073|00000000||Elementál. Nějaký mág ho vyvolal a nechal ho tu jako stráž.
   1030405|00000000||Podle těch poznámek musím umístit knihu na správné místo...
   1030811|00000000||Hučí mi medailon - je tady magie.
   1030893|00000000||To není obyčejná kovárna. Medailon cítí magii.
   1030894|00000000||Měl bych se tu porozhlédnout.
   1031014|00000000||Oheň vyhasl. Tak se podíváme, co je za tím krbem.
   1031234|00000000||Tajná místnost, schovaná za iluzí.
   1043631|00000000||Hm... kovářské měchy.
   1056394|00000000||Nemůže to být těžší než namíchat elixír.
   1056613|00000000||Dobrá, dáme se do práce.
   1056430|00000000||Hmm... nejsem si tím jistý...
   1056416|00000000||Omeleta bez vajec. To asi neprojde.
   1056405|00000000||Myslím, že je to jedlé...
   1056468|00000000||Mám přidat ještě něco?
   1056458|00000000||Nemám cibuli...
   1056456|00000000||Nemám papriku...
   1056454|00000000||Nemám houby...
   1056460|00000000||Hmm... vejce došly...
   1064514|00000000||Jedlé… myslím.
   1064510|00000000||To stačí.
   1056914|00000000||Argh. Musím začít znovu. Potřebuju pár dalších surovin.
   1056407|00000000||[Začít znovu.]
   1056412|00000000||Tohle je katastrofa...
   1056414|00000000||Tohle bych nedal ani psovi.
   1056396|00000000||[Přestat vařit.]
   1056408|00000000||[Sehnat další suroviny.]
   1064511|00000000||Zkusím to znovu.
   1056424|00000000||Ugh... tohle Yen dát nemůžu...
   1056422|00000000||Tak prostě budou míchaná vajíčka.
   1056426|00000000||Možná jsem tam toho dal moc...
   1056420|00000000||Omeleta, o tom není pochyb.
   1056410|00000000||Trochu tohohle, trochu tamtoho, všechno to promíchat...
   1056406|00000000||[Vařit.]
   1056469|00000000||[Přidat suroviny.]
   1056395|00000000||[Přidat suroviny.]
   1043725|00000000||Leží tu spousta mrtvých topivců... Jejich lovec bude pěkně silná potvora.
   1043764|00000000||Začíná to už být nuda. Nějaký přerostlý parchant povraždil celé stádo topivců.
   1043723|00000000||Další topivec, a ještě hůř rozdrásaný.
   1043719|00000000||Mrtvola topivce... ať ho zmasakrovalo cokoliv, člověk to nebyl.
   1043777|00000000||Troll. Takhle velkého už jsem dlouho neviděl... Musí být sakra starý.
   1047841|00000000||Něco mi říká, že se trochu naštval.
    514783|00000000||Eh...
    514785|00000000||Zas to někde teče...
   1075505|00000000||Sakra, Geralte, přestaň tu pobíhat. Chováš se jak hovno v díře do ledu. Vylezeme tam a skončíme to, ne?
   1075492|00000000||Můžeme?
   1075498|00000000||Ty jseš ale tlustoprd.
   1075501|00000000||Raz… dva… tři!
   1075559|00000000||Ty taky nejsi žádný pírko. No tak, jdeme.
   1075494|00000000||Sakra… Moc vysoko.
   1075503|00000000||Když ti pomůžu, tak ne. Pamatuješ? Součást Zkoušek. "Zaklínač je lovec osamělý--"
   1075561|00000000||"…ale i osamělému lovci se občas může hodit pomoc." Vesemir.
    529293|00000000||Měli bychom jít. Naskoč do loďky.
    529295|00000000||Dobře. Ale u kormidla budu já.
    529297|00000000||Protože...?
    529299|00000000||Protože je to moje loď. Nebudu se o tom bavit.
    529287|00000000||Naskoč do loďky.
    529288|00000000||Tebe to pořád ještě žere?
    529305|00000000||Tebe to pořád ještě žere?
    529307|00000000||Žere? Ne, přímo mě to sere.
    529308|00000000||K čemu sakra byla taková zkouška dobrá? Většina z těch, kteří se od kruhu živlů vrátili, stejně do roka chcípla někde v bažině při lovu topivců po třiceti korunách za kousek. Takže na co to vlastně bylo?
    529318|00000000||To by ses musel zeptat Vesemira.
    529320|00000000||Však já jsem se zeptal, a ne jednou. To mi můžeš věřit.
    527432|00000000||Dobře... Vchod do jeskyně je přímo proti nám. Vidíš ho?
    529278|00000000||Musíme přeplout rybník, projít jeskyní, vyšplhat na Trollí hlavu... a jsme na místě.
    529280|00000000||Dneska už se to nezdá tak strašné, co?
    529282|00000000||Ne... ale pořád mi z toho naskakuje husí kůže. Víš, že se z mé skupiny vrátili jenom dva kluci?
    529284|00000000||Vy jste ti dva, co natrefili v jeskyních na Starýho Ostroně, co?
    529286|00000000||Hmm.
   1000037|00000000||Myslíš, že univerzálie existují jako skutečná a konkrétní jsoucna, nebo jen jako myšlenkové konstrukty?
   1000039|00000000||Umaumauma.
   1000041|00000000||Mhm. Moje řeč.
   1000035|00000000||Existují univerzálie jako skutečná a konkrétní jsoucna?
   1000026|00000000||Jak ti můžu pomoct?
   1000028|00000000||Uma uma.
   1000017|00000000||Jak ti mohu pomoct?
   1000020|00000000||Zatím.
   1000018|00000000||Opatruj se.
   1000016|00000000||Hledám Ciri.
   1000022|00000000||Hledám Ciri. Popelavé vlasy, jizva na tváři... Neviděls ji?
   1000024|00000000||Uma! Uma! Umamama!
   1000015|00000000||Můžeme si promluvit?
    522194|00000000||Uvidíme.
    522236|00000000||Nevím. Uvidí se.
    522238|00000000||Geralte, chápu, že za ní pospícháš. Ale nemůžeme jednat naslepo.
    522534|00000000||Něco tě napadlo, že ano? No tak, ven s tím.
    522195|00000000||Budeme čekat.
    522240|00000000||Budeme na ně čekat s meči v rukou.
    522242|00000000||Ano…
    522464|00000000||Vrať se brzy zpátky, Geralte.
   1059162|00000000||Dobrá. Je čas, abych už šel.
    522425|00000000||Hodně štěstí, Vlku. A pozdravuj od nás Cirillu.
    522427|00000000||A ty, co plánuješ ty?
    522429|00000000||Musím se postarat o Avallac'ha. Bez opatrné magické péče určitě zemře. Se mnou má šanci. Ne velkou, ale je to lepší než nic.
    522431|00000000||A my se s chlapy domluvíme, jak přivítat naše nezvané hosty.
    522406|00000000||Co budeš dělat ty?
    522405|00000000||Seženu spojence.
    522423|00000000||Fajn… Najdu Ciri… a seženu pár spojenců. Přivedu všechny sem. Mám u pár lidí schované laskavosti.
   1059157|00000000||Jsou mezi nima nějaký pěkný ženský?
   1059160|00000000||Mhm. Výhradně.
    522244|00000000||Je na čase, aby se z kořisti stali lovci. Geralt najde Ciri a přivede ji sem… a Hon ji bude následovat.
    522277|00000000||Budou čekat, že nás překvapí… ale to budou zklamaní.
    522279|00000000||Budeme s nimi bojovat? Nás pět? V rozpadajícím se hradě?
    522375|00000000||Máme na výběr? Kromě toho, že budeme odsouvat nevyhnutelné?
    522376|00000000||Fešák by mohl sehnat pár dalších, co dokážou máchat mečem…
    522400|00000000||… nebo kouzlit.
    522232|00000000||Co navrhuješ ty?
    522234|00000000||Ciri nemůže utíkat do nekonečna. Jednoho dne zakopne… a druhou šanci nedostane.
    522193|00000000||Co navrhuješ ty?
    522173|00000000||Půjdu pro Ciri.
    522175|00000000||Počkat… nemyslíš, že nám dlužíš nějaké vysvětlení? Odkud znáš toho Avallac'ha? Co s ním Ciri dělala?
    522177|00000000||Yennefer vám to vysvětlí. Jen na něj dávejte pozor… není to přítel.
    522179|00000000||To možná ne, ale Ciri mu zjevně věřila… měli bychom brát vážně aspoň jeho slova.
    522181|00000000||Slyšeli jste, co říkal… když vezmeme Ciri z toho Ostrova mlh, Hon okamžitě najde její stopu. Co pak?
    522138|00000000||Půjdu pro Ciri
    522139|00000000||Zvládne to?
    522183|00000000||Zvládne to?
    522185|00000000||Já… nevím. Jak jsi viděl, všechno nešlo podle plánu. Sňala jsem kletbu, ale…
    522187|00000000||Zkouška mu v těle nadělala paseku.
    522189|00000000||Divoké škubání v prstech, oči nereagují na světlo… viděl jsem to mnohokrát. Zbytečně mnohokrát.
    522191|00000000||Toxiny trvale poškodily jeho nervovou soustavu. I kdyby přežil… Rozumíš?
    522129|00000000||Snažil jsem se ji ochránit… ale kletba…
    522131|00000000||Hon Ostrov nenašel. Zatím. Je to jen otázka času… Ale když odejde… najdou ji. Okamžitě.
    522137|00000000||Dost, Geralte. Pořád je jen krůček od smrti.
    522107|00000000||Ostrov mlh, kde je?
    522109|00000000||Všude… a nikde.
    522111|00000000||Poslyš, ty Vědoucí. Nesňali jsme z tebe tu kletbu, jen abychom teď řešili tvoje hádanky…
    522113|00000000||Praevein, arwein, cyrraen…
    522121|00000000||Na Skellige… sledujte ji… do mlhy… Rychle! Rychle!
    522095|00000000||Kde je ten Ostrov mlh?
    522096|00000000||Co od ní Hon chce?
    522123|00000000||Hon… co chce od Ciri?
    522125|00000000||Její krev… Starší krev… otevřít bránu.
    522127|00000000||Nemůžeme… nemůžeme to dovolit.
    514674|00000000||Avallac'h…?
    522083|00000000||Ty ho znáš?
    522085|00000000||Ano, elf, Aen Elle. Vědoucí…
    522089|00000000||Kde je Ciri?
    522087|00000000||Skrytá… na Ostrově mlh… ale… není… není v bezpečí… Hon…
    570855|00000000||Nevid, cyvir!
   1072717|00000000||Caniatad… Nevid… Cyvir…
   1072719|00000000||Coalle… Ariva… Aendir…
    570857|00000000||Ne... Ne... To ti nedovolím!
    570859|00000000||Geralte! Žlutou lahvičku! V mé brašně!
    570861|00000000||Tiše. Poslouchej.
    570863|00000000||Coalle... Coalle... Caniatad…
    570865|00000000||Nevid, cyvir! Coalle, coalle caniatad!
   1072723|00000000||Nevid! Ariva! Aendir!
   1072721|00000000||Geralte! Filakterium! Otevři ho!
   1072725|00000000||Caniatad! Taron Anede! Dis!
    535863|00000000||Pomalu. Mně rozkazy nevydáváš...
    535867|00000000||Obejdeme se bez zdvořilostí? Výborně.
    535869|00000000||Ale nezapomínej, že nejsem tvůj voják, tvé páže nebo tvůj pes. Takže mi nezkoušej dávat rozkazy.
    535871|00000000||Dal bys přednost tomu, abych vydal rozkazy strážím? Podívej, čekají na můj pokyn.
    535873|00000000||Geralte...
    535875|00000000||Takže... podej hlášení.
    536275|00000000||Tak dobře.
    536288|00000000||Dobře.
   1084020|00000000||Počkej.
   1084022|00000000||Tady.
   1084024|00000000||Radši si to nech u sebe.
   1084102|00000000||Samozřejmě.
   1084105|00000000||Mizím.
    536390|00000000||Dobře, tak... jak můžeme sejmout z Umy kletbu?
    536392|00000000||Musíme ho vzít na Kaer Morhen.
    536396|00000000||To ti vysvětlím, až se tam dostaneme. A Geralte... promiň, ale nedokážu teleportovat tebe, Umu i Klepnu, takže...
    536398|00000000||Neboj... my tam pojedeme. Já teleportaci nikdy nepřišel na chuť.
    536400|00000000||Dávej na sebe pozor.
    536332|00000000||Jak můžeme sejmout tu kletbu?
    556728|00000000||Už ne. Prosím.
   1086455|00000000||Yen...
   1018607|00000000||Geralte, prosím. Už není co říct.
   1086453|00000000||Yen, to, co se stalo - tam na Skellige...
   1086451|00000000||Yen, promiň, že jsem ti na Skellige nepomohl.
    536333|00000000||Kam se poděl tvůj kousavý humor?
    536335|00000000||Kam se poděl tvůj pověstný kousavý humor? Teď by se hodil. Byla jsi pokorná jako studentka z Aretuzy na kolokviu u pana rektora...
    536337|00000000||Prostě poznám, co si můžu dovolit a kdy je lepší spolknout pýchu.
    536402|00000000||Na rozdíl od někoho.
    536404|00000000||Aha, chápu... Takže na mě vystrkuješ drápy, protože jsem jenom prašivý zaklínač, zatímco...
    536406|00000000||Opravdu to chceš teď řešit, Geralte?
    536408|00000000||Hádat se můžeme i jindy a jinde. Nejlépe někde, kde stěny nemají uši.
    536331|00000000||Slyšení je u konce. Na shledanou.
    536284|00000000||Na to bych nespoléhal.
    536286|00000000||To nebyl požadavek. To byl rozkaz, Geralte. A dám ti jednu dobrou radu... neodvažuj se mě neposlechnout.
    536274|00000000||Nemám v úmyslu ji sem přivést.
    536219|00000000||Ta zrůdnost by klidně mohla být tvoje dcera. Za tu podobu může nějaká kletba... Někdo se pod ní skrývá.
    536225|00000000||Dokážeš tu kletbu sejmout?
    536227|00000000||Už jsem si toho zjistila docela hodně, pátrala jsem po tom... ale abych dokázala kletbu sejmout, musela bych znát její přesné znění, a to...
    536229|00000000||"Va fail, elaine - cáed'mil, folie! Glaeddyv dorne aep t'enaid, bunn'droh ithne i'yachus."
    536231|00000000||Řekl mi to Marigold... Ciri s ním o tom mluvila.
    536233|00000000||Konečně jsi dokázal příjemně překvapit... Paní Yennefer, má otázka stále platí.
    536235|00000000||Ano... myslím, že to dokážu... ale musím...
    536263|00000000||Podrobnosti mě nezajímají. Geralte... dokázal jsi toho velmi málo, ale pořád je to víc, než co vyšťourali všichni mí neschopní špehové. Dám ti polovinu slíbené odměny. Druhou polovinu dostaneš, až mi přivedeš Ciri.
    535884|00000000||Tahle zrůdnost by mohla být tvá zakletá dcera.
    535885|00000000||Vím, kde Ciri byla a co dělala.
    536038|00000000||Sledoval jsem ty stopy, které jsi mi poskytl.
