;meta[language=cz]
    552972|00000000||Nechceš se k nám v podvečer stavit? Věrka peče koláč.
    552979|00000000||Hm, nevím, jestli...
    552984|00000000||Jak myslíš. U nás jsi vždy vítaný.
    586286|00000000||Vidíš je? Přišli hodovat! Nakrmím je tvou bolestí!
    586287|00000000||Ať se radši vrátí, odkud přišli, pokud si váží svých životů. Přišel jsem si pro tebe.
    586288|00000000||Vědí, že je neušetříš… Jsi zaklínač, vrah. Lovíš a zabíjíš.
    586289|00000000||Už mě to nebaví.
    586290|00000000||Dělejte si, co chcete - pořád můžete odejít. Kdo zůstane, nepřežije.
    586291|00000000||Zabte ho!
    579064|00000000||Cítím tvou bolest. Vidím tvůj strach…
    579065|00000000||Rozhlédni se! Cítíš jejich nenávist? Zabil jsi jejich bratry za hrst mincí. Chtějí tě vidět trpět, až ztratíš drápy, vlku.
    579066|00000000||Proroctví nelžou... Tuto bitvu nepřežiješ.
    579067|00000000||Zireael je mrtvá. Nic víc než malá zmrzlá mrtvola v ledové divočině.
    579068|00000000||A ty se bojíš… Cítíš strach.
    579069|00000000||Lžeš. Já už necítím nic.
    578824|00000000||Trpělivost, sestry. Cítím ho, přichází. Jeho duši stále můžete získat…
    578936|00000000||Jeho bolest, ledové utrpení bude vaše. A budete se na něm pást.
    578937|00000000||Brzy, sestry, velmi brzy.
    578958|00000000||Pojď ven!
    576137|00000000||A koukejte si odnést všechno to harampádí. Ať tady nezůstane ani jeden zavšivenej hadr.
    576139|00000000||Fuj! Stejně to tady budeme muset vybílit.
    576147|00000000||Hajzli nilfgaardští.
    581876|00000000||Tohle je Temerie, jasný?
    581878|00000000||Však uvidíme, na jak dlouho.
    582555|00000000||Mahakamská dvojitá medovina. Kde ji asi ukradli?
    582569|00000000||Dost jídla pro celé vojsko.
    582586|00000000||Jestlipak je chytí...
    582538|00000000||Tábořit takhle blízko k cestě, to chce silné nervy.
    582556|00000000||Pohár tady není.
    582557|00000000||Vypadá to, že teď investují do movitého majetku.
    581194|00000000||Zlé oko! Je to přítelíček té vědmy, seberte ho!
    581170|00000000||Čarodějnici nesmí býti dovoleno dál žít život plný kacířství. Oheň nechť ji očistí a sežehne všechnu špínu...
    581188|00000000||Ticho, čarodějnice!
   1068563|00000000||Tak pojď!
    578847|00000000||Nenuť mě, abych tě zabil.
    578850|00000000||Uklidni se. Nemusíme bojovat.
    578851|00000000||Prostě jdi. A Dámu z močálu - tu nech bejt…
    578836|00000000||Dobrá, nezájem.
    578841|00000000||To je pravda.
    578842|00000000||Tak vodpal. Kazíš nám zábavu.
    578843|00000000||[Udeřit ho.]
    578854|00000000||Už jdu.
   1065296|00000000||Nashle. Musím něco zařídit.
    578845|00000000||Už jdu.
    578844|00000000||Pusťte toho vlka.
    578863|00000000||Pusťte tu vlčici.
    578864|00000000||Ještě není oslabená.
    578865|00000000||Běsní. Ví, že je už skoro mrtvá, ale ještě si to musí připustit.
    578866|00000000||Vypadněte odsud.
    578867|00000000||Cože? Nejseš padlej na hlavu? Ta šelma nám zabila dobytek a bude lovit dál. Zatracený zvíře! Je to kurva nepřítel! Buď vona, nebo my!
    578868|00000000||Přesně moje slova.
    578853|00000000||Pusťte toho vlka.
    578852|00000000||[Udeřit ho.]
    578835|00000000||Pusťte toho vlka.
    578848|00000000||Uhh…
    578849|00000000||Stáhneme tě zaživa z kůže, ty ubožáku!
    578846|00000000||[Udeřit ho.]
    578837|00000000||Kde je ta Ježibaba?
    578838|00000000||Vodpal, tvůj druh tady není vítanej. Vodejdi z našich zemí.
    578839|00000000||Až potom. Brzy. Nejdřív tu čarodějnici.
    578840|00000000||Ty jseš jeden. Nás je deset a máme psy. Chceš skončit jako ta vlčice?
    578834|00000000||Kde je Ježibaba?
    578829|00000000||Co tady děláte?
    578830|00000000||Posledních několik dnů je tu na lovu vlčice. Zabila krávu, zranila muže. Tak jsme nastražili pár pastí.
    578831|00000000||To blbý zvíře do jedný z nich přímo nakráčelo, hehe. Jakmile se unaví, pustíme na ní psy a zalovíme si.
    578832|00000000||Co se ti stalo s uchem?
    578833|00000000||Co na tom záleží? Do toho ti kurva nic není.
    584284|00000000||Poklekněte před svým novým pánem...
    584286|00000000||...a ochráncem.
    584253|00000000||Vznešený lord Dagborg se ujímá vlády nad touto zemí, aby vládl šlechetně a spravedlivě.
    584254|00000000||Všechna jiná břemena, závazky i povinné platby se tímto velkomyslně promíjejí.
    574281|00000000||Válka napáchala škody, které je nutno napravit. Daně tedy budou odteď zdvojnásobeny.
    574282|00000000||Každý, kdo zaplatí pokladně, dostane potvrzení na příslušnou částku.
    574278|00000000||Čarodějnice, falešní léčitelé, obchodníci s amulety a prašiví nelidé se tímto prohlašují za psance.
    574279|00000000||Všichni, kdo takovým osobám poskytnou přístřeší nebo jim budou jinak pomáhat, budou souzeni a popraveni z vůle Svatého tribunálu Věčného plamene.
    584266|00000000||Co to znamená?
    584268|00000000||To znamená, že teď budeš muset platit daně šlechetnému lordu Dagborgovi.
   1058998|00000000||Blíží se změny.
   1059080|00000000||Potřebujete pomoct? S tou károu?
   1059082|00000000||To zvládnem, kámo.
   1059084|00000000||Děkujeme za starost.
   1059086|00000000||Jo, páč nevypadáš jako žádnej kolář, to je jasný.
   1059088|00000000||Potřebujete s tou vaší károu pomoct?
   1059090|00000000||Myslím, že to zvládnem, heheh.
   1059092|00000000||Hah, no to si piš, že to zvládnem.
   1059094|00000000||Pravda, sudů je krdel, ale brzo si z každýho nalejeme.
   1059102|00000000||Pravda, to nepopírám.
   1059104|00000000||Nilfgaard prchá, ale tady se zdálo, že s nima nic nehne.
   1059112|00000000||Nechali tady i svoje víno. To je štědrý.
   1059096|00000000||Už jsme si zvykli, víš.
   1059098|00000000||Když jsou Černý pryč, přijdou sem lovci čarodějnic. Ale život půjde dál. Musíme si vážit každýho dne.
   1059100|00000000||To je pravda! Takže do práce, než nás přepadne noc!
   1059116|00000000||Musím jít. Sbohem.
   1059122|00000000||Je čas, abych šel. Hodně štěstí.
    584839|00000000||Hodně štěstí.
   1059013|00000000||Kam máš namířeno? Do nejbližší hospody, jak to tak vypadá.
   1059114|00000000||Jo. Nejdřív se mám s někým setkat - v bývalém táboře Nilfgaarďanů. Tak se opatrujte.
   1059118|00000000||Opravdu nepotřebujete pomoc?
   1059120|00000000||Myslím, že to zvládneme.
   1059115|00000000||Opravdu nepotřebujete pomoc?
   1059107|00000000||Taková je pravda.
   1059109|00000000||Nilfgaarďani uprchli, Redanský sotva dorazili a zbojníci cítí prázdnotu, v podstatě tady mají volnou ruku.
   1059111|00000000||Sotva jsme unikli, pak nám upadlo kolo a jen jsme se dívali, jak koně mizí v lesích.
   1059072|00000000||Potřebujete s tou vaší károu pomoct?
   1059074|00000000||Errr... n-ne.
   1059076|00000000||Ona není tak úplně naše, je to spíš zabraný vozidlo. Kořist, by se dalo říct.
   1059078|00000000||Lidi ji museli opustit ve spěchu - kam spěchali, to netuším. Byla by škoda, kdyby ji Redanský vyplenili.
    590603|00000000||Ah, už je to kyselý.
    590605|00000000||Ahoj, ty tam.
    590607|00000000||Co je novýho?
    590609|00000000||Jestli nesneseš to vedro, tak se kliď z kovárny.
    590619|00000000||Tady je jen prvotřídní zboží, žádný rezavý šméčko.
    590611|00000000||Že si každej svůj osud tvoří sám? Pff. Spíš si ho každej sám posere.
    590621|00000000||Má to nějakou cenu? Ty tvoje meče na zádech?
    590613|00000000||Chceš dostat nakládačku?
    590615|00000000||A co jako? Mám zavolat pro pomoc?
    590617|00000000||Pomoc! Zachraňte mě!
    573535|00000000||Podej hlášení.
    573530|00000000||Kapitáne!
    573536|00000000||Novigradská delegace je odsud půl dne cesty.
    573537|00000000||Pospíšili si...
    577531|00000000||Vrať se na stanoviště.
    577533|00000000||Ano, pane.
    573538|00000000||Čtvrtá švadrona... a vlastně celá divize Frundsberg... dezertovala.
    573539|00000000||Generál Voorhis to už ví?
    577540|00000000||Je na poradě, tam nikoho nepouštějí.
    577542|00000000||Nesmysl. Okamžitě mu to jdi oznámit.
    581879|00000000||...
    581883|00000000||Kurva mať, zaklínač!
    574700|00000000||Černí si asi mysleli, že tady zůstanou navždy, he he.
    584444|00000000||Nilfgaardští, Redanští... Stejná pakáž.
    574684|00000000||A to jsme si stěžovali na císařské...
   1061437|00000000||Kdyby nebylo nás, seděli by tu Černí jen tak - až do Yule nebo i déle!
   1061439|00000000||Ty jseš hrdina - a jenom můj! To se mám!
   1061711|00000000||Směj se, jestli chceš, ale kdyby se tvůj Gordek nevrátil a nevyhnal Nilfgaarďany...
   1061713|00000000||Hahahaha!
   1061715|00000000||...dostal by tvoje panenství nějakej Cahir nebo Johann!
   1061717|00000000||Ale ty, tys čekala na mě, moje malá Manny, že jo?
   1061719|00000000||Čekala. Čekala!
   1061721|00000000||Hahahahaaa!
    577594|00000000||Doneseme Marigoldovi pěkně macatého okouna a třeba na králičí guláš dočista zapomene.
    577595|00000000||Mhm.
   1068729|00000000||Trochu lituju, že nešel s námi.
   1068731|00000000||Trocha cvičení by mu prospěla.
   1068733|00000000||Mhm.
    578152|00000000||Led by tady neměl být tak silný.
    578154|00000000||Uh-huh.
    578150|00000000||Jak přesně chceš vůbec něco chytat?
    578157|00000000||Uvidíš.
