;meta[language=cz]
; id      |key(hex)|key(str)| text
    569503|00000000||Zaklínač! No tak to je naprosto skvělé!
    569499|00000000||Říkali mi, že mě přijme hned ráno - a už bylo poledne!
    569502|00000000||Uklidni se.
    569915|00000000||Co-cože? Víš, s kým to mluvíš, vojáku?! Jsem Herevard druhý, princ z Ellanderu!
    569917|00000000||Nejen že tu musím čekat jako nějaký prosebník, ale kdo mi dělá společnost? Kozoroh!
    569919|00000000||Koželuh. Mistr cechu koželuhů.
    569921|00000000||Jako by v tom byl rozdíl, zatraceně! Žádám…
    569923|00000000||Uklidni se.
    569925|00000000||Císař žádá ticho. Ty, kdo jej vyruší, čeká tvrdý trest. Nehledě na jejich původ.
    569487|00000000||Pán půjde za mnou, když dovolí.
    569488|00000000||Drž se prosím poblíž. V paláci je mnoho ctihodných hostů, které pán…
    569489|00000000||…znechucuje?
    569961|00000000||…nemusí obtěžovat.
    570594|00000000||Až bude pán hotov, měl by se stavit za mnou a dostane své věci zpět.
    570583|00000000||Nespěchá snad pán za tou čarodějkou?
    570581|00000000||Copak jsem nežádal…
   1044413|00000000||Pán bude mít čas na procházku později. Teď prosím zůstane se mnou.
    570571|00000000||Pán nerozuměl? Nezdůraznil jsem snad dostatečně, že se před císařem musí všichni uklonit?
    570573|00000000||Uklidni se. Nic se nestalo.
    570575|00000000||Pánovi ne. Ale mě čeká trest.
    570577|00000000||Jaký?
    570579|00000000||Prosím, drž se nablízku a nikoho neobtěžuj. Pro jeden den už jsme etiketu porušili dostkrát.
   1048792|00000000||Kaedwenské ten útok překvapil. Stále truchlili kvůli ztrátě svého krále. Zkroušení a bez vedení složili zbraně po pár prohraných šarvátkách - a přidali se k Radovidovi.
   1048383|00000000||A co Kovir?
   1048389|00000000||A co Kovir?
   1048391|00000000||Kovir si cení neutrality. Dost na to, aby ani jedné ze stran nepropůjčil vojska, a co víc, hlavně peníze.
   1048393|00000000||Zpět k válce... Letos na jaře došlo k obrovské bitvě ve velenských močálech. Obrovské, ale nerozhodné. Obě strany utrpěly nesmírné ztráty. Dokonce dosud nevídané.
   1048396|00000000||Radovid ustoupil přes Pontar. Prozatím je v bezpečí... dokud z jihu nedorazí posily. Pak se s ním císař Emhyr var Emreis vypořádá jednou pro vždy.
   1048398|00000000||Nemůžete se prostě vrátit domů? Ušetříte každému dlouhý pochod. O životech nemluvě.
   1048400|00000000||Obávám se, že na to je teď v sázce příliš mnoho. Všechno, nebo nic.
   1048385|00000000||Slyšel jsem ve tvém hlase náznak obdivu?
   1048387|00000000||Radovid je náš nepřítel... Ale chytrost mu upřít nemůžu. Udělal z nás hlupáky. A to velmi zabedněné hlupáky.
   1048375|00000000||Slyšel jsem náznak obdivu?
   1048819|00000000||A tak jsme na jaře místo dvou slabých nepřátel měli jednoho silného.
   1048790|00000000||Kaedwenské tím naprosto překvapil. Král Henselt bojoval v čelních liniích jako vždy... A právě tam zemřel. Jeho vojáci ztratili vůli bojovat. Přidali se k Radovidovi.
   1048684|00000000||Jak pokračuje válka? Tedy kromě skutečnosti, že Nilfgaard má vítězství na dosah.
   1048687|00000000||Předpokládám, že toto má být soukromý rozhovor. Nemáme svědky. Takže si odpusťme propagandu, i tu zahalenou ironií.
   1048690|00000000||Náš útok pokračoval znamenitě - dokud nepřišla zima. Aedirnem zmítal takový zmatek, že jsme nenarazili na žádný odpor. K Pontaru jsme dorazili před prvním sněhem.
   1048692|00000000||Zůstal jen oslabený Kaedwen... A Radovidova Redanie, která ignorovala žádosti o pomoc zbytku Severu. Mysleli jsme, že budou žádat mír, třeba by se podrobili vazalství. Čekali jsme na jaro a byli si jisti vítězstvím.
   1048695|00000000||Radovid? Vzdát se?
   1048697|00000000||Ano. Bláhová naděje, souhlasím. Radovid nevyslal žádné mírové posly ani nevytáhl na naše pozice. Místo toho se vláčel zasněženým pohořím Kestrel... a zaútočil na Kaedwen, na své spojence.
   1048342|00000000||Jak probíhá válka?
   1041275|00000000||Nějaké zprávy z Novigradu? Je svobodné město stále svobodné?
   1048488|00000000||Ano. Ačkoliv všichni vědí, že to nevydrží. Radovid je v Oxenfurtu a císař zde ve Wyzimě. Oba jsou na prahu Novigradu. A oba vyžadují peníze a lodě... A Novigrad to vše má.
   1048490|00000000||Proto je nálada ve městě poněkud... inu, vyhrocená.
   1048492|00000000||To znamená?
   1048494|00000000||Jak se muži vypořádávají se strachem? Hledají ujištění... a obětní beránky. Církev Věčného ohně tohle dokonale chápe. A tak slibuje, že zlepší životy svého stáda tím, že jim ukáže viníky.
   1048496|00000000||Kdo tu válku začal? Kdo z ní těží? Inu, to je nasnadě: mágové, elfové, trpaslíci. Jedním slovem všichni devianti.
   1048498|00000000||V Novigradu jsem byl nasazen třináct let. Nejdřív jako konzul, pak jako velvyslanec. Viděl jsem toho hodně. Krutost, cynismus, lakotu. Ale z toho, co se tam děje teď, mi běhá mráz po zádech.
   1041259|00000000||Co je nového v Novigradu?
   1041283|00000000||Co je nového na Skellige?
   1048519|00000000||Nic. Na to jsou ostrované pyšní, že ano? Dělají vše podle tradice. Jako jejich předkové.
   1048521|00000000||A jako jejich předkové jsou spolu znesváření. Drancují. Občas zaútočí na naše lodě. Je to otravné... ale nic víc. Skellige bylo vždy poznámkou pod čarou historie. A tak to i zůstane.
   1048523|00000000||Zníš nesmírně sebejistě. Co když se králi Branovi podaří sjednotit jarly? Vedl by proti vaší flotile všechny své klany.
   1048525|00000000||Král Bran je vetchý starý muž. Pokud vím, sotva si pamatuje jména svých vlastních vazalů... Sjednotit je všechny by mohlo být náročné.
   1041260|00000000||Jaké jsou nejnovější zprávy ze Skellige?
   1041293|00000000||Díky za pomoc.
   1048344|00000000||To nestojí za řeč. Kéž ti Velké slunce osvítí cestu.
   1041261|00000000||Díky za pomoc.
   1041258|00000000||Jaká je situace ve Velenu?
   1041263|00000000||Jak to vypadá ve Velenu?
   1041269|00000000||Špatně jako vždy... možná i hůře.
   1041271|00000000||Tato země nikdy mlékem a strdím neoplývala... A teď oplývá krví. Vojska se přes ni přehnala hned několikrát, podupala pole, vyrabovala sýpky, vypálila vesnice. Obyvatelstvo ochromil hladomor.
   1048476|00000000||Mhm. Jak se vám vládne takovému ráji?
   1048481|00000000||Popravdě, moc dobře ne. Naše jednotky jsou už tak dost slabé a Velen jsou hlavně lesnaté močály, které se těžko ovládají. Několik hlídek se vůbec nevrátilo do táborů.
   1048483|00000000||Pročež jsme správu v této oblasti dočasně převedli na jistého seveřana. Na bývalého nižšího důstojníka temerské armády, jistého Filipa Stengera... známějšího pod svým pseudonymem Krvavý baron.
   1048485|00000000||Radím ti dobře - tomu se vyhýbej.
   1041253|00000000||Velvyslanec var Attre?
   1048334|00000000||Yennefer navrhla, ať si s tebou popovídám o nedávných událostech. O válce a tak.
   1048336|00000000||Samozřejmě. Císařovi sluhové by před sebou neměli mít žádná tajemství. Když dovolíš... přistoupíme k mapě.
   1041257|00000000||Ano, Geralte? Ještě něco?
   1041255|00000000||To jsem já. A ty jsi určitě Geralt. Zaklínač známý jako Bílý vlk... či případně jako Řezník z Blavikenu.
   1048332|00000000||Geralt bude stačit, vážně.
   1077546|0aa7b54a||Stráž
   1048536|00000000||Je ten brk naostřený? Ano? Tak piš.
   1048538|00000000||Skutečnou správu Novigradu nedrží ani městská rada, ani cech kupců, ale Církev Věčného ohně a zločinecké podsvětí.
   1048546|00000000||Občas je složité je od sebe rozeznat. Obě strany vykazují podobnou bezcitnost a cynismus, který...
   1048548|00000000||Počkej prosím, výsosti... Nestíhám.
   1048550|00000000||Víš co, napíšu to hlášení sám. Ty pak jen připravíš čistý náčrt. A uděláš tři kopie.
    420952|7643aa11||Sluha
    569516|00000000||Omluv nás, pane. Jsme zaneprázdněni.
    569512|00000000||{Ess’va dearf? } [Víš to jistě?]
    570796|00000000||{Evelienn. Katte áth, tve gláeddyven. Essa vatt’ghern. } [Naprosto. Kočičí oči, dva meče… Zaklínač.]
    569513|00000000||{Esse ma a strigean aep Foltest aen carnnan. } [Třeba přišel vyčistit katakomby - strigy ještě z Foltestovy vlády.]
    569515|00000000||{Caen vyos? Ae’vyos que’ess imbael. Essa ssant. Ess’va Nordling. } [Možná. Těžko říct, kolik lidí vysál… Prý byl chlípný až nesmírně. Typický seveřan.]
    570811|00000000||{Allaidh. } [Barbaři.]
   1050605|00000000||{Esse clytie... Hyn vrae breinne gardd? } [Tyhle záhony... tomuhle říkají královská zahrada?]
   1050607|00000000||{En celfyd daen garddvrae esse plenten aep Nord, marche. } [Zdá se, že umění zahradnické na Severu ještě nezačalo vzkvétat.]
   1050634|00000000||{En celfyd daen sychiad hefyd, cassve caen gvelede tu meve. } [Ani umění uklízečské - podle toho, co jsem viděla uvnitř.]
   1050609|00000000||{Ymherodr caisse hvandre slafie aep caer’den duges Vicovaro. Glaenne esse plasse. } [Císař sem brzy přivede sto otroků ze dvora hraběnky z Vicovara. Ti už ten palác vyčistí.]
   1050611|00000000||{Hvandr gallu esse nac’gvasse... } [Stovka možná nebude stačit...]
   1050636|00000000||Nepotřebujeme pánův doprovod.
   1055186|3a515643||Nilfgaardský aristokrat
    571107|00000000||Jak mohu pánovi posloužit?
    571108|00000000||Tím, že mi vrátíš moje věci.
    571110|00000000||Citrus a jetel. Díky této vůni vydrží pánovy šaty čerstvé poněkud déle.
    571468|00000000||Hm. Tak díkec.
   1047735|00000000||Císař není proslulý svou trpělivostí. Chce zpět svou dceru, v bezpečí a v pořádku. Co možná nejdříve.
   1047737|00000000||Jo... Něco takového zmiňoval. Sbohem.
    571470|00000000||Nechť na tebe vždy svítí Zlaté slunce.
   1069326|e0351e50||Truhlice
   1001508|00000000||Už jsme domluvili.
   1001510|00000000||Dal jsem ti rozkazy - jsou jasné.
   1001506|00000000||Až s tebou budu chtít mluvit, nechám si tě zavolat.
   1028795|00000000||Dal bych si partičku karet.
   1086498|00000000||Gwint - pojď si zahrát.
    492362|00000000||Na viděnou.
    492353|00000000||Na viděnou.
    492349|00000000||Hm?
   1054906|cd8f7b8e||Velvyslanec var Attre
   1043973|00000000||Dobrá.
   1044089|00000000||Dobrá... A pak co? Uděláš mi i nehty?
   1044091|00000000||Když bude čas. Žel, den je krátký, zatímco seznam hygienických a kosmetických zákroků, které by měl pán podstoupit, je vpravdě celkem dlouhý.
   1041386|00000000||Ušetřil jsem ho a on utekl.
   1041398|00000000||Bojovali jsme na protichůdných stranách, pravda... Pak jsme skončili ve stejném žaláři. Arjan utekl. Cestou hrad zapálil.
   1041400|00000000||Ahh, takže takhle ten požár vypukl. Podle našeho hlášení za to mohl nejspíš ten drak.
   1041314|00000000||Přidal jsem se k Iorwethovi, pomohl mi.
   1041374|00000000||Z Flotsamu jsem odešel s Iorwethem, velitelem jednotky Scoia'tael.
   1041376|00000000||Zabiják příšer a zabiják lidí... Uzavíráš zajímavá spojenectví.
   1041324|00000000||Pomohl jsem Rochovi zachránit Anais.
   1041370|00000000||Já to tak nevidím. Pomohl jsem příteli... zachránit dítě.
   1041372|00000000||Anais nebyla ledasjaké dítě. Byla pěšákem ve hře, kterou jsi nechápal. Ty a Roche jste ji nezachránili ani v nejmenším... Spíš jste ji přemístili z jednoho rohu šachovnice na druhý. Rozvířili jste plameny střetu.
   1047296|00000000||Pomohl jsem Iorwethovi sejmout kouzlo ze Saskie.
   1047299|00000000||Vůbec ne. Zapletl jsem se do osobních záležitostí. Pomohl jsem Iorwethovi sejmout kouzlo ze Saskie.
   1047301|00000000||Ano. A tím jsi Radovidovi zavdal příčinu zahájit svůj hon na čarodějnice. Blahopřeju.
   1041334|00000000||Dostala, co si zasloužila.
   1041348|00000000||Hm, spíš starou známou. Nebyli jsme si tak blízcí, aby mi jí bylo líto. Ale dost na to, abych věděl, že si to zasloužila.
   1041350|00000000||"Domnívá se, že on sám ví, co je dobré a co je zlé. A že to mu dává právo vykonávat spravedlnost."
   1047303|00000000||Tak tě popsal tvůj druh, Letho z Gulety. Docela přesné, řekl bych.
   1044184|00000000||Můj druh. Váš špeh.
   1041346|00000000||To spojenectví stále trvá? Co se stalo s Lethem?
   1041352|00000000||To spojenectví trvá? Co Letho dělá?
   1041354|00000000||Doufal jsem, že na to odpovíš ty.
   1041356|00000000||Ah. Takže Letho se před tebou schovává... Asi má dobrý důvod. Asi ho k tomu donutila nějaká změna v národních zájmech.
   1044186|00000000||Nevím, kde je. Neřekl bych ti to, i kdybych to věděl. Ať už mám u krku ostří, nebo ne.
   1047765|00000000||Jak to jde? Přípravy na audienci pokračují podle plánu?
   1047767|00000000||Ano, generále. Pán bude vypadat více méně slušně.
   1047769|00000000||Co je to za chlapa? To je taky holič?
   1047771|00000000||Ne. Morvran Voorhis. Velitel divize Alba. Doprovod Yennefer - to byli moji muži, všichni.
   1047773|00000000||Vskutku... "byli." Protože z Wyzimy se žádný nevrátil, že? Vážně by mě zajímalo, co se včera na cestě stalo. Možná bys mi to mohl osvětlit. Máš čas... a břitvu u krku.
   1047787|00000000||Zabil je Divoký hon.
   1047789|00000000||Kavalkáda přízračných jezdců pádících po noční obloze? Ta znamení války, o kterých blábolí sedláci? Čekáš, že tomu budu věřit?
   1047791|00000000||Upřímně... je mi to vážně úplně jedno.
   1047779|00000000||Zabil je Divoký hon.
   1047778|00000000||Tví muži zemřeli v boji. To se vojákům stává.
   1047781|00000000||Tví muži zemřeli v boji. To se vojákům stává.
   1047783|00000000||Vidím, že tě jejich osud neznepokojuje... nijak moc.
   1047785|00000000||Pravda. Ale já hádám, že je nijak moc neznepokojoval osud těch, do jejichž země vpadli.
   1047802|00000000||Seveřani. Můžeme vás vykoupat, oholit a ošatit, ale naučit vás způsobům... to bude výzva.
   1047804|00000000||Taky jsem tě rád poznal.
   1047806|00000000||Hotovo. Mám ho oholit ještě jednou, i přes odpor?
   1047808|00000000||Ne. On sám je zde přes odpor ostatních - to stačí. Sbohem, zaklínači. Či spíše brzy na shledanou.
    569662|00000000||Výborně. Pán se teď může obléci.
    569664|00000000||Bohužel jsem neobdržel přesné míry. Pokud budou šaty škrtit, náš krejčí je povolí.
    569386|00000000||Kde jsou moje šaty?
    569389|00000000||Kde jsou moje šaty?
    569674|00000000||Tam, kde měly být už dávno. U pradleny.
    569676|00000000||Po audienci ti je vrátíme. Čisté a naškrobené.
    569391|00000000||Pán mi dá vědět, až si vybere oblek.
    569387|00000000||Černý, černý… nebo černý?
    569388|00000000||V Nilfgaardu nemáme rádi okázalé barvy.
    569385|00000000||Na barvě nezáleží, hlavně když bude černá?
   1041358|00000000||Domnívám se, že to je vše. Tvůj podpis, prosím, stvrzující, žes uvedl celou pravdu a nic než pravdu, pod výhrůžkou vězení či smrti atakdále atakdále. Tady... a tady.
   1041362|00000000||Když máme formality za sebou, poprosil bych generála, aby odešel. Budeme vybírat pánův úbor. Důležitá věc, ale generálovu pomoc nevyžaduje.
   1041364|00000000||Škoda... byl bych ti něco poradil. Sbohem, Geralte. Hodně štěstí na audienci.
   1044195|00000000||Spíš si připadám, jako by mě chystali na svatbu...
   1044202|00000000||Kdyby tomu tak bylo, připravil bych pánovi sutanu, frak či možná slušivou vestu. Ve skutečnosti si ovšem pán bude vybírat z těchto oděvů.
   1041366|00000000||No, tohle spojenectví je pryč. Nenávratně. Letha jsem v Loc Muinne zabil.
   1041368|00000000||Slyšel jsem... Dobře jsi udělal. Ušetřil jsi našim špehům špinavou a těžkou práci.
   1041345|00000000||To spojenectví skončilo. Víš, Letha jsem zabil.
   1044191|00000000||Inu... Kvůli národním zájmům jeden občas uzavře nelehká spojenectví. Třeba i se zaklínači.
   1041336|00000000||Sledoval jsem, jak do megaskopu vstoupila... Ale nakonec jsem ji pustil... z pasti, kterou nastražil tvůj muž Letho z Gulety. To si zapiš. Já se chci ujistit, že ty papíry teď budou v pořádku.
   1041333|00000000||Sheale se podařilo utéct.
   1044122|00000000||Nilfgaard nedávno začal válku. Aniž by byl vyprovokován. Takže toho nech a přestaň moralizovat.
   1044189|00000000||Pán musí sedět klidně. Už jsem skoro hotový.
   1044124|00000000||Obávám se, že to bude těžké. Protože podle toho, co vím, krátce poté jsi sledoval, jak pokažený megaskop roztrhal tvou přítelkyni Shealu de Tancarville na kusy.
   1041326|00000000||Mocní uvěznili Triss Ranuncul. Měl bys vědět, že ji mám rád... A ty, které mám rád, zachraňuju.
   1041328|00000000||A to jsi také udělal. Čímž jsi Radovidovi předal vládu nad Konkláve a Radou mágů.
   1041323|00000000||Musel jsem zachránit Triss.
   1044114|00000000||Něco mi říká, že to nejzajímavější teprve přijde. No tak, další otázku, než mi zase narostou vousy.
   1044116|00000000||Pokud narostou, znovu tě oholíme. Nuže dobrá... nechvalně proslulý sjezd v Loc Muinne. Byls tam. A opět ses zapletl do záležitostí mocných.
   1041316|00000000||Z Flotsamu jsem odjel s Vernonem Rochem. Velitelem Modrých pruhů a...
   1041318|00000000||...vrahem nelidí. Toho pána dobře známe, zaklínači. Uzavíráš zajímavá spojenectví.
   1041313|00000000||Z Flotsamu jsem odešel s Vernonem Rochem.
   1044110|00000000||Tak dále... Pak jsi nalezl úkryt v malebném Flotsamu a odtamtud ses dostal do Vergenu. Má otázka zní - jak?
   1041378|00000000||Foltest mi nařídil vyčistit cestu. Ten kluk mi stál v cestě.
   1041380|00000000||Zabít dědice La Valettů - to na tebe neudělalo dojem? Ale nejspíš ne... Co znamená baron pro vraha králů?
   1041385|00000000||Arjana jsem během obléhání zabil. Prostě se to stalo.
   1044077|00000000||A připrav se na to, že zodpovíš pár dotazů.
   1044079|00000000||Generále... nejsem si jistý, že je na to vhodná doba.
   1041390|00000000||Vhodnější doba mě nenapadá. Muži bývají upřímní, když na krku cítí ostří.
   1047100|00000000||Morvran Voorhis, velitel divize Alba. Než tě předvedou před císaře, zaklínači, musíš mi ověřit nějaké informace. Je to formalita, ale musí to být.
   1041392|00000000||Jistě. Papíry musí být v pořádku.
   1044081|00000000||Takže... Geralt z Rivie. Místo narození: neznámé, rodiče: neznámí, věk: neznámý... Samé nepodstatné podrobnosti. Přejděme k nedávným událostem. Obléhání hradu La Valette. Osud bránícího velitele, jistého Arjana.
   1041388|00000000||Zakloň hlavu, prosím. A nehýbej se.
   1044083|00000000||Co mám s vousy? Vždycky jsem myslel, že mi přidávají na důstojnosti.
   1044085|00000000||To ano. Ale také pánovi ubírají na eleganci. V Nilfgaardu považujeme vousy za nepěkný pohled... Obzvláště vousy zamořené vešmi.
   1044087|00000000||Nějakou dobu jsem na cestách... Dobrá, dělej, jak umíš.
   1043972|00000000||Mám snad vousy v nepořádku?
    569648|00000000||Pán si sedne na bergère.
    569650|00000000||Na cože?
    569652|00000000||Do toho… křesla.
    569655|00000000||Cledwyne. Ohol prosím pána. Kotlety na půl palce.
    569642|00000000||Hmm. To bude muset stačit.
    569644|00000000||Myslíš, že Emhyrovi záleží na tom, jestli jsem čistý?
    569646|00000000||Pán bude o Jeho císařské výsosti mluvit celým titulem - nebo vůbec.
    570205|00000000||Tvá císařská výsosti.
    570207|00000000||{Areir aep tho orde... } [Jak si Tvá výsost přála…]
    570209|00000000||{Evelienn namyn vatt’ghern va vort. } [Všichni ven. Až na zaklínače.]
    570185|00000000||[Neuklánět se.]
    570333|00000000||Myslel jsem, že se nikomu neukláníš.
    570335|00000000||Nechtěl jsem komořího zklamat. Jsme kámoši.
    566880|00000000||Udělám to jen kvůli Ciri.
    566901|00000000||Štědrost si schovej pro ty, kterým tvá vojska srovnala domov se zemí.
    566903|00000000||Udělám to kvůli Ciri, ne kvůli tvému zlatu.
    566905|00000000||Nezajímají mě tvé pohnutky, pouze výsledky.
   1047320|00000000||Zbytek ti řekne Yennefer.
    566899|00000000||Toto slyšení je u konce. Mereride!
    570367|00000000||Zaveď ho za tou čarodějkou.
    577657|00000000||Potřebuju stopy, ne důvody. Ciri… moc stop nezanechává. Bude těžké ji najít.
    577674|00000000||Můj sbor špehů ti pomůže. Počítej s nimi i s mým vojskem, pokud by bylo třeba.
    566878|00000000||Potřebuju stopy, ne důvody.
    566888|00000000||Kolik mužů má tvoje armáda? Dvacet tisíc? Třicet?
    577718|00000000||Takže - proč já?
   1044571|00000000||Ty víš proč. Protože ti věří.
    577410|00000000||Věří mi, to ano. Takže mi řekni, proč ji hledáš ty. Pochybuju, že jí chceš vynahradit všechny ty ztracené roky…
    577412|00000000||Kvůli zájmům státu. Jako vždy.
   1047316|00000000||Dost toho škádlení. Budeš souhlasit tak či tak.
   1047318|00000000||Když ne pro nic jiného, tak proto, že ti zaplatím. Víc, než kolik běžně bereš za zakázku. Podstatně víc.
    577209|00000000||Proč já?
    577210|00000000||Je zpátky? Víš to jistě?
    577321|00000000||Víš to jistě? Ciri… odešla. Šla daleko, hodně daleko.
    577417|00000000||Myslíš, že bych tě sem táhnul uprostřed války, abych s tebou probíral drby?
    577709|00000000||Myslím, že se může mýlit každý, i císař.
   1047312|00000000||Zapomněl jsem, jak neomalený umíš být.
   1047314|00000000||Nemám čas tě přesvědčovat. A vlastně ani chuť. To udělá Yennefer - po audienci.
    566763|00000000||Hádám, žes mě sem nezavolal, abychom zavzpomínali na staré časy, takže…
    566770|00000000||Ticho.
    566784|00000000||Má dcera Cirilla… Vrátila se. A je v nebezpečí. Pronásleduje ji Divoký hon.
    577208|00000000||Najdeš ji. A přivedeš ji ke mně.
    570337|00000000||Tolik měsíců u Foltestova dvora, ale stejně ses nenaučil ani základy etikety.
    570339|00000000||Víš, co se říká… starého vlka novým kouskům nenaučíš.
    570184|00000000||[Uklonit se.]
    570177|00000000||{Ym’grymie aep Aard Ker’zaer, Deithwen Addan yn Carn aep Morvudd, Emhyr var Emreis! } [Poklekněte před Jeho císařskou výsostí, Bílým plamenem tančícím na mohylách nepřátel, Emhyrem var Emreis!]
    570180|00000000||Uklonit.
    582353|00000000||Promiň, můj pane. Byl jsem si jistý, že…
    582355|00000000||Víš, kdo jsem?
    582357|00000000||Ano.
    582359|00000000||Emhyr var Emreis, císař Nilfgaardu, Bílý plamen tančící na mohylách nepřátel.
    582361|00000000||Ty jsi Foltestův sluha?
    582363|00000000||Byl jsem, ano… O-opravdu to děláš?
    582365|00000000||Co?
    582367|00000000||Tančíš na mohylách nepřátel?
    582369|00000000||{Stráže!
    582351|00000000||Na tohle se mě ještě nikdo neptal.
    582405|00000000||{Gàrracaer ess mëot leeg caer. } [Zahrada měla být prázdná.]
    582407|00000000||{A’ess, Aard Ker'zaer. N’evellien am caed... } [Taky byla, Tvá císařská výsosti. Nikdo se neměl…]
    582410|00000000||Slituj se, můj pane… Jen jsem se staral o ten strom… Myslel jsem, že se nikdo…
    582412|00000000||Ticho, Temeřane. Nemluv, dokud na tebe nepromluvím.
    582414|00000000||{Ax. } [Sekeru.]
    582416|00000000||Ano, Tvá císařská výsosti.
    582418|00000000||Tohle už není Temerie. Ani ta zahrada, ani ten palác, ani ta země. Teď už je to Nilfgaard.
    582420|00000000||Jo, Nilfgaard, budiž… O tenhle strom jsem se staral ještě za Medella, Foltestova otce.
    582422|00000000||Víš, jak Foltest zemřel?
    582426|00000000||Zavraždili ho na hradě La Valletů.
    582428|00000000||Kde byla tehdy vaše královská stráž?
    582430|00000000||Král byl sám. Říká se… že ho vrah zastihl ve věži.
    582434|00000000||Samota, ano. Může být smrtící pastí, když je někdo neopatrný.
   1002205|b352eb18||Nilfgaardský dvořan
    569510|00000000||{Vissean ess’va aen Novigrad? } [Vrátili se poslové z Novigradu?]
    569511|00000000||{Yeá... An neen. Raadsliden ae’enect, es Tunn esse saor an neenphàir. } [Ano… s prázdnýma rukama. Radní prohlásili, že město zůstane nezávislé a neutrální.]
    569998|00000000||{Esse'sidh avside aep feansa neen math theenk. Neen cofhurtail an ennv pa vall. } [Balancovat na plotě - bláhový nápad. Nejen že je to nepohodlné, ale je hrozně snadné spadnout.]
    570000|00000000||{Ess vraag, que’ss side... } [Otázka je, na kterou stranu…]
    570001|00000000||{Dùth. Visse var Attre ess pa’as aep. } [Na tu správnou. Velvyslanec var Attre se o to postará.]
    570030|00000000||To by se mělo zkoušet vždy.
    570054|00000000||To by se mělo zkoušet vždy.
    570056|00000000||Protože?
    570122|00000000||Protože je jen málo věcí, pro které stojí za to sloužit. Ještě méně mužů.
    570124|00000000||Ale dost už o tom. Vadilo by vám, kdybychom změnili téma?
    570048|00000000||O tom pár věcí vím.
    570050|00000000||Vysvětlíš to?
