;meta[language=cleartext]
    569511|00000000||{Yeá... An neen. Raadsliden ae’enect, es Tunn esse saor an neenphàir. } [Sí... Con las manos vacías. Los regidores han decretado que la ciudad se mantendrá independiente y neutral].
    569998|00000000||{Esse'sidh avside aep feansa neen math theenk. Neen cofhurtail an ennv pa vall. } [Mantenerse neutral es un error. Y es una posición incómoda. Antes o después hay que decantarse por un bando].
    570000|00000000||{Ess vraag, que’ss side... } [La cuestión es por cuál...].
    570001|00000000||{Dùth. Visse var Attre ess pa’as aep. } [Por el correcto. El embajador var Attre se asegurará de ello].
    570030|00000000||Siempre vale la pena intentarlo.
    570054|00000000||Pero vale la pena intentarlo.
    570056|00000000||¿Por qué?
    570122|00000000||Porque hay pocas causas que valgan la pena. Y hombres, menos aún.
    570124|00000000||Ya está bien. ¿Podemos cambiar de tema?
    570048|00000000||Sé un poco sobre ese tema.
    570050|00000000||¿Qué quieres decir?
    570052|00000000||Siempre es igual. Intento mantenerme al margen de todo... Hasta que me convocan de forma urgente. Y me hacen una oferta que no puedo rechazar.
    570029|00000000||Sé algo de ese tema...
    575870|00000000||{Tedd a’taeghane, en’ca land n’ees a evelloë saor. Aep Toussaint... } [En estos momentos no conviene que los reinos pequeños sean independientes del todo. Mira a Toussaint...].
    569522|00000000||¿Puedo interrumpir?
    570024|00000000||¿Por qué no te unes a nosotros?
    570026|00000000||Estamos hablando de la neutralidad, de lo difícil que es mantenerla.
    570028|00000000||¿Sí, Geralt?
    570120|00000000||Hablé con el emperador.
    570139|00000000||Hablé con el emperador.
    570141|00000000||Ajá. ¿Por qué te convocó?
    570143|00000000||Así que ni siquiera tú te enteraste.
    570146|00000000||No. Pero supongo que será por un contrato de brujo.
    570148|00000000||Ajá. Unos bobolakos.
    570062|00000000||Adiós.
    570058|00000000||Hasta luego.
    570060|00000000||Sí, hasta pronto.
   1055163|e128b05b||Noble nilfgaardiano
   1047371|00000000||Sí... Ha crecido mucho.
   1047420|00000000||Mira eso... Ya es una adulta.
   1047422|00000000||Han pasado años desde que entrenaron juntos en Kaer Morhen.
   1058728|00000000||Han cambiado muchas cosas.
   1049513|00000000||Pero tú no has cambiado nada.
   1049515|00000000||Extrañaba esos torpes cumplidos tuyos...
   1058726|00000000||Pero centrémonos en Ciri, ¿está bien?
   1047689|00000000||Supongo que tenemos que separarnos de nuevo... No es lo que quiero, pero lo entiendo. El tiempo apremia.
   1047710|00000000||Así es... Podría teletransportarte a Velen. Llegarías allí de inmediato.
   1047712|00000000||Ni hablar. Iré a caballo. Partiré en cuanto me cambie.
   1047714|00000000||Como prefieras. Ah, y... déjame decirte que el terciopelo negro te favorece.
   1047716|00000000||¿Tú crees? Quizá podría forrar parte de mi armadura con él... Buena suerte, Yen.
   1047722|00000000||Igualmente. Y si deseas saber todo lo que ocurrió mientras Vesemir y tú deambulaban por ahí, habla con el embajador var Attre. Es aquel de allí.
   1049543|00000000||Geralt, sé que estamos en guerra, pero no intentes hacerte el héroe, ¿de acuerdo? Comprueba esas pistas y ven a verme. Sin un rasguño.
   1065014|00000000||Te estaré esperando.
   1047686|00000000||Es hora de irse.
   1047687|00000000||Antes de irnos... ¿Por qué no me contactaste antes?
   1047691|00000000||Antes de que me vaya... ¿Por qué no me buscaste? ¿No me necesitabas? ¿Ni siquiera querías verme?
   1047693|00000000||No quería estropear las cosas. Me dijeron que Triss y tú hacían buena pareja.
   1047704|00000000||Yen... Había perdido la memoria.
   1048306|00000000||¿En serio? ¿Esa es tu excusa?
   1047706|00000000||Dejémoslo, ¿está bien? "No es lo que crees" o "Me ayudó a darme cuenta de lo mucho que te quiero"... No quiero oír nada semejante.
   1047652|00000000||¿Dónde han visto a Ciri exactamente?
   1047654|00000000||En dos lugares. Velen y Novigrado.
   1047656|00000000||El rastro de Velen es más prometedor. Deberías ir primero allí. Pregunta por un mercader llamado Hendrik en la Posada de la Encrucijada. Es uno de los agentes del emperador, debería ponerse en contacto contigo.
   1047658|00000000||¿Ya está? ¿No hay que usar contraseñas ni estrechar manos de forma secreta?
   1047660|00000000||No. Siento arruinar tu diversión y todas esas fantasías infantiles sobre el arte del espionaje.
   1047662|00000000||Lo único que tenemos en Novigrado son informes no confirmados, rumores... Pero allí contarás con la ayuda de nuestra conocida.
   1058730|00000000||Triss Merigold. Según dicen, tiene una acogedora vivienda en la plaza mayor.
   1047664|00000000||Seguro que estará encantada de verme... ¿Y tú? ¿Qué harás?
   1047666|00000000||Navegaré hacia Skellige. Hace poco se produjo allí una explosión que arrasó medio bosque. Creo que tuvo algo que ver con Ciri. Estaré en Kaer Trolde. Ven a verme cuando averigües algo.
   1047626|00000000||¿Dónde han visto a Ciri?
   1047435|00000000||¿Qué quiere de Ciri la Cacería salvaje?
   1047628|00000000||¿Qué podría querer de Ciri la Cacería salvaje?
   1047630|00000000||No tengo ni idea, Geralt. Les habría escrito para preguntarles, pero no sé su dirección.
   1047635|00000000||Sé lo mismo que tú. Debe ser por su sangre. Su... don.
   1047638|00000000||Respecto a lo que la Cacería quiere hacer con ese don, prefiero no imaginármelo, la verdad.
   1047432|00000000||De acuerdo... Emhyr dijo que la Cacería salvaje va tras ella. Hasta lo de ayer, me habría costado mucho creerlo. ¿Cómo nos localizaron?
   1047440|00000000||Por mi culpa. Mira, hace meses que busco a Ciri. He usado hechizos de localización, aruspicina, geomancia, de todo. Sabía que la Cacería podría sentirlo, e incluso encontrarme, pero creí que los había engañado.
   1047442|00000000||Parece que te equivocaste.
   1047623|00000000||Ajá. Hace tiempo que siento que me pisan los talones... De no ser por ti y los soldados de Emhyr, ya habrían conseguido lo que querían.
   1049521|00000000||No puedo arriesgarme a sufrir otro encuentro. Es hora de dejar a un lado la magia y recurrir a métodos más tradicionales... Al mejor rastreador que conozco.
   1049529|00000000||Geralt, tienes que encontrarla antes que la Cacería salvaje.
   1047373|00000000||Mmm, ¿ahora son "nuestros" agentes? Vaya, vaya, qué rápido te has adaptado.
   1047375|00000000||Geralt, no tergiverses mis palabras.
   1047418|00000000||Sé quién es Emhyr. Él empezó esta guerra y el derrame de sangre. Mandó a asesinar a mis amigas. Pero no tengo otra opción, así que por favor... deja de fustigarme y céntrate en encontrar a Ciri. ¿De acuerdo?
   1047370|00000000||¿Ahora son nuestros agentes?
   1047264|00000000||¡Geralt! Esa túnica... te queda fantástica...
   1047358|00000000||Uf, me muero por quitármela.
   1049500|00000000||En otras circunstancias lo consideraría una proposición, e incluso consideraría aceptarla. Pero tenemos asuntos de los que ocuparnos.
   1047361|00000000||¿Entiendes ahora por qué estoy en la corte de Emhyr?
   1047363|00000000||Ajá. Y parece que ahora estamos en la misma situación.
   1047366|00000000||Ciri... ¿De verdad ha vuelto? ¿No será un error?
   1047368|00000000||Mira... Este es más o menos el aspecto que tiene ahora, o al menos eso dicen nuestros agentes. Nuestra brujita se ha convertido en una joven dama.
    569369|00000000||Hemos llegado.
    454415|00000000||En cuanto entremos, no habrá forma de regresar hasta que encontremos a Ge'els. ¿Listo?
    584738|00000000||¿Un portal aquí?
    584744|00000000||¿Un portal aquí?
    586024|00000000||Este pasadizo ha existido desde la Conjunción de las esferas. Y seguirá existiendo y abriéndose de cuando en cuando, mucho después de tu muerte.
    584746|00000000||Hace varios siglos, aquí había un templo en honor a la luna. Y antes de eso se alzaba un círculo de menhires. Ahora hay una ciudad.
    584748|00000000||Construyes sobre las ruinas de lugares sagrados, sobre intersecciones del Poder. Y después olvidas el motivo. Pero la magia antigua de estos lugares persiste.
   1009438|00000000||¿Ha quedado satisfecha tu curiosidad? ¿Ya estás listo?
    454417|00000000||Vamos.
    454421|00000000||Sí, vamos.
    536464|00000000||Independientemente de donde termines, busca un lugar que se parezca a este. Tarde o temprano nos encontraremos.
    536466|00000000||¿Quieres decir que nos separaremos?
    584740|00000000||Es posible. Carezco del talento de tu pupila. Zireael es la Dama del espacio y el tiempo. Yo simplemente sé usar este conocimiento arcano hasta cierto punto.
    584753|00000000||Es hora.
   1063659|00000000||Odio los portales.
   1024688|00000000||El pasadizo está aquí, más allá del muro.
    536475|00000000||Espérame un minuto.
    454425|00000000||Te recuerdo que tenemos algo que hacer. Date prisa.
   1027690|00000000||Aquí está
    569851|00000000||El caballero se dirigirá al emperador solo cuando le pregunte algo, y usará el título correspondiente.
    569478|00000000||¿Su Archimagnificencia?
    569479|00000000||Veo que el caballero está de humor para bromas... Pero dudo que el emperador lo esté.
   1047305|00000000||Será suficiente con "Su Majestad". Dicho en voz alta, clara y respetuosa.
    569856|00000000||Deithwen Addan yn Carn aep Morvudd. Ese es el título completo de nuestro gentil gobernante.
    569858|00000000||Pero al emperador no le gusta escuchar cómo destrozan nuestro idioma. Así que, en su caso, bastará con un "Su Majestad".
    569773|00000000||Un poco justo de cintura... Pero servirá.
    569771|00000000||Y dicen que el hábito no hace al monje.
    569404|00000000||No soy ningún patán. Sé hacer una reverencia.
    569407|00000000||No soy ningún patán. Sé hacer una reverencia.
    569408|00000000||Demuéstremelo, por favor.
    569763|00000000||Así, señor, es como se hace una reverencia a una ramera en la calle, no al emperador de Nilfgaard.
    569472|00000000||Esto es ridículo.
    569473|00000000||¿Me tomas el pelo?
    569474|00000000||En absoluto. No puedo hablar más en serio.
    569843|00000000||¿Conoce el caballero el castigo por infringir las normas de etiqueta ante el emperador? Doscientos latigazos.
    569845|00000000||No deseo que sobre él caiga tal castigo. Por eso no lo dejaré marchar hasta estar seguro de que sabe comportarse.
    569468|00000000||Mmm, falta fluidez y elegancia... Pero tampoco podemos esperar mucho de los norteños.
    569469|00000000||Venga conmigo.
    569459|00000000||[Pierna izquierda adelante, mano derecha en el pecho].
    569465|00000000||Por favor, no es el momento ni el lugar para payasadas.
    569836|00000000||Caballero, preste atención.
    569461|00000000||[Pierna izquierda atrás, manos a los lados].
    569460|00000000||[Pierna derecha adelante, mano izquierda en el pecho].
    569463|00000000||Mal, mal, mal.
    569832|00000000||Otra vez.
    569470|00000000||Adelante la pierna, apoye la mano en el pecho, baje la barbilla.
    569471|00000000||El caballero tiene que ensayar.
    569451|00000000||Fíjese bien, por favor.
    569405|00000000||Asegúrate.
    569403|00000000||Asegúrate.
    569397|00000000||Un jubón tachonado y una espada a mi espalda, eso me dejaría satisfecho. Pero bueno, cuando vas a Nilfgaard...
    569751|00000000||¿Sí?
    569753|00000000||Es un dicho. ¿Y ahora qué? ¿Empolvarme la nariz?
    569755|00000000||No hace falta. La tez del caballero ya es bastante pálida.
    569757|00000000||El caballero va a presentarse ante el Gobernante del Norte y el Sur... Tengo que asegurarme de que sabe cómo hacer una reverencia.
    569393|00000000||Supongo.
    569395|00000000||Voy a probar otra cosa.
    569396|00000000||Adelante. Tenemos tiempo.
    569394|00000000||Voy a probar otra cosa.
    569775|00000000||¿Está satisfecho el caballero con su atuendo?
    569769|00000000||El negro le queda bien al caballero.
    569686|00000000||Puede que esto sorprenda al caballero, pero llevar una toalla enrollada a la cintura no es muy adecuado para una audiencia.
    569767|00000000||Caballero, vístase, por favor.
    578772|00000000||Creo que el caballero se olvida de algo.
