;meta[language=it]
    422578|00000000||Beh... Birra, idromele e liquori forti. Cosa ti aspetti in una taverna? Il salto della corda?
    437354|00000000||Non so da dove vieni, ma suppongo da lontano.
    422592|00000000||Fammi vedere che cos'hai.
    422582|00000000||Che cos'hai?
   1028778|00000000||Che ne dici di una partitina a gwent?
   1028777|00000000||Ho voglia di una partita a carte.
    422594|00000000||Stammi bene.
    422586|00000000||Addio.
    422584|00000000||Cosa puoi dirmi sul clan Brokvar?
    422588|00000000||Cosa puoi dirmi sul clan Brokvar?
    422590|00000000||Noi Brokvar siamo i signori del mare, nati e cresciuti per domare le acque.
    437779|00000000||Pensavo che tutti a Skellige trascorressero molto tempo in mare.
    437781|00000000||Ahahah, ne sono convinti, certo. Ma tutto ciò che fanno è veleggiare sulle loro navi, avvolti in pellicce e giubbe pesanti.
    437783|00000000||Di tanto in tanto, il vento gli soffia in faccia gli schizzi sollevati dai remi... Questo è il loro unico contatto con l'acqua. I nostri ragazzi, invece, si tuffano dalle scogliere nelle profondità marine non appena imparano a camminare.
    422580|00000000||Ehi... Scegli la tua bevanda e non fare scherzi.
    510503|00000000||Svegliati, Geralt! Mi senti?
    510505|00000000||Non posso... Sono morto! Mi hanno ucciso!
    509977|00000000||Quell'ago era intinto in una tossina. Ti sei punto quando hai provato ad aprire la porta.
    510508|00000000||Devi riprenderti. Non abbiamo tempo da perdere.
    520742|00000000||Non lo racconteremo a nessuno.
    520752|00000000||Ti dispiace non farne parola con nessuno?
    520754|00000000||Ovvio.
    520756|00000000||La porta è aperta. Procederemo non appena avrai raccolto i trofei dalle tue vittime.
    520744|00000000||Dovevo essere ridicolo.
    520746|00000000||Gli anni di duro addestramento a Kaer Morhen sono serviti a qualcosa. Hai sconfitto quasi tutti gli animali impagliati!
    520748|00000000||Ti prego...
    520750|00000000||Va bene. Abbiamo superato l'esame di tassidermia. Ora la porta è aperta.
    520741|00000000||Chissà che scena.
    508710|00000000||Che succede?
    506676|00000000||Avevi le allucinazioni. Ti sei lanciato contro gli animali di Ermellino agitando la spada. Ho dovuto calmarti.
    442702|00000000||Un fantasma! Moriremo tutti!
    442704|00000000||Stupida donna! Hai mai sentito di un fantasma che cammina così rumorosamente, trascinando i piedi? È un uomo, in carne e ossa. Solo, che cosa ci fa qui?
    442706|00000000||Sto esplorando la galleria sull'altro lato della collina.
   1045521|00000000||Salute a te.
   1045523|00000000||E anche a te.
   1045519|00000000||D'accordo, vedrò cosa posso fare per i fantasmi.
   1045507|00000000||Vi aiuterò.
   1045511|00000000||Arrivederci.
   1045509|00000000||Arrivederci.
   1045508|00000000||È fatta. I fantasmi non ci sono più.
   1045517|00000000||I fantasmi sono sistemati. La cripta è sicura.
   1045513|00000000||Grazie per il tuo aiuto, capelli bianchi.
   1045515|00000000||Offriremo un sacrificio a Freya in tuo nome.
    456323|00000000||Ho incontrato alcuni mostri là sotto. Li ho già eliminati.
    456325|00000000||Cosa ci fate qui?
    442710|00000000||Siamo venute a tagliare le unghie.
    442712|00000000||Le unghie?
    442714|00000000||Dei cadaveri. Non lo sai? I wraith usano le unghie per costruire la loro nave maledetta.
    449943|00000000||Quindi, speravi di sottrargli i materiali...
   1045506|00000000||Esatto, se solo potessimo scendere nelle cripte... Ma ci sono dei fantasmi lì. Ti occuperesti di loro?
   1045486|00000000||Che cosa vuoi?
   1045488|00000000||Hai intenzione di entrare nelle cripte?
   1045490|00000000||Forse...
   1045476|00000000||L'uomo dai capelli bianchi... Mi chiedo chi sia...
   1045478|00000000||Un guerriero, è evidente. Ci mancava solo questa...
   1050602|00000000||Vieni qui, viandante!
   1045482|00000000||Ripulisci le cripte soltanto dai mostri, o anche dai tesori...?
   1045484|00000000||Con occhi del genere, non mi stupisce che giri per le cripte... Il sole deve accecarlo.
   1024935|00000000||Ho saputo che Ynge la Grigia ha predetto il futuro di tuo figlio, eh?
   1049934|00000000||Già! Ha gettato il suo cordone ombelicale in acqua... e si è arrotolato come un serpente! Sapete cosa significa?
   1049936|00000000||Che... sarà veloce come una vipera?
   1049938|00000000||O che scivolerà via da ogni trappola?
   1049940|00000000||No, era qualcosa di diverso... Ma preferisco le vostre interpretazioni! Alla volta salute, indovini!
    582853|00000000||Temevo che questo momento non sarebbe mai arrivato. Che suo fratello avrebbe vinto, e che saremmo stati perduti.
    582855|00000000||Entrambi sono del clan degli an Craite.
    582857|00000000||Ma Hjalmar è pazzo, come me quando ero posseduto dall'hym.
    582859|00000000||È coraggioso quanto Cerys, ma lei ha qualcosa in più: è saggia e astuta.
    582861|00000000||È andata bene.
    434488|00000000||Il giovane an Craite sul trono. È come affidare il timone a un ubriacone. Pessima idea.
    434490|00000000||Il destino ha voluto così. Non sta a noi giudicare.
    439683|00000000||Me ne fotto del destino! Parliamo delle Isole, non di una spada in uno stagno!
   1050105|00000000||Devo ammetterlo, non pensavo che potessi aiutarci...
    422532|00000000||Salve. Vuoi dare un'occhiata alla merce?
    422534|00000000||È tutto in vendita?
    422536|00000000||Certo, se puoi permettertelo... Lo jarl ama la qualità, perciò non vendiamo spazzatura qui.
    422538|00000000||Lo vedo... Zefhar zerrikaniani, asce da guerra di Mahakam, spade corte di Viroledo... Dove hai trovato tante armi del Continente?
    434397|00000000||Le ha portate il mare.
    434401|00000000||E se non ci pensa lui, mozzi le mani che impugnano le spade in una stretta mortale?
    434431|00000000||Ahahah! Credi che le abbia raccolte sulla spiaggia, come le conchiglie con la bassa marea?
    422552|00000000||Mostrami cos'hai.
    422476|00000000||Fammi vedere che cos'hai.
    422554|00000000||Puoi realizzare qualcosa per me?
    422478|00000000||Vorrei che realizzassi qualcosa per me.
   1086488|00000000||Che ne dici di una partita a gwent?
    422556|00000000||Arrivederci.
    422482|00000000||Addio.
    422480|00000000||Che altro hai riportato dai saccheggi?
    422542|00000000||Che altro hai riportato dai saccheggi?
    422550|00000000||Ci concentriamo sull'essenziale... Vini di qualità, sete e ninnoli di ogni genere.
    434541|00000000||Oh, e sgualdrine. Se non ne facciamo buon uso noi, chi altro lo farà?
    436842|00000000||Hai sentito parlare di Hulda l'Urlatrice, nota come l'Infernale, la moglie di Lugos il Pazzo? O di Sanza Riccioli d'oro, la più bella fanciulla dei suoi tempi? Prese durante i saccheggi, entrambe!
    422540|00000000||Cerchi qualcosa di particolare?
    573092|00000000||Non c'è vergogna nel perdere contro uno di Skellige. Noi cavalchiamo i cavalli come cavalchiamo le onde... Calmi e lisci come la crema sul burro.
    573088|00000000||E il vincitore è... il witcher Geralt di Rivia!
   1049125|00000000||Una simile impresa merita una ricompensa. Tieni... a ricordo della tua gloria.
    583798|00000000||Beh... Non mi aspettavo che un forestiero vincesse tutte e tre le gare. Ti resta un solo Inseguimento... Il più importante. Affronterai un vero maestro della corsa. È a Hindarsfjall. Ti consiglio di metterti in viaggio.
   1024495|00000000||Ci vuole ancora molto?
   1024497|00000000||Se hai intenzione di stare lì alle mie spalle a guardare, sì, ci vorrà moltissimo.
   1024499|00000000||Non è il momento di essere suscettibili, Vilmar. Larve e curculioni hanno infestato tutti i pini di Spikeroog, e questo...
   1024501|00000000||Questo significa che ci serve del pesticida, lo so. Ma questo non è buon motivo per appestarmi.
    382182|00000000||Grazie. Stammi bene.
    382184|00000000||Buona fortuna con la tua ricerca!
    430789|00000000||Sto cercando Cerys.
    430791|00000000||Quella ragazzina tutta ossa? Ha occhi da cerbiatta, certo, e viene da un casato prestigioso. Ma è magra come un chiodo!
    382177|00000000||Non so dove sia, e suo padre...
    500841|00000000||Di' al vecchio Crach di darsi una calmata. Nessuna ragazza di Skellige può morire nelle sue stesse isole!
    382180|00000000||Era qui poche ore fa. È andata a cercare mio marito, Eiric. Ha detto che voleva parlargli. Li troverai sulla spiaggia, dall'altra parte dell'isola.
    382171|00000000||Sto cercando Cerys.
    382173|00000000||Belle, dici? Posso incontrarle?
    382200|00000000||Hai detto belle ragazze? Dove? Magari qualcuna sarebbe disposta a mostrarmi l'isola...?
    382202|00000000||Be', c'è Veya. Bella ragazza, figlia del bottaio. A pensarci bene però... Ha i denti storti come ami!
    382281|00000000||Poi c'è Debora, molto carina, denti dritti... Però ha un bozzo sotto l'occhio destro.
    382283|00000000||Hmm... Maya ha un faccino da sogno! Se non fosse per il piede destro deforme...
    382293|00000000||Accidenti! Ora che mi ci fai pensare, nessuna delle nostre ragazze è davvero attraente...
    347491|00000000||Salve. Sto cercando una ragazza.
    347493|00000000||Sei fortunato, allora! Io sono già impegnata, ma il villaggio pullula di belle fanciulle!
    379646|00000000||Sto cercando gli uomini di Undvik.
    424333|00000000||Javor è dell'isola. E un tempo io navigavo queste acque senza un attimo di riposo. Potrei trovare la costa a occhi chiusi.
    521956|00000000||Un'escursione incantevole, se non fosse per le dannate sirene...
    521934|00000000||Sono io l'uomo giusto! Io o Axel an Tordarroch. È quello laggiù. Cosa vuoi che ne sappia un idiota di Ard Skellig di Undvik...?
    521945|00000000||Non dicevi così mentre Hjalmar radunava la sua ciurma... Il tuo amore per gli an Craite è così volubile?
    521964|00000000||Mmmh...
    381077|00000000||Devo raggiungere Undvik.
    412649|00000000||Un altro in cerca di emozioni... Beh, allora ascoltami bene, a meno che tu non voglia morire in mare.
    381079|00000000||Salpa dal porto e dirigiti a sud-ovest. Fai attenzione alle rocce che affiorano come cazzi dall'acqua... Dovrai manovrare con prontezza per superarle.
    422219|00000000||Alcune rocce sono più corte, appena sotto la superficie, perciò fai attenzione a non incagliarti. Ti sfonderebbero lo scafo e saresti spacciato. In pochi minuti, l'acqua ghiacciata ti ucciderebbe. Una volta, io...
    422221|00000000||Non divagare.
    417784|00000000||Oh... Ehm, d'accordo. Fai attenzione alle correnti, perché possono trascinarti fuori rotta o persino sbatterti contro le rocce. Con un po' di fortuna, approderai sulla stessa spiaggia di Hjalmar.
    417994|00000000||Devo raggiungere Undvik.
    426331|00000000||Hai parlato di sirene... Ce ne sono molte a Undvik?
    426333|00000000||Molte... Moltisssime... Più che sulle altre isole...
    521985|00000000||Stronzate...
    424327|00000000||Una volta, hanno attaccato Lars e me mentre eravamo a pesca... Prima che potessimo scacciarle, hanno tirato Lars in acqua e mi hanno graffiato al punto che... Oh...
    424323|00000000||Scacciare le sirene? Come funziona?
    521987|00000000||Ah ah ah! Si vede che non sei dell'isola! Con un corno di cornomarino. Basta un suono e scappano via così in fretta da scuotere la barca con le loro onde!
    418059|00000000||Hai parlato di sirene...
    380739|00000000||È stato un piacere parlare con te, ma ora devo andare. Arrivederci.
    415193|00000000||Che i venti ti siano propizi!
    417999|00000000||Devo andare.
    417996|00000000||Perché non sei andato con Hjalmar?
    391938|00000000||Javor è di lì... O almeno sostiene... E tu sembri conoscere queste acque... Perché non siete andati con Hjalmar?
    391940|00000000||Perché quel genere di spedizione richiede un vero comandante. E un cucciolo in cerca di bernoccoli sul cranio non può che finire in rovina. Una volta, io...
    391942|00000000||Preferiresti restare qui seduto col naso in aria, principessa zerrikaniana? Quando arriva un uomo coraggioso, si va con lui!
    424339|00000000||Sarei andato con Hjalmar, se solo quelle puttane marine non mi avessero rotto il ginocchio. Preferirei navigare piuttosto che condividere il tavolo con un vecchio stizzito come te...
    522165|00000000||Preferiresti navigare con chiunque ti prenda a bordo... Figlia di Crach inclusa.
    413885|00000000||Il vento ti ha riportato qui, eh?
   1023194|00000000||La fioritura è in ritardo. E ci sono poche api...
   1023196|00000000||Questo inverno ci sono state forti gelate. Metà degli alveari di Spikeroog non è sopravvissuto fino al disgelo.
   1023198|00000000||Credi che il Bianco Gelo sia vicino? Che le profezie siano vere?
   1023200|00000000||Difficile dirlo. Ma una cosa è sicura... Ogni anno, la primavera arriva sempre più tardi.
    582960|00000000||Ci mancava una ragazzina!
    582962|00000000||Quando Nilfgaard colpirà, lei se la darà a gambe. Non avremo gloria né bottino!
    582964|00000000||Suo fratello, lui sì che dovrebbe portare la corona.
    582989|00000000||Aspettavo questo giorno.
    582991|00000000||Hjalmar non parla a vanvera. Colpiremo Nilfgaard prima della prossima luna.
    582992|00000000||Saranno nemici agguerriti, così si dice.
    582993|00000000||Gloria a colui che li sconfiggerà. I poeti canteranno le sue gesta, rendendolo immortale.
    158473|00000000||Andatevene da qui! Quel figlio di puttana è mio!
    158475|00000000||Taci, idiota...
    501349|00000000||Quando ti hanno parlato gli dèi? Subito dopo la mia partenza?
    501355|00000000||Poco dopo. Mi è venuto sonno, così mi sono sdraiato. È stato allora che mi hanno rivelato la loro volontà.
    501357|00000000||Ti parlano soltanto quando dormi?
    501373|00000000||Esatto.
    501375|00000000||Che cosa vedi? Provano a condurti in un luogo specifico?
    501379|00000000||Nella mia vecchia casa. Mi ordinano di accendere le torce e poi mi parlano dall'oscurità.
    493286|00000000||Quando ti hanno parlato gli dèi?
    493285|00000000||Cosa ti hanno detto gli dèi, con esattezza?
    493288|00000000||Cosa volevano gli dèi? Ricordi con esattezza che parole hanno usato?
    493289|00000000||Erano furibondi!
    493294|00000000||Una voce ha detto: "Miserabile codardo! Non hai salvato Aki e non sei nemmeno andato a chiedergli perdono!"
    493292|00000000||"Cavati un occhio. Soffri, e rimpiangi il male che hai causato."
    488309|00000000||Che cosa gli prende?
    488311|00000000||Possiamo parlare in privato?
    488313|00000000||Nella stanza degli ospiti. Vieni.
    488266|00000000||Ho restituito la spada, ma non è cambiato nulla. Non è il fantasma di suo fratello a torturarlo.
    501459|00000000||Cerys, dobbiamo parlare.
    501396|00000000||Gli dèi parlano dall'oscurità, hai detto. Per questo non vuoi luce qui?
    501399|00000000||Nei miei sogni a volte vedo la loro forma! Quando le torce si accendono...
    501423|00000000||Vedere gli dèi è un immenso onore. Forse con un po' più di luce potrebbero mostrarsi a te anche da sveglio!
    501424|00000000||I mortali non ne sono degni, non possono vedere i volti divini.
    501390|00000000||Agli dèi non piace la luce?
    501426|00000000||Gli dèi ti chiedono sempre di offrire loro la tua sofferenza?
    501428|00000000||Solo questo li appaga! Ne chiedono sempre di più...
    501391|00000000||Chiedono sempre il dolore come offerta?
    501394|00000000||Li hai mai visti?
    501445|00000000||Gli dèi si mostrano mai nella loro forma? O sono soltanto ombre?
    501446|00000000||Una volta mi sono fatto forza, ho raccolto il mio coraggio e nel sogno ho acceso una torcia. Così ho visto una figura confusa, seduta nell'oscurità.
    488240|00000000||Perché l'hai fatto?
    488243|00000000||Era... Il volere degli dèi. Un sacrificio, per Aki!
    485895|00000000||Che succede?
    485896|00000000||Udalryk! Le voci gli hanno ordinato di cavarsi un occhio!
    488209|00000000||Che cosa?
   1024524|00000000||Ehi, queste aringhe puzzano terribilmente!
   1024525|00000000||Eh eh eh... Se ti dà fastidio, perché sei diventato un pescatore?
   1024527|00000000||Mio padre pescava, come anche suo padre e il padre di suo padre... È successo e basta.
   1024528|00000000||Beh, io non ho questo tipo di tradizione di famiglia, ma so una cosa... Solo i pesci morti seguono la corrente.
    330618|00000000||Qui. Idromele corretto con qualche tipo di fungo... e... sangue umano?
    585630|00000000||Cerys!
    575324|00000000||Nessun altro? Che c'è, avete tutti paura? Non c'è niente da temere! Le ossa guariscono e la pelle si cicatrizza!
    575326|00000000||Ricordi l'anno scorso? Quando Yove e il suo cavallo sono volati giù da quel dirupo?
    575327|00000000||Sì, sì... Il ragazzo è morto giovane. Ma è stata una bella gara.
    575329|00000000||Afferrate le briglie e tenetevi alla sella!
    575332|00000000||Partite! Per Freya!
    575336|00000000||Nessuno può superare Osvald lo Svelto!
    575334|00000000||Tieniti a distanza, vagabondo!
    575338|00000000||Ah ah ah! Ho vinto!
    575340|00000000||Ah-aaah! Di nuovo primo!
    575406|00000000||Dannazione!
    457320|00000000||Orribile... Tutti quei morti... Il fiore della gioventù di Skellige.
    587987|00000000||Ti ho già detto come la penso.
   1028786|00000000||Che ne dici di prenderti una pausa dalle vendite e giocare a carte?
   1028785|00000000||Che ne dici di una partita a carte?
    421280|00000000||Arrivederci.
    421276|00000000||Addio.
    421274|00000000||Vediamo che cos'hai.
    421278|00000000||Mostrami le tue merci.
    421272|00000000||Salve. Sei fortunato... Proprio ieri è approdata la nave di Ejlof Raptus, quindi abbiamo merci fresche.
    582896|00000000||Bene, la ragazza ha dato una lezione a tutti!
    582898|00000000||Lunga vita alla Regina Cerys!
    582900|00000000||Che una balena m'inghiotta se non sarà un buon re!
    582902|00000000||Lunga vita a Re Hjalmar!
   1070690|00000000||Che sta succedendo qui?
   1025592|00000000||Urgh, puzza di carogne... Necrofagi?
   1025599|00000000||Tracce di sirena... Una sirena bella grossa.
   1025609|00000000||Strano colore di scaglie... Non è una sirena qualsiasi.
   1025612|00000000||Mmmh, un'ekhidna...
   1042144|00000000||I drowner non avrebbero potuto sollevare in aria Nils...
   1053430|00000000||Alcune scaglie sull'altare...
   1053441|00000000||Il culto di Melusine non è apparso dal nulla... L'ekhidna vive qui da parecchio.
   1053443|00000000||Dev'essere andata in letargo tempo fa, ma ora si è svegliata. E ha fame.
   1053516|00000000||Devo esplorare le caverne di cui mi ha parlato Britt.
   1053437|00000000||Melusine, la folle e pericolosa signora delle profondità...
   1054024|00000000||Ovviamente, un tempo veniva venerata qui...
   1042996|00000000||Quindi ora Hjalmar attaccherà gli Oscuri...
   1042998|00000000||Svanrige è figlio di Bran, non avrà pietà degli Oscuri!
   1043000|00000000||Gli Oscuri non sarebbero a Undvik se avessimo un uomo sul trono, come dovremmo.
    395577|00000000||Ma guarda!
    395579|00000000||{Tossisce}
   1042994|00000000||Sei venuto nelle nostre isole e ci hai salvato dal gigante.
    395571|00000000||Un nuovo arrivato!
    395575|00000000||Sei un vagabondo?
    395573|00000000||Dove sei diretto?
    395581|00000000||Qualcuno mi aiuti!
    395585|00000000||Non voglio morire!
    395583|00000000||Aiuto!
    537074|00000000||Oh, quante volte il mare mi ha inzuppato e mi ha congelato fino al midollo...
    540209|00000000||È stato lo jarl a farsela!
    540211|00000000||Hanno razziato il villaggio e stuprato le nostre donne. E Holger era fra loro!
    540215|00000000||Te lo dico io: ha perso l'occhio in una rissa, non durante un saccheggio.
    540213|00000000||Davvero? Davvero?!?
    540217|00000000||Non so più cosa pensare...
    540509|00000000||Pensi di poterne uscire?
    540511|00000000||Sì, certo.
    537076|00000000||Gli dèi siano con te.
    537078|00000000||Fai attenzione.
    537080|00000000||Che mio figlio abbia fama e gloria.
    537082|00000000||Cos'hai lì?
   1009981|00000000||Cerys...
   1038759|00000000||Fai qualcosa per quella torre. Contiamo su di te!
   1044172|00000000||Allora, che succede?
   1038626|00000000||Vedi quella collina? Quella là! Per secoli è rimasta libera, poi un giorno ci siamo svegliati e... bam! C'era una torre in cima!
   1038630|00000000||Poi all'improvviso hanno iniziato a cadere fulmini, come se stesse arrivando la Naglfar! E continua così tutt'ora.
   1038632|00000000||Bisogna fare qualcosa per quella tempesta! Con onde del genere non possiamo pescare né fare razzie.
   1018577|00000000||Che Hemdall ti guidi.
   1044174|00000000||Una volta dentro, vedi se trovi gli abitanti del villaggio che ci si erano avventurati: un druido e cinque ragazzi. Sarebbe una disgrazia perderli.
   1044176|00000000||Hai la mia parola.
   1018575|00000000||Bene. Indagherò sulla torre.
   1018572|00000000||Va bene, andrò a controllare.
   1041584|00000000||Qualcuno ha provato a entrare nella torre?
   1041586|00000000||Se ci abbiamo provato? Fin dal primo giorno. Ci siamo andati tutti noi del villaggio, e non solo.
   1041594|00000000||La gente voleva dare il benvenuto al proprietario nel caso fosse venuto in pace, o cacciarlo se avesse avuto cattive intenzioni.
   1041588|00000000||Abbiamo bussato, ma non ha risposto nessuno. Così abbiamo aperto la porta e... Le nostre gambe sono diventate di gelatina!
   1041590|00000000||Perché?
   1041592|00000000||Perché dietro la porta c'era come... uno specchio d'acqua che si reggeva da solo in verticale. Mai visto niente del genere in vita mia!
   1041596|00000000||Il druido ha detto che era magia. È entrato con cinque coraggiosi ragazzi. Nessuno li ha più visti.
   1041566|00000000||Qualcuno è entrato nella torre?
   1030796|00000000||Le torri magiche non sono roba mia.
   1030798|00000000||Pensaci, per favore. Non sappiamo a chi altro chiedere.
   1018573|00000000||Mi dispiace, non mi interessa
   1040296|00000000||Qual è il problema?
   1040298|00000000||Puoi ricordarmi qual è il problema?
   1040300|00000000||Sei cieco? Infuria una tempesta con onde alte come case! E lassù cadono fulmini di continuo!
   1041574|00000000||E questo da quando è apparsa quella torre magica. Bisogna fare qualcosa!
   1019449|00000000||Oh, sei tornato. E la torre? Hai combinato qualcosa?
    421324|00000000||Vorrei che realizzassi qualcosa per me...
    459274|00000000||Se hai denaro oltre che desideri, possiamo fare affari.
    421322|00000000||Puoi realizzare qualcosa per me?
   1086485|00000000||Ho proprio voglia di giocare a carte.
    421294|00000000||Arrivederci.
    459272|00000000||Ti auguro vento in poppa e mare calmo!
    421288|00000000||Addio.
    421286|00000000||Mostrami cos'hai.
    421292|00000000||Mostrami cos'hai, allora.
    421290|00000000||Ho di tutto, dai cerchi per botti alle spade.
    499341|00000000||Ma suppongo ti interessino di più le spade.
    587870|00000000||Qualche motivo evidente?
    587876|00000000||Quali erano le sue motivazioni?
    587893|00000000||È ovvio... Ha complottato tutto questo per liberarsi degli altri candidati e, al tempo stesso, diffamare il nostro clan.
    587895|00000000||Se ci fosse riuscita, Svanrige sarebbe rimasto l'unico pretendente al trono di Skellige.
    561384|00000000||Uno scompartimento segreto? Mmmh, forse potrei provare con la chiave di Arnvald?
    561381|00000000||Una lettera. Te l'avevo detto!
    569150|00000000||Lo senti? Il profumo di Birna...
   1070535|00000000||Allora è stata lei…
    569151|00000000||Non mi è mai piaciuto... Terribilmente soffocante. Dovevo immaginarlo che era opera sua.
    587869|00000000||Leggiamo la lettera.
    587902|00000000||Leggi quella lettera.
    587904|00000000||Istruzioni su come correggere l'idromele... Alcune promesse. Ma non ha firma né sigillo.
    589926|00000000||Credi che basterà?
    587908|00000000||Dovremo accontentarci. Non perdiamo altro tempo. Raduniamo gli jarl.
    585852|00000000||Peccato che non vi abbia apposto il suo sigillo ufficiale...
    585850|00000000||Non serve. Guarda... Un capello.
    392737|00000000||O è un impiccione, oppure è sordo...
    393616|00000000||Uccidetelo.
    551415|00000000||Brrr, mi ci vuole una bevuta per scaldarmi le budella.
    550391|00000000||Nel villaggio sulla baia è nata un'agnella con due teste, sei zampe ma una sola fica!
    550393|00000000||Tz...
    550395|00000000||Ho sentito bene? Vuoi ritirarti dagli affari?
    550397|00000000||Il mio maestro dice sempre di non mollare mai incudine e martello.
    551441|00000000||Vento in poppa!
    551443|00000000||Eeeh?
    551452|00000000||Non ho niente da dire...
    551439|00000000||Al tuo servizio.
    551445|00000000||Uno straniero. Molto bene.
    551417|00000000||Alcuni diventano calvi e alcuni grigi.
    551447|00000000||Ehi!
    551449|00000000||Vuoi spaventarci?
    551450|00000000||Per Hemdal! Via!
    576618|00000000||Geralt di Rivia... Ti stavo aspettando.
    576620|00000000||Fagliela vedere, Astrid! Crediamo in te, ragazza!
    576621|00000000||La Vipera ingoierà il Lupo!
    576623|00000000||Forza! Cavalca più veloce del vento e del carro della dea!
    576626|00000000||Sono partiti! Sono partiti!
    576630|00000000||Grrr!
   1063430|00000000||Mantieni le distanze, idiota!
    576628|00000000||Fuori dai piedi! O ti ammazzo!
   1063432|00000000||Ah ah ah! Ho vinto!
    576632|00000000||Ah ah ah! Ho vinto! Per il secondo anno consecutivo!
    481267|00000000||Forza, avvicinati... Non avere paura. Vincerai sicuramente.
    481268|00000000||Tutti sconfiggono Ulle lo Sfortunato. Lo farai anche tu.
    481266|00000000||Oh, un altro... Sei qui per sconfiggere il Fantasma dell'Arena? Prego.
