;meta[language=it]
   1044182|00000000||Mi ha assoldato la gente di qui. Vedi, la tua torre ha scatenato una tremenda tempesta sull'isola.
   1042177|00000000||Siamo a Skellige? Siamo stati teletrasportati? Oh, è peggio di quanto pensassi...
   1042193|00000000||Fammi indovinare: hai perso il controllo del golem. Lui ti ha imprigionato qui e poi mi ha attaccato.
   1039374|00000000||Cielo, no, niente affatto! I golem sono una delle difese della torre. Sono parte della Difesa Regolatrice Magica.
   1042179|00000000||Ti ha imprigionato il golem?
   1042178|00000000||Che succede qui?
   1042181|00000000||Non sono sicuro di seguirti...
   1042213|00000000||Ehm... La torre è dotata di una... ehm... Difesa Regolatrice Magica.
   1042119|00000000||Di che?!
   1042121|00000000||Un sistema di sicurezza, solo che è magico. Solo il proprietario della torre può usarlo. Quando individua un intruso, chiude tutte le stanze e gli impedisce di entrare.
   1042466|00000000||E dato che nessuno di noi è il proprietario della torre, il golem ha attaccato me e rinchiuso te. Come sfuggiamo a questa magia?
   1042486|00000000||Dobbiamo disattivare la Difesa Regolatrice Magica. Il precedente proprietario della torre ha scritto un trattato su come farlo, il "Grimorio Onnipotente di Gottfried".
   1042443|00000000||Dev'esserci una copia nella torre. Devi trovarlo! Con quello potrò superare il sistema di sicurezza, rimandarti a casa e riportare la torre a Kovir.
   1022439|00000000||Trovato il libro?
    410403|00000000||A Skellige un tempo regnavano i giganti,
    410405|00000000||Ma i nostri nonni li uccisero tutti quanti,
    410407|00000000||Ma tra i dirupi di Undvik ne rimase uno,
    410409|00000000||E sotto il suo giogo viveva ognuno.
    410379|00000000||Finché Hjalmar gli spaccò l'enorme cranio,
    410381|00000000||Liberando le isole dal temibile avversario.
    410383|00000000||Finché Hjalmar e Geralt, eroi arditi,
    410385|00000000||Lo uccisero nella sua caverna infreddoliti!
   1017969|00000000||Che problemi ti dava il mio voto?
   1017970|00000000||Non avevo nessuno con cui parlare! Devo forse andare da Gremist ogni volta che voglio chiacchierare?
   1017972|00000000||Oh! Vieni, witcher! Egill ha qualcosa da dire!
   1017973|00000000||Sì! Che sei un impiccione crudele e malvagio!
   1021122|00000000||Allora, witcher...? Aiuterai Egill?
   1017950|00000000||Ho sentito il tuo richiamo.
   1017959|00000000||Sì, ti stavo chiamando. Ringrazio Madre Natura per non avermi privato della voce come ha fatto con altri che conosco...
   1017961|00000000||Vedi, uno di noi... Egill... è diventato muto all'improvviso. Nessun incantesimo o pozione può aiutarlo. Ma si dice che le emozioni e le esperienze forti possano ridare la voce. Così ho pensato che, forse, tu potresti... Ti pagherò, naturalmente! Ti darò un'ottima carta da gwent!
   1021126|00000000||Mi dispiace, non è tra i servizi che offro.
   1021124|00000000||Non sembra un lavoro per me.
   1021123|00000000||Cosa dovrei fare esattamente?
   1021128|00000000||Immagino che potrei provare... Ma non so neanche da dove iniziare. Vuoi che lo... spaventi?
   1021130|00000000||Sì, bene, bene! Dovrebbe funzionare! Spaventalo, irritalo... Fa' come vuoi, basta che non gli provochi danni. Solitamente, Egill passa il tempo vicino alla quercia sacra. Poverino, probabilmente prega per una cura.
   1017932|00000000||Un witcher? Ehi! Vieni qui!
   1017974|00000000||Ah! Senti come grida forte! Ottimo lavoro, witcher! La tua ricompensa, come promesso.
   1021136|00000000||Ma guarda... Barba lunga fino alla cintola... e il senso dell'umorismo di un bambino. Buona fortuna.
   1021132|00000000||Non pensavo che i druidi avessero un tal senso dell'umorismo...
   1021131|00000000||Non mi piace essere preso in giro.
   1021134|00000000||Non mi piace essere preso in giro. Ricordatelo... o la prossima volta sarai tu a restare senza parole.
    433303|00000000||Cercate di sbrigarvi!
    575302|00000000||Mi chiamano "Osvald lo Svelto". Perché sono veloce. Forte, eh?
    575304|00000000||Hai cavalcato bene... Ma questo non è sufficiente a Skellige.
    575307|00000000||Hai superato Osvald lo Svelto... Non sono in molti quelli che possono vantarsene.
   1069984|00000000||Che gli dèi ti benedicano e ti proteggano, Cerys.
   1069986|00000000||Che gli dèi ti benedicano e ti proteggano, Hjalmar.
    492623|00000000||Parlano da un pezzo...
    492624|00000000||Forse ha avuto un altro sogno.
    567937|00000000||Una guardia ha visto cos'è successo. Quelli non erano orsi, erano...
    567938|00000000||Uomini trasformati in orsi.
    588243|00000000||Mmmh... Berserker...
    585675|00000000||Berserker?
    585677|00000000||Berserker?
    585679|00000000||Il nome coniato dai poeti per i guerrieri che si trasformano in animali durante la battaglia.
    588247|00000000||Usciti direttamente da fiabe e leggende... Ma sembra avere senso, giusto?
   1070353|00000000||Mmmh... Quasi. Eravamo a un banchetto, non su un campo di battaglia.
    585674|00000000||Ho una mezza idea di cosa abbia causato la trasformazione.
    588249|00000000||Credo di sapere cos'ha causato la trasformazione... L'idromele che hanno bevuto. Annusa.
    585683|00000000||Idromele corretto con sangue... E qualcos'altro. Credo si tratti di un fungo, ma non ne riconosco il tipo.
    585685|00000000||Hjort potrebbe aiutarci. Pochi druidi conoscono le erbe meglio di lui.
    585687|00000000||Tentare non nuoce.
    350833|00000000||Cos'è successo a tuo padre?
    451777|00000000||Stava tagliando la legna e un orso l'ha attaccato!
    451779|00000000||Mostrami dov'è successo.
    451781|00000000||Laggiù, tra gli alberi!
    345457|00000000||Aaaah! Aiuto!
    345455|00000000||Aaaah!
    470231|0d2919bb||Anziana
   1025930|00000000||Salve.
   1035022|00000000||Per ora è tutto. Grazie dell'aiuto. Ti prometto che li vendicherò.
   1035018|00000000||Non sarà facile per te, ma devo esaminare le ferite.
   1035020|00000000||Almeno tu chiedi il permesso, non come gli altri. Se servirà a uccidere quella bestia... Fai pure.
   1035009|00000000||Devo esaminare le ferite.
   1035008|00000000||Dove sono stati trovati i corpi?
   1035014|00000000||Dove sono stati trovati i corpi?
   1035016|00000000||Nella radura oltre il fiume. I ragazzi adoravano quel posto, fin da quando erano piccoli. Ci andavano a caccia di lepri.
   1035000|00000000||Molto bene. Un altro venuto ad ammirare le vittime del drago. Forse dovrei farmi pagare.
   1035002|00000000||Forse. Ma io non pagherei, vedo già fin troppi cadaveri nel mio lavoro.
   1035005|00000000||Sono un witcher e sono qui per il contratto per il drago.
   1035007|00000000||Perdonami, non avevo idea. Come posso aiutarti?
   1040009|00000000||Ti ho detto tutto. Ti prego, lasciami in pace.
    523562|00000000||Stendilo, Olaf!
    523558|00000000||Così! Bravo!
    523563|00000000||Oh, gli ha appena rotto il grugno!
    523565|00000000||Olaf! Olaf! Olaf!
    523566|00000000||Finiscilo!
    523564|00000000||Aaaaah!
    523567|00000000||L'incontro è concluso! Geralt di Rivia ha vinto! Ammirate il nostro nuovo campione!
    523570|00000000||L'incontro è concluso! Olaf mantiene il suo titolo!
    569130|00000000||Spero proprio che Hjalmar stia facendo qualcosa di utile, e non stia solo cercando di attaccare briga.
   1070358|00000000||Rilassati. Tuo fratello è impulsivo, non stupido.
    376343|00000000||Qualcuno inseguiva Ciri. Vedi? Forse era ferita.
    376345|00000000||È fuggita attraverso un altro portale.
    481141|00000000||Sai dove conduceva?
    481142|00000000||Le tracce lasciate dalla magia indicano... Velen.
    498796|00000000||Hai modo di scoprire dov'è finito il compagno di Ciri? Il suo portale dev'essere qui vicino.
   1063746|00000000||Lo cercherò. Vieni.
    414739|00000000||Splendida lavorazione... Da dove arrivano questi calici?
    414741|00000000||Da un tempio del Fuoco Eterno! C'è più argento lì che nel tesoro di un drago!
    414743|00000000||Quindi, sul Continente erigono templi... Al fuoco?
    414745|00000000||Sì. Non conoscono i veri dèi.
    437793|00000000||E l'acqua? Ha un proprio tabernacolo? E l'aria?
    414747|00000000||Non lo so. Me se ce l'ha, saccheggeremo anche quello!
   1056428|00000000||Se mio nipote verrà nominato re, berremo tutti in coppe d'argento! Porta il calice in giro e dillo agli altri!
    454151|00000000||Se il mio ragazzo verrà nominato re, berremo tutti in coppe d'argento! Porta il calice in giro e dillo agli altri!
    462290|00000000||La porta è chiusa. Apriranno solo quando avrà inizio la veglia per Bran.
   1056506|00000000||È inappropriato lasciare una veglia. Devi brindare con lo jarl in onore del defunto.
   1024999|00000000||Oste! Birra!
   1025001|00000000||Siamo appena tornati da un'incursione e carichi di bottino! Bisogna festeggiare!
   1025003|00000000||E portaci qualcosa da sgranocchiare! Alla svelta!
   1025005|00000000||Questi modi vanno bene per le taverne del Continente, ma ora siete tornati a casa, perciò comportatevi bene!
   1036620|00000000||"Come vivere e morire felici: esegesi moderna di Lebioda". Ma che diavolo ci fa qui?
   1036619|00000000||I grandi maghi di Kovir"
   1036621|00000000||"Grimorio Onnipotente di Gottfried", ci siamo!
   1036618|00000000||"Alchimia per dilemmi di famiglia, volume 3". Non è questo.
   1036617|00000000||"Golemanzia applicata". Devo cercare ancora.
   1036616|00000000||"Intersezioni e linee geomantiche", non è quello che cerco.
    506298|00000000||Questo è il nostro posto.
    506300|00000000||Ho chiesto io di mettervi qui. Volevo incontrare il famoso witcher Geralt.
   1070465|00000000||Ci siamo già incontrati, non ricordi?
   1070467|00000000||È stato anni fa. Hjalmar e io eravamo bambini l'ultima volta che hai fatto visita a nostro padre. Ma... Dovreste conoscere i vostri compagni di banchetto. Lasciate che faccia questi dubbi onori...
    506303|00000000||Quello è Halbjorn, figlio di Holger Manonera... Lugos il Blu, primogenito di Lugos il Pazzo... E quello che sta trangugiando uno stoccafisso è Otrygg an Hindar.
    516438|00000000||Perdonami, ricordo il nostro incontro di anni fa, davvero... Ma non ricordo il tuo nome.
    516440|00000000||Cerys an Craite. Crach... Suo padre... E suo fratello maggiore Hjalmar la chiamano "Aquila". È figlia di uno jarl. Per quel che può servirle...
    516431|00000000||E tu come ti chiami? Perdonami, l'ho dimenticato.
    516432|00000000||Siete tutti figli degli jarl...
    516434|00000000||Sembra che ci abbiano messo esclusivamente con i figli degli jarl...
    516436|00000000||Cerys an Craite è la figlia di uno jarl, Geralt. Le figlie degli jarl non sono certo inferiori ai figli.
   1070596|00000000||Sai che sognano tutti di diventare il successore di Bran. Ma guardali...
    499928|00000000||Cerys è invidiosa, chi di noi compierà l'azione più eclatante verrà incoronato re.
    508457|00000000||Sappiamo che i banchetti sono solo scena. Saranno i nostri padri a decidere chi porterà la corona. Di cosa credi abbiano parlato con Crach?
    508459|00000000||Parli così perché non sei abbastanza forte. Ricordi quando Hjalmar ci ha sfidato a scalare il monte? Non ti sei unita a noi. Quando ha piantato l'ascia in cima per sancire la sua vittoria, ti stavi scaldando le ossa davanti al fuoco!
    516441|00000000||Avevo le mie ragioni per non partecipare. Ma oggi sarei io a vincere.
   1057944|00000000||Mmmh, ora che mi ci fai pensare... Noto che Hjalmar non è qui...
   1057946|00000000||Mio fratello percorre la sua strada.
    508461|00000000||Ma a proposito della corsa... Perché non la ripetiamo? Sono disposta a sfidare chiunque di voi, witcher compreso. Se riuscissi a batterlo, oserei dire che sarebbe una bella impresa, eh? Allora, ci state?
    508463|00000000||Se il witcher è d'accordo.
    508465|00000000||Geralt?
    500673|00000000||La veglia è in pieno svolgimento!
    500674|00000000||Ti ho perso di vista. Chi ha vinto?
    500697|00000000||Ho perso.
    500698|00000000||Con un witcher, Aquila. Sarebbe accaduto a chiunque.
    500694|00000000||Cerys ha dimostrato di essere all'altezza di suo fratello Hjalmar. Ha recuperato l'ascia dalla roccia.
    500695|00000000||Non può essere!
    508497|00000000||Ora capisco perché Hjalmar ti ha soprannominato Aquila!
    501400|00000000||Non so perché hai deviato dal percorso, witcher... Se dovessero chiedermelo, potrei quasi dire che ti sei arreso.
    501401|00000000||Sia come sia, è comunque una scusa per brindare! Crach ha tirato fuori dell'ottimo idromele!
    373774|00000000||No, grazie.
    373786|00000000||Oggi non posso davvero, credetemi.
    373788|00000000||Se non oggi quando allora?!?
    503864|00000000||Siete un'allegra compagnia. Purtroppo però dobbiamo andare.
   1058733|00000000||Davvero...?
   1058735|00000000||Già. Dobbiamo parlare. Ma non qui.
    516651|00000000||Saprai tutto oltre quella porta.
    420437|00000000||Alla mia bellissima amica!
    420413|00000000||Un boccale pieno di idromele per il nostro amico!
    420415|00000000||A Bran! Che trovi nell'aldilà tutto ciò che desidera!
    376355|00000000||A Cerys!
    373772|00000000||Beviamo!
    373770|00000000||Basta blaterare. Beviamo!
    346948|00000000||Grazie dell'offerta, magari un'altra volta.
    346950|00000000||È un peccato.
    346942|00000000||Un'altra volta.
    346940|00000000||Certo. Andiamo!
    499936|00000000||Allora, quali sono le regole?
    499937|00000000||Chi estrarrà l'ascia di Hjalmar piantata in cima alla collina, sarà il vincitore. Chi esce dal percorso stabilito perde.
    499938|00000000||E dire che stavo per vomitare dalla noia! Andiamo!
   1042438|00000000||Finalmente!
   1042446|00000000||Sembrava facile.
   1042448|00000000||Il difficile deve ancora venire. Dobbiamo raggiungere il cuore della torre e lanciare un incantesimo per disattivarla.
   1042545|00000000||La torre farà tutto ciò che è in suo potere per fermarci.
   1042539|00000000||Fammi strada.
   1027459|00000000||Cominciamo.
   1027469|00000000||Dammi un minuto, devo prepararmi.
   1042445|00000000||Certo, ma sbrigati.
   1027460|00000000||Devo prepararmi.
   1027466|00000000||Pronto? Possiamo andare?
   1071221|00000000||Lunga vita a Cerys! Lunga vita alla regina!
   1071227|00000000||Ti seguiremo per sempre! Persino tra le fiamme!
   1071225|00000000||Oscuri, preparatevi! Presto verremo a prendervi!
   1071223|00000000||Lunga vita a Hjalmar! Il nuovo re di Skellige!
    578556|00000000||Non è che giochi a gwent?
    578557|00000000||Certamente! Ho completato il mio primo mazzo... oh, anni fa, a Cintra. Poi ho insegnato le regole a mezza Skellige. Perché me lo chiedi? Vuoi giocare?
    578562|00000000||Sì, lieto di fare una partita.
    578548|00000000||Giochiamo.
    578563|00000000||Un'altra volta, magari.
    578549|00000000||Non ora.
    578560|00000000||Hai tempo per giocare a carte...?
    578561|00000000||No... Ah, al diavolo, giochiamo.
    578547|00000000||Una partita a gwent, magari?
    578565|00000000||Fantastico! Le mie congratulazioni! Hai un buon mazzo, ma una piccola integrazione potrebbe aiutarti...
   1042470|00000000||Tieni, prendi questa carta.
   1042472|00000000||Grazie.
   1076477|00000000||Hai un dono per le carte, devi sfidare Crach. Gli ho dato il mazzo, gli ho spiegato il gioco, ma l'allievo ha presto superato il maestro. C'è anche Gremist... Un caratteraccio, ma indubbiamente dotato.
    578564|00000000||Non abbatterti. Non è una vergogna perdere contro di me.
   1042476|00000000||Se vuoi espandere la tua collezione, gioca con Sjusta... Non ti deluderà. Anche Lugos il Pazzo non avrebbe mai rifiutato una partita. In questo senso, mi manca.
   1042474|00000000||Se vuoi espandere la tua collezione, gioca con Sjusta o Lugos il Pazzo. Quei due non rifiutano mai una partita.
    475415|934cc8af||Oste
    488316|00000000||Allora? Sai di che si tratta?
    488337|00000000||È un hym. Una creatura nata dopo la Congiunzione, molto rara e molto pericolosa. Si accanisce sugli uomini che compiono azioni abiette.
    501977|00000000||Si nutre del loro dolore per anni, alimentando il senso di colpa. Alla fine l'hym costringe le vittime all'automutilazione...
    488399|00000000||È orribile! C'è modo di sconfiggerlo?
    488404|00000000||Ci sono due metodi efficaci, in teoria.
    488462|00000000||Si dice che gli hym possano essere ingannati. Bisogna fingere di aver commesso un'azione infame, per diventare la sua prossima vittima.
    502153|00000000||Quando si rende conto dell'inganno, è costretto ad andarsene.
    502154|00000000||Ottimo! Proviamo!
    502155|00000000||Non conosco nessuno che ci sia riuscito.
    502140|00000000||Forse nessuno è mai stato abbastanza abile.
    488417|00000000||Si può provare a ingannarlo.
    488416|00000000||C'è il metodo dei witcher.
    488431|00000000||Nei bestiari dei witcher si dice che occorre trascorrere una notte nella tana dell'hym. Insieme alla persona in questione.
    488444|00000000||Nella casa infestata, intendi? Non sarà accogliente, ma di sicuro hai dormito in posti peggiori...
    488446|00000000||Non si tratta di dormire. Devi attirare l'hym, costringerlo a uscire dall'ombra, a mostrarsi.
    501980|00000000||Altrimenti è impossibile colpirlo.
    502100|00000000||E di sicuro si difenderà con tutte le sue forze.
    502131|00000000||Hai visto Udalryk. Non sarà uno scontro facile.
    488454|00000000||Qual è l'altro metodo?
    488468|00000000||So che non sei convinto, ma dovremmo almeno tentare di ingannare l'hym.
    488639|00000000||Potrebbe non essere così facile... Del resto, non esiste il metodo perfetto.
    493883|00000000||Che vuoi dire?
    495299|00000000||Hmm... E quanto all'altro metodo?
    493475|00000000||Udalryk potrebbe non sopravvivere un'intera notte nella tana dell'hym.
    494078|00000000||Credi che l'hym proverà a uccidere Udalryk?
    494079|00000000||No. Perderebbe la sua fonte di sostentamento.
    502174|00000000||Ma Udalryk potrebbe non farcela. È debole, e quella casa evocherà molti ricordi dolorosi. Questo per l'hym sarà un vantaggio, invece...
    495297|00000000||Più dolore l'hym infligge a Udalryk, più forte diventa.
    502175|00000000||E più pericoloso sarà per te...
    493344|00000000||Udalryk potrebbe morire.
    494072|00000000||È molto difficile ingannare un hym.
    495302|00000000||L'hym è un demone, e i demoni sono difficili da ingannare. E chi inganna non deve sapere che è un inganno.
    495305|00000000||Cosa?
    495307|00000000||L'hym attacca chi ha la coscienza sporca, chi è convinto di avere commesso un'azione infame. Così si nutre e si rafforza grazie al senso di colpa.
    495308|00000000||Quindi se il potenziale nuovo ospite non prova un sincero pentimento, l'hym se ne accorge.
    495319|00000000||Capisco. Quindi se uno di noi due ha un'idea, non deve rivelarla.
    505472|00000000||Esatto.
    495326|00000000||Entrambi i metodi sembrano rischiosi, ma io propendo per l'inganno.
    495329|00000000||Non sono convinto.
    495398|00000000||Dimmi che non devi chiedere il permesso a Yennefer anche per questa cosa!
    495408|00000000||Se non ci viene in mente niente, possiamo tentare con il metodo dei witcher.
    495488|00000000||Che posso dire? Hai letto nel nostro cuore.
    495489|00000000||Bene. Allora proviamo prima con l'inganno?
    495491|00000000||Sì, va bene.
    495465|00000000||Mi sa che hai ragione.
    495470|00000000||Hmm... Quindi per dimostrare che ti sbagli, dovrei obbedire a te?
    495472|00000000||Finché non mi chiamerò Yennefer, nessuno dirà che sei il mio schiavetto.
    495481|00000000||E ricorda: se non ci viene in mente un buon trucco, possiamo sempre fare a modo tuo.
    495482|00000000||Va bene. Proviamo a ingannare l'hym.
    495466|00000000||Ti sbagli.
    495384|00000000||Cosa c'è fra te e Yennefer? Alludi a lei di continuo.
    495387|00000000||Niente. Ho solo notato che... La pensi sempre come lei.
    495389|00000000||Vuoi dire che mi comanda a bacchetta?
    495391|00000000||Non più degli altri. Succede a tutti gli uomini...
    495432|00000000||Che si tratti di un grezzo uomo di Skellige, di un impavido cavaliere o di un rude witcher, tutti finiscono al guinzaglio di una donna.
    495381|00000000||Cosa c'entra Yennefer?
    495380|00000000||Bene, proviamo a ingannarlo.
    495478|00000000||Hmm... Tentare non nuoce, credo.
    495449|00000000||Saggia decisione.
    495454|00000000||Una casa infestata, rifugio dell'hym... L'unico luogo in cui potrebbe funzionare.
    496242|00000000||Ci vediamo là. Ho qualcosa da sistemare lungo la strada.
    496786|00000000||Bene. A dopo.
    496781|00000000||Ci vediamo là.
    496780|00000000||Andiamo.
    496241|00000000||Non c'è motivo di aspettare.
    522054|00000000||Sono pronto.
    522055|00000000||Lottate senza pietà, ma con onore!
    522058|00000000||E conservate un po' di forze per il prossimo incontro, ah ah ah!
    543064|00000000||Sono pronto.
    543066|00000000||Magnifico! In tal caso, iniziate!
    522046|00000000||Sono pronto.
    522049|00000000||Proverò un'altra volta.
    522048|00000000||Arrivederci.
    522047|00000000||Chi devo affrontare?
    522050|00000000||Chi è il mio avversario?
    522051|00000000||Ah ah ah, sei un tipo curioso, eh? Si chiama Grim... Uuuuuh... È un taglialegna, passa gli inverni tra le risse delle taverne. Ha provato a vincere il campionato di questa stagione, ma... Niente, non ce l'ha fatta.
    522044|00000000||Salve. Mi conosci?
    522045|00000000||Sì, ho sentito parlare di te.
    543082|00000000||Folan è mio amico da quando eravamo due monelli... e tu gli hai salvato la vita!
    543070|00000000||Ti sei unito all'equipaggio di Hjalmar e sei andato a uccidere il gigante di Undvik!
    543080|00000000||Sei quello che ha salvato Jarl Udalryk!
    543084|00000000||Non ricordo esattamente perché... ma sono sicuro che fosse qualcosa di sgradevole.
   1059886|00000000||Ho sentito dire che... ehm... organizzate degli incontri...
   1059888|00000000||Sì... ehm... hai sentito giusto. Puoi sfidare la sorte, se vuoi.
    543049|00000000||Voglio lottare di nuovo.
    543051|00000000||Quando sei pronto, devi solo chiedere.
   1050052|00000000||Da oggi in poi, casa mia è anche casa tua.
    476094|00000000||Il posto è questo. Indossa la maschera.
    476096|00000000||Istruzioni particolari?
    480864|00000000||Tienila finché non avremo visto tutto.
    480865|00000000||E non ti allontanare. La telepatia ha un raggio limitato.
   1022713|00000000||Ruar, non mangiare così tanto.
   1022715|00000000||Perché diavolo no?
   1022717|00000000||Perché se vieni colpito allo stomaco e quelle aringhe ti si bloccano nelle viscere, non avrai speranze.
   1022719|00000000||Folmer ha ragione. Non dovresti mangiare o bere troppo prima di un'incursione. Dopo potrai abbuffarti fino a stare male!
    482575|00000000||Hai detto che la Caccia Selvaggia era a Hindarsfjall?
    482566|00000000||A proposito della Caccia, hai detto che è apparsa a Hindarsfjall?
    482437|00000000||Beh, è successo almeno due settimane dopo il cataclisma che ha colpito Ard Skellig...
   1064518|00000000||I wraith hanno attaccato Lofoten al tramonto, in una bufera.
    482438|00000000||Cosa strana per questo periodo dell'anno...
    482439|00000000||Gli abitanti hanno raccontato che i wraith sono entrati nelle capanne, hanno ucciso chiunque facesse resistenza e poi si sono lanciati al galoppo verso l'interno, ridendo in modo diabolico.
    482441|00000000||Ci sono stati sopravvissuti?
    482442|00000000||Una dozzina di donne e un vecchio.
    482530|00000000||Prossima tappa: Hindarsfjall.
    482577|00000000||Ci vediamo sulla spiaggia vicino a Lofoten.
   1064542|00000000||Vi auguro buona fortuna. Se scoprite qualcosa, fatemelo sapere.
    498080|00000000||Aspetta. Perché non ci andiamo insieme, subito?
    498081|00000000||Ma tu detesti il teletrasporto.
    503192|00000000||Non amo nemmeno le pozioni, ma le bevo quando serve.
    503196|00000000||A dire il vero ne fai uso più spesso del necessario. D'accordo, andiamo. Stammi vicino.
    498078|00000000||Andiamoci insieme, subito.
    498082|00000000||Bene, ci vediamo là.
    498079|00000000||Ci vediamo là.
    436908|00000000||È una lunga storia, che riguarda il Sangue Ancestrale e le abilità di Ciri...
    436910|00000000||Ha forse ereditato le doti di sua madre?
    436912|00000000||Ciri l'ha superata di gran lunga. Ma in questo momento ci preme sapere che cosa ci faceva la Caccia Selvaggia a Hindarsfjall.
    436906|00000000||Te lo dirò dopo.
    436904|00000000||La Caccia Selvaggia vuole Ciri per il Sangue Ancestrale che scorre nelle sue vene.
    436916|00000000||Nelle vene di Ciri scorre il Sangue Ancestrale.
    482502|00000000||Questo è vero, in effetti è una discendente di Lara Dorren. Il che spiega perché le donne della sua famiglia hanno doti tanto straordinarie...
    482504|00000000||Possibile che sia così importante?
    436918|00000000||Ciri è eccezionale. Viaggia tra vari luoghi, qui e in altri mondi. Lo spazio non è un ostacolo per lei.
    482449|00000000||...
    482451|00000000||Il che spiega perché la Caccia Selvaggia vuole catturarla.
    348147|00000000||L'armatura è intatta: niente sangue né ammaccature. L'amico di Ciri deve averlo... Com'è che dici?
    437060|00000000||Vaporizzato.
    348149|00000000||Un'armatura di eccellente fattura, anche se non riconosco la mano. Uff! Impossibile dire da dove proviene.
    348151|00000000||Probabilmente perché apparteneva a un cavaliere della Caccia Selvaggia.
    348153|00000000||Cosa?!?
    433478|00000000||Quindi è così, la Caccia Selvaggia! Come temevo...
    482344|00000000||Prima qui, poi a Hindarsfjall. Che cosa vogliono?
    482391|00000000||Stanno cercando Ciri.
    482447|00000000||Ma perché?
