;meta[language=it]
; id      |key(hex)|key(str)| text
    593592|00000000||Ehi, gente! Volete sentire di Fyresdal?
    593596|00000000||Ehi, brava gente! Volete sapere cos'ha fatto la nostra coraggiosa guardia a Fyresdal?
    593598|00000000||Chiudi quella bocca, dannazione!
    591702|00000000||Quattro contro uno... e ne sei uscito vivo.
    591704|00000000||È un peccato lasciare che uno come te marcisca dietro le sbarre... Vieni. Forse Lugos ti giudicherà oggi.
    591705|00000000||E poi dicono che la violenza non risolve nulla...
    593600|00000000||Come diavolo fai a saperlo?
    593602|00000000||Da Simun la Peppola. Ha promesso di dimenticarlo se mi porterai dallo jarl.
    593604|00000000||La Peppola... Direi più Simun il Chiacchierone. D'accordo, vieni con me.
    593594|00000000||Ti costerà. Una mano lava l'altra.
    593591|00000000||Ti costerà.
    591686|00000000||Ti annoi? Prendi un piccone.
    591687|00000000||Preferisco parlare. Ad esempio, di ciò che è successo a Fyresdal...
    591699|00000000||Taci!
   1077251|00000000||Ehi, Capelli Grigi! Fammi uscire, eh? Devi solo trovare la chiave!
    587823|00000000||Che ne dici di una mano di gwent?
    587824|00000000||D'accordo, giochiamo. Ma non devi parlare.
   1016317|00000000||Che ne dici di una partita a carte?
    587822|00000000||Arrivederci.
   1016320|00000000||Preferirei "addio".
    587803|00000000||Arrivederci.
    587812|00000000||Hai qualcosa che potresti vendermi?
    587825|00000000||Hai qualcosa da vendere?
   1016325|00000000||Sì. Ma è roba costosa.
   1016316|00000000||Che altro vuoi? Ti ho insegnato tutto quello che so.
   1069326|e0351e50||Baule del tesoro
    567932|00000000||Geralt, ci serve vivo.
    567933|00000000||L'avevo intuito... Aiutami.
    583682|00000000||Mi sto a malapena riscaldando. Beh, che aspetti? Va' a chiamare il prossimo.
    425869|00000000||Forza, il prossimo.
    410018|00000000||Un witcher, eh? Combatti più come una puttanella. Sparisci, vagabondo.
    583686|00000000||Ho la gola secca... Vado a bere qualcosa.
    583688|00000000||Va'. Ma spero di affrontarti ancora.
    425871|00000000||Vado a bere qualcosa.
    410016|00000000||Colpisci bene. Duramente.
    478312|dbb86633||Bandito
    582904|00000000||Oh, è una vera disgrazia...
    577289|c10c4bf2||Pescatore
    446094|00000000||Non so cosa stessi cercando qui, viandante... Ma hai trovato la morte.
    446180|00000000||Le sue spade sono mie! Chi di voi combatterà meglio avrà la sua armatura!
   1044788|00000000||Fannar ha scritto di essere disposto a pagare bene per la spada. Il suo peso in oro.
   1044790|00000000||Kuliu vale di più. Molto di più.
   1044792|00000000||Non lo nego... Ma nessun altro è disposto a comprarla. Temono tutti gli an Craite.
    446092|00000000||Uccidiamolo! Asulf, prendilo alle spalle!
   1063144|00000000||Geralt, smettila di perdere tempo! Indossa la dannata Maschera!
   1063142|00000000||Indossa la Maschera. Non abbiamo tempo.
    545346|391ece5b||Costruttore di barche
   1072727|00000000||Devo continuare a cercare... Hjalmar è passato da qui. Per forza.
    420027|00000000||Ha reclutato parecchi uomini... Hjalmar non è qui.
    420031|00000000||La dispensa del gigante...
   1050103|00000000||Non dimenticherò mai ciò che hai fatto per noi!
    332443|002e3ae9||Libro
   1086642|a1d615e0||Guardia degli an Craite
    578437|00000000||Hai mai giocato a gwent?
   1008173|00000000||Ah! Ermellino mi ha insegnato le regole e regalato un mazzo. Vuoi giocare?
    578443|00000000||Giocheremo un'altra volta.
    578442|00000000||Un'altra volta.
    578441|00000000||Giochiamo.
    578444|00000000||Facciamo una partita veloce.
    578436|00000000||Che ne dici di una partita a gwent?
    578447|00000000||Sei bravo! Sai una cosa, Lupo? Ho qui una carta rara... Prendila, servirà più a te.
   1042372|00000000||Grazie.
   1076491|00000000||Ti consiglio di sfidare un uomo del villaggio di Kaer Trolde... Un valido avversario, anche se un semplice sarto. Si chiama Sjusta.
    578446|00000000||Non male. Ma avresti bisogno di carte migliori.
   1042374|00000000||Ermellino mi ha parlato del druido Gremist... Pare che abbia carte rare simili, come anche un certo eremita di Velen. Se vuoi espandere la tua collezione, passa a trovarli.
   1024674|00000000||Sono stato a Lofoten. Ci sono più tombe che uomini. E pensare che avrebbero potuto colpire noi...
   1024676|00000000||Noi li avremmo respinti. Lo sanno tutti che Larvik ha guerrieri migliori.
   1024678|00000000||Più stupidi, forse. Figliolo... se la Naglfar fosse arrivata qui, ora saresti morto e sepolto.
   1017241|00000000||E tu chi sei? Ah, aspetta, ti conosco... Geralt di Rivia, vero? Che c'è?
    320709|00000000||Arrivederci.
    320707|00000000||Arrivederci.
   1016830|00000000||Come vanno le cose a Faroe?
   1017247|00000000||Come vanno le cose a Faroe?
   1017249|00000000||Come sempre... Piove e fa un freddo cane.
   1017251|00000000||Un'esplosione di orgoglio...
   1017253|00000000||Non ha senso ricoprire la merda di foca con miele. Faroe è un grosso sasso irto di pini, ma non ci occorre altro.
   1017255|00000000||Non puoi mangiare il legno di pino...
   1017257|00000000||Ma puoi usarlo per costruire una nave, e mangerai ciò che altri hanno coltivato o allevato. Dopo che avrai preso le loro donne e il loro oro, e bruciato le loro case. È così che vive il clan Dimun!
   1017243|00000000||Sì?
   1074011|00000000||Ho una pista da seguire. Mi chiedo dove porti...
   1002812|00000000||Un'altra vittima...
   1002814|00000000||Questo tanfo... Sicuramente dei drowner. La tana dev'essere vicina.
   1002878|00000000||Granchi... Devo essere vicino alla zona di pesca descritta da Rurik.
   1002912|00000000||Ancora quel tanfo... Melma e pesce putrefatto...
   1002915|00000000||Oh... Altri drowner.
   1003006|00000000||La tana di un mostro... Ma sicuramente non di un drowner.
   1003254|00000000||Quasi intatto... Nascosto per dopo. I drowner non lo farebbero mai.
   1003272|00000000||Lividi sul collo, laringe schiacciata... Strangolato.
   1003415|00000000||Pezzi di barca, vele strappate, funi... Arredamento marinaresco, diciamo.
   1003462|00000000||Il tanfo, i segni sui cadaveri... Dev'essere la tana di una strega d'acqua. Ha un olfatto molto sviluppato. Non tornerà finché sono qui.
   1003463|00000000||A meno che... Coesiste con i drowner... potrei ricavare un estratto dalle loro ghiandole per coprire il mio odore...
   1003720|00000000||Così dovrebbe andare. Ora devo cercare un posto per nascondermi e aspettare. Dietro quelle barche...?
   1039089|00000000||Ossa umane... Integre, ma il midollo è stato succhiato. Serve una lingua lunga e sottile per farlo.
   1045367|00000000||Un bacino, graffiato... Segni lunghi e larghi di artigli.
   1039099|00000000||Un pezzo d'armatura arrugginito... si sgretola tra le mani...
   1049090|00000000||Parlare non servirà a nulla...
   1017978|00000000||Ti ho già detto di sparire...! Oh, no... Io... Il mio voto del silenzio... Tutto invano!
   1021195|00000000||Mi dispiace, sono stato ingannato.
   1021201|00000000||Oh, mi dispiace. Qualcuno mi ha ingannato. Pensavo che...
   1021203|00000000||Le mie più sentite condoglianze! Ora sparisci dalla mia vista, imbecille!
   1021197|00000000||Volevo aiutarti, davvero...
   1021199|00000000||Beh, non mi hai aiutato di certo! Sparisci dalla mia vista, porco!
   1021194|00000000||Volevo aiutarti...
   1017979|00000000||Tre anni! Tre anni senza una parola... Neanche una! Fino a oggi. Ho infranto il mio voto per colpa tua. Sei contento?
   1049084|00000000||Sei tu il druido silenzioso?
   1049086|00000000||...
   1049088|00000000||Oh, già... Domanda stupida.
   1049170|00000000||...
   1049177|00000000||...
   1049185|00000000||Quando hai perso la voce? Puoi indicarmelo con le dita?
   1049189|00000000||Una persona davvero deliziosa...
   1049172|00000000||Quando hai perso la voce?
   1049175|00000000||Mmmh, sembra che parlare non servirà a molto... Arrivederci.
   1049173|00000000||Arrivederci.
   1049171|00000000||Hanno provato a curarti in un altro modo?
   1049179|00000000||Hanno mai provato a curarti in un altro modo? Con pozioni ed erbe?
   1049181|00000000||...
   1049183|00000000||Non solo muto... Sembra che sia anche sordo...
   1023377|00000000||Le nubi oscurano il cielo e il mare è tumultuoso. Difendici, Grande Madre.
   1023379|00000000||Questo è ciò che ti chiediamo, Freya, Falconessa, Leonessa, Portatrice di Sole e Pioggia.
   1023384|00000000||Ti versiamo idromele e sangue, ti offriamo queste vivande. Ricordati di noi, Madre, e proteggi le nostre coste.
   1023282|00000000||Di nuovo porridge, cara? Potresti servire un po' di carne...
   1023284|00000000||E cosa te ne faresti? Non hai i denti.
   1023286|00000000||Potrei succhiarla... Dopo potresti metterla nella zuppa.
   1048859|00000000||Ho sentito dire che Olaf non mangia carne da due giorni...
   1048861|00000000||E quando è affamato, diventa furioso.
   1048863|00000000||Ma ha bevuto un sacco d'idromele.
   1048865|00000000||Oh-oh... Allora Olaf ucciderà qualcuno.
    475630|00000000||Sei pazza, donna! Pazza!
    475638|00000000||Forse. Ma ho i miei buoni motivi.
    475640|00000000||Anch'io tengo a Ciri, e lo sai! Sai quanto le voglio bene! Ma la Maschera dell'Uroboro non è un giocattolo!
    478557|00000000||Hai idea di cosa potrebbe accadere se la usassi? Sai quali conseguenze ci sarebbero?
    478673|00000000||No, e nemmeno tu. Quindi, datti una calmata.
   1077064|150e14a2||Capitano dei pirati
    591718|00000000||Ehi, ehi! Che cosa ti è preso?
    591720|00000000||Gliel'avevo detto... Rinchiudere qui un witcher è come mettere un orso in una gabbia di segugi.
    592996|00000000||Vero. In entrambi i casi, è un vero spettacolo.
    482485|00000000||Mi dispiace, ma devo raggiungere la Roccia del Morto Affogato... Il prima possibile.
    484123|00000000||Non ti costringerò a restare... Ma la Roccia è piuttosto lontana, e tu ti reggi a malapena in piedi. Ti conviene prendere un cavallo.
    484125|00000000||Vero! Skjall può prepararti un cavallo. Dovrai aspettare un po', ma arriverai comunque prima che a piedi.
    484127|00000000||D'accordo... Va bene. Grazie infinite a entrambi.
    484885|00000000||Sciocchezze, non c'è bisogno... Ora vieni, devi sudare via la malattia!
   1056937|00000000||Dove sono i miei vestiti?
   1056939|00000000||Li ho presi io. Vieni!
    482478|00000000||Devo raggiungere la Roccia del Morto Affogato.
    482479|00000000||Sto bene ora.
    484131|00000000||Davvero, non c'è bisogno... Sto bene...
    484134|00000000||Ehi!
    484136|00000000||Bene? Non ti reggi neanche in piedi...
    484137|00000000||E non mi stupisce, con quei muscoli congelati. Ma non preoccuparti... La mamma e io ci prenderemo cura di te.
    427868|00000000||Aiutami... Aiutami ad alzarmi.
    427871|00000000||Io non... Non credo che dovresti...
    427873|00000000||Meno chiacchiere. Dammi una mano, piuttosto.
    482465|00000000||Ah, tipico di mio fratello... Lo perdo di vista per un attimo, e subito palpeggia una ragazza.
    482467|00000000||Astrid, sei davvero noiosa! Sai benissimo che la sto solo aiutando ad alzarsi!
    482471|00000000||È un peccato, lo so, ma devo interrompere il tuo corteggiamento. Vieni... Andiamo alla sauna.
    484082|00000000||Dove?
    484084|00000000||Perché mi guardi come un pesce lesso? La sauna!
    497869|00000000||Ragazza... Eri blu come una balena quando ti abbiamo portata qui! Devi scaldarti il sangue!
    386093|00000000||Aiutami ad alzarmi...
    497284|00000000||Cosa? Mi hai spogliata tu?
    497286|00000000||Non avevo scelta! Eri bagnata fradicia, e dovevo vedere se avevi qualche ferita da curare...
    497289|00000000||Mmmh... E se il mio petto aveva bisogno di un po' di grasso di volpe...
    497291|00000000||No, no... Quella è opera di mia madre e mia sorella. Io... Non oserei mai... Lo giuro... Sul mio onore...
    497293|00000000||Tranquillo, ti credo.
    497281|00000000||Cosa? Mi hai spogliata tu?
    497302|00000000||Sì... Ne ho passate tante.
    497304|00000000||Pensavo che le donne del Continente non combattessero...
    497306|00000000||A volte non hanno scelta.
    497282|00000000||Già... Parecchie.
    386075|00000000||Quanto sono rimasta priva di sensi?
    386077|00000000||Più o meno, tutto il giorno. Era mattino quando ti abbiamo portata qui, e ora è quasi notte.
    482453|00000000||Dannazione... Troppo...
    430289|00000000||Avevi disperatamente bisogno di riposo.
    497299|00000000||Ne hai passate tante, eh? Hai delle brutte cicatrici recenti...
    386097|00000000||Ho dormito a lungo?
    386095|00000000||Dov'è il mio compagno?
    386063|00000000||E ora dov'è? Il mio... Amico?
    386065|00000000||È uscito da un po'... Ha detto che doveva cercare una barca...
    429741|00000000||Perché indossa quella maschera? La sua faccia ha qualcosa di strano?
    386067|00000000||No. Semplicemente, non gli piace che gli altri la vedano.
    482396|00000000||Sei sveglia... E io che temevo che...
    482400|00000000||Dove sono? Tu chi sei?
    482473|00000000||Va tutto bene... Sei a Hindarsfjall, nel villaggio di Lofoten. Io sono Skjall.
    482475|00000000||Ma come...? Cosa...?
    482477|00000000||Vi abbiamo ripescati in mare... Te e il tuo amico.
    438330|00000000||Oh, un witcher! Sei qui per il drago, giusto?
    511121|00000000||Già, e aveva le scaglie d'oro e dal culo gli usciva fumo come da un camino!
    511123|00000000||Proprio come narrano i poeti... Ti sei guadagnato la tua ricompensa!
    511125|00000000||E la mano della principessa. Ma mi accontenterò del denaro.
    511119|00000000||Già, e aveva squame d'oro!
    511127|00000000||Non era un drago, ma un codabiforca. Gli somiglia, ma è più piccolo e meno pericoloso.
    511129|00000000||Meno pericoloso, dici? Allora anche la tua paga sarà più bassa.
    511131|00000000||Ascolta, avevamo stabilito un prezzo.
    511133|00000000||Sì, ma per un drago! Se avessi saputo che era un codabiforca, l'avrei ucciso io stesso. E questo è quanto!
    511093|00000000||Era un codabiforca, non un drago.
    381159|00000000||Il problema è risolto.
    381167|00000000||Allora? Tutto qui? Dimmi di più! Il drago sputava fuoco? O veleno?
    581413|00000000||Problema risolto.
    581407|00000000||Ho trovato la tana del drago, ma mi serve un'esca per ucciderlo. Magari una pecora.
    581410|00000000||Ah, capisco. La vuoi riempire di zolfo?
    581411|00000000||Uf, un altro amico del coraggioso piccolo ciabattino... No, farò a meno dello zolfo. Mi basta una pecora, nuda e cruda.
    581412|00000000||Va bene, ne ho una da darti. È malconcia ma andrà bene. Sai come condurre una pecora dove vuoi? Devi fare come i cani da pastore: se ti avvicini da sinistra, andrà a destra. Se ti avvicini da destra...
    591025|00000000||Se ce la fanno i cani, posso riuscirci anch'io.
    581321|00000000||Mi serve un'esca.
    511072|00000000||I witcher di solito non uccidono draghi, ma darò un'occhiata. Hai parlato di vittime, giusto?
   1034968|00000000||Due fratelli, Askel e Nilas. Erano andati a caccia, ma sono diventati prede. Le ferite sono così orribili che mi sono sentito mancare, quando li ho visti. E ho una certa esperienza di corpi martoriati, avendo partecipato a trentadue razzie, da Poviss alle montagne di...
   1034970|00000000||Una storia affascinante, ne sono certo, ma mi interessano di più le ferite. Puoi descriverle?
   1034972|00000000||Puoi vederle tu stesso. La famiglia sta preparando il funerale. I cadaveri sono ancora a casa loro, a nord del villaggio. Ma tratta i corpi con rispetto, come vuole la tradizione.
    511064|00000000||Andrò a controllare.
   1068423|00000000||Cosa? Non ti darò quella somma, neanche fossero tanti draghi!
   1068425|00000000||Mi stai chiedendo un po' troppe corone, mastro.
   1068427|00000000||È una somma impegnativa... Ma anche il drago lo è. Accetto!
   1068429|00000000||Ora basta. Accetta quanto ti offro o vattene! Troverò un ragazzo... vari ragazzi... che affrontino il drago soltanto per la gloria!
    511063|00000000||Parliamo della ricompensa. Quello che offrite per questo drago è quello che di solito ottengo per un nekker.
    511065|00000000||Parliamo della mia ricompensa...
    511066|00000000||Devo pensarci.
    511068|00000000||Ci penserò.
    438332|00000000||Addio.
    438336|00000000||Addio.
    438334|00000000||Quanto al drago...
    511070|00000000||Rifletterò sul contratto...
    443746|00000000||Parlami di questo drago. Che aspetto ha, tanto per cominciare?
    443748|00000000||Non lo sai? Che razza di ammazzamostri sei? Ha le squame, le ali, gli artigli... Insomma, è un drago! Non perdiamo tempo, uccidilo e basta prima che ci siano altre vittime!
    511025|00000000||Allora, ucciderai il drago?
    492240|00000000||Tra un anno o due, li avrai dimenticati. Ti darò dei figli, forti e sani. Vedrai.
    492241|00000000||Beh? Vuoi dire qualcosa?
    492242|00000000||Lasciami in pace, donna. Ho accettato di tornare da te, non di amarti.
    509663|00000000||Probabilmente, non l'hai mai sentito nominare.
    509666|00000000||Probabilmente, non l'hai mai sentito nominare.
    509667|00000000||Resteresti sorpreso... Ma non sei costretto a dirmelo, se non vuoi.
    509673|00000000||In realtà, non è un segreto.
    509674|00000000||In tal caso, me lo dirai più tardi? Davanti a del buon idromele, in un posticino accogliente?
    509677|00000000||Volentieri. Ci vediamo alla taverna?
    509678|00000000||Troppo chiassosa. Vieni a casa mia, a Harviken... Ti aspetterò dopo il tramonto.
    513393|00000000||A dopo, allora.
    509675|00000000||Volentieri.
    509679|00000000||Un'altra volta, magari.
    509680|00000000||Mmmh... Devo ammettere che non è la risposta che mi aspettavo. Pensavo volessi festeggiare la tua vittoria...
    513396|00000000||Anche se, naturalmente, capisco che tu possa andare di fretta. Buona fortuna sulla tua Via.
    509676|00000000||Un'altra volta, magari.
    509664|00000000||A Kaer Morhen.
    509665|00000000||Kaer Morhen! È terribilmente lontana. Ma sicuramente hai imparato tanto anche sulla strada... Perché non mi racconti tutto?
    513341|00000000||Sarebbe una lunga storia.
    513342|00000000||D'accordo, allora ci servirà un luogo tranquillo, del buon idromele e... Che ne dici?
    509662|00000000||A Kaer Morhen.
    509659|00000000||Basta! Mi arrendo! Oh, dèi...
    509660|00000000||Non mi sorprende che tu faccia fatica a trovare avversari degni.
    509661|00000000||Alla fine... ne ho trovato uno... Dove hai imparato a combattere?
    512056|00000000||Allora? Ne hai abbastanza?
    509654|00000000||Sì.
    509655|00000000||Urgh... Pensavo di aver finalmente trovato un uomo in grado di battermi...
    509657|00000000||Non avresti dovuto combattere così sul serio...
    509658|00000000||Non sai niente, capelli bianchi. Ora va'.
    509737|00000000||Slealtà! Inganno! Magia e pozioni per sconfiggere una donna?
    512090|00000000||Ma...
    512130|00000000||Vergogna!
   1017985|2537f9a8||Macellaio
   1022604|00000000||Forza, vai! Devi toccare il teschio della balena. Hai paura, eh?
   1022605|00000000||No, ma...
   1022606|00000000||Ma cosa?
   1022607|00000000||Dai, Yergen, cambia la sua sfida. Non c'è bisogno di andare nel cimitero, è infestato.
   1022608|00000000||Codardi! Deboli! Non voglio più giocare con voi!
    551475|00000000||Io adoro la pioggia quanto una puttana adora una colonia di lebbrosi.
    550399|00000000||Una maga è andata a Kaer Trolde.
    551477|00000000||La gente dice che è l'amante di Crach.
    550401|00000000||Ma non mi dire!
    550403|00000000||È vero che si è ammalato di nuovo?
    550405|00000000||Sei testardo quanto lurido.
    551651|00000000||Hm, salve.
    551653|00000000||Mmmh?
    551667|00000000||Eh?
    551649|00000000||Aaaah...
    551479|00000000||So quello che dico! Quell'oste culostretto annacqua il vino!
    551480|00000000||Torna da dove sei venuto.
    551512|00000000||Occhio con quei gomiti!
    551655|00000000||Vuoi derubarmi? E di cosa?
    551665|00000000||Aaaah... Aaaah...
    427578|00000000||Che cosa vuoi?
    427580|00000000||Sto cercando gli abitanti di Undvik.
    419069|00000000||Sono morti.
    522369|00000000||Sai, ho sentito dire che molti sono sopravvissuti...
    427576|00000000||Sei un tipo testardo... Che cosa vuoi sapere?
    419071|00000000||Eri lì quando il gigante ha attaccato?
    419073|00000000||Sì, c'ero... Ero una delle guardie personali dello jarl. L'ho deluso. Non abbiamo creduto a ciò che dicevano le sacerdotesse... Che saremmo stati puniti...
    496916|00000000||Per aver depredato la terra del ferro, forgiando armature che gli uomini indossano per uccidersi... Che Freya ci avrebbe puniti. Forse dicevano il vero...
    419095|00000000||Lo jarl di Undvik... Parlami della sua morte.
    419097|00000000||Lo jarl Harald Facciadisegugio... Quella notte, tutta la sua ciurma è morta. Wilmar, Wilfred e Wilhelm...
    419099|00000000||Li ho raggiunti troppo tardi. Ho visto il gigante scagliare Wilmar contro una roccia.
    496922|00000000||È crollato accanto a me, con tutte le ossa rotte, agitandosi come un salmone sulla sabbia.
    419101|00000000||Harald era già morto?
    419103|00000000||Cosa? No, lo jarl ha combattuto come un orso! Colpiva, schivava e urlava, poi colpiva ancora... Ma non è riuscito a salvarsi comunque.
    425006|00000000||Com'è morto lo jarl di Undvik?
    419107|00000000||Devo andare.
    421296|00000000||Eh...
    419085|00000000||Devo andare.
    425004|00000000||Come hai fatto a sopravvivere?
    419155|00000000||Come hai fatto a sopravvivere?
    419157|00000000||Prima ho sentito il gigante ruggire verso le fottute sirene... Che io sia dannato se non gli stava dando ordini!
    425285|00000000||Sotto stress, gli uomini vedono ogni genere di cosa...
    419159|00000000||So quello che ho visto! Sono corso ad aiutare lo jarl, ma una di quelle troie mi ha afferrato con i suoi artigli, sollevandomi in aria. Ha cercato di portarmi nel loro nido per mangiarmi, credo.
    419161|00000000||Ma io ho spezzato la presa, cadendo da una bella altezza. Ho urtato duramente... Non riuscivo ad alzarmi. L'ultima cosa che ho visto... Branchi di sirene che sciamavano verso lo jarl, circondandolo. Un urlo, un gemito, un grido e un ruggito. Poi il silenzio.
    425215|00000000||Gli uomini che hanno scortato le donne e i bambini alle navi mi hanno trovato svenuto e mi hanno portato ad Ard Skellig.
    419143|00000000||Ancora tu... Non hai nessun altro da importunare?
    522371|00000000||Va' a chiedere a Rante o a Javor. O al locandiere.
    338912|9f754b64||Fabbro
    332382|00365006||Bandito
    170812|f3248005||Strega d'acqua
   1017971|0687b403||Fabbro
   1028266|00000000||Witcher!
   1028342|00000000||Sono dispersi... La mia fidanzata e i miei fratelli! Aiutami, witcher!
   1046778|00000000||Fu il padre di Bran, Torgeir il Rosso, a navigare per l'Alba fino alle porte della capitale nilfgaardiana... Incendiò i sobborghi della città.
   1046781|00000000||L'imperatore se la fece addosso dalla paura... Oh, sì.
   1046783|00000000||Peccato che questo attirò una grande sfortuna sulla sua gente...
   1046932|00000000||La vendetta dell'imperatore fu brutale.
   1046934|00000000||Il mare divenne una distesa nera per le vele dei nilfgaardiani. Sbarcarono sull'isola... Centinaia di uomini. Migliaia.
   1046936|00000000||Uccisero guerrieri, donne e bambini... E quando ebbero finito, bruciarono ogni edificio. Pietra per pietra.
   1046938|00000000||E che ne fu di Torgeir? Riuscì a sopravvivere?
   1046942|00000000||Fu fatto prigioniero. Ma gli Oscuri non sapevano di aver catturato un demonio...
   1046944|00000000||Durante la traversata, si liberò, uccise metà dell'equipaggio e si buttò in mare!
   1049160|00000000||Il faro di Eldberg è ancora spento...
   1049162|00000000||Credo che resterà così.
   1049164|00000000||Dicono che l'isola sia infestata... Un wraith o qualcosa del genere.
   1049166|00000000||Allora faremmo meglio a recarci laggiù. E risolvere questo casino spettrale.
   1049168|00000000||Non molto tempo fa, alcuni uomini ci hanno provato. Il giorno dopo, la loro barca è tornata a riva... vuota.
   1072285|130bfe67||Penitente
   1056837|00000000||Manda quell'idiota dove merita! Sotto il tavolo!
   1056835|00000000||Spaccagli il muso, Capelli Bianchi! Fallo a pezzi!
   1056849|00000000||Fottigli il grugno! Colpiscilo in faccia! Fallo strozzare con i suoi denti!
   1056839|00000000||Papà! Dai una lezione a quel bastardo! Se non lo fai tu, lo farò io!
   1056853|00000000||È magnifico! Proprio come ai vecchi tempi! Una veglia non vale niente senza una rissa!
   1056851|00000000||Non andateci piano! Datevi da fare!
    372790|00000000||Ha combattuto fino alla fine, ma le sirene erano troppe...
    379674|00000000||Si è rifiutato di abbandonare il gregge alle bestie.
    372792|00000000||Eh, sul letto di morte, mia madre mi aveva chiesto di proteggerlo...
    379676|00000000||Dovevo sostituirlo al mattino... Se solo avessi scelto il turno di notte, sarebbe ancora vivo.
    513667|00000000||Aspetterò qui. Ma sbrigati.
    515172|00000000||Aspetterò all'ingresso della caverna.
    515487|00000000||Presto... Acceleriamo il passo!
    515486|00000000||Ti dico che è un fottuto figlio di puttana enorme!
    515475|00000000||Non posso credere di aver finalmente ucciso quel bastardo...
    518086|00000000||Fottute troie del mare!
    518085|00000000||Vi sventro!
    518084|00000000||Tieni duro, Leif! Le finirò presto!
    518083|00000000||Morite, troie marine!
    509051|00000000||Crach an Craite ha chiesto di voi.
    509053|00000000||Abbiamo preso una boccata d'aria fresca.
    509055|00000000||Ehm, i pretendenti al trono si faranno avanti fra poco.
