;meta[language=it]
   1013821|00000000||Non farà alcuna differenza. La profezia è chiara... Dopo il Ragh nar Roog, il mondo finirà.
   1013823|00000000||Le profezie possono essere ingannevoli. E ogni fine è sempre un nuovo inizio. Una nuova alba.
   1013825|00000000||Speriamo tu abbia ragione, viandante... Speriamo tu abbia ragione.
   1011038|00000000||Parlami di Hemdall.
   1011906|00000000||Salve, viandante. Sono lieto di vederti sano e salvo.
   1013630|00000000||Salve. Ancora in pellegrinaggio?
   1013632|00000000||Già. E a ogni Volto di Hemdall prego affinché gli dèi siano clementi con te.
    166703|2948fe35||Pescatore
    524210|00000000||Colti di sorpresa, ma hanno respinto l'attacco... Mi servono altri indizi. Controllare il perimetro?
   1021906|00000000||Ditemi, ragazzi, per dove salperete questa volta?
   1021908|00000000||Kerack. Sevald c'è stato per vendere delle pellicce. Dice che la loro guarnigione non è al completo.
   1021910|00000000||Oh, sì... Devono aver mandato i soldati contro gli Oscuri. Non si aspettano che qualcuno attacchi dal mare.
   1021912|00000000||In tal caso, li attende una sorpresa. E a noi attendono gloria e ricchezze!
    562678|87e5ea9d||Guerriero
   1021678|00000000||Ho vinto! Ho vinto nell'arena!
   1021683|00000000||Davvero? Chi hai battuto?
   1021685|00000000||Ulle lo Sfortunato.
   1054615|00000000||Idiota! Tutti quanti battono Ulle. Perdere sempre è il destino di Ulle!
   1054617|00000000||Torna quando avrai sconfitto un vero avversario.
    506904|00000000||Ci siamo. Dobbiamo tornare di corsa alla festa prima che...
    506905|00000000||Attenta!
    508785|00000000||Ecco!
    506935|00000000||Stringiti a me!
    506933|00000000||Dannazione, voglio baciarti, Yen.
    506934|00000000||Soffocheremo e moriremo.
   1057955|00000000||Quel dannato druido ci avvelenerà! I vapori sono letali, abbiamo pochi minuti!
    506931|00000000||Teletrasportaci fuori da qui.
    506932|00000000||Pensa a qualcosa! Presto! La prima cosa che ti viene in mente!
   1032470|00000000||Il miglior idromele! Brinderò con un intero barile a un re così!
   1032473|00000000||Tuirseach!
   1032476|00000000||Ve l'avevo detto che Svanrige gliel'avrebbe fatta vedere!
   1032478|00000000||Proprio come Bran da giovane... A Bran!
   1032480|00000000||A Bran! Tuirseach!
    174153|49292af3||Ciclope
   1047249|baa6fb37||Jessie
   1024067|00000000||E fa male. Terribilmente. Come se... Come se qualcosa mi lacerasse dall'interno.
   1024069|00000000||Dovresti andare dai druidi.
   1024071|00000000||Ci sono già stata. Dicono che le erbe non possono aiutarmi e che posso soltanto pregare.
   1024073|00000000||E l'hai fatto?
   1024075|00000000||Ho pregato quando Kjarre mi ha lasciata... Quando mia madre si è ammalata... Quando le pecore hanno iniziato a morire... Ormai ho esaurito tutte le preghiere.
   1055104|7418226b||Guerriero dei Craite
   1070253|00000000||Potrebbero anche iniziare...
   1049995|00000000||Grazie, witcher!
    538568|ec216618||Oste
   1006022|00000000||Non ti vogliamo qui, strega!
    580264|00000000||Maledetta sgualdrina.
    589780|00000000||Rimangiati quello che hai detto...
    580255|00000000||Vattene dal villaggio, puttana sterile!
    580266|00000000||Che cos'ho? Il malocchio! Quella puttana mi ha maledetto!
   1006024|00000000||Hai contaminato il terreno sacro! Gli dèi non ti perdoneranno!
    580265|00000000||Profanare il giardino di Freya, un luogo sacro...
   1027713|00000000||Le arpie gli hanno riservato una fine dolorosa.
    499599|00000000||Brrr... Che freddo...
    595387|00000000||Uve? Tutto bene, amico?
    595389|00000000||Oh, già... Non puoi parlare. Andiamo.
   1001512|00000000||Forza, uomini! Chi mi porterà la testa di Uve il Farfugliante riceverà il comando di una nave!
    594984|00000000||Lunga vita a Bran, jarl di Tuirseach, re di Skellige!
    594985|00000000||Lunga vita al re!
    595375|00000000||Bran? Non è possibile...
    595377|00000000||Vedo che la battaglia ti ha sfinito... Siediti con me, figliolo. Bevi dell'idromele e raccontami le tue avventure.
    595379|00000000||Grazie, mio re. Noi...
    594989|00000000||Non berrò con te, vecchio, e non ti chiamerò "re". Alzati da quel trono, finché hai ancora forza in quelle ossa decrepite.
    595382|00000000||Uve? Tu parli?
    595384|00000000||Io... Io non... Ma io...
    594991|00000000||Osi insultarmi di nuovo, Uve il Farfugliante. La prima volta ho lasciato che ti punissi da solo per conservare il tuo onore. Ma ora... Ora morirai come un servo, e le anguille mangeranno i tuoi resti.
    585148|00000000||Pensavo che non vi sareste parlati mai più, dopo la contesa per la corona.
    585150|00000000||Chi? Io e Hjalmar? Devi essere pazzo!
    585157|00000000||Sembrava una rivalità molto accesa.
    585159|00000000||La rivalità è una cosa, ma abbiamo lo stesso sangue. È questo che conta.
    585154|00000000||Non ti dispiace di aver perso?
    585161|00000000||Allora, ti dispiace di aver perso?
    585163|00000000||Naturalmente preferirei sedere al suo posto, ma mio fratello è forte e ha carisma. Credo che la gente lo seguirà.
    585165|00000000||E se diventasse troppo arrogante, papà saprà ridimensionarlo. Puoi starne certo.
    585153|00000000||Addio.
    585155|00000000||Fagli le mie congratulazioni.
    585168|00000000||Certo.
    426794|00000000||Incrocio le dita. Addio.
    426790|00000000||Addio.
    426688|00000000||Ora che cosa farai?
    426744|00000000||Cos'ha in programma la nuova regina di Skellige?
    426752|00000000||Uhm... Di ascoltare, imparare e ascoltare ancora. Poi si vedrà.
    426754|00000000||Un ottimo piano.
    426758|00000000||Devo unire i clan. Vorrei evitare la guerra, ma se Nilfgaard attaccherà noi li respingeremo.
    583716|00000000||I Drummond potrebbero essere un problema. Ho visto Lugos durante la cerimonia. Era a dir poco furioso.
    583718|00000000||C'è sempre stato attrito fra i nostri clan. Proverò a parlargli, per portarlo dalla mia parte.
    409165|00000000||Congratulazioni. Sarai una grande regina.
    426624|00000000||Grazie. Non sarei qui, se non fosse per te.
   1055665|718d5ea6||Ekhidna
    412531|00000000||È andata così. Si sentiva la nave degli Oscuri in lontananza...
    412533|00000000||Non mi stupisce! Urlano gli ordini come se l'imperatore in persona dovesse sentirli e approvare la loro rotta!
    414751|00000000||Abbiamo atteso nascosti in una baia. Non appena ci hanno superati, li abbiamo speronati dritti sulla fiancata!
    414753|00000000||Ucciderli era dura, visto che indossano armature... Quindi li abbiamo affondati!
    414755|00000000||Sono andati giù come pietre!
    593869|00000000||Voglio parlare con Lugos il Blu.
    593871|00000000||Hai sentito? Vuole parlare con Lugos! Che altro, vagabondo? Magari scoparti Freya?
   1001525|00000000||Niente. Mi chiedevo cosa ci faceste qui... se non è un segreto.
   1001526|00000000||Un segreto? Ne andiamo fieri! Siamo venuti con Lugos il Blu per combattere i mostri della Caverna dei Sogni!
   1001527|00000000||Mostri, hai detto? Siete fortunati... Posso parlare con Lugos? Magari vuole assoldare un professionista.
   1001667|00000000||Dove vai, vagabondo? Nessun forestiero può avvicinarsi alla nave!
    593873|00000000||Levatevi di mezzo.
   1001659|00000000||Levatevi di mezzo.
   1001661|00000000||Altrimenti?
   1001662|00000000||Ah, queste conversazioni... Altrimenti vi farò saltare i denti.
    594009|00000000||Credi di farmi paura? Di spaventare Jorulf, figlio di Odmar, altrimenti noto come "il Ghiottone"?
    594011|00000000||Ehi! Cos'è questa confusione?
    594013|00000000||Un forestiero vuole salire sulla nave. Dice che deve parlarti. Ma...
    594015|00000000||Fatelo passare. Se si rivela uno scocciatore, lo getteremo in mare.
    594017|00000000||Ci vediamo, Jorulf, figlio del Ghiottone... O quello che era.
    595707|00000000||Non si scherza su mio padre. Mai.
    593912|00000000||Per me sta bene, se organizzi tu...
    593914|00000000||Credo di poterti organizzare un coltello tra le costole mentre affondi in mare. Ora sparisci.
    593916|00000000||Non costringetemi a farvi del male. Ho già abbastanza problemi.
    593872|00000000||Se organizzi tu, per me sta bene...
    593928|00000000||Lugos mi sta aspettando. Fammi strada.
    593930|00000000||S-subito... Vieni...
    593932|00000000||Ma cosa...? Non capisco...
    593934|00000000||Allora resta qui a rifletterci.
    593910|00000000||Lugos mi sta aspettando.
   1001674|00000000||Non importa... Buona fortuna.
   1001668|00000000||Non importa.
   1001672|00000000||Che cosa vuoi?
   1051817|00000000||Simun la Peppola ti manda i suoi saluti.
   1051596|00000000||Simun? Beh, che sorpresa... Dopo tutte le discussioni con Lugos per convincerlo a consegnarti, ora tu vieni qui tutto solo...
   1051598|00000000||No, non sono solo.
   1051600|00000000||Non so che cazzo ti sia venuto in mente, Simun... Non importa. È tempo di chiudere i conti. Finalmente.
    166476|00000000||Grazie, fratello. Me lo ricorderò.
    166481|00000000||Andiamocene da qui.
    166483|00000000||D'accordo. Dopo che lo avrò ucciso.
   1024807|00000000||Verbena, levistico, camomilla!
   1024809|00000000||Camomilla? A che serve?
   1024811|00000000||Per lo stomaco.
   1024813|00000000||E il levistico?
   1024815|00000000||Per l'amore.
   1024817|00000000||Hai qualcosa per il prurito? Perché ultimamente di amore ne ho avuto in abbondanza, e ora ho questa terribile infiammazione...
   1049201|00000000||...
   1049203|00000000||!!!
   1049205|00000000||...!
   1024087|00000000||Che io non fugga mai dal campo di battaglia.
   1024089|00000000||Che io non muoia avvelenato o in trappola.
   1024091|00000000||Che la mia spada grondi del sangue dei nilfgaardiani.
    491248|00000000||Mmmh, che cos'è? Uno scialle di donna... Disegno particolare... Profumo particolare...
   1038386|00000000||Piccole impronte... Una donna.
   1038388|00000000||Troppi odori... Il mio naso non può andare oltre. Dovrò chiedere in giro dello scialle.
   1050146|00000000||Sarò onesto... Non so come avremmo fatto senza di te.
   1044280|00000000||Mi sembra che tu li abbia menzionati quando sono entrato...
    587504|00000000||Dobbiamo prenderne vivo almeno uno.
    587506|00000000||Dovremmo prenderne vivo almeno uno, per farlo testimoniare dinanzi a...
    587508|00000000||Questo non è il Continente, witcher. Non serve una corte per fare giustizia.
   1069100|00000000||Hai considerato la possibilità che qualcuno possa averli incastrati? Usati?
   1069102|00000000||In tal caso, moriranno per la loro idiozia. Basta chiacchiere. Andiamo.
    587358|00000000||Semplice e conciso... Il tipo di piano che adoro.
    587361|00000000||È per questo che mi piaci. Vieni, Lupo... I poeti canteranno della nostra vendetta contro gli orsi.
    587503|00000000||Un piano semplice. Mi piace.
    587497|00000000||E adesso?
    587499|00000000||Semplice. Noi abbiamo accolto i Vildkaarl sotto il nostro tetto, dandogli cibo e bevande... E loro hanno versato il nostro sangue.
    587502|00000000||Quindi, ora devono pagare. Col sangue.
    587356|00000000||E adesso?
    584791|00000000||I Vildkaarl... Che altro sai su di loro?
    584924|00000000||Non appartengono a nessun clan. Non hanno mogli né figli.
    584926|00000000||E allora come si riproducono? Per gemmazione?
    584928|00000000||No. Chi desidera dedicare la propria vita alla battaglia viene qui e si unisce a loro.
    584930|00000000||D'estate vanno a caccia e compiono incursioni. D'inverno dormono nelle caverne... Con gli orsi. Almeno, questo è ciò che dice la gente.
    584932|00000000||Ho l'impressione che non siano soltanto chiacchiere...
    584726|00000000||Che cosa sai sui Vildkaarl?
    584789|00000000||Perché non l'hai detto subito?
    584793|00000000||Perché non l'hai detto subito? Al castello, di fronte a tutti?
    584795|00000000||Perché avrebbero iniziato a parlare. Fare domande, discutere.
    584797|00000000||Le parole non laveranno via l'onta sul mio clan. Soltanto le azioni.
    587352|00000000||Questo è Fornhala... Il loro villaggio.
    560038|00000000||Sono loro a essersi trasformati in orsi. Proprio come nelle leggende sui berserker. Li ho visti con i miei occhi... Forse sono l'unico. Tutti gli altri stavano guardando il giovane Lugos.
    588162|00000000||Sosteneva di poter trangugiare un barile di birra tutto d'un fiato. C'era quasi riuscito.
    584112|00000000||Mmmh... Difficile dimenticarli.
    560037|00000000||D'accordo, eccoci.
    584108|00000000||Che significa? Vuoi spiegarmi o no cosa ci facciamo qui?
    584110|00000000||Ricordi gli uomini selvaggi con cui ho lottato? Quelli che chiamiamo "Vildkaarl"?
    408219|00000000||Merda, dalla stiva viene una puzza terribile...
    408221|00000000||Sì, siamo vittime del nostro stesso successo. La miglior incursione di sempre.
    408223|00000000||Successo o no, tira subito fuori quei mangiamerda, prima che il tanfo non vada più via.
    408225|00000000||Posso servirmi?
    408227|00000000||Troppo tardi. Ho un compratore per l'intero carico.
    408229|00000000||Non lo saprà nessuno...
    408231|00000000||Urgh...
    408233|00000000||Che c'è?
    408235|00000000||Quel figlio di puttana mi ha morso fino all'osso...
    408237|00000000||Avresti dovuto ficcargli una lama tra le costole e farla finita.
   1024096|00000000||E questa la chiami "merce di lusso"? Maledetto buffone! Questa gente è tutta pelle e ossa.
    475482|00000000||La scorsa primavera, Tarald di Lofoten si è recato nella Caverna... Urlava così forte che l'hanno sentito a Kaer Trolde.
    475484|00000000||Magari ha visto ciò che attendeva il suo villaggio...
    475486|00000000||Qualcuno ha provato queste erbe?
    475488|00000000||Pave. Poi si è infilato in un barile, si è cosparso il capo di sale e diceva di essere un'aringa.
    475490|00000000||Quando giungerà il Ragh nar Roog, si dice che dalla Caverna strisceranno fuori tutte le creature da incubo sognate dall'uomo.
    475492|00000000||Allora saranno guidate da mia suocera!
    475478|00000000||Jorulf ha detto che domani prenderà lui il timone.
    475480|00000000||Proprio quello che ci mancava...
    391116|00000000||Che vita da schifo. Sono uscito cinque volte... Ogni volta, sono tornato con più alghe che pesci.
    391118|00000000||Il mio pescato? A malapena sufficiente per la cena... Ed è già tempo d'iniziare a salare per l'inverno.
    391120|00000000||Quando le uova scarseggiano, dicono che le galline hanno smesso di deporle. Cosa si dice per la pesca?
    391122|00000000||Che i pesci sono finiti.
    391130|00000000||Una buona metà dei Fayrlund è morta affrontando gli Oscuri.
    391132|00000000||In mare?
    391138|00000000||No, gli imperiali hanno teso un'imboscata sulle coste della baia. Hanno attaccato mentre i Fayrlund tiravano le barche sulla spiaggia.
    391140|00000000||Un vero peccato. Perlomeno, sono morti in battaglia...
    347744|00000000||Non ne posso più... Qualcuno mi aiuti...
   1054152|54610db3||Segugio della Caccia Selvaggia
   1050123|00000000||A quanto pare dicevano il vero su di te...
    500729|00000000||Vogliamo puntare dei soldi, Lugos? No, è un'idea del cazzo, non paghi mai i debiti...
    500728|00000000||Niente trucchi!
    500727|00000000||Dai una lezione a quella sgualdrinella!
    500916|00000000||Via! E che vinca il migliore!
    587573|00000000||Potrebbero lavorare con qualcuno...
    587588|00000000||Sai che potrebbero aver agito per conto di qualcuno? Che potrebbero essere parte di un complotto?
    587590|00000000||Noi an Craite abbiamo sempre dei nemici. Lascia che complottano e colpiscano... Finiranno come i Vildkaarl.
    587592|00000000||Voci... Ce ne sono altri più avanti.
    587594|00000000||Lo spero proprio. Andiamo.
    587586|00000000||È la tua vendetta, decidi tu.
    587572|00000000||È la tua vendetta, decidi tu.
    563193|00000000||Beh, non gli caveremo fuori altro.
    587571|00000000||Non ce ne sarà bisogno. È tutto chiaro... Sangue per sangue.
    392717|00000000||Arriva qualcuno!
   1047379|00000000||Avvio della neutralizzazione dell'intruso.
   1022253|00000000||Intruso individuato.
   1030923|00000000||Desisti dalla tua intrusione. Esci subito.
   1030925|00000000||Rifiuta di andarsene in seguito a richiesta.
   1027383|00000000||Liberami, ti scongiuro...
   1027389|00000000||Perché ti hanno incatenato qui?
   1027390|00000000||Non mi piaceva il vecchio Gretter, vero, ma non volevo la sua morte. Liberami, ti prego. Sono stato incastrato nel suo omicidio.
   1027471|00000000||Mmmh... Ti credo...
   1027472|00000000||Grazie, non lo dimenticherò. Non ho modo di ripagarti, ma... Se mai ci rivedremo, mi sdebiterò con te.
   1027607|00000000||Riesci a camminare?
   1027609|00000000||Non preoccuparti per me. Devo solo riposarmi un po', poi starò bene. Grazie per l'aiuto.
   1027377|00000000||Ti credo. Ora ti libero.
   1027473|00000000||Certo... Tutti i prigionieri dicono così.
   1027474|00000000||No... No, non andare, ti prego... Non lasciarmi! Ti scongiuro, non lasciarmi!
   1027378|00000000||Non ti credo. Arrivederci.
   1027384|00000000||Sei tornato... Liberami, ti prego. Sono stato incastrato, davvero...
   1028055|00000000||Non preoccuparti per me, devo solo riposarmi un po'. Ti ringrazio per l'aiuto.
   1049986|00000000||La mamma dice che sei un eroe!
    578928|00000000||I tuoi figli non avevano rispetto per la legge.
    578931|00000000||I tuoi figli non avevano rispetto per la legge. Se non fosse stato per Jorund, sarebbe già successo qualcosa la prima volta...
    578934|00000000||Tra la famiglia di Jorund e la mia c'è una faida di sangue. Non fa differenza cos'abbia detto o fatto.
    592730|00000000||Vi ho aiutati. Ho ucciso il mostro del faro.
    592736|00000000||Ho ucciso il mostro del faro, la bestia che vi tormentava... È così che mi ripagate?
    592738|00000000||Ti abbiamo pagato in oro. Non ti dobbiamo altro.
    578935|00000000||Non voglio altri spargimenti di sangue. Ma mi difenderò se sarà necessario.
    578949|00000000||Dovrai difenderti dinanzi allo jarl. Se Lugos il Pazzo ti dichiarerà innocente, sarai libero di andare.
    592744|00000000||Dovrei essere giudicato da un uomo che chiamate "il Pazzo"?
    592746|00000000||Così, o affrontare l'intero villaggio. E non puoi sconfiggerci tutti... Non con tre spade.
    592748|00000000||D'accordo. Fatemi strada.
    578929|00000000||Stai mentendo. Devi aver visto chi ha iniziato.
    578930|00000000||Preferisco credere a uno dei nostri. A uomini che sanno cos'è l'onore.
    578927|00000000||Stai mentendo.
    592706|00000000||Avevo soltanto due figli. E tu li hai uccisi. Hai spezzato la mia discendenza.
    578915|00000000||Mi dispiace, ma non ho iniziato io.
    578916|00000000||Lo straniero dice il vero? Chi ha estratto per primo la lama?
    592710|00000000||Non lo so. È successo tutto in fretta, e avevamo bevuto parecchio...
    171010|c51bb659||Pirata
   1050093|00000000||Canteranno ballate su di te! Grazie, Geralt!
   1021525|00000000||Che c'è? Hai una faccia come se avessi appena bevuto dell'olio di pesce rancido...
   1021527|00000000||Ynge mi ha cacciato di casa.
   1021529|00000000||Ah... Ha scoperto che te la spassavi con Gista?
   1021531|00000000||No. Ha saputo che mi sono rifiutato di salpare per Undvik insieme a Hjalmar.
   1021533|00000000||Ha gettato la mia spada in mare. Ha detto che a un codardo non serve.
    582884|00000000||Preferivo lei fin dall'inizio.
    582886|00000000||Sono felice che abbia vinto lui. È forte e coraggioso.
    582890|00000000||È il tipo di re che ci serve!
    577863|d84f8157||Wraith diurno
    481362|00000000||Ti ho sconfitto!
   1043937|00000000||Così pare. Congratulazioni.
    503462|00000000||Ma... Ma come...? Dovevo perdere fino alla fine dei tempi...
   1043939|00000000||Che cos'è? Sento... Sento... risate e grida gioiose... Il tintinnio dei calici... E una voce... che mi chiama al banchetto degli eroi...
   1043941|00000000||Tu... mi hai lasciato vincere... Mi hai liberato. Grazie! Che gli dèi siano con te...
    503464|00000000||Arrivederci, fantasma.
    481358|00000000||Beh, ce l'hai fatta... Bravo. Tornerò. Arrivederci.
    481359|00000000||Dove vai? Non vuoi sconfiggere il Fantasma dell'Arena?
    575316|00000000||Ah, non hai vinto, dopotutto... Non è così facile, eh? Forse la prossima volta.
    583826|00000000||E se queste tre vittorie non ti bastano... c'è sempre la Grande Corsa di Hindarsfjall. Ma vincere quella non sarà per niente facile.
    575311|00000000||È andata proprio come avevi detto. Hai vinto. La gloria è tua... come anche il premio.
    479168|00000000||Salve... Possiamo parlare?
    482211|00000000||Ho combattuto quanto chiunque altro.
    482213|00000000||Che hai detto?
    482215|00000000||Ho detto che io, Soren l'Anziano, ho combattuto quanto gli altri. Sono sopravvissuto soltanto perché il colpo ha mancato gli organi vitali.
    482239|00000000||Stiamo cercando una giovane donna... Capelli biondo cenere, occhi verdi... È stata qui?
    482240|00000000||I nostri ragazzi tornano spesso dal Continente con fanciulle prigioniere... Non mi interessano. Alla mia età, una donna sotto il mio tetto è già troppo.
    482288|00000000||No... Ciri non si sarebbe mai fatta catturare.
    482290|00000000||Oh, non conosci i nostri ragazzi...
    482292|00000000||E tu non conosci Ciri.
    482216|00000000||Stiamo cercando Ciri...
    482230|00000000||Arrivederci.
    482232|00000000||Che Freya vegli su di voi.
    482218|00000000||Arrivederci.
    482217|00000000||Sei piuttosto irascibile, eh?
    482222|00000000||Un tantino irascibile, eh?
    482224|00000000||E chi non lo sarebbe? La gente viene qui per curiosare e vedere cos'è successo... Mi guardano tutti storto...
    482234|00000000||"Non ti hanno ucciso?"... "Hai seppellito tre figli, ma sei ancora vivo?"...
    482226|00000000||Non faccio che dare spiegazioni... Ma ora sono stanco. Alla prossima incursione, mi unirò ai ragazzi di Larvik e gli farò vedere quanto valgo.
    482236|00000000||Non sei un po' troppo vecchio per un'incursione?
    482238|00000000||Vecchio? Non si è mai troppo vecchi per versare il sangue della feccia del Nord... O per trovare una morte onorevole per mano loro.
    482228|00000000||Beh? E ora?
   1043363|00000000||Forse era scritto nelle stelle...?
   1043361|00000000||Tove, Kvit, Hanne... Avevano a malapena i primi peli della barba, eppure giacciono già sottoterra. Io invece io sono ancora qui, vivo e vegeto.
   1050121|00000000||Nessuno è come un witcher.
    517927|00000000||Non tormentarti... Vigi non era esattamente prevedibile. Avrebbe potuto caricare il gigante brandendo soltanto i pugni e l'uccello non appena liberato.
    517929|00000000||Chi può dire cosa sarebbe successo? Lo scontro sarebbe potuto volgere a nostro sfavore.
   1055068|00000000||La gloria per la morte del gigante dev'essere tua.
   1055072|00000000||"Hjalmar l'Ammazzagiganti" suona meglio. Era la tua avventura, meriti tu la gloria.
   1055074|00000000||Mmmh... Credo che tu abbia ragione.
    165093|00000000||Pronto? Possiamo andare?
    517960|00000000||Voglio dare un'occhiata in giro.
    517967|00000000||Voglio dare un'occhiata in giro.
    518298|00000000||In tal caso, ci vediamo alla spiaggia, vicino al porto.
    165097|00000000||Non ancora.
    165095|00000000||Andiamo.
    517962|00000000||Andiamo.
    517959|00000000||Andiamo.
    517956|00000000||Andiamocene da qui.
   1055070|00000000||Di certo, suona meglio di "Carnefice di Blaviken"... D'accordo.
   1055067|00000000||Grazie, d'accordo.
   1055064|00000000||Grazie dell'aiuto, Lupo Bianco. "Geralt l'Ammazzagiganti"... Farò in modo che i bardi ne traggano una canzone.
    517922|00000000||Non tormentarti... Vigi era imprevedibile. Avrebbe potuto caricare il gigante a mani nude non appena liberato.
    517924|00000000||E sarebbe stata la morte per tutti noi.
    517910|00000000||Vigi... Poveraccio.
    517912|00000000||Avremmo dovuto liberarlo.
    517931|00000000||Ah! Lo sapevo che l'avremmo sconfitto!
    517952|00000000||Vigi... Stupido bastardo.
   1055091|00000000||Ah ah ah!
   1055093|00000000||Ah ah ah!
   1055095|00000000||Ah ah ah!
    517934|00000000||Vigi... Stupido bastardo.
   1055087|00000000||Ah ah ah!
   1055089|00000000||Ah ah ah!
    517949|00000000||Ehm... Ma dove sono gli altri?
    348752|00000000||Di certo, non riavrò i miei soldi se ti consegno. Ma prova a fregarmi ancora, e ti troverò. Ti troverò e ti...
    348754|00000000||No, non sto mentendo! Inoltre, puoi andare dallo jarl in qualsiasi momento!
    451441|00000000||In tal caso, mi aspetto di rivederti.
    393375|00000000||Non ti denuncerò.
    451925|00000000||Mi occuperò io di te, imbroglione.
    451927|00000000||Non mi serve uno jarl per occuparmi di te, piccolo imbroglione.
    348756|00000000||Credi di potermi fregare una seconda volta? Lascerò che sia lo jarl a decidere che fare di te.
    348758|00000000||Costringimi a venire con te... Coraggio, provaci!
    393377|00000000||Sarà lo jarl a decidere che fare di te.
    348736|00000000||Chiedo umilmente perdono, ma mi trovo in un grosso impiccio. Vedi, sono un giocoliere itinerante della Temeria occupata e...
    348738|00000000||Di Temeria? Sicuro? Non di Novigrad?
    348740|00000000||Perché... Perché Novigrad? Vengo da Maribor e...
    348742|00000000||Non sei tagliato per questo genere di cose... Hai la memoria troppo corta. Vedi, ci siamo già incontrati, ma allora eri un rispettato mercante di Novigrad che voleva disperatamente tornare a casa.
    348744|00000000||Ma ti assicuro che... Argh, va bene. Mi hai beccato.
    348746|00000000||So che può sembrare disonesto, ma giuro che ti ripagherò, amico... Tutto quanto, con gli interessi. Solo... Ti prego, non portarmi dallo jarl.
