;meta[language=cz]
    551966|00000000||Neodpověděls mi na otázku.
    551968|00000000||Však nemusím.
    551940|00000000||Fringillu Vigo. Prý jsi slíbil Yennefer, že ji pustíš. Vidím… Chápu, že jsi zaneprázdněný…
   1050522|00000000||…takže tady je dopis. Měl by ti osvěžit paměť, co se Lóže týče.
    551942|00000000||Hm… Yennefer dokáže i ty nejpokornější prosby podat jako výhrůžky. To se mi na ní vždy líbilo. Nuže dobrá, staniž se.
    551549|00000000||Co chceš?
    551467|00000000||Máme válku, pokud sis náhodou nevšiml.
    551487|00000000||Všiml jsem si. Kouř, který stoupá z vypálených chatrčí, je vidět na míle daleko.
   1071752|00000000||Zaklínač. Jaké to milé překvapení.
   1050514|00000000||Zadržte.
    551464|00000000||Děkuju za vřelé přivítání, Veličenstvo.
    555010|00000000||Od Ciri se drž dál.
    555025|00000000||Je už dospělá, Geralte. Nezapomínej na to. Může se rozhodovat sama za sebe.
    555071|00000000||Tak co, jdeme?
    554808|00000000||Ta dohoda s Emhyrem je věc vás čarodějek. Jdi si tahat rozumy z někoho jiného.
    554819|00000000||Takže ti o tom nic neřekla. A co nějaké její soukromé plány?
    554983|00000000||Neříkala něco? Třeba o místě rádce? Po boku mladé, slibné císařovny?
    554797|00000000||Dohoda s Emhyrem je vaše věc.
    554880|00000000||Budeš moct spolupracovat s císařem. Nemáš radost?
    554882|00000000||Ne, totiž ano, samozřejmě že mám radost. Dosud největší chybou Lóže bylo to, že využívala především slabé vládce.
    554908|00000000||Dělá na tebe dojem, že Emhyr drží své mágy zkrátka?
    554950|00000000||Yennefer dobře dělá, že tě nenechá fušovat do politiky. Bojím se, že bys nepoznal, odkud vítr fouká, ani kdybys právě chcal přímo proti němu.
    554821|00000000||Nejsi nadšená, že můžeš pracovat s císařem?
    554801|00000000||Škorpit se můžeš s Yennefer.
    554804|00000000||O tom si promluv s Yennefer. Očividně spolu máte nějaké nevyřešené záležitosti.
    554859|00000000||Yennefer vždycky kráčela svou vlastní cestou. V podstatě mi lichotí, že se právě teď rozhodla prosazovat zájmy Lóže.
    554897|00000000||Ty jí nevěříš. Takže jakmile porazíme Hon, odejdi a najdi si útočiště někde jinde. V Redanii je prý volné místo.
    554906|00000000||To dřív strčím hlavu zeuglovi přímo do zubaté tlamy. Děkuju, ale mám jiné plány.
    554713|00000000||Yennefer musí mít na císaře obrovský vliv. Přiměla ho, aby se zaručil za bezpečí Lóže? Co si o tom myslíš?
    554721|00000000||Já? Očividně jdeš rovnou k věci. Žádné "Geralte, jsem unavená, co takhle si sednout a popovídat si?"
    554723|00000000||To je pro tebe předehra až tak důležitá?
    521646|00000000||Prosím.
    521639|00000000||Tak, a co teď?
    541763|00000000||Vypadá to, že za tebe budu muset udělat úplně všechno.
    542020|00000000||Vidíš toho strážného, který vypadá, jako by čekal na platbu?
    555775|00000000||Zrovna mi došly drobné.
    555777|00000000||Eh, ten vybírá daň v krvi, nechce peníze. Ten strážný je fiallan, jako v elfských legendách. Copak ty opravdu vůbec nic nečteš?
    558387|00000000||Jdeme na ty parchanty.
    558388|00000000||S radostí, Geralte. S radostí.
    558386|00000000||Můžeme začít.
    559812|00000000||Ještě trochu déle.
    559814|00000000||Dobrá… ale zbytečně se nezdržuj.
    558385|00000000||Dej mi ještě chvíli.
    558384|00000000||Takže, Geralte… připraven?
    558356|00000000||Geralt z Rivie?
    558357|00000000||Znáš ještě nějaké jiné Geralty?
    559160|00000000||Půjdeš s námi, prosím. Už tě očekávají.
    558379|00000000||Zaujmete pozici na útesech, tady, tady a--
    559165|00000000||Díky. Myslím, že víme, jak utvořit kruh.
    559167|00000000||I ti z nás, kterým se prozatím nedostává očí.
    559169|00000000||Chtěl jsem se jen vyvarovat… Oh, Geralte. Čekali jsme na tebe.
    559191|00000000||Prostý, leč zároveň tak spletitý. Teď ne, Geralte.
    559193|00000000||Nic si z toho nedělej. Prostota má své vlastní kouzlo.
    559175|00000000||Vážně? Vypadá to, že jste už začali.
    559177|00000000||Probírali jsme otázky magické povahy. Nic, co by tě příliš zajímalo.
    559179|00000000||Jasně. Protože jsem jen prostý zaklínač.
    559171|00000000||Vážně? Zdá se, že jste začali beze mě.
    559170|00000000||Jak milé.
    559173|00000000||To je od vás milé.
    559383|00000000||Chtěl jsi vysvětlit plán.
    559385|00000000||Je prostý… Což neznamená, že jeho provedení bude jednoduché.
    559387|00000000||Já aktivuji Sluneční kámen. Pokud Caranthir na volání odpoví, měl by se v zátoce krátce poté objevit Naglfar.
    559389|00000000||Lóže pak lodi musí zabránit v návratu do světa Aen Elle, zatímco císařská flotila jí zablokuje únik na moře.
    559391|00000000||Sedmý pěší pluk z Ymlats pod vedením vévody var Attre se pak musí dostat na palubu. S tvou pomocí, přirozeně.
    559403|00000000||A co ty? Ty budeš kde?
    559405|00000000||Budu čekat v záloze. Pokud se něco pokazí… zasáhnu.
    559407|00000000||Mm. Jako generál velící svým jednotkám z kopce. Dáš nám znamení trubkou, nebo použiješ poslíčky?
    559409|00000000||Vytříbená ironie, ale čím jsem si ji zasloužil? Dal jsem ti snad podnět pochybovat o mých záměrech?
    559393|00000000||A ty? Co budeš dělat ty?
    559392|00000000||Císař tedy nešetří…
    559395|00000000||Páni… Emhyr na prostředcích rozhodně nešetří.
    559397|00000000||Pozastavil celé své tažení na Skellige, aby nám pomohl.
    559399|00000000||Nedělá to proto, aby byl hodný, to mi věř.
    559401|00000000||Dělá to ze stejného důvodu jako my ostatní.
    559411|00000000||Dámy a pánové, méně slov, více činů, prosím. Sestry… Musíme vyšplhat na útesy.
    559413|00000000||Hodně štěstí.
    559416|00000000||V tom plánu chybí jeden důležitý prvek… A co Ciri?
    559420|00000000||Zireael počká. V bezpečné vzdálenosti od Naglfaru.
    560269|00000000||Nemáš právo jí rozkazovat.
    560271|00000000||Nemáš právo jí rozkazovat.
    560273|00000000||Úsměvné. Zireael řekla to samé, ačkoliv mnohem hlasitěji.
    560274|00000000||Ve skutečnosti toto právo mám. Neboť jen já vím, jak Sluneční kámen aktivovat. Což udělám podle svého - nebo vůbec.
    560343|00000000||Zireael uznala sílu mého argumentu. Nepochybuji, že ty tak učiníš rovněž.
    559476|00000000||Zakazovat Ciri cokoliv nemá smysl.
    559502|00000000||Říkat Ciri, že něco nesmí, je kontraproduktivní. To ze mě mluví zkušenost…Nakonec si dělá, co chce.
    559504|00000000||Doufejme.
    559506|00000000||Pardon?
    559477|00000000||Nezněla moc přesvědčeně.
    559508|00000000||Nezněla moc přesvědčeně.
    559510|00000000||Ne. Ale jen tak ji svázat a teleportovat pryč dost dobře nemohu, že?
    559512|00000000||Hmm. Něco takového nedoporučuju zkoušet.
   1123509|00000000||Nedaleko odsud je maják...
   1123676|00000000||Hm. Nedaleko odsud je maják, víš...
   1123679|00000000||Geralte! Navrhuješ snad, abychom--?
   1123681|00000000||Ne... no, aspoň ne zrovna teď. Jen jsem chtěl říct...
   1123684|00000000||Chtěl jsem to říct už od... od Novigradu. Kdykoliv vidím světlo majáku, cítím se dobře. Myslím při tom na tebe.
   1123709|00000000||Budu v pořádku.
   1123758|00000000||Já to zvládnu.
   1123760|00000000||To říkáš vždycky.
   1123762|00000000||Taky mě ještě nezabili.
   1126893|00000000||No, akorát jednou tenkrát...
   1051794|00000000||Yen? Proč jsi přišla?
   1051796|00000000||Přišla jsem za tebou.
   1051798|00000000||Něco se stalo?
   1051800|00000000||Ještě ne. Ale brzo může. Možná to nepřežijeme. Naše šance jsou vlastně dost malé.
   1051819|00000000||No, jsme tady, abychom se Eredinovi a Divokému honu postavili v plné síle. Mohlo by to být jako u Soddenu. Nebo horší.
   1051825|00000000||Nic nemůže být horší než Sodden.
   1051802|00000000||Pravda, může to být drsné.
   1051821|00000000||Yen, nepropadej panice. To ti prostě nesluší.
   1051823|00000000||Já nepanikařím. Jen se snažím být realistická. Ale kvůli tomu jsem nepřišla.
   1051803|00000000||Nepropadej panice.
   1051801|00000000||Neboj se. Bude to v pořádku.
   1051805|00000000||Ušli jsme dlouhou cestu a já se propadnu, než abych měl selhat. Bude to v pořádku.
   1051808|00000000||Obdivuju tvůj optimismus. Kéž bych ho sdílela.
   1051811|00000000||Poslouchej. Až bude po všem, jestli přežijeme… chci odejít, někam daleko. A byla bych ráda, kdybys šel se mnou.
   1051813|00000000||Kam?
   1051815|00000000||Kamkoliv. Do Povissu, za Dračí hory, třeba do Zerrikánie. Tak daleko od politiky, pletich a takzvané vyšší společnosti, jak to jen bude možné.
   1051837|00000000||Ty chceš pověsit politiku na hřebík? No páni.
   1051840|00000000||Ty? Abys pověsila politiku na hřebík? V tomhle světě jsi jak ve svém živlu, je to tvůj život.
   1051842|00000000||Je čas začít znovu.
   1051844|00000000||Tomu uvěřím, až to uvidím. I teď jsi v tom až po uši.
   1051847|00000000||Ano, ale jen abych to tu urovnala, abych se mohla stáhnout z pozice, kdy jsem měla navrch.
   1051849|00000000||A co pak? Malá osamělá chajda s květinovou zahrádkou?
   1051851|00000000||Proč ne? Pokud jsi o tom snil…
   1051853|00000000||Odejdeme spolu, kamkoliv budeme chtít, a budeme dělat, co se nám zachce.
   1051860|00000000||Takže půjdeš?
   1051870|00000000||Nevím, Yen. Upřímně to zní až moc krásně, aby to byla pravda.
   1051880|00000000||Vrátit se budeš moct vždycky - když budeme mít po měsíci jeden druhého plné zuby.
   1051882|00000000||Hmm… Dobrá. Jsem ochoten to zkusit.
   1051884|00000000||To mi stačí.
   1051836|00000000||To zní až příliš krásně.
   1051835|00000000||Jistě že půjdu.
   1051862|00000000||S tebou bych šel kamkoliv.
   1051864|00000000||V tuhle odpověď jsem doufala.
   1051868|00000000||Jdi, Geralte, Avallac'h čeká.
   1056445|00000000||A nenech se zabít, zaklínači.
   1123764|00000000||Ach, Geralte. Ty jsi tak roztomilý, když se snažíš být vtipný.
   1123766|00000000||Snažím? To vezmi zpátky. Byl to skvělý vtip.
   1123768|00000000||Mhm. To víš, že jo.
   1123771|00000000||Miluju tě, víš?
   1123780|00000000||Chceš mě rozbrečet? Ciri by mi to nikdy nezapomněla. No tak, pusť.
   1123783|00000000||Taky tě miluju.
   1123752|00000000||Na to nesmíš myslet.
   1123754|00000000||A na co mám myslet?
   1123756|00000000||Na Emhyra var Emreis. V průvodu. A je úplně nahatý.
   1123708|00000000||Na to nemysli.
   1123702|00000000||Neuvěřitelné. Ty jsi řekl něco romantického! Ty, Geralt z Rivie!
   1123686|00000000||Chvilková slabost.
   1123707|00000000||Tak ty si během bitvy prosím odpusť. Kdyby se ti mělo něco stát...
   1123688|00000000||Všechen ten sníh... Nutí mě myslet na Kovir.
   1123690|00000000||A na co myslíš?
   1123692|00000000||Že je tam takhle celý rok. Tma a zima.
   1123694|00000000||A víš co? Vůbec mi to nebude vadit.
   1123696|00000000||Nebude?
   1123698|00000000||Ne. Protože dny, no, dny mohou být krátké, ale noci? Noci budou dlouhé.
   1123700|00000000||Nemůžu se dočkat.
   1123674|00000000||Nemůžu se dočkat, až vyrazíme do Koviru.
   1123499|00000000||Triss? Je všechno v pořádku?
   1123501|00000000||Ano. Chtěla jsem si s tebou jen na chvíli promluvit. Než... než to začne.
   1123503|00000000||Hlavu vzhůru. Hon je oslabený. Máme--
   1123505|00000000||Ne. O bitvě už ne.
   1123508|00000000||Prostě mě obejmi. A řekni mi něco hezkého.
   1056437|00000000||Nemáme času nazbyt. Čím dřív se o to postaráme, tím líp.
   1056439|00000000||Následuj mě.
   1056434|00000000||Jo, půjdeme.
   1056441|00000000||Asi by se hodilo pár elixírů. Jen jdi, brzo tě dohoním.
   1056443|00000000||Ale příliš neotálej.
   1056435|00000000||Připojím se později.
   1056433|00000000||Pokud tedy se mnou nechceš jít hned.
    559514|00000000||Čas se krátí. Pokud chceš něco dělat, uvař si nějaké ty své substance či co… Pusť se do toho.
    559516|00000000||Později už nebudeš mít možnost. Budu tě čekat u lodí mezi vojáky.
    559518|00000000||To nic.
    559496|00000000||To má po svém otci.
    559498|00000000||Dovoluji si nesouhlasit… Emhyr je pragmatik, Ciri idealistka.
    559500|00000000||Idealistka? O čem to mluvíš?
    559468|00000000||Má osobnost po svém otci.
    560395|00000000||Zireael… Přísaháš, že zůstaneš na břehu?
    560397|00000000||Mám snad na vybranou?
    560400|00000000||Kam jdeš?
    560403|00000000||Projít se. Nebo to se taky nesmí? Protože bych si mohla zlomit nohu?
    560410|00000000||Ach ano… Starší krev dokáže být řevnivá.
    560338|00000000||Heh. Myslela jsem, že aspoň ty mě budeš brát vážně.
    560340|00000000||Nikdy tě neberu nijak jinak. To přece víš.
    560393|00000000||Eredina neporazíš, nemáš šanci… Sakra, ani já si nejsem jistý, jestli to dokážu. Takže se od něj drž daleko, hodně daleko.
    560345|00000000||No… nemůžu říct, že se v tom pleteš.
    560268|00000000||Nemůžu říct, že by ses pletl.
    560263|00000000||Jen tak hádám - tohles asi na mysli neměla.
    560265|00000000||Ne. Chtěla jsem jít s vámi - to jsem chtěla.
    560267|00000000||Ale to já nedovolím. Je to příliš velké riziko.
    559421|00000000||Hádám, že to nebyl její nápad…
    559422|00000000||Moudré.
    560347|00000000||To dává smysl.
    414295|00000000||Počkej, něco tady je. Necítíš to?
    414297|00000000||Ne. Můj medailon...
    562076|00000000||Směšná cetka. Nenech se vysmát.
    562138|00000000||Naladit se na elfskou magii je jen o trošku obtížnější než vyčmuchat smradlavého běsa.
    562140|00000000||Sleduj. Arha'an lumar!
    562134|00000000||No a co?
    562136|00000000||Takže tady ten Sluneční kámen někde je. Nestůj tam jako kůl v plotě. Zkus nastavit ta zrcadla.
    549864|00000000||Myslíš, že tě ušetřím?
    549866|00000000||Myslíš, že tě ušetřím?
    549868|00000000||Myslím, že nezaútočíš na neozbrojeného.
    549870|00000000||Tím bych si nebyl tak jistý. Mám hodně mizernou náladu.
    549884|00000000||To tě nenapadlo mě varovat?
    549886|00000000||To tě ani nenapadlo, že bys mě mohla varovat a oznámit, jaké máš plány?
    549888|00000000||Promiň. Vím, měla jsem… ale bála jsem se, že nepochopíš.
    549890|00000000||Ach jo, mám pocit, jako bych mluvil s Yennefer.
    549892|00000000||Odejdi se mnou. Prosím.
    549894|00000000||Odejdu. Až se vrátím z věže, Geralte… jestli se vrátím.
   1077808|00000000||Avallac'h ti do hlavy nacpal nesmysly.
   1077828|00000000||Avallac'h ti popletl hlavu žvásty starých kartářek.
   1077830|00000000||Mýlíš se. Bílá zima se opravdu blíží. Světy zamrznou, jeden po druhém, a veškerý život bude zahuben.
   1077832|00000000||Avallac'h mi dal na výběr. A já se rozhodla. Musím to zastavit.
   1077806|00000000||Nemusíš takovou oběť podstupovat.
   1077816|00000000||Nemusíš takovou oběť podstupovat.
   1077818|00000000||To se mýlíš. Bílá zima je nevyhnutelná. Přijde zmrazit světy, jeden po druhém, a zahubí veškerý život.
   1077820|00000000||Tu zkázu můžu zastavit jedině já. Hodně jsem o tom přemýšlela a už jsem se rozhodla.
   1077805|00000000||Žádný zánik se konat nebude.
   1077810|00000000||Ithlinnino proroctví jsou žvásty. Zkáza není náš osud.
   1077812|00000000||Ty jsi budoucnost viděl, pamatuješ? Entropie je nevyhnutelná. Světy zamrznou, jeden po druhém, a veškerý život zahyne.
   1077814|00000000||Avallac'h má pravdu. Pokud nic neudělám, budou lidé, elfové, všichni čelit zkáze.
    549907|00000000||Ciri… zakazuju ti to.
    549922|00000000||Ciri... Zakazuju ti to.
    549924|00000000||Znáš mě. Ze všeho nejradši porušuju pravidla.
    549926|00000000||Ale tohle? Tímhle zlomíš víc než jen pravidlo.
    549928|00000000||Promiň.
    549908|00000000||Nedělej mi to. Prosím.
    549930|00000000||Tohle mi nedělej... Tohle ne. Prosím. Ne teď.
    549932|00000000||Geralte, věř mi... Hospoda, svařené víno, naše boty se suší u ohně - nic bych nechtěla víc.
    549933|00000000||Ale nemůžu. Musím to zkusit. Kvůli tobě, Yen, Triss... kvůli všem.
    549969|00000000||Drž mi palce.
    549909|00000000||Hodně štěstí.
    549935|00000000||Hodně štěstí, Ciri.
    549937|00000000||Možná jsem ti to měla říct… teď vidím, že bys možná rozuměl.
    549939|00000000||Znám tě líp, než si myslíš.
    549941|00000000||Nenech mě čekat.
   1062870|00000000||[Neříkat nic.]
   1077834|00000000||Musí být jiný způsob…
   1077836|00000000||Co ty můžeš vědět o záchraně světa, hlupáčku? Jsi jen zaklínač.
   1077841|00000000||Tohle je můj příběh, ne tvůj. Musíš mě ho nechat dovyprávět.
   1077822|00000000||Bílá zima mě vůbec nezajímá. Pojďme prostě pryč.
   1077824|00000000||Ne, Geralte. Viděla jsem, co má přijít. Vím, že se blíží zkáza. Světy zamrznou, jeden po druhém, a veškerý život bude zahuben.
   1077826|00000000||Jen já tomu můžu předejít.
   1077807|00000000||To je mi jedno. Jdeme.
    549896|00000000||Proč to u všech čertů chceš udělat? Divoký hon je poražený…
    549898|00000000||Ale Bílá zima ne…
    549900|00000000||Proroctví jsou pravdivá. Viděla jsem světy spoutané ledem... Vím, co vás čeká.
    549902|00000000||Bílou zimu může zastavit jen Starší krev. Jen já ji můžu zastavit.
    549883|00000000||Proč to chceš udělat?
    549876|00000000||Nejsem tvůj nepřítel. Jen pomáhám Cirille.
    549878|00000000||Já ti nevěřím. Nemůžu. Ne po tom všem, co se stalo.
    549880|00000000||A mně věřit budeš?
    549882|00000000||Avallac'h říká pravdu. Požádala jsem ho, aby mi pomohl věž otevřít… protože do ní vstoupím.
    549872|00000000||Myslíš, že na to skočím? Tak to se šeredně pleteš.
    549874|00000000||Kdysi jsem ti věřil. Znovu už tu chybu neudělám.
    549863|00000000||Na to ti neskočím.
    549835|00000000||Geralte… Škoda. Doufal jsem, že tohle nebudeš muset vidět.
    549837|00000000||Kde je Ciri?
    549839|00000000||Poblíž. Poslyš…
    549840|00000000||Drž hubu.
    549861|00000000||Už jsem slyšel dost tvých keců. Tas meč a skončíme s tím.
    563092|00000000||Hmm, teď už jsou otevřené.
   1063099|00000000||Nějaká poslední slova?
   1063101|00000000||Sklapni a bojuj.
   1063103|00000000||Svou možnost jsi měl.
   1063105|00000000||Zaklínači. Doufal jsem, že přijdeš.
   1063107|00000000||Protože?
   1063109|00000000||Chci ti něco říct. Ale udělám to potom.
   1063111|00000000||Až budeš umírat.
    533366|00000000||Potopte tu loďku! Palte!
    560184|00000000||Počkat! Jsem vyjednavač! Jsem-- Sakra!
   1074904|00000000||Kurva!
   1074912|00000000||Geralte… teď ne, prosím.
   1074908|00000000||Zdá se, že děláš pokroky…
   1074910|00000000||Mhm… Pomalu… ale jistě kupředu…
    559249|00000000||Děkuji ti za pomoc.
    559251|00000000||Ještě jednu věc, Geralte. Co se týče těch jeskyní nebo rozvalin – Matyášovi a Erlingovi předkové by je byli vybílili už před staletími, kdyby je nechránily nějaké magické bariéry.
    559253|00000000||Vezmi s sebou nějakou čarodějku. Rozhodně aspoň jednu.
    559255|00000000||Zrovna jich můžu vzít hned několik.
    559257|00000000||Bohové nás ochraňujte.
    559237|00000000||Děkuji za pomoc.
    559236|00000000||Žábrovec?
    559239|00000000||Žábrovec? To zní zajímavě.
    559241|00000000||Říká se mu tak. Dokáže se potápět celé hodiny.
    559243|00000000||Nikdo neví, jak to ten chlap dělá. Ale já mám své podezření.
    559245|00000000||Hm. A nemáš ho rád, co?
    559247|00000000||Není to nic osobního. Jeho otce a dědka jsem taky nemohl vystát.
    559221|00000000||Poslyš, Myšilove, nevíš něco o nějakém Slunečním kameni? Podle legend by se měl nacházet někde na Skellige.
    559223|00000000||Nejdřív Uroborova maska, teď Sluneční kámen. Příšery si můžou oddechnout, ty teď lovíš poklady.
    559229|00000000||Nikdy jsem se o Aen Seidhe moc nezajímal. Ale máme tu jednoho skalda, nějakého Eyvinda - ten by ti mohl pomoct. Vyprávěl mi kdysi o nějakých špatně dostupných jeskyních nebo zříceninách nebo o něčem podobném…
    559231|00000000||Kde bych ho našel?
    559233|00000000||Dneska? Určitě bude v Arinbjornu.
    559235|00000000||A můžeš se taky zeptat lovců perel, jako je Erling a Matyáš Žábrovec. V poslední době se potápějí u ústí zátoky, na východní straně.
    559208|00000000||Slyšel jsi někdy o Slunečním kameni?
    559340|00000000||Jak si vede Hjalmar?
    559371|00000000||Ten kluk si začal libovat v hrdinských výpravách. Vládu nad ostrovy nechal na svém otci.
    559372|00000000||Což je v zásadě štěstí, protože teď, když je válka na spadnutí, potřebujeme zkušenějšího vůdce.
    559375|00000000||A Cerys?
    559377|00000000||Řekl bych, že je o dost užitečnější než Hjalmar.
    559310|00000000||Jak se má Hjalmar?
    559209|00000000||Jak se má Cerys?
    559217|00000000||Jak to zvládá Cerys?
    559332|00000000||Byla by z ní skvělá královna, kdyby se jí podařilo vymanit ze stínu svého otce.
    559334|00000000||Podpořili ji všichni kromě Lugoše. Když se ale na obzoru objevila nepřátelská flotila, vzal jarl věci do vlastních rukou.
    559342|00000000||A co Hjalmar?
    559354|00000000||Ten kluk už vedl tři nájezdy proti císařské flotile. Všechny proti Crachově vůli a všechny neúspěšně. Ale stejně už sbírá dobrovolníky pro další.
    559356|00000000||Ano, to je Hjalmarovi podobné.
   1066633|00000000||No, Geralte, vidím, že se bez tebe žádná rvačka na Skellige neobejde.
   1066635|00000000||To je sprosté a nepřesné, Myšilove. Mně přijde, že jsem jich pár vynechal.
   1070684|00000000||Na trůnu sedí krev Crachovy krve a to je tvoje dílo. Obávám se, že jsi vyvolal malou občanskou válku.
    559275|00000000||Zdá se, že klan Drummond zaútočí dřív, než jsme si mysleli.
    559277|00000000||Myslel jsem, že tě Crach poslal, abys s Lugošem sjednal dohodu.
    559279|00000000||Dohodu! Jen Crach se domníval, že něco takového je teď ještě možné.
    559302|00000000||Takže jsem ti to vlastně zas tak moc nepokazil?
    559304|00000000||Ne, tentokrát ne. Lugošovou smrtí se věci hodně změní. Jeho bratranec, který teď bude jmenován jarlem, není dobrý vůdce, je to hlupák. Tahle válka začne brzy, ale stejně tak i rychle skončí.
    559219|00000000||Proč ses vlastně vrátil na Skellige?
    556499|00000000||{Esse'tilleadh, theervil esse'caen. } [Měli bychom se vrátit, dokud můžeme.]
    556500|00000000||{Dat esse'croigh a va voot breuk aen orde? Ess ae’iarr.. } [A nechat se oběsit za neposlechnutí rozkazu? Radši bych..]
    556501|00000000||{Gar'ean! Havfrue! } [Pozor! Sirény!]
    556513|00000000||{N'esse mar a tha. A'ess ver'spreiden aep evellien Inis. Caen Skellig'ea esse'dekk hwre. } [To není dobré. Jsme rozptýlení po celém ostrově… Skelližani by na nás mohli číhat.]
    556514|00000000||{Ker'zaer esse'vyos que getan. } [Císař ví, co dělá.]
    553661|00000000||Eyvinde!
    553684|00000000||Eyvinde!
    553687|00000000||Co je?
    553689|00000000||Já... chtěl jsem tě ujistit, že se do té jeskyně opravdu chci jenom podívat. Kvůli výzkumu.
    553702|00000000||Sbírám materiál na dobrodružný román.
    553735|00000000||Píšu dobrodružný román, sbírám na ni materiál.
    553737|00000000||Chceš napsat o příjezdu Bílé flotily? To je výborný nápad.
    553745|00000000||V tom případě určitě budeš chtít vidět můj překlad Písně o Gealbhanovi a Dillian...?
    553739|00000000||Ano, to bych moc rád. Takže, kde bych našel ty jeskyně?
    553698|00000000||Musíš se plavit na východ od Kaer Trolde. Jeskyně je ve srázu a je k ní přístup pouze od moře.
    553708|00000000||Tak se měj. A... hodně štěstí s tou bílou velrybou.
    553710|00000000||Objeví se dneska. Jsem si tím jist.
    553718|00000000||Píšu historické pojednání o Aen Seidhe. Pod vedením Myšilova.
    553720|00000000||Myšilova? Ten chlap se o elfy z hor nikdy nezajímal.
    553722|00000000||Je mi to jasné, ty lumpe - chceš to tam vykrást! Můžeš mě třeba rozkrájet na kousky, nikdy ti o té jeskyni neřeknu.
    553764|00000000||Ach jo.
    553701|00000000||Píšu pod vedením Myšilova pojednání o Aen Seidhe.
    553700|00000000||Výzkumu?
    553693|00000000||Ha! Podle tvýho ksichtu vidím, že jsem měl pravdu! A když pomyslím, že jsem tě za vykradače nepovažoval…
    553695|00000000||Chtěl bych se do těch jeskyní jen podívat. Kvůli výzkumu.
    553662|00000000||[zůstat zticha]
    553617|00000000||Budu vyhlížet Gevorga s tebou. A mohl bys mi zatím říct, jestli něco nevíš o elfských rozvalinách na Skellige.
    553640|00000000||Slyšel jsem o nějaké jeskyni, do které nikdo nedokáže vstoupit.
