;meta[language=cz]
    553638|00000000||A to je dobře. Jinak už by je byli dávno vyplenili jako všechny ostatní.
    553527|00000000||Budu ji vyhlížet s tebou.
    553523|00000000||Co je to za velrybu?
    553462|00000000||Co je na té velrybě tak zvláštního?
    553592|00000000||Má se objevit, když přízraky sestoupí z nebes do vln, had probudí hněv moří a ledový netvor pozře ostrovy.
    553593|00000000||Budu prvním bardem, který o tom složí baladu.
    553598|00000000||O Kletbě Černého slunce se ty legendy náhodou nezmiňují, že ne?
    553600|00000000||O černém slunci? Nemám ponětí, o čem to mluvíš...
    553610|00000000||Nevadí, není to důležité.
    553456|00000000||Teď nemám čas!
    553553|00000000||Vyhlížíš nilfgaardskou flotilu?
    553555|00000000||Flotilu? Co? Vlastně ano, říkali něco takového... Ne, mám teď v hlavě důležitější věci.
    553590|00000000||Podle mých výpočtů dnes nastane den, kdy legendární bílá velryba Gevorg připluje do vod Skellige.
    553566|00000000||Čekal jsem na to celý život...
    553461|00000000||Nezapomněl jsi na něco?
    553469|00000000||Na co jako? Ale ano! Zapálit oheň. Zapovídal jsem se...
    553471|00000000||No to mě… navlhnul mi troud. Jak to teď udělám...
    553472|00000000||Ukaž, pomůžu ti.
    553458|00000000||Zapomněl jsi zapálit signální oheň.
    553457|00000000||Na shledanou.
   1065605|00000000||Jdeme na to.
   1065607|00000000||Brzy se vraťte, jasné?
   1067788|00000000||Mhm. Měj se.
   1067732|00000000||Pojďme, Ciri.
   1065609|00000000||Můžeš ho použít sama, Ciri. Sejdeme se na Hindarsfjallu.
   1065611|00000000||Jak chceš. Budu u hřbitova.
   1065613|00000000||Postarejte se o to rychle, prosím. A Ciri, vyvaruj se potíží, ano?
   1067785|00000000||Žádné potíže nemám v úmyslu. Zatím.
   1067753|00000000||Setkáme se tam.
    565138|00000000||Zajdu tam s tebou.
    565463|00000000||Děkuju.
   1067735|00000000||Mohla bys otevřít portál - na Hindarsfjall?
    565465|00000000||Mohla.
    565136|00000000||Ano, půjdu s tebou.
    565384|00000000||Jasně. Vždycky jsou nějaké důležitější věci.
    565390|00000000||Já si s ní promluvím. Ty bys jí hned všechno prozradil.
    565380|00000000||Ciri, na tohle teď nemáme čas.
    565382|00000000||Můžeš tam zajít později. Teď máme na starosti důležitější věci.
    565137|00000000||Na to není čas.
    565487|00000000||Musíme se hned vrátit na loď?
    565611|00000000||Chtěla by ses podívat ještě někam jinam?
    565612|00000000||Tady ne. Na Hindarsfjallu. V Lofotách. Potkala jsem mladého muže, Skjalla, a chtěla bych...
    565631|00000000||Co se stalo?
    565651|00000000||Ciri, Skjall je mrtvý.
    565653|00000000||Divoký hon... všichni? Nikdo nepřežil?
    565659|00000000||Skjall zemřel až později.
    565676|00000000||Víš určitě, že to byl on? Setkala ses s ním?
    565716|00000000||Byla jsem tam a viděla jsem jeho tělo.
    565719|00000000||Nešel bys se mnou aspoň na jeho hrob? Chtěla bych se s ním... rozloučit.
    517302|00000000||Tak co? Nějaké usvědčující dopisy? Spousta kostlivců ve skříni?
    517303|00000000||Ještě jsme ani neotevřely dveře.
    517305|00000000||Je to velmi složitá magická bariéra. Zkusíme to...
    517311|00000000||Geata'ar ligen!
   1055110|231374e3||Skelližan
    556520|00000000||{Aen iarean nyald aep kroofeir… } [Hledáme jehlu v kupce sena…]
    519932|00000000||Slyšíš to?
    519933|00000000||Hmm.
    534052|00000000||Z cesty, starče… Tvůj život ušetřím.
    534726|00000000||Jen si ho zkus vzít.
    534728|00000000||Hahaha… Jak si přeješ.
    534778|00000000||Aaaaach!
    534051|00000000||Nějaká poslední slova?
    534721|00000000||Ještě jsi mě nezabil.
    534723|00000000||Ne. Tohle si užívám. Jsi moje hračka.
    534050|00000000||Ubohé… Prostě ubohé…
    534772|00000000||Přestaň si hrát na válečníka… Bojuj!
    534774|00000000||Chceš zemřít čestnou smrtí, o to jde? Tak to budeš zklamán.
    534776|00000000||Aaaargh!
    566083|00000000||Možná by sis s ním přece jen měla promluvit.
    566085|00000000||To nemá smysl... a teď už teprv ne.
    566087|00000000||A později? A neměla bys zapomínat na svého otce jenom proto, že je nejbohatší a nejmocnější na světě...
    566089|00000000||… a taky je to ten nejprohnilejší tyran, kterému se nedá věřit ani za mák.
    566091|00000000||Víš, že ty bys mu jako jediná ze všech lidí důvěřovat mohla a možná bys dokonce měla.
    566093|00000000||A co se prohnilého prašivého diktátora týče?
    566095|00000000||Na to si časem zvykneš.
    548880|00000000||Mockrát děkuju.
    533642|00000000||Myslela jsem, že se budeš chtít setkat s Crachem.
    533645|00000000||Já jenom, že... Co když zítra zase zmizím? A tentokrát pro dobrou věc, jako kdysi moje matka?
    534678|00000000||Zdá se mi... že bych se radši neměla vídat s nikým, kdo... kdo mě má rád. Aspoň dokud neporazím Divoký hon.
    534679|00000000||Vždycky tě můžeme zase vysadit na Ostrově mlh.
    534066|00000000||Trochu jsme se porozhlédli u tebe v laboratoriu.
    534067|00000000||O tom nepochybuji. Ale proč jste to vůbec dělali? Mohli jste se mě prostě zeptat.
    544423|00000000||A ty bys nám prozradil celou pravdu o svých pokusech se Starší krví? O tom pochybuji.
    544425|00000000||Nezatajil jsem vám nic, co by nám mohlo být v boji proti Eredinovi k užitku.
    544426|00000000||A co se týče Starší krve... Všichni si jistě uvědomujete, jak je Ciri výjimečná. Já pouze jako jediný vím, až jak moc je výjimečná.
    544440|00000000||Nebo jsi jí jednoduše posedlý.
    544442|00000000||Já že jsem posedlý?
    559125|00000000||Chceš být králem z milosti Nilfgaardu?
    559129|00000000||Chceš být králem z milosti Nilfgaardu?
    559142|00000000||Štěkáš, protože se chystáš kousnout?
    559149|00000000||Poslal tě sem snad Crach pro mou hlavu? Tak do toho, zkus si ji vzít!
    561116|00000000||Chopte se jich!
    559127|00000000||Jak bys to nazval, pokud ne velezrada?
    559124|00000000||A jak bys to nazval, když ne velezrada?
    558553|00000000||Přece nepokleknu před nějakým an Craitem! Nikdy! Je ti to jasný?!
    558554|00000000||Takže místo toho radši pomůžeš Černým?
    559089|00000000||To dřív pomůžu přeludům ze samotnýho Mörhoggu, než dopustím, aby Crach vládnul celýmu Skellige!
    558555|00000000||A co tomu řeknou tví muži? Budou tě následovat, až tě jarlové prohlásí za zrádce?
    559120|00000000||Tady jsi na mý půdě, druide. Dávej si pozor na jazyk!
    558886|00000000||Birna Bran všechno sjednala za našima zádama! A dokonce to ani nepopírá!
    558872|00000000||Co se tam děje?
    558868|00000000||Co se to tam děje?
    558870|00000000||Ta mrcha se nás snaží prodat Černejm! Chceš se jít podívat? Prosím!
    558888|00000000||Grr… Já se na tu hanbu nemůžu dívat.
    558891|00000000||A co Svanrige? Králem je tady konec konců on.
    558893|00000000||Jenže kraluje asi tak dobře, jako rybí prdel hvízdá.
    558878|00000000||Hledám Myšilova.
    558880|00000000||Ten je tam s nimi uvnitř, ale vypadá bledě jak vyplavenej kapr... Jestli toho smrada nepostaví do latě on, tak kdo?
    558882|00000000||Ale ne, tvrdí, že nám bohové dali krále, tak ho musíme podpořit! Jenže co máme podpořit? Svanrige tam bude stát jako dřevěnej panák, zatímco nás ta babizna zaprodá Černejm?
    558871|00000000||Hledám Myšilova.
    558874|00000000||Kdyby byl starej Bran ještě naživu, podříznul by tý zrádný čubce hrdlo!
    558876|00000000||A to štěně jsme měli utopit ve slaný vodě hned po narození!
   1070432|00000000||Šťouchaný brambory s hustou omáčkou. Nebo trochu tvrdýho sejra z Gemmery.
   1070452|00000000||Hovězí guláš - to bych si dal. Moje máma do něj dávala pečenou cibuli, víš. Tu křupavou.
   1070454|00000000||Chjo… Jak dlouho se dá přežít na rybách a námořnickejch sušenkách?
   1063162|00000000||Ticho. Je naprostý klid.
   1063164|00000000||Je to past. Musíme zmizet. Hned.
   1063166|00000000||Tentokrát ne.
   1063168|00000000||Ne, Zireael. Nejsi připravena. Neovládáš svou moc.
   1063170|00000000||Já to zvládnu. Jdi mi z cesty.
   1063172|00000000||Ciri.
   1063174|00000000||Ciri!
   1063176|00000000||Ten led… je to kouzlo. Musíš najít mága, který jej seslal, a zlomit mu hůl.
   1063178|00000000||Zlomím mu něco víc než jen hůl.
   1063094|00000000||Za mnou. Naglfar musí být blízko.
    557050|00000000||Arhaaam shinaaaz!
    557045|00000000||Co to říkala?
    557046|00000000||Že nejsi její typ.
   1069328|00000000||Po setmění bude snazší se proplížit na palubu.
   1031236|00000000||Co teď budeš dělat? Chceš si vypěstovat nové oči jako Vilgefortz?
   1056344|00000000||Pamatuju si ten okamžik, kdy jsem ho zabil - ještě nedorostly, nebyly úplně vyzrálé. Vypadaly… nechutně, ale…
   1031237|00000000||Hádám, že tvá zmínka o tom úchylovi je čistě náhodná.
   1056346|00000000||Jistěže.
   1056348|00000000||Taky jsem slyšel o nějakém bohatém slepém trpaslíkovi z Mahakamu…
   1056350|00000000||…nechal si do důlků vpravit dva dost velké rubíny.
   1056352|00000000||Neviděl vůbec nic, ale prý to vypadalo náramně.
