;meta[language=zh]
    554713|00000000||葉奈法竟然能讓皇帝答應確保集會所的安全，顯然她很受重用。你對這件事有什麼看法？
    554721|00000000||你問我的看法？想誘導我說什麼，不先說句「傑洛特，我累了，我們坐下來聊聊」嗎？
    554723|00000000||你那麼看重前戲啊？
    521646|00000000||看吧。
    521639|00000000||現在呢？
    541763|00000000||唉，看來什麼都要我幫你。
    542020|00000000||你有看到那個等著領薪水的守衛嗎？
    555775|00000000||我剛好沒零錢了。
    555777|00000000||唉唷，他要的是血，不是錢。那個守衛是精靈傳說中的伐艾倫，你都不讀書嗎？
    558387|00000000||我們去解決掉這些混蛋。
    558388|00000000||傑洛特，當然，我很樂意奉陪。 
    558386|00000000||可以開始了。
    559812|00000000||再給我一點時間。
    559814|00000000||好吧，但別拖太久。
    558385|00000000||等我一下。
    558384|00000000||傑洛特，準備好了吧？
    558356|00000000||利維亞的傑洛特 ？
    558357|00000000||你還認識別的傑洛特嗎？
    559160|00000000||請跟我來，大家在等你了。
    558379|00000000||妳們分別站在懸崖的這邊、這邊、還有…
    559165|00000000||謝謝，我們知道要怎麼圍成一圈。
    559167|00000000||連像我這樣的瞎子都明白。
    559169|00000000||我只是希望能避免…喔，傑洛特，我們正在等你。
    559191|00000000||很單純，又很複雜。傑洛特，現在不是鬧情緒的時候。
    559193|00000000||別擔心，單純也有單純的魅力。
    559175|00000000||是嗎？但看起來你們已經開始了。
    559177|00000000||我們只是在討論有關魔法本質的事情，你不會有興趣聽的。
    559179|00000000||是啊，因為我只是個單純的狩魔獵人。
    559171|00000000||是嗎？我怎麼覺得你沒等我就開始了。
    559170|00000000||真貼心。 
    559173|00000000||你人還真好。 
    559383|00000000||說說你的計劃吧。
    559385|00000000||計劃很簡單，但並不表示執行起來會很容易。
    559387|00000000||我會啟動太陽石。如果卡蘭希爾回應召喚，納吉爾法船艦於不久後應該就會出現在海灣裡。
    559389|00000000||到時候集會所的女術士必須防止船艦回去艾恩·艾爾世界，同時皇家艦隊負責阻止它出海逃亡。
    559391|00000000||接著，亞卓公爵將率領第七約姆拉茲步兵團登艦。而你將在一旁協助他們。
    559403|00000000||那你呢？你會在哪裡？
    559405|00000000||在一旁待命。萬一出了什麼差錯，我可以馬上處理。
    559407|00000000||喔，就像是在山頂上指揮作戰的將軍一樣。你要用號角還是信差來調度我們？
    559409|00000000||為何要這樣諷刺我呢？計劃中有任何讓你覺得可疑的地方嗎？
    559393|00000000||那你呢？你要做什麼？
    559392|00000000||皇帝還真大方。
    559395|00000000||哇，恩希爾調度兵力可是一點都不手軟。
    559397|00000000||為了幫助我們，他將討伐史凱利傑的攻勢暫停了下來。
    559399|00000000||相信我，他絕不是因為善心大發才這樣做。
    559401|00000000||他的出發點跟我們每一個人的都一樣。
    559411|00000000||先生女士們，還是少說多做吧。各位姊妹，我們得朝懸崖前進了。
    559413|00000000||祝好運。
    559416|00000000||漏了計劃中最重要的一件事，希里要做什麼？
    559420|00000000||吉薇艾兒只能等待。她必須與納吉爾法船艦保持安全距離。
    560269|00000000||你無權命令她。
    560271|00000000||你沒有權力命令她。
    560273|00000000||有趣。吉薇艾兒說了一模一樣的話，只差在她是用吼的。
    560274|00000000||而且事實上我的確有權力，因為只有我知道如何啟動太陽石。而要不要那樣做的決定，全都在我身上。
    560343|00000000||吉薇艾兒已明白了這個道理，而你應該也會明白的。
    559476|00000000||禁止希里行動一點意義也沒有。
    559502|00000000||禁止希里的行動只會得到反效果。按照我以前的經驗，到最後她終究還是會照著自己的意思去做。
    559504|00000000||但願如此。
    559506|00000000||什麼？
    559477|00000000||她似乎不太服氣。
    559508|00000000||她似乎不太服氣。
    559510|00000000||沒錯，但我總不能把她綑起來傳送到別的地方去吧？
    559512|00000000||嗯，你最好別那麼做。
   1123509|00000000||這附近有座燈塔。
   1123676|00000000||你知道這附近有座燈塔吧。
   1123679|00000000||傑洛特！你是說我們…？
   1123681|00000000||不…至少不是現在。只是想說…
   1123684|00000000||我想說自從…自從諾維格瑞之後，我看到燈塔的光就覺得很安心，因為會讓我想到你。
   1123709|00000000||我會沒事的。
   1123758|00000000||我會沒事的。
   1123760|00000000||你老是這樣說。
   1123762|00000000||我到現在都還沒死啊。
   1126893|00000000||除了一次以外啦。
   1051794|00000000||葉奈法？你怎麼在這裡？
   1051796|00000000||我來見你的。
   1051798|00000000||發生什麼事了嗎？
   1051800|00000000||沒事，但可能很快就有事了。我們可能撐不過這一戰，其實我們獲勝的機率很渺茫。
   1051819|00000000||我們是來用奮力一搏，對抗艾瑞汀和狂獵行列的。說不定會像索登之戰，說不定更淒慘。
   1051825|00000000||不可能有戰役會比索登之戰更淒慘。
   1051802|00000000||的確，這一戰可能會很艱辛。
   1051821|00000000||葉奈法，別驚慌失措了。這不像你。
   1051823|00000000||我沒有驚慌失措，只是考量現實而已。但我來找你是想討論別的事。
   1051803|00000000||別慌張。
   1051801|00000000||別擔心，一定沒問題的。
   1051805|00000000||我們辛苦了這麼久，失敗的話我會對不起自己。肯定沒問題的。
   1051808|00000000||我很欣賞你的正面態度，我真希望我也能跟你一樣。
   1051811|00000000||聽我說。結束之後，如果我們都活下來了…我想離開，遠走高飛。我希望你跟我一起走。
   1051813|00000000||去哪裡？
   1051815|00000000||隨便，去波維斯、巨龍山脈的另一頭、甚至是瑟瑞卡尼亞。只要能遠離政治、陰謀和什麼貴族就好了。
   1051837|00000000||你不想搞政治了？還真是意外。
   1051840|00000000||你？想要永遠脫離政治和陰謀？但你在政治界如魚得水，那是你的生活啊。
   1051842|00000000||是時候開始新生活了。
   1051844|00000000||親眼見到我才相信。就連現在你都深陷政治麻煩裡。
   1051847|00000000||的確，但我只是為了做個了結，用高姿態全身而退。
   1051849|00000000||然後呢？要退隱山林，種花種草？
   1051851|00000000||有何不可？如果你也想要的話當然好啊？
   1051853|00000000||我們可以一起離開，想去哪裡就去哪裡，想幹嘛就幹嘛。
   1051860|00000000||你要一起走嗎？
   1051870|00000000||我不知道，葉奈法。你的夢想聽起來美得太不真實了。
   1051880|00000000||你隨時可以回來，如果一個月後我們真的忍不了對方的話。
   1051882|00000000||嗯…好吧，我願意試試看。
   1051884|00000000||這答案我能接受。
   1051836|00000000||聽起來美得太不真實了。
   1051835|00000000||我當然願意跟你走。
   1051862|00000000||我願意跟你去任何地方。
   1051864|00000000||這正是我想聽的答案。
   1051868|00000000||去吧，傑洛特，阿瓦拉克在等你。
   1056445|00000000||記得保住自己的小命，狩魔獵人。
   1123764|00000000||傑洛特，你說笑話失敗的時候真是迷人。
   1123766|00000000||失敗？快收回，我的笑話明明很好笑。
   1123768|00000000||你說的是。
   1123771|00000000||我愛你。
   1123780|00000000||你想讓我哭？希里肯定會永遠把這件事掛在嘴邊。繼續呀。
   1123783|00000000||我也愛你。
   1123752|00000000||別這樣想。
   1123754|00000000||那你要想什麼？
   1123756|00000000||恩希爾・恩瑞斯在行軍，全身一絲不掛。
   1123708|00000000||別這樣想。
   1123702|00000000||真讓人不敢置信，你說了浪漫的話耶！利維亞的傑洛特本人耶！
   1123686|00000000||我展現了弱小的一面。
   1123707|00000000||拜託你大戰時可別這樣。如果你發生了什麼萬一…
   1123688|00000000||這些雪…讓我想到科維爾。
   1123690|00000000||你會想些什麼東西？
   1123692|00000000||那裡一年四季都是這樣，又暗又冷。
   1123694|00000000||但是你猜怎樣？我一點也不覺得煩。
   1123696|00000000||真的嗎？
   1123698|00000000||不會，因為雖然白天短，但是夜晚很長。
   1123700|00000000||我等不及了。
   1123674|00000000||我等不及跟你一起去科維爾了。
   1123499|00000000||特莉絲？沒什麼事吧？
   1123501|00000000||沒事，我只是想跟你說幾句話，趕在…趕在一切開始之前。
   1123503|00000000||開心點。狂獵的勢力削弱了，我們要…
   1123505|00000000||別說了，別再講大戰的事了。
   1123508|00000000||抱我，說點好聽的話。
   1056437|00000000||沒時間拖拖拉拉了。我們越早處理完越好。
   1056439|00000000||跟我來。
   1056434|00000000||好，走吧。
   1056441|00000000||說不定會用上一些魔藥。去吧，我晚點再去找你。
   1056443|00000000||別拖太久了。
   1056435|00000000||我晚點再去找你。
   1056433|00000000||除非你想現在就跟我來？
    559514|00000000||時間緊迫，如果你還需要準備東西，像是製作藥水或什麼的，就趁現在。
    559516|00000000||等等就沒機會了。我會在船邊的士兵旁等你。
    559518|00000000||沒什麼。
    559496|00000000||那是遺傳自她父親的脾氣。
    559498|00000000||我倒不這樣覺得。恩希爾是個現實的人，希里則是理想主義者。
    559500|00000000||理想主義者？你在說什麼啊？
    559468|00000000||她的脾氣遺傳自父親。
    560395|00000000||吉薇艾兒，妳是否發誓會一直待在岸上？
    560397|00000000||我有選擇的餘地嗎？
    560400|00000000||妳要去哪裡？
    560403|00000000||去散步。還是我連散步都不能去？因為我有可能把自己的腿摔斷？
    560410|00000000||流著長者之血的人脾氣果然總是較為火爆。
    560338|00000000||哼，我以為至少還能指望你把我的想法當一回事。
    560340|00000000||我一直都有，妳知道的。
    560393|00000000||妳不可能打敗艾瑞汀，一點勝算都沒有。老天，我連自己做不做得到都不確定，所以妳離他愈遠愈好。
    560345|00000000||嗯，你說得沒錯。
    560268|00000000||我也同意。
    560263|00000000||讓我猜猜，這並不是妳的主意。
    560265|00000000||當然不。跟你們一起去才是我想做的事。
    560267|00000000||但我不准，太危險了。
    559421|00000000||我猜這不是希里的主意。
    559422|00000000||很好。
    560347|00000000||有道理。
    414295|00000000||等等，感覺到這裡有東西了嗎？
    414297|00000000||沒有。我的徽章…
    562076|00000000||只是個可笑的廉價飾品。別笑死我了。
    562138|00000000||感應精靈魔法的難度，只比嗅出有臭味的惡魔高一點點而已。
    562140|00000000||看好了。Arha'an lumar!
    562134|00000000||嗯哼。
    562136|00000000||那表示太陽石在這裡。別光站在那邊發呆，去移鏡子啊。
    549864|00000000||你以為我會饒了你？
    549866|00000000||你以為我會饒了你？
    549868|00000000||我認為你不會攻擊一個手無寸鐵的人。
    549870|00000000||別太肯定，我現在心情非常不好。
    549884|00000000||妳沒想過先和我說嗎？
    549886|00000000||難道事先告訴我你的計畫會浪費妳很多時間嗎？
    549888|00000000||對不起。我知道我應該要跟你說，但我擔心你不懂。
    549890|00000000||唉，感覺就跟和葉奈法對話時一樣。
    549892|00000000||拜託，跟我走吧。
    549894|00000000||傑洛特，我會的。等我從塔裡出來後…如果我出得來的話。
   1077808|00000000||阿瓦拉克對妳說的都是無稽之談。
   1077828|00000000||阿瓦拉克用那些假寓言故事把妳給洗腦了。
   1077830|00000000||你錯了。白霜的確將至，世界會一個接著一個凍結，所有生命都會消逝。
   1077832|00000000||阿瓦拉克給了我選擇。我下了決定，我一定要阻止白霜。
   1077806|00000000||妳沒必要自我犧牲。
   1077816|00000000||妳沒必要自我犧牲。
   1077818|00000000||你錯了。白霜無可避免，它會讓所有世界一個接著一個凍結，殲滅所有生命。
   1077820|00000000||只有我能阻止這場浩劫。我已經詳細考慮，做出我的決定了。
   1077805|00000000||世界才不會毀滅。
   1077810|00000000||伊絲琳妮的預言都是胡說，我們才不會招至毀滅。
   1077812|00000000||妳看過未來了，不記得嗎？沒人能阻止世界毀滅。世界將會一個接著一個凍結，所有生命都會消逝。
   1077814|00000000||阿瓦拉克說得對。如果我袖手旁觀，人類、精靈和所有生物都會毀滅。
    549907|00000000||希里，我不准。
    549922|00000000||希里…我不准你這樣做。
    549924|00000000||你了解我的。我可是最愛打破規則的人了。
    549926|00000000||這個？你現在打破的可不僅僅是個規則。
    549928|00000000||我很抱歉。
    549908|00000000||拜託不要對我這樣做。
    549930|00000000||不要這樣對我…求求你，別挑現在。
    549932|00000000||傑洛特，相信我…沒有什麼比小酒館、熱紅酒，以及在火爐邊烤乾我們的靴子更吸引我了。
    549933|00000000||但我不能。我必須嘗試，為了你、葉奈法、特莉絲…為了大家。
    549969|00000000||請祝我好運。
    549909|00000000||祝妳好運。
    549935|00000000||希里，祝妳好運。
    549937|00000000||也許我早該告訴你。不過你似乎能理解我的想法了。
    549939|00000000||我比妳想得更了解妳。
    549941|00000000||別讓我等太久。
   1062870|00000000||[不發一語。]
   1077834|00000000||一定有其他辦法吧…
   1077836|00000000||笨蛋，你怎麼拯救得了世界呢？你不過是個狩魔獵人而已。
   1077841|00000000||這是我的命運，與你無關。你一定要讓我自己做個了結。
   1077822|00000000||我才不在乎什麼白霜咧，我們快走吧。
   1077824|00000000||不行，傑洛特。我已經看見未來了，我知道毀滅將至。世界將會一個接著一個凍結，所有生命都會消逝。
   1077826|00000000||只有我能阻止這一切。
   1077807|00000000||我才不在乎，我們快走吧。
    549896|00000000||妳為什麼要這麼做？狂獵已經被打敗了。
    549898|00000000||可是白霜還沒有。
    549900|00000000||預言是真的。我看過許多被困在冰裡的世界，我知道這個世界終將遭遇的命運。
    549902|00000000||只有長者之血可以阻止白霜。只有我可以阻止它。
    549883|00000000||妳為什麼要那樣做？
    549876|00000000||我不是你的敵人，我只不過是在幫助希里雅。
    549878|00000000||我不信你，我也不能信你，畢竟都發生了這麼多事。
    549880|00000000||那你願意相信我嗎？
    549882|00000000||阿瓦拉克說的是實話。是我請他幫忙把塔打開的，因為我想要進去。
    549872|00000000||你以為我會上當？不可能，你大錯特錯。
    549874|00000000||我曾經信任過你，但我不會再犯相同的錯誤了。
    549863|00000000||我不吃這套。
    549835|00000000||傑洛特，真不幸啊。我本來希望你不用目睹這些的。
    549837|00000000||希里在哪裡？
    549839|00000000||就在附近。聽我說…
    549840|00000000||閉嘴。
    549861|00000000||我已經聽夠了你的廢話。拔出你的武器，我們做個了斷。
    563092|00000000||嗯，門現在開了。
   1063099|00000000||有遺言嗎？
   1063101|00000000||閉嘴戰鬥吧。
   1063103|00000000||我給過你機會了。
   1063105|00000000||狩魔獵人，我正希望你會來呢。
   1063107|00000000||為什麼？
   1063109|00000000||我有事情要說，但結束後再告訴你。
   1063111|00000000||我要先要了你的命。
    533366|00000000||把船擊沉！發射！
    560184|00000000||等等！請求談判！我是…！可惡！
   1074904|00000000||該死！
   1074912|00000000||傑洛特…現在不是時候，拜託。
   1074908|00000000||看來妳進步了…
   1074910|00000000||嗯…雖然慢…但有進步了…
    559249|00000000||謝謝你的幫助。
    559251|00000000||傑洛特，聽我一言。這些洞穴或廢墟，要不是有某種魔法壁障擋著，早在幾世紀前就被艾爾林和馬提亞的祖先掏空了。
    559253|00000000||你得帶女術士一起去。你身邊至少有一個吧。
    559255|00000000||這次我身邊有一整群。
    559257|00000000||噢！眾神保佑我們。
    559237|00000000||謝謝你的幫助。
    559236|00000000||魚肺？
    559239|00000000||魚肺？真有趣。
    559241|00000000||人們是這樣叫他的，他一次可以潛水好幾個小時。
    559243|00000000||沒有人知道他是怎麼辦到的，但我不太相信。
    559245|00000000||嗯，對他沒有好感嗎？
    559247|00000000||我們是沒有私怨，只是我也不喜歡他爸或他祖父。
    559221|00000000||爾米亞，聽著。你知道任何有關太陽石的事嗎？傳說它在史凱利傑的某個地方。
    559223|00000000||先是銜尾蛇面具，現在又來個太陽石。你改行當寶物獵人了嗎？看來怪物可以安心了。
    559229|00000000||我對艾恩·西迪族的精靈從來沒有興趣，但有一個叫艾文德的吟唱詩人可以幫你。他曾跟我說過某個隱密的洞穴或廢墟之類的…
    559231|00000000||我可以在哪裡找到他？
    559233|00000000||今天嗎？毫無疑問在阿林比翁。
    559235|00000000||你也可以問採珠人艾爾林和「魚肺」馬提亞，他們最近在海灣東邊最外圍採珠。
    559208|00000000||你聽過太陽石嗎？
    559340|00000000||哈爾瑪還好嗎？
    559371|00000000||那小伙子愛上英勇冒險，將島嶼交由他父親治理了。
    559372|00000000||這其實是好事。現在這戰爭前夕，我們需要一個比較有經驗的領導者。
    559375|00000000||那凱瑞絲呢？
    559377|00000000||我會說她比哈爾瑪還有用。
    559310|00000000||哈爾瑪還好嗎？
    559209|00000000||凱瑞絲還好嗎？
    559217|00000000||凱瑞絲還好嗎？
    559332|00000000||她有潛力成為傑出的女王，但願她能擺脫她父親的陰影。
    559334|00000000||除了盧戈之外，每個人都宣稱支持她。然而皇家艦隊一出現，領主就自作主張了。
    559342|00000000||那哈爾瑪呢？
    559354|00000000||那小伙子不顧克拉奇反對，攻打皇家船艦三次都失敗了。但他下一次還是會找到自告奮勇的戰士的。
    559356|00000000||嗯，聽起來很像哈爾瑪的作風。
   1066633|00000000||傑洛特，看來史凱利傑不管大小架都有你的份。
   1066635|00000000||這話不中聽但倒挺正確的，爾米亞。我好像錯過了幾次爭執呢。
   1070684|00000000||克拉奇的血脈坐上王位，這都是你的作為。恐怕你引起了小型內戰。
    559275|00000000||看來，德拉蒙家族會比我們預期的還要早攻擊。
    559277|00000000||我以為克拉奇是派你去和盧戈協議。
    559279|00000000||協議！只有克拉奇相信這階段還可能協議。
    559302|00000000||意思是我其實沒有破壞你的好事嗎？
    559304|00000000||這次沒有。盧戈的死亡將會是事情的轉捩點。他有個表親將被提名為領主，但他是個又懦弱又笨的指揮官。這場戰爭很快就會開始，但會更快結束。
    559219|00000000||但你為什麼回到了史凱利傑？
    556499|00000000||{Esse'tilleadh, theervil esse'caen. } [我們應該趁還有機會的時候回頭。]
    556500|00000000||{Dat esse'croigh a va voot breuk aen orde? Ess ae’iarr... } [然後因違抗命令而被絞死嗎？那我寧願…]
    556501|00000000||{Gar'ean! Havfrue! } [小心！是女海妖！]
    556513|00000000||{N'esse mar a tha. A'ess ver'spreiden aep evellien Inis. Caen Skellig'ea esse'dekk hwre. } [這可不妙。我們現在全都分散在島上了。可能還有史凱利傑人潛伏在這裡 。]
    556514|00000000||{Ker'zaer esse'vyos que getan. } [皇帝很清楚自己在做什麼。]
    553661|00000000||艾文德！
    553684|00000000||艾文德！
    553687|00000000||什麼？
    553689|00000000||我只是想跟你保證我只在洞穴附近看看，做研究用的。
    553702|00000000||我在為冒險小說蒐集資料。
    553735|00000000||我在寫一本冒險小說，需要收集資料。
    553737|00000000||你想寫白艦隊的來襲嗎？好主意。
    553745|00000000||也許你可以看看我翻譯的《蓋伯漢與迪莉安之歌》。
    553739|00000000||當然。所以，這個洞穴在哪裡？
    553698|00000000||你得從凱爾卓向東航行。洞穴位在海灣，只能走海路進去。
    553708|00000000||再會，還有祝你看到白鯨魚。
    553710|00000000||我確定牠今天會出現。
    553718|00000000||我在爾米亞指導下，要寫一篇有關艾恩·西迪族的歷史論文。
    553720|00000000||爾米亞？那個人從來不關心山精靈的。
    553722|00000000||我已經看穿你了，陰險小人！把我碎屍萬段，我也不會告訴你洞穴的事。
    553764|00000000||唉…
    553701|00000000||爾米亞在指導我寫一篇艾恩·西迪族的論文。
    553700|00000000||研究？
    553693|00000000||哈！從你的表情就可以看出我沒說錯！虧我原本還以為你是要來搜刮的。
    553695|00000000||我只想到洞穴看一看，做研究用。
    553662|00000000||[沈默不語。]
    553617|00000000||我們一起等格沃爾格吧。然後你可以跟我說說有關史凱利傑的精靈遺址。
    553640|00000000||聽說有些洞穴沒有人進得去。
    553638|00000000||這樣也好，要不然早就像其他地方一樣被洗劫一空了。
    553527|00000000||我和你一起等格沃爾格。
    553523|00000000||這隻鯨魚是什麼？
    553462|00000000||這隻鯨魚有什麼來頭？
    553592|00000000||當亡靈從天堂降到海裡、毒蛇喚起大海的怒吼、冰冷的怪物吞噬島嶼時，這條鯨魚將會出現。
    553593|00000000||我要當第一個為牠譜曲的吟遊詩人。
    553598|00000000||這些傳說有沒有剛好提到黑色太陽的詛咒？
    553600|00000000||黑色太陽？你在說什麼？
    553610|00000000||算了。
    553456|00000000||等一下啦！
    553553|00000000||你在留意尼弗迦德的艦隊嗎？
    553555|00000000||艦隊？喔，對，他們有提過。不，我在想更重要的事。
    553590|00000000||依照我的計算，今天傳奇的白鯨魚格沃爾格會游到史凱利傑的水域。
    553566|00000000||我等這天等一輩子了。
    553461|00000000||你沒忘記什麼嗎？
    553469|00000000||嗯？啊，對！柴堆，聊天聊到…
    553471|00000000||我來，火種濕了。那我要用什麼…
    553472|00000000||我來幫忙。
    553458|00000000||你忘了點燃烽火。
    553457|00000000||再會。
   1065605|00000000||我們走吧。
   1065607|00000000||儘早回來，好嗎？
   1067788|00000000||嗯，回頭見。
   1067732|00000000||我們走吧，希里。
   1065609|00000000||妳自己傳送吧，希里。我們在印達爾斯費爾島上見。
   1065611|00000000||隨你便吧，我會在墓園等你。
   1065613|00000000||請你們動作快點。希里，別惹麻煩了，好嗎？
   1067785|00000000||我是沒這個打算。回頭見。
   1067753|00000000||我們那兒見。
    565138|00000000||我跟妳去。
    565463|00000000||謝謝。
   1067735|00000000||妳可以開個傳送門通往印達爾斯費爾島嗎？
    565465|00000000||可以。
    565136|00000000||好，我跟妳去。
    565384|00000000||是啊，我們永遠都有更重要的事。
    565390|00000000||我去跟她談。你這人真的很不會保密。
    565380|00000000||希里，我們沒有時間。
    565382|00000000||妳可以之後再去。我們現在有更重要的事要做。
    565137|00000000||我們沒有時間。
    565487|00000000||我們一定要馬上回到船上嗎？
    565611|00000000||妳還有想看的東西嗎？
    565612|00000000||不在這裡。是在印達爾斯費爾島，羅伏藤島那邊。我遇見了一個叫史凱裘的年輕人，我想要…
    565631|00000000||怎麼了？
    565651|00000000||希里，史凱裘死了。
    565653|00000000||是狂獵…所有人都…?沒有一人生存嗎？
    565659|00000000||史凱裘後來才死的。
    565676|00000000||妳確定是他？妳有碰到他？
    565716|00000000||我去過那裡，看到了他的屍體。
    565719|00000000||你們願意和我一起去他的墳墓致意嗎？我想要跟他道別。
    517302|00000000||如何？有沒有可以拿來定罪的信件？或是裝滿骷髏的小房間？
