;meta[language=zh]
    561924|00000000||妳是獨一無二的。
    561966|00000000||所以我們才得對付狂獵。
    540694|00000000||我們繼續查吧，看看是否能找到更有意思的事物。
    565251|00000000||我們沒有惡意。
    565258|00000000||我們沒有惡意。
    565262|00000000||我一點也不在乎你們為何而來，出去。
    565294|00000000||希里，我們走吧。
    565296|00000000||希里，我們離開這裡吧。
    565298|00000000||不，我想聽。
    565269|00000000||你不會真的相信她吧？
    565265|00000000||希里，你該不會真的相信她吧？她很明顯摻雜了個人的情感在裡面。
    565267|00000000||那又怎麼樣？
    565312|00000000||放手去做吧。
   1070643|00000000||哈呀！
   1070649|00000000||呃！
   1070654|00000000||咿！！！
   1070656|00000000||啊啊！
   1073637|00000000||好，好多了。我們快離開吧。
    549267|00000000||那是什麼？
    549269|00000000||勞拉·朵蘭的項鍊。
    549272|00000000||這很漂亮，但是…
    549274|00000000||你戴上吧。
    565317|00000000||走吧。我受夠這個地方了。
    565319|00000000||冷靜點。那個精靈說得對。
    565321|00000000||啊，你不會鼓勵我一下嗎？
    565323|00000000||你有勞拉的血緣，這是無法改變的，你也繼承了她的天賦和力量。
    565325|00000000||若能成為你，那個女精靈會情願拿一百年的壽命來交換。
    565327|00000000||看起來不像是這麼一回事。
    565329|00000000||你有優秀的天賦，而且只有你可以決定要怎麼運用。
    565311|00000000||冷靜點。
    565304|00000000||如果他們這麼鄙視我，他們應該不要管我的！
    565306|00000000||希里…
    565308|00000000||幹嘛？你怕我會把這裡像凱爾莫罕一樣夷平嗎？
    565310|00000000||真可惜我不能想做就做，不然我現在真想把這裡夷成平地！
    565300|00000000||阿瓦拉克對你有那麼重要嗎？
    565302|00000000||那又有什麼關係？
    565268|00000000||他對你那麼重要？
    565271|00000000||他說你的五官跟勞拉很像，但我不認同，那種比較就像試圖從泥巴坑喝水一樣。
    565273|00000000||但我想那個信念多少幫助了他的任務。
    565275|00000000||什麼任務？
    565278|00000000||你以為他是為了好玩而跟著你到處跑嗎？連我看到你都覺得厭煩。
    565280|00000000||真是不可思議，你們還相信自己各方面都比人類優越。
    565282|00000000||她不是人類，她是個劣等的混種。我們別無選擇只能屈就於這種東西，實在是恥辱。
    565284|00000000||再說一個字我就…
    565286|00000000||就怎樣？你什麼也沒辦法改變。她必須去做她該做的事，才能讓阿瓦拉克真正地擺脫她。
    565290|00000000||如果他那麼恨我，為什麼不當著我的面說？
    565292|00000000||比如說呢？
    565293|00000000||比如什麼？
    565332|00000000||我記得在提爾納麗亞見過妳。
    565334|00000000||了不起，我以為你們人類都分不出精靈長相的差異。如果你們要找阿瓦拉克，他不在這裡。
    565336|00000000||我知道。
    565338|00000000||你知道還來做什麼？來監視他嗎？每次你做了蠢事他都盡力去救你，這還不夠嗎？
    565340|00000000||你又知道什麼了？
    565342|00000000||說來你應該會吃驚，但他跟我說了不少你的事。
    565253|00000000||你是誰？
    565255|00000000||跟你無關，馬上離開這裡。
    565250|00000000||你是誰？
    565249|00000000||你們怎麼進來的？
    560064|00000000||我注意到你跟葉奈法還有特莉絲之間顯然關係緊張，這八成讓希里很不好受。
    561076|00000000||有時候我會懷疑你們三個到底知不知道你們看起來像什麼樣子。
    561078|00000000||特莉絲對希里擺出大姊的樣子，卻又等不及想上你的床。而你跟葉奈法則整天在那辦演父母的角色。
    561080|00000000||對，所以這裡顯然沒你的位置，別想攪進來五人行。
   1062819|00000000||等等！（咒語）Gvares, tavel！
   1062823|00000000||跟緊我！
   1062817|00000000||可惡…我們會被埋住！
    562141|00000000||掃描的回響在這邊最強烈。
    546700|00000000||我們驚動了警衛。
    517397|00000000||我去對付他。
    520682|00000000||我來對付她！
   1063059|00000000||「我把我的心給你？」這是哪門子的咒語？
   1063061|00000000||這是一封舊情書，年代久遠了。
   1063063|00000000||我說過了，這顆石頭能讓愛人團圓。
   1063065|00000000||我沒想過我會對艾瑞汀說這種話。
   1063067|00000000||{Aen verelith cyrre naid. } [我把我的心給你。]
   1063069|00000000||{Ader eich blaen eide ‘me. } [但我要帶走你的頭。]
   1063071|00000000||精靈道具起作用了。
   1063073|00000000||他們接近了。
   1063077|00000000||大顯身手吧，傑洛特。
    553195|00000000||這些人是你們的同胞。
    553321|00000000||我沒聽說史凱利傑人會在死去的戰士身上搜刮。這是傳統嗎？他們可是你們的同胞啊。
    553322|00000000||你沒長眼睛嗎？說他們是我們同胞？這些是法羅島的人渣！
    553366|00000000||乘兩艘長船去追黑衣者，蠢死了！
    553393|00000000||我們都說完了，如果你沒別的事，我們要回到上面去。
    553396|00000000||我沒別的事了，就這麼辦吧。
    553390|00000000||但你到底…什麼聲音？艾爾林，你有聽見嗎？
    553226|00000000||關於史凱利傑的精靈遺址，聽說你們知道些什麼。
    553271|00000000||你聽誰說的？
    553273|00000000||爾米亞。
    553275|00000000||嗯，你不會告訴他你今天看見的事吧？
    553277|00000000||看情況。
    553279|00000000||精靈遺址是吧。你想知道什麼？
    553356|00000000||德魯伊說有個洞穴你們一直進不去，那在哪裡？
    553228|00000000||它在凱爾卓東邊，一個只能走海路進入的海灣裡。
    553212|00000000||聽說你們知道精靈遺址的事。
    553221|00000000||你們拿完之後至少會將屍體交還家屬吧？
    553222|00000000||看來流言是真的，變種的確沒有什麼纖細情感。
    553289|00000000||看看他們，你覺得深愛他們的媽媽和老婆會想見到他們這副模樣嗎？
    553290|00000000||大海就是他們的墳場。
    553300|00000000||就是這樣。
    553211|00000000||之後會把屍體交給他們的家屬嗎？
    553213|00000000||你們冒了蠻大的風險。
    553257|00000000||你們冒了大風險。
    553403|00000000||什麼意思？是在威脅我們嗎？
    553405|00000000||你們沒必要提防我，但我聽到水底下傳來叫聲…是怪物，肯定是感應到鮮血了。
    553414|00000000||我什麼都沒聽到啊。
    557014|00000000||一般人聽不到這種聲音的…聽到的時候就來不及了。
    553409|00000000||馬提亞，我們還是離開比較好吧。
    553191|00000000||沒珍珠可採了？
    553200|00000000||不關你的事，大海給什麼，我們拿什麼。
    553202|00000000||看來大海有點小氣。
    553203|00000000||對啊，我需要好一點的刀。才幾個小時他們的手指就浮腫了。
    553194|00000000||採不到珍珠了嗎？
    553182|00000000||艾爾林，你看，我就說今天的工作還沒完。這個連撈都不用撈哪。
    553184|00000000||你白痴啊？看不出他是狩魔獵人嗎？
    553219|00000000||狩魔獵人來這裡幹嘛？
    568598|00000000||來啊？ 誰想來嚐嚐史凱利傑刀刃的厲害？
    568599|00000000||哈爾瑪！你有看到希里嗎？
    568600|00000000||在納吉爾法船艦那邊！
    568602|00000000||我們會把你們這些混蛋通通淹死！用你們的屍體填滿這個海灣！
    458483|00000000||妖靈。
    170734|00017dcc||小男孩
   1076961|00000000||嗯…有更多要來了。
   1076963|00000000||我們要加快腳步，傑洛特。世界間的傳送門越開越大了。
    556472|00000000||「而巨人應與巨人對戰…」和民謠唱得一模一樣。
    556473|00000000||這才不是終末之戰 …還沒到。天球交會才剛開始。
   1076958|00000000||接下來會怎樣？
   1076960|00000000||我不知道，傑洛特。我不想知道。
    562764|00000000||白狼，你好！
    556375|00000000||{Verloos? } [傷亡情況？]
    556376|00000000||{Tve tuveë, yn sehr ràno. Als esse'lamh esan... } [兩人死亡、一人重傷。如果我們抬他到…]
    556377|00000000||{N'ess tedd. Ver'spreiden evellienn. Que esse'iare beanna esse kraihen dri bethaalen. } [沒有時間了。分散開來，找到那女人的人可以獲得三倍酬勞！]
    556373|00000000||{Aen skip esse krach! Ratreut! } [船快解體了！我們必須撤退！]
    556374|00000000||{Ess orde a me! Adhart! } [我才是發號施令的人！前進！]
    344533|00000000||哼，總算知道皇帝陛下的下落了。
    344535|00000000||他要征服史凱利傑嗎？但他明明知道那些人是我的朋友！
    534211|00000000||他想將全島、辛特拉… 和整個帝國都賞賜給妳。
    534224|00000000||這整件事還是有好處的。
    534226|00000000||是嗎？
    534228|00000000||大帝這下就必須幫我們抵抗狂獵了，我們剛剛還找到了芙琳吉拉·薇歌。
   1075807|00000000||只差一點，吉薇艾兒。妳只差一點。
   1075809|00000000||可惡。
   1075811|00000000||狩魔獵人…？我們來一決死戰吧。
    557112|00000000||妳想太多了。
    557128|00000000||妳想太多了。阿瓦拉克和任何精靈一樣神秘，妳到底在懷疑什麼？
    557135|00000000||我…不知道。傑洛特，我覺得這很重要，你也一起來吧。
    557142|00000000||好吧，在哪裡？
    557151|00000000||在一個烏德維克和史派克魯格之間的小島上。
    557159|00000000||那有點不順路。我才剛查出太陽石在大史凱利格島的崖邊，一個只能走海路進去的洞穴裡。
    557161|00000000||而且還需要真的魔法才進得去。
    557162|00000000||你們去找這個實驗室吧，我會去大史凱利格島看看，而你待會可以來找我。
    557164|00000000||菲麗芭，妳的視力才剛利用魔法復原，你不是說需要一些時間來適應嗎？
    557192|00000000||我有嗎？
    557194|00000000||我都忘了她可以惹人生厭到什麼地步。希里，來吧。
    557197|00000000||我們會在那邊等你。
    557114|00000000||所以呢？妳想偷溜進去看看嗎？
    557116|00000000||沒錯。你要一起來嗎？
    557111|00000000||嗯，很可疑。
    549090|00000000||妳們要去哪裡嗎？
    549091|00000000||希里說史凱利傑有個地方一定要查看。阿瓦拉克顯然有事情隱瞞著我們。
    557091|00000000||先前我們都在群島的時候，阿瓦拉克提過一個實驗室。
    557700|00000000||他一度想要傳送到那裡取回某個東西，而且不願意帶我一起去，非常奇怪。
    557093|00000000||你不覺得這很可疑嗎？
    517102|b339ce5d||艾文德
    335378|05e21ea5||守衛
   1068720|00000000||來吧。
   1081898|00000000||希里！
    517276|00000000||入口保護得很好。我相信裡面一定有些有意思的東西。
    549089|00000000||妳會怎麼解除這個魔法壁障？
    549067|00000000||用阿特蘭.科爾客的囊括術應該就可以了，妳記得咒語嗎？
    549069|00000000||我記得你教過我。想當初我還覺得你是個自大冷血的潑婦。
    549087|00000000||好了，好了。現在不是多愁善感的時候。
    558545|00000000||克拉奇還想怎樣？
    559046|00000000||他有最強大的船艦，掌管我的島嶼，還讓他後代坐上了寶座，這樣還不夠嗎？
    558546|00000000||在現在這個情況下…
    559049|00000000||在現在這個情況下，克拉奇應得到他該死的報應。
    559060|00000000||神通廣大的克拉奇，一定有本事對抗黑衣者和我。
   1073880|00000000||現在是我們的大好機會！
    568591|00000000||畢迦尼！你跟你的人馬對付帝國軍隊！我來對付妖靈！
    568589|00000000||啊！有種就追來啊！黑衣走狗 去死吧！
    568592|00000000||你有沒有看到希里？！
    568594|00000000||你說希里？！去找那個精靈！啊！來啊，你們這些混蛋！愈多愈好！
    568593|00000000||她跟你們的精靈在一起！
    568743|00000000||護甲太厚了，你砍不動的！直接把他們推下海！
    555836|00000000||唉，艾文德又沒有點燃烽火。該派人去那裡…
    555838|00000000||別看我！我的工作是站在這看守，不是和那笨蛋吵架。
    555839|00000000||如果我們的人看不到信號，你看守也沒用。
    556546|00000000||他們怎麼了？
    556547|00000000||是白霜。
    552675|00000000||可惡，那艘船要解體了！
    552717|00000000||躲到另一側的山谷裡去。走！
   1069114|00000000||大帝的船在烏德維克島附近下錨了。一動也不動！
   1069916|00000000||沒有霍格的長船，我們不可能突破重圍的。最好先靜觀其變…
   1069116|00000000||不行！我們應該馬上出擊！殺他們個措手不及！
   1069128|00000000||我們沒時間浪費了。
   1069130|00000000||布亞涅、史提安！過來！集合所有人，要出航了。
    559826|00000000||來，我們不該待在這裡。
   1069459|00000000||再見。
   1069461|00000000||保重了。
   1069627|00000000||所以你不打算告訴我你是怎麼找到的。
   1069629|00000000||我的確不打算告訴你，但我很感激你的幫忙。再見，願幸運女神守護著你。
   1069350|00000000||所以你不打算告訴我了？
   1066180|00000000||謝謝你願意幫忙。
   1066182|00000000||小事一件。
   1066184|00000000||至於精靈遺跡嘛，其實…
   1066186|00000000||嗯？
   1069343|00000000||算了，就當作這事沒發生吧。你肯定有其他辦法能維生的，沒必要用掠奪這種小手段。
   1074107|00000000||天哪！哪些是敵人？我們到底要射誰？
   1074109|00000000||看到誰就射誰！
   1064768|00000000||小心！注意背後！
    413740|00000000||想看到黑衣者的船比看到白鯨魚還難。
    413744|00000000||據說皇帝指揮的船艦比我們的大兩倍。
    454263|00000000||那如果大家說他有尾巴，你會相信嗎？
    534798|00000000||我才不管他屁股會長出什麼，我只在意一年後的我們是不是會困在堡壘裡吃老鼠。
    553429|00000000||我們不受你們的法律約束。
    553433|00000000||我們不受你們的法律約束。
    553434|00000000||是啊，你們顯然也不尊重我們的習俗。
   1055970|00000000||回船上吧。
   1066205|00000000||嗯。
   1055967|00000000||一起走吧。
   1055972|00000000||我自己回去吧，我還有事要處理。
   1066227|00000000||好，我們回頭見。
   1055968|00000000||我還有其他事情要處理。
    553634|00000000||至少他們不會再侮蔑他了。
    553636|00000000||我們走吧。
    553630|00000000||唉，幸好我們有來。
    553632|00000000||你不知道我有多煩惱。
    553516|00000000||亡靈抓一個姑娘要做什麼？
    553526|00000000||我不只是個姑娘。誰敢碰這個墳墓，我就會給他好看。
    553568|00000000||沒有人會來打擾的。在會遭長者懲罰的所有罪惡之中，只有褻瀆墳墓比戰場逃兵更為嚴重。
    553570|00000000||而妳說的是真是假，我們無從知道。就讓眾神審判史凱裘吧。
   1031284|00000000||史凱裘救了你們的狗命！
   1031286|00000000||當時狂獵緊追著我不放。如果史凱裘沒把我帶走…他們肯定會把羅伏藤島化成灰。
   1031288|00000000||窩囊廢只配葬在水溝裡。
    553431|00000000||小聲點，小心我們得被迫多挖一個墳墓。
    553439|00000000||你竟然為他說話！
    553428|00000000||安靜。
    553421|00000000||你們在幹嘛？
    553423|00000000||我們在埋葬史凱裘，這是你們早該做的事。
    553425|00000000||埋葬窩囊廢？這違反了長者的命令。
    553427|00000000||走開，遠離這裡。你們違背了我們的法令！
   1065313|00000000||有水鬼在保護她。可惡，還真多…
   1057740|00000000||你應該不會打算一直在這鬼地方打混吧。
   1066320|00000000||我們有任務在身。
   1057742|00000000||快看看！
   1012999|00000000||氣色不錯喔。
   1013000|00000000||…被恩希爾抓起來之後還算不錯，這是你的意思嗎？
   1016824|00000000||看來他竟然對你…大發慈悲？沒有訊問、也沒有用刑？還是他想知道的東西，你已經全招了？
   1013001|00000000||如果我全招了，那我活著對他也沒用了。不是嗎？
   1013002|00000000||總之，別再說了。反正我做什麼都跟你無關了。
   1012997|00000000||氣色不錯。
    313072|00000000||再見。
    313076|00000000||再見。
   1012998|00000000||誰是坎塔蕾拉？
   1013004|00000000||坎塔蕾拉，她究竟是誰？她說過你們倆認識。
   1013005|00000000||你碰到她了？她的真名是卡席亞·坎婷，她跟艾希蕾合作過。她很有…天分。
   1013006|00000000||她幫你們刺探敵情？
   1013007|00000000||不只是為了我們。她八成也不希望我和其他女術士受傷害，但是在她面前講話一定要特別小心。
   1016576|00000000||看來你跟她說了很多我的事情。
   1016579|00000000||那你應該深感榮幸，這樣你在亞魯迦河的兩岸都出了名。
   1016626|00000000||傑洛特，怎麼了？
    172334|06c10782||史凱利傑女性
   1050539|00000000||停火！是狩魔獵人！
   1050541|00000000||大帝下令！住手！
    556136|00000000||他們知道我們在這嗎？
    556138|00000000||妳覺得他們知道我們在這裡嗎？
    556140|00000000||你說恩希爾手下的法師？他們當然知道。
    556142|00000000||如果芙琳吉拉·薇歌的事情解決了，他們八成會用小船送她過來。
    556143|00000000||離解決還遠得很。皇帝承諾會確保集會所的安全，但是…
    556209|00000000||芙琳吉拉的狀況比較複雜比較棘手。她是他的手下，因叛國罪正式被判死刑。
    556239|00000000||等我們找到方法把你丟上皇家船艦，你再設法打聽看看恩希爾打算怎麼處理她。
    556382|00000000||我要走了。
   1065244|00000000||祝你好運。
    556120|00000000||我要走了。
    561552|00000000||史凱利傑正準備開戰，所以他只有可能在凱爾卓。
    561556|00000000||你知道他在哪裡嗎？
    561558|00000000||我會去港口附近打聽。克拉奇的長船停在那邊。
    551562|00000000||我們怎麼知道太陽石在史凱利傑？
    551610|00000000||根據精靈傳說，它位在白艦隊幾百年前登陸的地方。
    551680|00000000||也就是可能在這些島嶼的任何地方，太棒了…
    551692|00000000||我去問爾米亞。
    555543|00000000||我們能肯定太陽石在史凱利傑嗎？
    555587|00000000||我想知道我們能不能利用太陽石。
    555589|00000000||你不行，我的話當然可以。
    561084|00000000||只要女術士能幫一點小忙。
    555591|00000000||只是有的女術士正在甲板下嘔吐，其他的則行蹤不明。
    551556|00000000||我比較想知道能怎麼利用它。
    551557|00000000||我愛精靈傳說，告訴我們吧。
    551554|00000000||拜託你告訴我們，我實在太愛聽精靈傳說了。
    551560|00000000||蓋伯漢是赤楊精靈的賢者，他愛上了艾恩．西迪族的精靈迪莉安，但她拒絕了他。
    551564|00000000||咳，你這是在糗傑洛特嗎？
    551565|00000000||現在才發現已經來不及了，不過知道對你們也沒壞處。在白艦隊要啟航的那天，蓋伯漢將太陽石當禮物送給了迪莉安。
    551608|00000000||他相信等過一段時間之後，迪莉安會改變心意。
    555433|00000000||若她對他萌生思慕之情，就可以使用太陽石，而就算相隔萬里他也會為她回來。
    551614|00000000||聽起來不錯，但願這個太陽石對我們比對那個女精靈還有用。
    551413|00000000||太陽石本來是為了讓山精靈可以召喚艾恩·艾爾族的船而製造的，現在它只能象徵兩族間的連繫已不復存在的事實。
    551469|00000000||你們真的全都不知道蓋伯漢與白艦隊迪莉安的故事嗎？
    556380|00000000||目前我們連太陽石是什麼都不知道。
    556117|00000000||我們連太陽石是什麼都不知道。
    556116|00000000||妳可以把我傳送到皇帝的船上嗎？
    534280|00000000||妳能把我傳送到恩希爾的船上嗎？
    534282|00000000||門都沒有。它的防衛比皇帝的行宮還嚴密。
    534283|00000000||但我們可以試著強行進入。
    555535|00000000||我們不能讓芙琳吉拉受傷。
    556130|00000000||我自己上恩希爾的船。
    556134|00000000||我會自己上恩希爾的船。
    556340|00000000||你打算背著劍游過去嗎？你還沒說完「在其敵人墳上飛舞的白焰」就會被射死了。
    556342|00000000||妳別慌。他會找到辦法的。
   1072912|00000000||晚上行動，你成功的機率比較高。登上船之後…
   1050495|00000000||把這封信給殿下看，記得一定要直接交給他本人。我們要提醒他許下的承諾，還有他會得到的報酬。
    556081|00000000||我們得快點找到太陽石，之後在史凱利傑大概還有很多事要做。
    556108|00000000||我們需要芙琳吉拉·薇歌。
    551466|00000000||你應該帶我女兒一起來的，歡迎你的陣仗就會大不同了。
    551526|00000000||她在哪裡？
    551539|00000000||在瑟瑞卡尼亞，她想曬曬太陽。
    551541|00000000||大家都知道我既沒有幽默感也沒有耐心。
    551529|00000000||在瑟瑞卡尼亞。
    551527|00000000||在附近。
    551531|00000000||她離這裡不遠。
    551533|00000000||白狼，你離斷頭台也非常接近了。
    551543|00000000||你相信我不能傷害你，所以才如此無禮。你這樣想也沒錯。
    551545|00000000||但這是會改變的。有一天你會失去重要性，而變成棄子。
    551547|00000000||說也說夠了，未來的事以後再說。
    551986|00000000||芙琳吉拉，好久不見。
    532268|00000000||其他女術士都在吉納維爾上，在大史凱利格島附近。我們可以搭船…
    532319|00000000||我受夠坐船了。
    551993|00000000||我不喜歡瞬間傳送，但就順妳的意吧。我們走吧。
    551970|00000000||我該走了。
    551972|00000000||我們總算有共識了。衛兵！把芙琳吉拉·薇歌帶來！移除她的反魔法金屬手銬。
    551975|00000000||看來我不需要幫你們介紹彼此了。再會。
    551959|00000000||我該走了。
    551960|00000000||你願意原諒她們了？真的？
    551962|00000000||你真的願意原諒她們了？你要用赦免換取她們幫助？
    551964|00000000||我願意遵守與葉奈法訂好的協議。
    551966|00000000||你沒回答我的問題。
    551968|00000000||我沒義務回答。
    551940|00000000||我要芙琳吉拉.薇歌。聽說你答應葉奈法要釋放她。我看得出來…我知道你是大忙人…
   1050522|00000000||…這兒有一封信，應該能讓你想起你對集會所許下的承諾。
    551942|00000000||嗯…連葉奈法低聲下氣的請求聽起來都像威脅呢。我一直很欣賞她這個火辣的個性。很好，就這麼辦吧。
    551549|00000000||你想要什麼？
    551467|00000000||需要我提醒你我們正在征戰嗎？
    551487|00000000||我知道，燒茅屋的煙在好幾哩外都看得見。
   1071752|00000000||狩魔獵人，真讓人驚喜啊。
   1050514|00000000||等等。
    551464|00000000||真是熱烈的歡迎，感謝陛下。
    555010|00000000||你別動希里。
    555025|00000000||傑洛特，你一直忘記她已經長大了，她可以為自己做決定。
    555071|00000000||好了，繼續前進吧。
    554808|00000000||跟恩希爾交易是女術士的事，你問別人吧。
    554819|00000000||所以她什麼都沒跟你說，那私人的計畫呢？
    554983|00000000||她有提到什麼嗎？比如說讓你當個顧問，為年輕有為的女王效力之類的？
    554797|00000000||和恩希爾交易是女術士的事。
    554880|00000000||你會替皇帝效勞，不興奮嗎？
    554882|00000000||不，我是說，我當然很興奮。集會所以往都協助弱勢的統治者，這是我們最大的錯誤之一。
    554908|00000000||嗯，所以恩希爾對他的法師嚴厲控管，令你刮目相看嗎？
    554950|00000000||葉奈法不讓你接觸政治是明智的。你就算對著風解尿，也不會知道風向吧。
    554821|00000000||你不會因為要替皇帝工作而興奮？
    554801|00000000||你去和葉奈法仔細討論。
    554804|00000000||你該找葉奈法談談。你們之間很明顯還有沒解決的問題。
    554859|00000000||葉奈法向來獨來獨往。她這次決定插手集會所的事，倒是讓我很感動哪。
    554897|00000000||你不信任她。所以一旦打敗了狂獵，你可以離開這裡到別處躲藏。我聽說拉多維德願意收留女術士。
    554906|00000000||我還寧願把頭塞進觸手巨怪長滿牙的口中。真謝謝你的情報，但我另有打算。
