;meta[language=zh]
    517303|00000000||我們連門都還沒打開呢。
    517305|00000000||這個魔法壁障非常複雜，我們試試吧。
    517311|00000000||Geata'ar ligen!
   1055110|231374e3||史凱利傑男性
    556520|00000000||{Aen iarean nyald aep kroofeir… } [根本是大海撈針。]
    519932|00000000||有聽到嗎？
    519933|00000000||嗯。
    534052|00000000||老頭，你滾一邊去的話，我就考慮饒你一命。 
    534726|00000000||你有膽就殺了我。
    534728|00000000||哈哈哈…你自找的。
    534778|00000000||啊啊！
    534051|00000000||有什麼遺言嗎？
    534721|00000000||你還沒殺死我呢。
    534723|00000000||沒錯，我還蠻享受得。你是個不錯的玩具。
    534050|00000000||可悲，真可悲啊。
    534772|00000000||別戲弄戰士，快上！
    534774|00000000||想要光榮地死去嗎？恐怕要讓你失望了。
    534776|00000000||啊啊！
    566083|00000000||也許妳還是該去跟他說說話。
    566085|00000000||何必呢？現在更沒有意義了。
    566087|00000000||那之後呢？別排斥你父親啊，只因為他是世上最有錢又最有權勢的…
    566089|00000000||腐敗獨裁者，不值得半點信賴。
    566091|00000000||其實，我認為他是妳可以信任的人。也許妳該信任他。
    566093|00000000||那腐敗獨裁的部分呢？
    566095|00000000||習慣就好。
    548880|00000000||真謝謝你啊。
    533642|00000000||我以為你會想見克拉奇。
    533645|00000000||不過，如果我明天又消失了怎麼辦？如果這次像我母親一樣，永遠消失的話呢？
    534678|00000000||我覺得我不應該見任何對我有好感的人。至少也要等我們打敗狂獵。
    534679|00000000||我們可以隨時把你送回迷霧之島啊。
    534066|00000000||我們去看過你的實驗室了。
    534067|00000000||我想也是。你們怎麼會想去？直接問我就行了。
    544423|00000000||問了你就會公開所有長者之血的相關實驗？不太可能吧。
    544425|00000000||在我們對抗艾瑞汀的過程中，我不曾隱瞞任何有用的資料。
    544426|00000000||至於長者之血，你們都知道希里與眾不同，但只有我明白她非凡到什麼境界。
    544440|00000000||也許你只是對她著迷？
    544442|00000000||是嗎？
    559125|00000000||你想藉尼弗迦德的幫助稱王？
    559129|00000000||你要藉尼弗迦德的幫助稱王嗎？
    559142|00000000||那是你咬人前的虛張聲勢嗎？
    559149|00000000||是克拉奇派你來殺我的嗎？好啊，動手啊，你試試看啊！
    561116|00000000||抓住他們！
    559127|00000000||這不是叛國是什麼？
    559124|00000000||這不是叛國是什麼？
    558553|00000000||我絕不對奎特家族的人屈服！這樣夠清楚嗎？
    558554|00000000||你寧可協助黑衣者嗎？
    559089|00000000||我寧可幫助摩霍格該死的妖靈，也不願讓克拉奇統治全史凱利傑！
    558555|00000000||那你的人民是怎麼想的呢？等眾領主說你是叛徒，他們還會跟隨你嗎？
    559120|00000000||德魯伊，這邊是我的土地！說話當心點！
    558886|00000000||碧兒娜.布蘭在我們背後密謀了整件事！哼，她甚至懶得否認！
    558872|00000000||裡面發生了什麼事？
    558868|00000000||裡面發生了什麼事？
    558870|00000000||那個廢物要把我們出賣給黑衣者！你想看嗎？進去啊！
    558888|00000000||我不願目睹這恥辱！
    558891|00000000||那斯凡瑞吉呢？他畢竟是國王。
    558893|00000000||他當國王就和拿魚屁眼來當哨子吹一樣有用！
    558878|00000000||我在找爾米亞。
    558880|00000000||喔，他跟他們在裡面，臉色白得像死魚一樣。如果他不會好好教那臭小子，還有誰會呢？
    558882|00000000||但他卻說，眾神賜給我們這個國王，我們要支持他！支持什麼？斯凡瑞吉站在那邊像個假人一樣不說話，呆呆地看著那個巫婆把我們賣給黑衣者！
    558871|00000000||我找爾米亞。
    558874|00000000||布蘭如果還活著的話，鐵定會割了那叛徒的喉嚨！
    558876|00000000||而且在那小鬼出生的當天我們就該把他丟進深水淹死！
   1070432|00000000||馬鈴薯泥和香噴噴的肉醬。或是傑莫蘭的起士。
   1070452|00000000||燉牛肉，是我的話就會選那道。我媽會加一點烤洋蔥，吃起來脆脆的。
   1070454|00000000||哎…魚和乾糧要吃多久啊？
   1063162|00000000||一片寂靜，完全沒動靜。
   1063164|00000000||這是陷阱，我們快逃。
   1063166|00000000||這次不能逃。
   1063168|00000000||不行，吉薇艾兒。妳還沒準備好，妳還無法控制妳的能力。
   1063170|00000000||我會想辦法，讓開。
   1063172|00000000||希里。
   1063174|00000000||希里！
   1063176|00000000||冰…是咒語的作用。妳要找到施法的法師，摧毀他的法杖。
   1063178|00000000||我不只會摧毀他的法杖。
   1063094|00000000||跟我來，納吉爾法一定在附近。
    557050|00000000||Arhaaam shinaaaz!
    557045|00000000||她剛說什麼？
    557046|00000000||說你不是她喜歡的型。
   1069328|00000000||天黑後比較容易溜上船。
   1031236|00000000||怎樣？你想跟威爾吉佛茲一樣長出新眼睛嗎？
   1056344|00000000||我還記得我殺死他的那個片刻，生長還沒完成，他的眼睛還沒完全長好。看起來…很噁心，但是…
   1031237|00000000||你提起那個怪胎應該只是巧合吧？
   1056346|00000000||當然了。
   1056348|00000000||我也聽說過瑪哈坎有個有錢的瞎子侏儒…
   1056350|00000000||…叫人在他的眼窩裡塞了兩顆大紅寶石。
   1056352|00000000||他還是什麼都看不到，但聽說寶石看起來很高貴。
