;meta[language=en]
; id      |key(hex)|key(str)| text
   1053375|57a11068||Once part of Redania, Novigrad now has the status of a free city. It is the world's largest city and, without a doubt, the richest as well. Cradle of the cult of the Eternal Fire, it is now home to the church of the same name. It is ruled officially by the head of the church, referred to as the hierarch, though its underworld crime bosses also have a great deal of say in matters.
   1053347|f658b69b||Once upon a time Oxenfurt was a renowned university center, a capital of learning and liberty. The outbreak of war brought Redanian troops to the city, King Radovid at their head. The university dorrs were shut and locked, the students were driven out, and the entire town began to feel like an extension of the infamous prison located within its walls.
   1055973|f853c9c4||Nilfgaardian Army Group 'Center' Camp
   1055800|8964b984||To: His Imperial Majesty Emhyr var Emreis, Emperor of Nilfgaard<br><br>Since the time of my last report, remarkably swift progress has been made and sentiment in the city has crystallized. If anyone previously believed the ongoing war did not concern the free city, not a single resident now doubts the further course of the conflict will be determined within its walls. Our agents have confirmed earlier reports contending that King Radovid has important plans for Novigrad, and lately we have observed an increase in his agents' activity as well as the spread of his propaganda. His prime objective seems to be seizure of the wealth held by the Church of the Eternal Fire. Yet though Hierarch Hemmelfart officially rules the city, true power is in the hands of local crime lords. I recommend the emperor's agents focus further activity in that direction.<br><br>Henry var Attre<br><br>by decree of His Imperial Majesty<br><br>Ambassador of the Empire of Nilfgaard in the Free City of Novigrad
   1055389|a1e5490f||The Opposition in Nilfgaard
   1049221|00000000||Those who stray off the beaten tracks in the bogs of Velen rarely live to amend their error. Even the Nilfgaardian soldiers stationed at the Army Group 'Center' camp would at times disappear in the marshes without a trace. After yet another patrol failed to return, the quartermaster of the camp posted a call for some brave soul to search them out and bring them back, or, barring that, at least determine their fate.<br>
   1050852|00000000||When Geralt entered the Novigrad bathhouse, he happened to walk in on a meeting of the heads of the city's criminal underworld. Becoming an unwitting participant in their conversation, he learned of the conflict between the triumvirate made up of the King of Beggars, Sigi Reuven and Carlo "Cleaver" Varese on the one hand, and Whoreson Junior and the unknown powers backing him on the other. Cleaver in particular wanted Whoreson gone and offered Geralt help in finding and gettin to the bastard, which suited Geralt's interests. They say hands aplenty make for light work, and Geralt had every reason to believe this applied to gang warfare as much as it did to cleaning a barn, so he graciously accepted the gangster's offer.<br>
   1062565|797d3ba2||Announcement:<br><br>Soldiers in the service of His Imperial Majesty Emhyr var Emreis went missing while performing their duties. A reward shall be paid to anyone who assists in finding them. For more information see the quartermaster at the Army Group 'Center' camp.
   1062440|00000000||In times of war one often encounters those who have suffered cruelly at the hands of fate. Geralt was thus not shocked to meet the woman who the children in the Velen swamps called Gran, though she seemed to have suffered manifold unspecified ills.<br><br>Whatever her woes, it was clear she cared for the war orphans in her charge with love and devotion.<br>
   1062446|00000000||When Geralt saw the marks on the woman’s hands, he quickly realized she must be the Bloody Baron’s wife, though changed beyond all recognition by the hardship she had suffered.<br>
   1062444|00000000||Gran bore strange marks on her hands that burned with living fire. In time they proved to be signs of her indentured servitude to the Crones. How exactly the old woman had come to be in their power, however, remained unknown.<br>
   1062505|00000000||The circumstances of Geralt’s initial reunion with Yennefer after two years were quite different than he had imagined. The sorceress was not only safe and sound, but had even secured the aid of an unexpected and mighty ally - the Nilfgaardian Empire.<br>
   1061890|017d89e5||Report no. 1527<br>Agent DQ4<br><br>Who is Who in the Novigrad Underworld<br>Order reigns in the city’s criminal underworld and has for some time. One suspects no unauthorized thievery, banditry or hucksterism of any sort takes place here. Perhaps this is a testament to the City Council’s effective reinvigoration of the Temple Guard, but it is my opinion that the true cause lies in the rise of organized crime groups. Our agents’ mission is to identify their leader (or leaders) and bring about their collapse from the inside.<br>Tasks:<br>Investigate gambling dens.<br>Inspect houses of ill repute.<br>Infiltrate shopkeepers’ circles and determine if they are paying protection or tribute.<br>Interrogate apprehended criminals and determine in whose employ they remain.<br>Additional remarks:<br>Agent "Gisel" has observed certain individuals convening for mysterious meetings at the city bathhouse from time to time. The building is closed to the citizenry of Novigrad during said assemblies.
   1061783|e59b866a||Let it be known that anyone suspected of aiding or abetting Temerian rebels will answer before a summary military tribunal. Taking down the bodies of rebels executed by hanging is considered aid to the rebellion. By imperial decree, bandits thus punished are to serve as a warning to other rabble-rousers, and so their corpses are to hang at the roadside until they drop of their own accord to fertilize the once Temerian, now Nilfgaardian soil for the glory of the emperor.
   1061786|1896e04c||Emhyr var Emreis: A Biography
   1061785|00000000||Keira quickly seized on the witcher as an impromptu assistant. In return for showing him where a certain mysterious elf dwelled, she asked Geralt to help her retrieve a magic lamp from the nearby elven ruins.<br>
   1061790|5fa8ebca||The Northern Wars, Volume I
   1061789|99d66d40||<i>Childhood and Early Manhood</i><br><br>Though the Nilfgaardian throne was his by right of birth, it would be many long years before Emhyr var Emreis sat upon it. When he was but thirteen, an uprising engulfed the empire’s capital. A usurper seized power, overthrowing Emhyr’s father, Fergus var Emreis, who then refused to grant legitimacy to the coup. The usurper then decided he would break Fergus by having mages torture his son and heir, Emhyr. He failed in his plan, was forced to kill Fergus, and Emhyr escaped, presumably to a land beyond the empire's borders.<br><br>No reliable accounts of the emperor's actions in exile exist. Some claim he fell into the company of a knight errant, serving as his squire. This seems plausible enough, though the tales about the eccentric knight's proclivity to charge at windmills must surely be storytellers' exaggerations. A few unreliable reports claim a connection between Emhyr and the fabled Urcheon of Erlenwald who saved the life of King Roegner of Cintra. This seems far less likely, for it is public record that when the witcher Geralt of Rivia lifted the Urcheon's curse, he was revealed to be a duke named Duny, who later wed Roegner's daughter, Pavetta, and perished at her side when their ship went down at sea.<br><br>What is known for certain is that around the time of this great tragedy for the kingdom of Cintra, Emhyr reappeared in the empire and led a revolt to overthrow the usurper and restore his own birthright. Soon after he led the empire's armies in their successful conquest of Cintra, setting a tone of determined military expansion that would endure through the rest of his reign.
   1061810|0b1524e1||The Second War against Nilfgaard
   1061808|7fef2684||War with Nilfgaard first broke out in 1263 - its immediate cause a clear act of aggression by Nilfgaard against Cintra. The Imperial Army crossed the Amell Mountains and attacked Cintra's southern border posts near the forest known as Erlenwald. There are unverified claims of Emhyr var Emreis having a special attachment for this place - their import, however, remains unknown. What is certain is that he long ago staked an unfounded claim to control over all Cintra.<br><br>The decisive battle of the conflict took place in the Marnadal Valley. There Nilfgaard surrounded and decimated Cintra’s forces led by the royal couple. King Eist Tuirseach fell in the battle. The survivors, led by Queen Calanthe, sought shelter in the capital, yet none was to be found there. The city was overrun, its population massacred, and Queen Calanthe preferred to take her own life rather than surrender to the invaders.<br><br>The theater of war then shifted to Upper Sodden, where acts of terror and barbarous cruelty were perpetrated. Historical consensus holds that the Imperial Army's bestial acts here propelled the North to victory during the so-called Second Battle of Sodden. The atrocities had left the northern forces with only two options: to win the war, or to die with their families. Desperate determination thus drove them to defeat the seemingly invincible Nilfgaardians. The next year, in 1264, an armistice was signed which ceded control of Cintra to the empire, making it the northernmost province of Nilfgaard in all but name.
   1061814|8de4bdcb||Unlike in the First War against Nilfgaard, there was no clear aggressor at the start of the second conflict. In early 1267 the kings of the North met at Hagge to prepare a plan for Cintra's reconquest. Foreseeing their intentions, Emperor var Emreis amassed a large expeditionary force on the Temerian border. He then masterminded a series of events that left the North ripe for invasion - a mages' revolt erupted on Thanedd Island, and Redania descended into chaos after King Vizimir was assassinated. All Emhyr needed now was a pretext, which he got when supposedly Aedirnian soldiers attacked the Nilfgaardian frontier fortress known as Glevitzingen. Armed with this excuse, Nilfgaardian forces marched north and thus began the second war.<br><br>During the war's first phase, the imperial offensive quickly swept across the North. The empire's army started by occupying southern Lyria. Rivia was next to fall, after a short siege. Then came the Battle of Aldersberg, followed by Menno Coehoorn's march into Vengerberg. King Henselt of Kaedwen seized this opportunity to dismember his neighbor and promptly signed a treaty with Nilfgaard partitioning Aedirn between them. Opportunistic elves also joined the empire's cause and for their trouble gained an independent realm in Dol Blathanna. King Foltest was the next rat to scurry from the sinking ship, signing a truce with Nilfgaard and grabbing for himself a portion of western Aedirn. Abandoned by his allies and left with the rump of his kingdom, Demavend, ruler of Aedirn, fled to seek shelter in Redania.<br><br>The war's first stage ended and its second stage began when Nilfgaard broke its truce with Temeria after a mere fortnight and two days. Its forces immediately entered Brugge and Sodden, and soon both lands were awash in blood. In short order Emhyr occupied all of southern Temeria and shattered Foltest’s troops at Maribor. The shrewd emperor then retreated for the winter to Sodden, where he prepared for a renewed offensive come spring.<br><br>No war in history saw such fierce battles as were waged during the great Temerian offensive undertaken over those fair spring days. The forces of the North, united at last, proved a worthy opponent and slowed the Nilfgaardian advance. This provided Emhyr's internal enemies with an opening to set in motion a plot designed to depose him. Weakened by the infighting (known as the Conspiracy of Nobles), the myth of its invincibility shattered, Nilfgaard then saw its mightiest army routed by northern forces near Brenna. The tide of war had clearly turned.<br><br>Thus began the war's fourth and final phase. The North embarked on a counter-offensive, forcing the Imperial Army into a slow and bloody retreat. It was only a matter of time before armistice talks began, temporary truce lines were drawn, and the war drew to a close. Delegates from all parties to the conflict convened in Cintra to draft a peace treaty and establish a new world order. On the 2nd of April, 1268, the Peace of Cintra was signed, bringing to an end the Second War against Nilfgaard.
   1061823|862df541||Temeria… a land where milk and honey once flowed. In what did she wrong the gods that they should treat her so cruelly? The Pearl of the North to some, she proved a galloping range for Nilfgaardian cavalry to others. As a country it had survived two previous wars against the empire. It was here that the wars' bloodiest battles were fought. It was in Temeria where their most bestial deeds were wrought. It was Temerian civilians who bore the full brunt of these wars' horrors.<br><br>And bear them we did, bravely and steadfastly, until the demise of our great protector - King Foltest. Then providence turned its fickle face from Temeria. Murdered most treacherously, Foltest failed to leave Temeria a worthy successor.<br><br>And so all manner of cur soon fell upon her, tearing her apart like so much carrion. She had no more allies, then. None remembered that we had once been the armor protecting the North from the designs of the mad Dancer, he who had the gravestones of his foes pounded into a ballroom floor.<br><br>A free and independent Temeria is no more. A dark-faced sun looms over her every rampart. Yet we Temerians live on. And always will. As long as folk believe, the usurper who took our beloved capital, Vizima, to treat as his property will forever peer over his shoulder in fear. For in the shadows lurks not one dagger, but the power of a nation of daggers, waiting to deal justice’s blow.
   1061795|95748ddf||The Northern Wars, Volume II
   1061792|8a55e082||Responsibility for the outbreak of the first war (1263-1264) lies wholly with the Temerian Special Forces. Intercepted documents clearly show that Temeria intended to annex Cintra and moved in this direction, dealing a brazen blow to the balance of power that the Empire could not abide. Only by moving its forces into Cintra and establishing order there could the Empire preempt the Temerians’ destructive actions and safeguard peace. Sadly, the North, stubborn and short-sighted as ever, chose armed conflict over reasonable compromise.<br><br>During this conflict the forces of the Northern Realms perpetrated unpardonable atrocities, for which reprisals came first with the Battle of the Marnadal Valley and then with the Cintrian Incident. Our Imperial Majesty, Emhyr var Emreis, expressed his sympathies in a letter to the Cintrian court, adding that he hoped such horrors would never need to be repeated.<br><br>Once Cintra was taken, Nilfgaard considered the situation in the North stabilized, yet the Northern Realms fought on, bringing the situation to a head with the clash near Sodden. Nordling propaganda depicts this battle as the turning point of the war. In truth it had no political significance whatever. Shortly afterwards an armistice was signed, rendering Cintra a vassal of the Empire of Nilfgaard for all eternity.
   1061799|6ae017c0||His Imperial Majesty, Emhyr var Emreis
   1061797|d055438d||The Empire and the North crossed swords again in 1267 to 1268. Following an eruption of mage treachery on Thanedd Island, Nilfgaard could not sit idly by while the North let magic sow destruction freely. The Imperial Army took Lyria at lightning speed, meeting with little resistance. After short sieges, our forces marched into Rivia and Vengerberg, greeted each time by jubilant crowds thirsty for peace and civilization. We then moved against Aedirn.<br><br>(…) King Demavend’s attempt to stop the Golden Sun’s triumphant march failed, and his forces were pushed back to the Pontar Valley and Dol Blathanna.<br><br>(…) Queen Meve began to format guerilla bands made up of bandits and outlaws, of which the North has never been short.<br><br>(…) In a display of typical Nordling treachery, King Henselt signed a truce with the Empire behind his allies’ backs, resulting in Aedirn being promptly partitioned.<br><br>(…) His Imperial Majesty, in an act of supreme benevolence, created an elven state in Dol Blathanna, thus forging a bulwark of tolerance against the abhorrent racist laws of the Nordlings.<br><br>(…) King Foltest of Temeria signed a truce with the Empire. Yet this Nordling’s word proved to have as much value as the snow melting in the fields that spring. The truce held a mere sixteen days before it was violated. Foltest’s stupidity led to the Slaughter of Brugge, and then to a number of bloody battles in the Yaruga Valley. Faced with senseless and uncontrolled violence, the Imperial Army's leadership took it upon itself to tamp the bloodshed and ordered a retreat to Sodden.<br><br>Sadly, Foltest’s greed meant that hostilities resumed with the coming of spring. They culminated with the Battle of Brenna, where our heroic regiments faced a combined Temerian-Redanian force. To this day the North considers said battle a turning point in the war. There is no point debating this conviction. Far more important is the fact that this battle saw two strategies confronted: an honorable one, presented by the Imperial Army’s leadership, and one of trickery and subterfuge, conducted by the Nordlings.<br><br>(…) His Imperial Majesty realized the direction the conflict had taken. The Northern armies employed scorched-earth tactics, caring not at all for the pain they inflicted on civilian populations. Disgusted and unwilling to take part in this type of war, Nilfgaard withdrew its armies south. The Nordlings mistakenly saw this as an admission of defeat.<br><br>(…) Through the Emperor’s mediation, an armistice was drawn up and eventually signed in Cintra, putting an end to the Second Northern War.
   1061803|eda9be4c||Emhyr var Emreis rules to expand. He has trained his strategic brilliance on a singular vision - to conquer the world, though he rightly calls this not conquest, but salvation. Yes. The emperor of Nilfgaard sets the world alight with the torch of civilization.<br><br>Trampling the still-warm corpses of his father's usurpers, the emperor seized the throne and began to assimilate the Northern Realms, one after the other. Terror engulfed the North. Only the Battle of Brenna slowed the Imperial Army's march toward victory. A temporary peace then took hold, though none believed this mirage would last. Emhyr’s aim, to make the entire North a vassal of Nilfgaard, remained unchanged. Emhyr used peace as a cover to intensify his political efforts. Now all can see their results - chaos and disorder devour the Nordlings’ states. Ridden with internal bickering and backstabbing, they near collapse. Only a strong ruler can grapple this dysfunction into function. Only a wise ruler can give vision to their blindness. Only Emhyr var Emreis can save the North. So our armies have again crossed the Yaruga - for the third and final time…
   1061805|73f86c88||The First War against Nilfgaard
   1061842|00000000||As it turned out, Radovid's plan was for Whoreson to start a gang war in Novigrad. In the resulting chaos, Radovid would take control of the city with ease.<br>
   1061841|00000000||Whoreson's audacity had a very specific cause - King Radovid, who had commissioned the gangster's actions.<br>
   1061840|00000000||Cyprian also took after his father in terms of ambition. He broke the unwritten armistice between Novigrad's various criminal groups and tried to murder the other three leading underworld bosses.<br>
   1061850|00000000||This spy's life story would make for a positively enthralling adventure tale. A victim of Philippa Eilhart's intrigues, he had been forced to flee Redania at breakneck speed - or have his own neck broken by assassins. For a certain time he sought refuge in far-off lands, but in the end he decided to return to the Free City of Novigrad.<br>
   1061849|00000000||Though he did not show it, in his own way Dijkstra respected Geralt - even though the very thought of their last meeting brought a pained grimace to his face. The two had found themselves standing in each other's way during the coup on Thanedd Island. The stalemate was quickly broken when Geralt summarily broke Dijkstra's leg.<br>
   1061848|00000000||The individual masquerading as Sigi Reuven was in fact none other than Sigismund Dijkstra, the former head of Redanian intelligence and a man Geralt and I had had many dealings with in the past.<br><br>He had fallen out of King Radovid's favor and nothing had been heard of him for many years. Now it seemed he had finally decided to emerge from the shadows, but instead of returning to high political wrangling he dove deep into the criminal underground - and quickly surfaced as one of its leading figures.<br>
   1061839|00000000||Cyprian Wiley the younger was one of Novigrad's most dangerous criminals. He had inherited his father's casinos, fighting ring and brothels – as well as the old man's sadistic tendencies, ruthlessness and lack of scruples.<br><br>These traits had made the moniker "Whoreson" something of a family heirloom for his powerful criminal clan.<br>
   1061875|3123eb57||(…) Which brings us to the epithet of the current ruler of Redania - “the Stern.” Allow me to diagnose the causes and consequences of this appellation.<br><br>Firstly, the seeds of Radovid’s Sternness were surely planted in his childhood. When Radovid was born to King Vizimir and Queen Hedwig in 1255, his care was immediately entrusted to Philippa Eilhart, the court sorceress. While none dared question if she was fit for the role of tutor, few now envisage her as having been a warm caregiver to a young child - and whatever harsh lessons she gave Radovid clearly left a lasting mark.<br><br>The next step on Radovid’s path to becoming the Stern? The death of his father when Radovid was but 13 years of age. Though rumor has it father and son barely knew one another, the mere fact of being thrust into one’s inheritance at such an early age and in such murky circumstances must have had a hardening effect.<br><br>Finally, the regency finished schooling Radovid towards becoming the Stern. Led by Sigismund Dijkstra of Tretogor, the Regency Council imparted upon Radovid a style of politics seeped in Dijkstra's aggressive, no-holds-barred, reason-of-state-first principles.<br><br>Such are the causes of Radovid’s temperament - now on to the consequences. Most manifestations of his fierce manner are well known, however, a few illustrative examples might prove useful here. They include his summoning of the Order of the Flaming Rose to be his armed enforcers, his later support for the witch hunters in their zealous cause, and finally, there is the massacre at Loc Muinne…<br><br>Yet it is in the fight against Nilfgaard that Radovid has proven himself truly the Stern. While the forces of other realms disintegrated in the face of the empire’s onslaught, he has strengthened his own realm and taken command of the joint armies of the North. Whatever their opinion of him before, all clear-eyed observers now agree: Radovid V, known also as Radovid the Stern, is the North’s last bulwark against Emhyr’s expanding power.
   1061882|a382fb62||(...) and so the emperor’s brutes crossed the Yaruga’s waters. Yet this splashing was but a foretaste of the ocean of Temerian blood they would yet spill. Black has swarmed over our sweet Temerian soil, like ants swarming a drop of honey fallen in their path. Emhyr’s cutthroats adore their master and long to emulate his desecrations. The Nilfgaardian onslaught will spare no one. Under its sun-adorned banners hide dark hordes, cackling with anticipation, gleefully practicing how they will prance on the graves of our elders, women and children alike…<br><br>Good folk of the North! The time has come to unite! Forget our past feuds and quarrels! There is but one foe, one despicable to us all! Let us spare no blood, for each drop spilled might save the life of a brothers.<br><br>Yet is there any man who will not yield before their frightful charge, before that mass clad in plate black as pitch and stinking of the blood of the raped and murdered…?<br><br>I tell you there is, brothers and sisters. There is one man whom the loathsome foe frightens not one bit. A man who, armed with wisdom, courage and cunning, can give fight to the southern plague. That man's name is Radovid V. The Stern, they call him, and in this we are blessed, for only such a man can turn back the deluge of iron and steel, send it rushing back whence it came.<br><br>Mothers, weep not for your sons! Death for a noble cause is an honor every man should embrace. Let your menfolk gather round the banners of Redania's ruler, for he is no longer just Redania's - he is the proud commander of the united forces of the Northern Realms!
   1061884|00000000||Not for the first time Geralt showed what a babe in the wilderness he was in matters involving the fairer sex. For while I can say from experience that there are indeed women who will willingly share a man with their best friend, when trying that with women to whom one has declared true and undying love, things tend to turn out differently.<br><br>Toying with Triss' feelings ended in humiliation for Geralt - a fate which, I must admit, he thoroughly deserved.<br>
