;meta[language=zh]
   1062144|00000000||他說我們不能只在這裡乾等著人來救我們，他要採取行動。
   1062146|00000000||他說他看到海上有燈火，所以想爬上最高的山峰，看看有沒有船隻接近。
   1062133|00000000||該從哪裡開始找蓋斯普？
   1062148|00000000||費倫克跑到哪裡去了？
   1062150|00000000||他往西邊走，聽說那裡有一艘船，他想去找。
   1062152|00000000||費倫克懂點工藝，可能是想把那艘船修一修，讓它能出海。
   1062134|00000000||費倫克跑到哪裡去了？
   1062132|00000000||伊佛該去哪裡找？
   1062136|00000000||伊佛這傢伙... 該去哪裡找？
   1062138|00000000||那笨蛋堅持要去東邊的洞穴探險。
   1062140|00000000||講也講不聽，揍他也沒用，反正他就是不死心。
   1062623|00000000||如果我把你們同伴找回來，你們願意相信我沒有惡意嗎？
   1062625|00000000||好，可是事情可沒這麼簡單...
   1062627|00000000||有幾個人？
   1062631|00000000||三個，伊佛、蓋斯普和費倫克。
   1062620|00000000||我可以幫你們找回同伴。
   1063404|00000000||我不會傷害你們的...
   1063582|00000000||根本是貓哭耗子假慈悲。
   1063584|00000000||我已經失去太多同伴了，我不能再冒險了，沒辦法。
   1063388|00000000||我不會傷害你們。
   1063390|00000000||你們怎麼來到這裡的？
   1063392|00000000||一般的方法是絕對到不了這座島的。
   1063394|00000000||乖乖，你覺得船難是一般方法嗎？
   1063396|00000000||別挑他毛病了，我們都知道他是什麼意思。
   1063398|00000000||哈啾！我來解釋。不久前我們從史凱利傑群島出發，要前往諾維格瑞。
   1063400|00000000||費倫克跟船長聊起來了，結果船長賣給他一隻魔法螢火蟲，號稱可以讓人找到一大批寶藏。
    575809|00000000||老天，你們有完沒完啊，通通給我打起精神來。
    560199|00000000||喂，門外的…你叫傑洛特？是嗎？
    575812|00000000||沒錯，傑洛特。
    575814|00000000||聽著，傑洛特，那我們就直話直說了。
   1062617|00000000||我們不久前才遇到船難。深海的怪獸吃掉了好幾個人，我們幾個幸運的才躲來在裡。
   1063387|00000000||這沒什麼稀奇的，這島上處處是危險。可是遇到這種事，我們疑心當然會重一點。
    371137|00000000||葉奈法，女術士就是范格堡的葉奈法。
    371139|00000000||對，就是她！「她有雙閃電般的明眸，還有一顆冰冷如山的心…」嗯…然後是怎麼唱的？
    371127|00000000||你說的女術士是葉奈法。
    370946|00000000||我開始失去耐性了。
    371129|00000000||我快失去耐性了。
    371131|00000000||很好，表示你很快就會他媽的滾蛋了。
    371133|00000000||我快抓狂了。
    370930|00000000||我是狩魔獵人傑洛特。
    370932|00000000||滾開！
    370934|00000000||我在找一個灰白頭髮的年輕女子，她臉上有疤，可以讓我進去嗎？
    370936|00000000||…不行。
    370826|00000000||我在找一個灰白頭髮的年輕女子。
    370812|00000000||鎖住了…
    370814|00000000||有人嗎？
    370816|00000000||可惡…
    370818|00000000||哈啾！
    370820|00000000||我不會傷害你，趕快開門。
    370822|00000000||你害我們漏餡了。
    370824|00000000||你是誰？到底想幹嘛啊？
    312802|05e75e62||人面妖鳥
    305735|00000000||我把你朋友帶來了。
    576264|00000000||是嗎？給我聽聽他的聲音。
    576266|00000000||醒來。
    305737|00000000||醒了！
    560391|00000000||蓋斯普！退後，我要開門了！
